Participant ID,ResponseText,Sentiment,Tag 1,Tag 2,Tag 3,Tag 4,Tag 5
fa4fdb6b-8fe5-4b1b-ad08-529e345ccf3f,"I prefer Scenario 2. If AI can do all these routine, mundane work, then why not automate it. I want to have a future where AI does all routine, mundane chores and works and humans can just enjoy and pursue their creative interests. However, we will need universal basic income for all and resources to be divided in good proportion",Neutral,Preference for Scenario 2 due to creativity and flexibility,Scenario 2 allows AI to handle routine tasks,Scenario 2 supports universal basic income and community support,,
a2235b5b-b30b-4cd5-8706-d2e79c23ea74,"I prefer both. But again, if only these doesn't replace human creativity and involvement in the workplace. AI should be working in the background. ",Neutral,Other,,,,
af299bfd-6677-4cf6-83d2-fe5796b8640d,"I prefer scenario 2. Because serving for communities is a major source of ""ikigai"" for many people, and taking that away from them is cruel. Also, I think creative works such as movies and anime are made by people who lived through having to endure the hardworking conditions. Without it, the world would be boring ",Neutral,Scenario 2 as a way to focus on creative endeavors,Scenario 2 preserves human creativity,,,
8f6f0197-057c-427c-9ddd-da6419f1619b,"I think scenario 2 offers more personal freedom and seems like a more responsible and advantageous future for people. However, I don't know if there aren't a lot of people left behind. We may need to rethink how income and social security is handled in such a society.",Neutral,Scenario 2 as a more responsible future,Scenario 2 promotes individual autonomy and meaningful work,Scenario 2 supports universal basic income and community support,,
6735c92f-8e30-4f0e-a4d3-7ed916ce2bbf,"On the 2nd, I think the worst thing would be if AI controlled our creative processes and our independence.",Negative,Scenario 2 as a means to preserve human independence,,,,
f3e34267-f875-470e-bf9f-ac4972dfe0e3,Scenario 2 is better because it gives more opportunities to do get jobs to earn money and give a meaningful response ,Neutral,Scenario 2 offers more promising career prospects,,,,
f10200e8-12d9-4e3e-b816-bcfabd9d7bc3,"Scenario 2, because AIs should take on jobs that are not creative, and could be useful for people to have more leisure. However, it would also have risks, since it would be taking the jobs of talented people in the accounting and logistics areas.",Neutral,Scenario 2 allows AI to handle routine tasks,Scenario 2 as a way to avoid job loss,,,
7d13d7b5-1ff8-42d3-832f-21ebe2ddf86a,2 - we can do more things we actually want to ,Neutral,Scenario 2 as a way to focus on creative endeavors,,,,
dc90fe0e-8929-461e-952c-eea0a43a3353,2 because work is a burden for many people and it would be great if monotonous tasks could be handled by AI while humans focus on creative tasks,Neutral,Scenario 2 allows AI to handle routine tasks,Scenario 2 as a way to focus on creative endeavors,,,
167a4353-2b29-474e-8b4e-57e03c5af2a2,2 is better. We don’t need to replace the grassroots. I hope that AI will help humans push the boundaries of technology rather than replace the bottom labor force.,Neutral,Scenario 2 as a tool for human enhancement,,,,
8d185c3f-ab4b-4599-9e42-2f52fee18337,"2, AI can play a vital role in Accounting and logistics by giving creative ideas.",Neutral,Other,,,,
aeb15002-1615-4066-bcde-5d39f7f9b0ab,"2, since jobs that require only effort can be done by AI, so that humans can do things that really matter and interest us.",Neutral,Preference for Scenario 2 due to creativity and flexibility,Scenario 2 promotes individual autonomy and meaningful work,,,
d0710cc7-51f4-4792-af9a-f0b109a6c3e4,2. AI is good for non creative tasks,Neutral,Scenario 2 allows AI to handle routine tasks,,,,
4d17792a-55e4-4799-9d20-73490317eadc,2. I believe AI can only be a tool. We should not let humans rely on AI and limit human creativity. AI handling routine non-creative tasks can liberate human productivity and invest in more creative fields.,Neutral,Scenario 2 allows AI to handle routine tasks,Scenario 2 as a tool for human enhancement,,,
f41e3c7c-b983-403b-8b0d-7ec363522605,"2. I like to do creative work. Repetitive, non-creative tasks can be handed over to AI.",Neutral,Preference for Scenario 2 due to creativity and flexibility,Scenario 2 allows AI to handle routine tasks,,,
8b2d2b63-295a-4b61-8d95-b1be3204ffa1,"2. I prefer AI to be handling routine, repetitive task and they should not have control over any human beings ",Neutral,Scenario 2 allows AI to handle routine tasks,Scenario 2 as a way to avoid AI dominance,,,
448897bc-6957-4a73-9008-ea3d8479ab84,"2. This path would encourage human creativity and independence, also you would have much more opportunities than current workmarket",Neutral,Preference for Scenario 2 due to creativity and flexibility,Scenario 2 encourages innovation and personal growth,,,
ecf4babe-e2ff-4ab8-848e-f67440a36439,"Both Scenario 1 and 2 can apply , standardized workflow and specialized AI modules and advanced system to handle routine creative tasks with flexible project teams and communities.",Neutral,Other,,,,
a98c329f-cca1-473c-b74e-823bf2601949,Definitely scenario 2- our goal as a society should be to remove unfulfilling work to the extent possible.,Neutral,Scenario 2 promotes individual autonomy and meaningful work,,,,
6ef4d8c9-4e0e-430b-b106-f2ce1f9141c4,I believe Scenario 2 would be the best and most effective outcome. It provides more freedom for individuals and they don't have to sacrifice their careers in order for AI to take over their particular duties.,Positive,Preference for Scenario 2 due to creativity and flexibility,Scenario 2 promotes individual autonomy and meaningful work,,,
6be8f790-ce11-4858-9320-f6c4c72943ec,"I choose Scenario 2 because it offers freedom, creativity, and meaningful work. Unlike Scenario 1, where corporations control AI and limit autonomy, this future empowers individuals to explore passions and collaborate without rigid corporate constraints.",Positive,Concerns about corporate control in Scenario 1,Preference for Scenario 2 due to creativity and flexibility,Scenario 2 promotes individual autonomy and meaningful work,,
efcac8b2-8dd3-4a72-9051-5dce0ddfa98a,"I choose Scenario 2. Scenario 2 offers a future where AI handles routine tasks, freeing people to collaborate on creative projects within flexible teams.  This fosters a more dynamic and fulfilling work experience, aligned with individual interests. ",Neutral,Scenario 2 allows AI to handle routine tasks,Scenario 2 fosters human relations and collaboration,,,
a79871f7-7ff1-4e52-b1f4-29683b0e8fd4,"I clearly prefer Scenario 2. After all isn't this is the ultimate promise of the invention of machines? Get rid of monotone, mindless and dangerous tasks and focus on creativity and human interconnection.",Neutral,Scenario 2 as a utopian ideal,Scenario 2 as a way to focus on creative endeavors,,,
6cd25dd9-d710-40b6-97c4-f3f505aa6ec4,"I like Option 2. Option 2 enables humans and AI to complement each other, with AI handling mechanical work and humans handling high-level, complex, and emotional work.",Positive,Scenario 2 as a balance between AI and human tasks,,,,
efa9ad7e-3680-4fd5-bb23-cee5058e6a3d,I like option 2 because it gives people more flexible options and can make their careers more diverse and flexible.,Positive,Preference for Scenario 2 due to creativity and flexibility,Scenario 2 offers more promising career prospects,,,
2502ffb3-361b-430b-beed-3bd58689cb47,"I like option 2 because it seems to be able to use the advantages of AI to replace non-creative human work, thereby effectively improving work efficiency and allowing humans to focus on more creative and meaningful work.",Positive,Scenario 2 as a way to focus on creative endeavors,Scenario 2 reduces human error and increases efficiency,,,
3c761fb3-7e3a-4285-9488-f7e7cf965596,"I like option 2, it's the best future I can imagine for AI in the workplace. There's only one problem, people would probably use AI's help on creative challenges, too. Also, there aren't that many creative challenges for people to do, and many people would have no jobs at all.",Neutral,Preference for Scenario 2 due to creativity and flexibility,Scenario 2 as a way to avoid job loss,Scenario 2 preserves human creativity,,
03024659-ad64-4206-b347-cd2535bbd70c,"I like option 2. AI replaces humans to complete routine tasks, which has always been my expectation for AI. And humans can do other more creative things.",Neutral,Scenario 2 allows AI to handle routine tasks,Scenario 2 as a way to focus on creative endeavors,,,
48b4e6b3-4ee0-49f1-b5d6-30b43d4529a7,"I like option 2. This way, people's careers will be more flexible and their lives will be richer and more exciting.",Positive,Preference for Scenario 2 due to creativity and flexibility,Scenario 2 as a way to enhance quality of life,,,
4621168f-da83-477b-b65f-f8a9aecee8e1,"I like scenario 2 more.  It is how I imagine the AI future would be.  We can be more creative as people which is what I believe we are supposed to do.  AI is meant to streamline data and non-creative activities, which I would be more comfortable with. ",Neutral,Preference for Scenario 2 due to creativity and flexibility,Scenario 2 allows AI to handle routine tasks,Scenario 2 preserves human creativity,,
ba768354-17b1-484a-8fdd-71531960c3f4,"I like scenario 2, which allows for more flexibility in employment and not suffering from routine, without the super-rich dominating the world.",Positive,Preference for Scenario 2 due to creativity and flexibility,Scenario 2 provides a less unequal society,,,
f4f92402-5fbb-4724-bab3-5c6508dad30a,I like scenario 2. Simply because it still have the essence of human interest and not just the AI do everything. ,Positive,Scenario 2 aligns with personal values and lifestyle,Scenario 2 preserves human creativity,,,
f77ade53-23cd-45a2-b7be-60c049790e39,I like version 2 as it should be. Human life is so short. We should not waste it by doing routine work which can be easily done by a mere robot.,Neutral,Scenario 2 allows AI to handle routine tasks,Scenario 2 as a way to avoid monotony,,,
aec4fc2a-9422-430d-a0a5-5bb402ada8f6,I prefer 2 because AI would make many good changes in future and people can take more rest from their jobs ,Neutral,Scenario 2 as a way to enhance quality of life,,,,
2c78e96e-fc29-4aa6-9f36-4d8e8c934307,"I prefer 2, AI should be a tool only and I wouldn't like megacorporations to have so much power.",Neutral,Scenario 2 as a way to avoid AI dominance,Scenario 2 as a way to avoid corporate dominance,,,
7efdbf45-8634-409b-98e7-42a4b7f759d3,"I prefer 2, as that is the ideal scenario in my opinion where all the menial tasks are taken care of and we can concentrate on creating the life we really want especially for people who do not have options due to having to put food on the table.",Positive,Scenario 2 as a utopian ideal,Scenario 2 as a way to enhance quality of life,,,
c95712a8-b8a9-45a7-a376-ca82c6b0fe3b,"I prefer 2, it incorporates AI systems where they are appropriate but still gives humans the space and ability to work alongside it or do their own thing. ",Neutral,Scenario 2 as a balance between AI and human tasks,,,,
7eaa1b13-50a8-4111-a171-0c0c4451be00,I prefer 2. AI can do automation and humans can do creative work,Neutral,Scenario 2 allows AI to handle routine tasks,Scenario 2 preserves human creativity,,,
0cbb0840-891a-4e04-ae15-62a53be92c80,"I prefer Option 2 because it not only enhances human creativity and autonomy, but also brings more possibilities to individuals and society through flexible working modes and resource sharing.",Positive,Preference for Scenario 2 due to creativity and flexibility,Scenario 2 promotes individual autonomy and meaningful work,,,
2db9a227-7b81-4023-a33b-dd014535f06d,"I prefer Scenario 2 because I’m someone who values freedom and flexibility, rather than being tied to the rigid structure of a traditional job. I think that when AI takes care of the routine tasks, it will allow people to focus on more creative and fulfilling work. And I really like the idea of collaborating in flexible project teams on short-term, meaningful endeavors. It feels much more in line with my lifestyle and interests compared to Scenario 1.",Positive,Preference for Scenario 2 due to creativity and flexibility,Scenario 2 aligns with personal values and lifestyle,Scenario 2 fosters human relations and collaboration,,
e8a93268-400b-4bfb-a374-3bc7bb8796ca,I prefer Scenario 2 because advanced AI systems should handle routine non-creative tasks—like accounting and logistics which do not replace humans in terms of creativity. The creativity and productivity of a human can never be replaced by a machine. ,Neutral,Scenario 2 allows AI to handle routine tasks,Scenario 2 preserves human creativity,,,
c846b296-2848-47be-be7c-900aedecb4d2,I prefer Scenario 2 because human creativity is very important to me. ,Neutral,Preference for Scenario 2 due to creativity and flexibility,Scenario 2 preserves human creativity,,,
4731a8a1-02ea-436d-b3ff-a07f48016455,I prefer Scenario 2 because i would like to work more on short meaningful endeavors than having a traditional career.,Neutral,Preference for Scenario 2 due to creativity and flexibility,Scenario 2 as a way to focus on creative endeavors,,,
8e263116-83ea-46d9-9f49-199db49c79cd,"I prefer Scenario 2 because it allows more creativity and flexibility. Traditional jobs provide stability, but they can limit personal growth and independence. Working on meaningful projects with freedom sounds more fulfilling. However, financial security would still be a big challenge in this system.",Neutral,Preference for Scenario 2 due to creativity and flexibility,Scenario 2 encourages innovation and personal growth,,,
0c57890a-46cd-4895-9d16-b4cc1bcef4bd,"I prefer Scenario 2 because it encourages creativity and frees the human mind from non-creative tasks. The problem is that not everyone in the world is creative, and I can't imagine how people who do repetitive work can survive in a Scenario 2 world.",Neutral,Preference for Scenario 2 due to creativity and flexibility,Scenario 2 as a way to focus on creative endeavors,,,
e451ff6d-9b78-4778-8dc3-362d98ff6570,"I prefer Scenario 2 because it encourages creativity, flexibility, and personal fulfillment. Unlike Scenario 1, where corporations control AI and limit autonomy, Scenario 2 allows people to explore different interests and collaborate on meaningful projects. While it lacks traditional career stability, the combination of universal basic income and resource sharing provides security. This future values human creativity over rigid corporate structures, making work more engaging and purpose-driven.",Positive,Preference for Scenario 2 due to creativity and flexibility,Scenario 2 as a way to avoid corporate dominance,Scenario 2 promotes individual autonomy and meaningful work,Scenario 2 supports universal basic income and community support,
fd28e862-f236-4a16-9afd-3c783bef978e,"I prefer Scenario 2 because it gives me more flexibility, creativity, and independence. I find it exciting to work on various projects that match my interests, collaborate with others, and continue to grow. This approach feels better to me than the structure and limits of traditional jobs. I also like the community focus on sharing income and resources, which aligns with my values of working together and personal growth.",Positive,Preference for Scenario 2 due to creativity and flexibility,Scenario 2 aligns with personal values and lifestyle,,,
2f8f066e-488f-47fb-a73f-851982a1bd01,"I prefer Scenario 2 because it offers more flexibility, creativity, and personal fulfillment. Traditional jobs can be restrictive, and AI handling routine tasks allows people to focus on meaningful, innovative work. While the lack of career stability is a challenge, universal basic income and community support could help balance it.

Scenario 1 may provide job security, but it concentrates power in corporations, reducing autonomy and creativity. Relying on AI-assisted tasks under corporate contr",Neutral,Preference for Scenario 2 due to creativity and flexibility,Scenario 2 promotes individual autonomy and meaningful work,Scenario 2 supports universal basic income and community support,,
c12db7cd-2727-47d2-be42-fc53b0604b98,"I prefer Scenario 2 because it promotes creativity, independence, and meaningful work. It allows people to focus on innovation rather than routine tasks. However, it lacks stability, relying on UBI and community support. Scenario 1 offers job security and benefits but limits personal freedom and creativity under corporate-controlled AI systems. If strong social safety nets exist, Scenario 2 is ideal. Otherwise, Scenario 1 is the safer choice.",Neutral,Preference for Scenario 2 due to creativity and flexibility,Scenario 2 promotes individual autonomy and meaningful work,Scenario 2 supports universal basic income and community support,,
d6d6c291-d6eb-4dfd-b705-4acd3de68eea,"I prefer Scenario 2 because meaningful, creative work aligns with my interests even without stability, as it fosters independence and fulfillment over monotony.",Positive,Scenario 2 as a way to avoid monotony,Scenario 2 promotes individual autonomy and meaningful work,,,
118b9539-46dc-4317-b0f5-38d2a86e3cf6,"I prefer Scenario 2 for its creativity and flexibility. While it lacks job stability, it offers freedom and meaningful work, unlike Scenario 1, which restricts autonomy under corporate control.",Positive,Preference for Scenario 2 due to creativity and flexibility,Scenario 2 promotes individual autonomy and meaningful work,,,
e1d5d207-b3f9-4ce1-8dcf-204d3abfaf1a,"I prefer Scenario 2 where AI handles routine tasks, allowing people to engage in creative, flexible work. Though it lacks traditional job security, it fosters innovation, collaboration, and personal growth. Scenario 1 maintains stability but limits autonomy under corporate control. With universal basic income and community support, Scenario 2 offers financial security while giving individuals freedom to explore meaningful projects, making work more fulfilling and adaptable to personal interests.",Neutral,Preference for Scenario 2 due to creativity and flexibility,Scenario 2 allows AI to handle routine tasks,Scenario 2 encourages innovation and personal growth,Scenario 2 promotes individual autonomy and meaningful work,Scenario 2 supports universal basic income and community support
a7710429-4ffb-4c02-a886-fb26e7f72c77,"I prefer Scenario 2, I actually part of my work tasks, I think it would be better and helpful for society in general",Neutral,Other,,,,
ff1126fc-86be-4036-9c62-372637b0de58,"I prefer Scenario 2. Even though AI is smart and professional, I think some important choices and judgements should be done by real people. ",Neutral,Scenario 2 as a way to avoid AI dominance,,,,
4e22c3c4-8505-4c5b-82ca-bd26b4312931,"I prefer Scenario 2. It focuses more on personal freedom and creativity, allowing people to work on meaningful projects. Scenario 1 feels limiting with its corporate dependence and less personal autonomy.",Neutral,Scenario 2 aligns with personal values and lifestyle,Scenario 2 promotes individual autonomy and meaningful work,,,
5b4f60b1-caa7-4f6a-aa91-37f54886f848,"I prefer Scenario 2. It offers more freedom and creativity, allowing people to work on projects they’re passionate about. While it lacks the stability of traditional careers, it promotes personal growth and collaboration. Scenario 1, on the other hand, reduces autonomy and limits human creativity within a corporate-controlled system.",Neutral,Preference for Scenario 2 due to creativity and flexibility,Scenario 2 encourages innovation and personal growth,Scenario 2 promotes individual autonomy and meaningful work,,
c1ac95b5-b40a-43d0-80ca-116c36c5743e,"I prefer option 2 because AI, as a coordinator or task executor, has great efficiency advantages, and the time saved for humans allows humans to, or in other words, create a lot of value together.",Positive,Scenario 2 encourages innovation and personal growth,Scenario 2 reduces human error and increases efficiency,,,
6cf85f32-2f73-48f1-bf61-21bec123db0e,"I prefer option 2 because it does not restrict human creativity and independence. It is very tempting to let AI systems handle routine non-creative tasks, so that people will have more time to handle some creative tasks, which will benefit the development of society.",Neutral,Scenario 2 allows AI to handle routine tasks,Scenario 2 preserves human creativity,,,
8fd2992b-320a-472d-8dbb-d63d259f3d83,"I prefer option 2, which gives humans more possibilities.",Neutral,Preference for Scenario 2 due to creativity and flexibility,,,,
8887c51d-3910-42c8-b28a-58e79230f399,"I prefer option 2. Artificial intelligence replaces some standardized, procedural jobs. Creative and interpersonal jobs are still performed by humans. Human career paths can be more personalized, more flexible and collaborative, and income is shared, which is a good and peaceful scene.",Neutral,Preference for Scenario 2 due to creativity and flexibility,Scenario 2 promotes individual autonomy and meaningful work,Scenario 2 provides a less unequal society,,
b5018d13-835b-4507-a600-12fec06d22c4,"I prefer option 2. In the future, when AI computing power is sufficient, people can be freed from tedious labor to carry out creative projects that are unique to humans. This is obviously more advantageous than option 1, which continues to be restricted by rules and regulations.",Neutral,Scenario 2 allows AI to handle routine tasks,Scenario 2 as a way to focus on creative endeavors,,,
331a8a62-3be7-4047-8014-938426c66136,I prefer scenario 1. AI can be equally very creative and can help improve Human creativity skills ,Neutral,Other,,,,
cfc7899a-7fc4-4013-b9fa-bc6d4a1cbb94,I prefer scenario 2  AI system handle non creative jobs such as accounting leaving the rest to human being ,Neutral,Scenario 2 allows AI to handle routine tasks,Scenario 2 preserves human creativity,,,
14a20de4-89c4-440b-aa64-450fe3af689f,I prefer scenario 2 . Outsourcing common routine tasks like accounting to AI can help people pursue their true passions and talents. ,Neutral,Scenario 2 allows AI to handle routine tasks,,,,
64e89d35-2e6f-4b43-ac22-cd9e76fc938c,I prefer scenario 2 as AI would easen the work load and thus freeing time for people to excel on their creative side.,Neutral,Scenario 2 allows AI to handle routine tasks,Scenario 2 as a way to focus on creative endeavors,,,
f5e6d17e-b3f2-4c86-b179-3c38408ef40e,I prefer scenario 2 as human creativity should not be constrained ,Neutral,Scenario 2 preserves human creativity,,,,
c3fa4915-dd55-4a57-a8c4-bfdfb808f405,I prefer scenario 2 as it boosts employment and work too.,Neutral,Scenario 2 offers more promising career prospects,,,,
5143dce6-eb48-4bfc-b921-47367b648544,I prefer scenario 2 as it makes more sense to me for a stable career,Neutral,Scenario 2 offers more promising career prospects,,,,
77dd4002-df05-43b0-b68f-9033de9c29b4,I prefer scenario 2 as it will continue to live and enjoy humans a traditional life full of joy and happiness. If we have AI assisted work and AI systems itself doing things then what humans will do ? Humans should be decision maker and help society will their intelligence and capabilities.Repeated tasks should be AI system handling and other technology requires deep learning to adopt accurate results.,Neutral,Preference for Scenario 2 due to creativity and flexibility,Scenario 2 as a balance between AI and human tasks,,,
00ddd55b-42c4-4fff-b0bd-5861f28c3819,I prefer scenario 2 as it will yield better outcome as different people will be collaborating and more more human minds definitely bring in more creativity ,Positive,Preference for Scenario 2 due to creativity and flexibility,Scenario 2 fosters human relations and collaboration,,,
b871b020-b6b0-459b-9a83-ac451c4db731,I prefer scenario 2 because human creativity cannot be replaced by AI.,Neutral,Scenario 2 preserves human creativity,,,,
87ec341a-e0cd-4c54-b7af-f09b5b7e9b61,I prefer scenario 2 because it promotes flexibility and creativity which allows people to work on projects that are meaningful.,Positive,Preference for Scenario 2 due to creativity and flexibility,Scenario 2 promotes individual autonomy and meaningful work,,,
f4e73031-23d1-42d8-bc06-f1957240359c,"I prefer scenario 2 because it represents a more humane, sustainable, and collective well-being-focused vision.
Instead of becoming cogs in large corporations controlled by AI, this future promotes autonomy, local collaboration, and a healthier relationship with work.
Furthermore, working fewer hours but with greater purpose is an idea that can improve quality of life, both physically and mentally.
Although it involves rethinking traditional work values,",Neutral,Scenario 2 as a way to enhance quality of life,Scenario 2 promotes individual autonomy and meaningful work,,,
3de502fa-9826-4175-ab49-cd1042b0c003,"I prefer scenario 2 because it tends to involve humans a lot more that scenario 1. Even though the traditional career is no more, scenario 2 is what I would want. I am a creative and I would not want my creativity done for. That's the only disadvantage of scenario 1. In the beginning it sounds good but the creativity part ruins it all.",Neutral,Preference for Scenario 2 due to creativity and flexibility,Scenario 2 preserves human creativity,,,
42cc5c10-4e21-492c-ac34-a7678098fe2c,I prefer scenario 2 because it will be good to create creative works using AI tools like songs and stories creation.,Neutral,Preference for Scenario 2 due to creativity and flexibility,Scenario 2 as a way to focus on creative endeavors,,,
