Participant ID,ResponseText,Sentiment,Tag 1,Tag 2,Tag 3,Tag 4,Tag 5
2bf27e1c-02df-41b2-8dcd-374441db7e04,I will not give 100% trust on the chat bots because many of the times it gives wrong answers and it doest give me the answers what I asked and it not trusted easily and the chatbots are also telling that only that chatbots can make mistakes please check the anwsers,Negative,AI's limitations in handling complex or sensitive tasks,AI's potential for errors and misinformation,,,
e26d9238-7fd3-4c97-b659-5bc27105d05a,"I'll not blindly trust AI chatbots because they are machines and can also make mistake and provide biased information. But they can be really helpful like when I don't have anyone for talking. They can help me in sorting my tasks. 

But I don't have so much trust in AI chatbot. ",Neutral,AI's inability to fully replace human judgment,AI's potential for errors and misinformation,AI's role as a tool for efficiency and assistance,AI's role in providing emotional support,
bfb26da4-677e-43b1-951d-eaf74aeefc08,"I'm familiar with the process of AI training, as far to my knowledge goes most AI is trained to give a factual unbiased information, not influences by politics. But things can change. ",Neutral,AI's reliance on training data and potential biases,AI's role in providing unbiased and factual information,,,
61011617-805a-42c4-a654-19b8aa655a53,"I'm kind of suspicious of AIs because they don't always point out the right thing, and they're manipulated by humans. I don't trust human beings.",Negative,AI's potential manipulation by developers or companies,Concerns about AI's data privacy and security,,,
5a06a974-9262-4729-902a-f6fbe56dec68,"I've had bad experiences, especially with chatbots that operate on issues of vital importance in society, regarding user support in various aspects. In all cases, the experience is poor.",Negative,AI's limitations in handling complex or sensitive tasks,,,,
da1fd2b0-adbd-4362-8fc2-954349948729,I've read a little about ChatGPT's philosophy and I want to believe that their moral foundation and the values they preach so much will become real.,Positive,Other,,,,
28eb2257-2c64-4a41-a11f-91707390c5ad,I've used AI chatbot many times before and they are smart in finding good responses to meet my needs,Positive,AI's role as a tool for efficiency and assistance,,,,
8b93f34d-0408-4e8c-a13e-17d3d08dd7dc,"If you prompt AI correctly it will always give you exactly what you want.

",Positive,Trust in AI chatbots due to prompt and accurate responses,,,,
29da2f09-086c-4ae8-8cea-a585ab87d707,"In general, AI chatbots are trained to try to help in any way they can. They are often much more cautious than humans about the information they give you, even recommending that you cross-check it. They always write in a good way, and I feel comfortable writing to them. Of course, this could change someday if the models were trained differently.",Neutral,AI's role as a tool for efficiency and assistance,Verification of AI-provided information,,,
93671e38-35e6-4925-9934-aa821fb31ad3,"In general, I can  expect the bot to do my work  and redundant , academic or work research well.

But the every society has to look for itself rather than dependency on bot on WhatsApp could benefit them ",Neutral,AI's impact on personal and professional tasks,AI's role as a tool for efficiency and assistance,,,
9cacc45b-a817-4943-af1a-7a8c643f49bd,In my opinion the AI chatbots are getting good day by day. But perhaps still there is a need for human scanning and supervision for the results produced by these chatbots,Neutral,AI's continuous improvement and development,AI's inability to fully replace human judgment,,,
4ad034c3-f067-4db6-b7b9-ea873a1e630b,"In the end results, they are meant to bring profit to their companies rather than the users. Even if they are immensely helpful to the user, they would still do stuff like sharing user information to advertisers or collect info for training models.",Neutral,AI's potential manipulation by developers or companies,Concerns about AI's data privacy and security,,,
c0722e3d-6fed-4b6e-83ac-1d34c1baf2a2,Information Integration,Neutral,Uninformative answer,,,,
7f8c37e1-b578-4ef5-9804-81b492442c63,It all depends on the prompt I ask him.,Neutral,Uninformative answer,,,,
70703530-2581-43cf-8cfa-d0df26e4df62,It can give me an information actual and give me a reference link ,Neutral,AI's role in providing quick and reliable information,,,,
f33687d8-5d0d-4f65-b97d-d8a7415f95f1,It could have hidden features I'm unaware of that access more than what I input on my device,Negative,AI's lack of transparency and potential hidden agendas,,,,
7d0ac625-c4b7-4f7a-a24c-60162eeece0a,It delivers response based on my prompt not generating or speaking on its own like a conversational. It is like a enhanced version of the traditional search engine,Neutral,AI's role in enhancing productivity and efficiency,AI's role in providing general assistance and support,,,
12b1fdb9-73b0-4577-88ee-60aa4befcd51,It depends on how much my corporate interests overlap with the robot's.,Neutral,AI's neutrality and lack of self-interest,,,,
64594302-5337-49c0-a6b0-e7fc71031e2f,"It gives me a precise information , make my work easy and save my time",Positive,AI's role as a tool for efficiency and assistance,Trust in AI chatbots due to prompt and accurate responses,,,
6656137d-5327-4dba-99fa-1f094d340e8e,"It gives or solves day to day problems. I can ask whatever to AI chatbot, whenever I couldn't ask that in real life. And most of the time it will give proper responses as it is trained on massive amount of datasets",Positive,AI's role in decision-making and problem-solving,AI's role in providing quick and reliable information,,,
6a70d00a-a244-4ac5-bfa4-2dec945cc841,It has helped me in dire circumstances and the information was correct,Positive,Trust in AI chatbots due to prompt and accurate responses,,,,
2f47dd1a-1ce4-4da2-b6ee-f73819f7e560,It helps in my daily tasks,Positive,AI's impact on personal and professional tasks,AI's role as a tool for efficiency and assistance,,,
35606e90-7107-4f7d-bb34-c3392ab22b4c,"It is a program after all, and I think that it is limited by what the company that oversees it will do with my data. I am aware that as of now my data is used to learn more and as a basis for replies to other users. I do not trust it with my original ideas or thesis statements.",Neutral,AI's reliance on training data and potential biases,Concerns about AI's data privacy and security,,,
09e83c29-9962-4aea-aa7f-e035bf4e9eff,"It is a system that develops strongly every day I use this tool for work and some daily tasks simple things, in which I trust.",Positive,AI's continuous improvement and development,AI's role as a tool for efficiency and assistance,,,
e563d981-66bd-4f1d-9339-0d1cd2b04888,It is currently easier to control than humans,Neutral,AI's role in enhancing productivity and efficiency,,,,
e935e7b0-63d1-4d25-b4b2-aae0385d4814,It seems to respond to me with empathy. ,Positive,AI's role in providing emotional support,,,,
521a6dc4-14e3-4d31-b22b-5ba2ba750a57,It's almost accurate information obtained,Positive,Trust in AI chatbots due to prompt and accurate responses,,,,
5ed278f0-14a3-40d0-9ddb-54257b5375cf,"It's an AI; I don't have to trust a programmed robot. It's pragmatic and only answers to the creator if it doesn't gain independence.

",Neutral,AI's lack of human emotions and understanding,,,,
e451ff6d-9b78-4778-8dc3-362d98ff6570,"It's because,it provides well-reasoned, unbiased insights tailored to my needs. It helps me think critically, make informed decisions, and explore creative ideas without judgment. Unlike human interactions, where emotions or biases can sometimes interfere, ChatGPT remains objective, reliable, and consistent. Whether it’s problem-solving, learning, or strategizing,I know I can count on it to offer thoughtful guidance based on logic and the information available",Positive,AI's role in decision-making and problem-solving,AI's role in providing unbiased and factual information,Trust in AI chatbots due to prompt and accurate responses,,
064510f2-8453-4d1d-94db-703a41dbbf04,"It's just a computer model, a database, and one that's prone to hallucinations. It can produce both correct and incorrect information.",Neutral,AI's potential for errors and misinformation,,,,
02e90912-d058-4133-abd2-cdf802b63ff1,It's something that is reliable with high accuracy and gives best results ,Positive,Trust in AI chatbots due to prompt and accurate responses,,,,
676f6ea8-353c-464d-b562-f733a0d7dd52,"Its depend on the situation and conditions. If related about general knowledge and not involving personal or sensitive matters, I'm okay with that.",Neutral,AI's limitations in handling complex or sensitive tasks,,,,
88aceab5-5202-4afa-91de-93f2f22265bb,Its give answers based on what it is trained so i check the reliable sources and do not fully trust AI chatbot to act in my best interest,Neutral,AI's reliance on training data and potential biases,Verification of AI-provided information,,,
b77cb754-8b0e-43ee-936e-ad8a41d61909,"More trustworthy, advantages outweigh disadvantages",Positive,Trust in AI chatbots due to prompt and accurate responses,,,,
a104d65f-1ce6-42fa-9d1f-41eef909a7ab,My chatbot it is precise and straightforward. It will always give me exactly what I asked for and occasionally even more depending on how clearly I phrase my questions. It will provide me support to the best of its current capabilities and try to improve where it fails. Unlike humans it does not have any self interest or motives for holding back on me. ,Neutral,AI's neutrality and lack of self-interest,AI's role in providing general assistance and support,Trust in AI chatbots due to prompt and accurate responses,,
38078b60-12d8-49b7-b221-7fea46aadaa1,Privacy concern,Neutral,Concerns about AI's data privacy and security,,,,
b3a90ba2-0f1a-483a-900b-1f4831c00e4d,"Provide the best possible help without having to consider other things, maximize benefits, and facilitate daily life",Positive,AI's role as a tool for efficiency and assistance,AI's role in enhancing productivity and efficiency,,,
8405afbf-0545-492e-8756-942cf068b0a4,Saves me a lot of time searching in the browser,Positive,AI's role as a tool for efficiency and assistance,AI's role in enhancing productivity and efficiency,,,
0d8d7b70-ec0a-4dd1-8cd9-8ebe74486528,"Since AI is not influenced by emotions, I feel it can act in the best of my interest. Its job is to perform in the best way possible, exactly what I need.",Positive,AI's lack of human emotions and understanding,AI's potential to act in the user's best interest,,,
1b2aa72b-924a-4ecf-87e3-f06d2e2badf1,"Since AI systems usually act in my best interest, in my opinion, since they are designed for that, but I think they have to be used judiciously since there is erroneous, biased information, etc. I don't think using it, and taking the answers for sensitive or research topics as correct is a good idea.",Neutral,AI's potential for errors and misinformation,AI's potential to act in the user's best interest,,,
27c7a461-e50c-4d41-8b50-2faca73836f3,Sometimes AI gives erroneous data that needs to be verified.,Negative,AI's potential for errors and misinformation,Verification of AI-provided information,,,
1a9aa568-4c74-437f-90d0-6beaf5154814,Sometimes the answer or an AI chatbot is very accurate ,Neutral,Trust in AI chatbots due to prompt and accurate responses,,,,
76ffde94-7453-4e5a-97cc-16d9b44734e7,Sometimes they give suggestive answers that make sense.,Neutral,Trust in AI chatbots due to prompt and accurate responses,,,,
7298a301-433f-47b6-95c1-9be23fd08ebd,"Sometimes, it will give the right answers and sometimes it will not.",Neutral,AI's potential for errors and misinformation,,,,
bedd1b1f-f469-445c-89cc-589835476124,"Sometimes, they can generate false or biased information",Negative,AI's potential for errors and misinformation,,,,
8222fc7b-04a3-4942-8ad7-3385dabd98cd,Taking into account my usage of AI chatbots I haven't faced any kind of difficulty and threat personally but I do think that excess usage might harm me ,Neutral,AI's impact on personal and professional tasks,Other,,,
452792b5-2212-4694-8099-6e95b2f657b2,"Technically, AI should not have any hidden agendas, unless it is programmed by the developers to have it. So it is up to the individual user to assess the outputs to determine the trustworthiness of the response.",Neutral,AI's lack of transparency and potential hidden agendas,AI's neutrality and lack of self-interest,,,
577a5f2a-94d9-4369-84fb-809404688611,"The AI Chat will respond to me according to my needs and what I ask it, there is no reason to distrust it if I ask it the question correctly.",Neutral,AI's potential to act in the user's best interest,Trust in AI chatbots due to prompt and accurate responses,,,
a3981121-7a9b-4054-a682-f9868dbbd7d5,The AI chatbot fulfils its prompts in an objective way.,Neutral,AI's neutrality and lack of self-interest,,,,
8a7ea13d-7787-422a-9929-095477e0a262,"The AI chatbot is not someone I know in real life, but based on its relatively rational judgment, it will give some answers, so I neither trust nor doubt it.",Neutral,AI's inability to fully replace human judgment,,,,
20cb3cfb-4911-4d94-afef-7629676cbf81,The Ai chatbot i have used never gave me a misinformation. It has done tasks according my requirements without any faults. I gave somewhat trust because it might have used some of my personal information sometimes. But i trust it was never misused,Neutral,Concerns about AI's data privacy and security,Trust in AI chatbots due to prompt and accurate responses,,,
6cb3023a-22c4-49ab-9c09-e8eb1a92a604,The ai chatbot cannot much helpful now days and need to be imporved much more by ai building companies. If a Emotional ai is build by companies are very much welcomed. I gave the score because i have recently seen many news regarding Ai unexpected answers like a student asked answers for his exam and that chatbot abused him and asked him to die. This was really concerned.,Neutral,AI's limitations in handling complex or sensitive tasks,AI's potential for errors and misinformation,,,
4c016c4f-f2f3-4ec6-944d-98280b4007cb,The chatbot is useful when answering a precisely asked question. But the algorithms of its actions remain unknown to users.,Neutral,AI's lack of transparency and potential hidden agendas,AI's limitations in handling complex or sensitive tasks,,,
79e00d7e-9cd2-4fc5-8403-4a7f177423d6,"The data is stored in their database, and both my responses and those of others inform their approach.

In addition, it's common for them to fabricate information and fail to provide their sources.",Neutral,AI's potential for errors and misinformation,Concerns about AI's data privacy and security,,,
aec720ea-f0c1-434f-96eb-46e6260addeb,"The reason for giving this trust score to the AI ​​chatbot is that even though it has deep knowledge on most of the topics, it also makes errors and I have experienced this on many occasions. Instead of blindly trusting the information given by it, one must check it at his level once.",Neutral,AI's potential for errors and misinformation,Verification of AI-provided information,,,
748ce664-fa73-4df5-99f3-12cafa2cdc98,The robot really seems to be working more for the factory than me.,Neutral,Other,,,,
e6a5ff95-4405-42ec-8646-eeeb8a2c6106,"The training of chatbots is based on probability theory. I believe that when there is enough data, the responses given will be relatively excellent.",Neutral,AI's reliance on training data and potential biases,,,,
cd012b0a-cb68-4f94-8994-080fe1ed9dca,"There are enough safeguards in place for me to give it some degree of trust, although this is in the context of tasks I give it and the data I supply it. I would not wholly rely on it for, say, fact-checking (unless sources were cited) and there is a limit on how much PII (Personal Identifiable Information) I am personally willing to submit on a public AI such as ChatGPT.

",Neutral,AI's potential to be a threat to privacy,Concerns about AI's data privacy and security,Verification of AI-provided information,,
52209e78-4fcf-4012-b781-27e8c7023ad9,There are obviously boundaries on LLMs they act based on what we want from them and yea right now I can trust on them,Positive,AI's neutrality and lack of self-interest,AI's role in providing consistent and reliable responses,,,
d19689c8-440d-4ba1-8d5f-daf795f3aad8,There have been several articles on how AI companies censor their language models. They can make these models produce a biased response. Not all companies are corrupt but the huge ones they only care about the profit. They will tailor their models to please as many people as possible. Because they want to make the biggest revenue.,Neutral,AI's influence by the creators' biases and intentions,AI's potential manipulation by developers or companies,AI's reliance on training data and potential biases,,
12575a7b-525d-45a9-9f50-e06e19d78d37,"There is a strong lack in transparency which makes me wonder who can get access to the real, raw data which has been collated. Tracking and surveillance becomes really easy and intellectual property could be easily stolen.",Neutral,AI's lack of transparency and potential hidden agendas,AI's potential to be a threat to privacy,Concerns about AI's data privacy and security,,
2baaaf5c-423a-4ba5-8d76-a8e0801a6ccc,There is no way AI chatbot can give invalid information ,Negative,AI's potential for errors and misinformation,,,,
0b65458e-7dee-43f0-a4b8-6273a830bd64,"They are continually adjusted and provide reliable, complete answers -- you just have to know how to ask.",Positive,AI's continuous improvement and development,AI's role in providing consistent and reliable responses,,,
efcac8b2-8dd3-4a72-9051-5dce0ddfa98a,They tend to always look for durable solution to problems so they are problem solvers so I need to somewhat trust them.,Neutral,AI's role in decision-making and problem-solving,,,,
08c907ff-00c8-4117-9426-b705b1606b96,"This is because I don't wholly trust AI chatbots since I have had a few experiences where they have not been a hundred percent accurate, meaning they have their faults, so I have to double-check other things to ensure they are right.",Neutral,AI's potential for errors and misinformation,,,,
4dabd28b-36ba-4e7e-b398-b3ad7945078c,"This is because all time the AI chatbot works on whatever issues availed to it , trying to generate correct answers ",Neutral,AI's role as a tool for efficiency and assistance,,,,
866e7a19-33ba-4706-8982-2f207854ddf5,"This survey is not well-phrased. If I am the one responsible for the prompts and evaluations of the AI chatbot output, I am the one making the decisions. Your question astronomizes AI, it cannot ""act in someone's interest"". ",Neutral,Other,,,,
73722739-5719-41db-b39a-9a40f898b62d,"Till now I haven't read any article about how AI is using my data. Of course, they are using my data. I am sharing everything with them, but still, I am not sure about the consequences. Till now I trust AI; that's why I asked personal questions as well. If I didn't trust AI, then I wouldn't ask personal questions at all. AI knows all about my family, my occupation, etc. It's scary, but still I am using it. I feel it is a necessity. ",Neutral,AI's potential to act in the user's best interest,AI's potential to be a threat to privacy,Concerns about AI's data privacy and security,,
aaaa6389-15db-4d2e-827a-50e274c80940,"To a large extent, AI chat robots have no conflict of interest with me, so I believe that they can think about problems and make choices from my perspective.",Neutral,AI's neutrality and lack of self-interest,AI's role in decision-making and problem-solving,,,
f01f2d43-9896-4a2c-8d46-d4ccbb3c04e7,"Unles specifically programmed in a malicious way, it should work only for the benefit of the user",Negative,AI's potential to act in the user's best interest,,,,
ac41446e-ac7b-4e2d-8234-16bfe73c60e7,"Well it's quite simple. The chatbot itself does not (as far as I'm aware of) have it's own agenda. It does not get any reward from intentionally telling me a lie. It does not have a notion of furthering it's own goals.

I trust it to aggregate information from wherever it can and present it to me.

Of course, sometimes the AI returns complete gibberish or factually wrong information, but it does so rarely. It does not tire, it does not thirst, it does not yearn for anything but to answer me.",Neutral,AI's neutrality and lack of self-interest,AI's potential for errors and misinformation,AI's role in providing quick and reliable information,,
e6dac369-2a8b-46e5-b03f-708226a9cdf5,"Well, for example, I encountered a political coloring of AI, asking a question about the current ownership of Crimea, about the war between Ukraine and Russia, I see that the AI is a little politicized, apparently it depends on who developed the AI",Negative,AI's influence by the creators' biases and intentions,AI's reliance on training data and potential biases,,,
f67a85af-c8fc-47a8-b672-79b44116fdba,Whatever interactions I had with AI until this point has been overall fruitful and satisfactory to say.,Neutral,AI's role as a tool for efficiency and assistance,Trust in AI chatbots due to prompt and accurate responses,,,
c846b296-2848-47be-be7c-900aedecb4d2,"When I requests something to my AI chatbot, it's willing to help with the requests usually. ",Positive,AI's role in providing general assistance and support,,,,
60bc5d17-6e9d-400e-b696-5653a767816a,Yes for sure! I use prompt to make good output and add some references from high authority websites so that I can trust it.,Neutral,Trust in AI chatbots due to prompt and accurate responses,Verification of AI-provided information,,,
34655636-ed63-49b7-9a01-49a13ceb4e72,"a chatbot is fed data to be trained on, it doesn't have any interest in mind

if it's fed with data that show altruistic behavior it will turn to be altruistic but also the converse",Neutral,AI's neutrality and lack of self-interest,AI's reliance on training data and potential biases,,,
6991f06b-b363-41b7-86a4-4dbf333f9b66,"a chatbot is ideally neutral and does not act in anyone's interests, but I'm not sure that the neutrality of the companies running chatbots has been proven",Neutral,AI's influence by the creators' biases and intentions,AI's neutrality and lack of self-interest,,,
0fbf53e1-e062-4cf7-b77b-cd58a6b87e0f,at the moment i have concerns about bias in ai chat bots,Negative,AI's reliance on training data and potential biases,,,,
758a6e22-2154-480c-afe0-d6e04fb1bdb8,"because AI chatbot was trained by some people and some faith, so it has some fairness",Neutral,AI's reliance on training data and potential biases,AI's role in providing unbiased and factual information,,,
3ed13600-974f-4071-a55d-68e9c132238d,"because I feel much more confident about it

",Positive,Uninformative answer,,,,
32d11c0a-ee11-47eb-9cd4-d1028aeef51b,because i can see the references if needed.,Neutral,Verification of AI-provided information,,,,
f1fc335c-f402-40ac-994d-0e8cba0fe43b,"because it clearly explain my questions, step by step, with understandable reasons. Eventhough it might be wrong some times.",Neutral,AI's role in providing consistent and reliable responses,Trust in AI chatbots due to prompt and accurate responses,,,
97333f7c-1f1a-44cc-8452-515b134e1def,because it gives the good answer to my questions like it is reading my mind.,Positive,Trust in AI chatbots due to prompt and accurate responses,,,,
42946d72-dcc3-44bc-9ca6-df27f521a30c,because they are trained on enormous amount of data and are mostly accurate,Positive,Trust in AI chatbots due to prompt and accurate responses,,,,
140877f3-73e5-4529-abf1-36c9de6d2519,because usually they are programmed on ethical bases so it wont go beyond that,Neutral,AI's reliance on training data and potential biases,,,,
893189a9-220d-4c73-9373-77fde35eebad,chatbots may provide personalized answers in light of the detailed questions provided to them or the type of assistance asked for. May be the chatbots can provide previous examples where similar situations have happened and they can offer multiple ways to resolve a situation. ,Neutral,AI's role in providing general assistance and support,,,,
83079bb4-aa5f-46ce-8d0f-5dbf10bb20cd,"data may be incorrect, AI can get the data from the source which is unknown",Neutral,AI's potential for errors and misinformation,AI's potential to be influenced by external factors,,,
02fcc43c-7e05-4644-b6f0-80f48fa8a034,"from my experience of utilizing chatbots so far with tasks that were of concern to me, i havent yet encountered any response that would force me to consider whether the response from AI was something that wouldnt be in my favor or interest or not. I am not saying its impossible, just that I myself havent encountered that yet",Neutral,AI's neutrality and lack of self-interest,AI's potential to act in the user's best interest,,,
99440f3e-bde1-4569-b677-998b9f6cf1bc,i can control the output of the chat and I can ask it for references if I am not sure ,Neutral,Trust in AI chatbots due to prompt and accurate responses,Verification of AI-provided information,,,
167414f4-44d8-47ef-af95-f6d083935263,"i do not trust a machine, i prefer human contact face to face so i can pretty much see hoe he feels, thinks. instead of an invisable machine, an it that doesnt have human form or mind.",Neutral,AI's lack of human emotions and understanding,,,,
4311474e-5376-421d-9f8e-57336cd57f27,"i have been using these chatbot in most cases and they are always 100% accurate, i trust them but i might not trust the person who is controlling them but overall, they have given me the best experience of my life",Positive,AI's role as a tool for efficiency and assistance,Trust in AI chatbots due to prompt and accurate responses,,,
