Participant ID,ResponseText,Sentiment,Tag 1,Tag 2,Tag 3,Tag 4,Tag 5
55d748c9-f0ae-444f-a4a7-20c8a49f3435,The AI Chat may not offer accurate cultural information,Negative,AI's inability to understand cultural or contextual nuances,,,,
8f09b036-1692-4113-9ba3-b37381fb0458,"The AI chatbot always responded according to my instructions, but occasionally included fictitious information.",Neutral,AI's potential for errors and misinformation,Trust in AI chatbots due to prompt and accurate responses,,,
061b8bd6-4b1b-4cc9-ba8f-8ec8af2e2efa,"The AI chatbot responds to my prompt. It can give me what I want to see but, it also can give answers so generic or unrelated to my prompt.",Neutral,AI's role in providing consistent and reliable responses,Trust in AI chatbots due to prompt and accurate responses,,,
e15b0fbf-1881-4c06-b6c9-192b0c79d05a,"The ai (Chat gpt) model at this stage of its development 99% of the time encourages me  alot , advices me helps me with tasks and discourages me from engaging in harmful behavior. Since I started using chat gpt my knowledge base has increased skills and in all aspects that the model can help.",Positive,AI's impact on personal and professional tasks,AI's role in enhancing productivity and efficiency,,,
8b2d2b63-295a-4b61-8d95-b1be3204ffa1,"The answer that I have gotten is close to what I was looking for
",Positive,Trust in AI chatbots due to prompt and accurate responses,,,,
259c0372-35fa-4057-9fc8-9deca37e2e22,"The chatbot does have safety standards concerning children, and will not give any advice that they aren't legally allowed ",Negative,Other,,,,
88ca74f1-955f-4cb4-8fdc-cda017365fae,The chatbot has no will of its own. It's indifferent to anyone's interests.,Negative,AI's neutrality and lack of self-interest,,,,
c7e78138-3658-4e14-a18d-f42ff8e1045d,The chatbot is very liable  and is efficient to me.,Positive,Trust in AI chatbots due to prompt and accurate responses,,,,
1bec32d9-050f-4fcc-8c2f-493f4faab34d,"The chatbot operates within the boundaries I have set for it. If I ask it to write a script, it writes a script. It does not happen that I ask it to write a script for work, and instead it writes a virus for my computer.",Neutral,AI's impact on personal and professional tasks,AI's neutrality and lack of self-interest,,,
56c355b3-81d2-48a6-93e3-146afb5460a9,"The current AI chatbots have not yet surpassed the existing knowledge of humans, and their intelligence has not yet reached the level of humans. In addition, according to the framework and logic that humans have set for them, the suggestions and responses given by AI chatbots are still based on the answers that the questioner wants to get. They may not necessarily be the best solutions, but at least the current AI chatbots will not deliberately give wrong answers to the questioner. So at present, compared with humans, such as friends around us, or even so-called experts, I think the answers given by AI chatbots are fairer and more comprehensive, because AI chatbots do not need to avoid anything, and do not have to worry about the answers they give will attract criticism or bad influence. In addition, according to the settings made by humans, AI chatbots will not give illegal or politically biased responses.",Neutral,AI's neutrality and lack of self-interest,AI's potential for errors and misinformation,,,
89ef6da4-2f5f-4a85-aee7-b68e6a8251a5,The current results of AI are based on algorithms and big data. I don’t think the results are targeted.,Neutral,AI's neutrality and lack of self-interest,,,,
1d0106a2-9c7a-48c6-977b-c10d126a3215,The result that AI gives me is almost same answer with that Google provides.,Neutral,Trust in AI chatbots due to prompt and accurate responses,,,,
11ddef55-ce2f-42b2-9141-c863dfe3b713,There are benefits and risks involved in using AI. It totally depends on how we use it. It is just a robot which cannot be in your favour.,Neutral,Other,,,,
f4f92402-5fbb-4724-bab3-5c6508dad30a,There are certain circumstances that AI can't surpass human behaviors and such. ,Neutral,AI's inability to fully replace human judgment,AI's lack of human emotions and understanding,,,
42cc5c10-4e21-492c-ac34-a7678098fe2c,There is no human bias in using AI chatbots,Neutral,AI's role in providing unbiased and factual information,,,,
6b7e4a09-6bbe-48ce-82e3-6e82f6a6faf5,"They are programmed to respond in a certain way and only allow you to say limited things, I can disagree with you and not have a same vocal opinion ",Negative,AI's lack of human emotions and understanding,AI's reliance on training data and potential biases,,,
8269d27f-7a6e-4b8a-9ff9-4c66f3c71539,They're usually controlled by humans so i can neither trust them or distrust as they're in no control of whatever they do,Negative,AI's neutrality and lack of self-interest,,,,
f085b64a-ede7-4767-851e-7b8730385860,"This is because even though it is not human, there is still room for bias in ideas and ideologies. The ChatGPT can give me what I request of it, but not necessarily in my best interests.",Neutral,AI's potential to act in the user's best interest,AI's reliance on training data and potential biases,,,
5986d28e-2ca6-4c5f-8f6f-3d9f3f834b31,"Up to this point, AIs are programmed by humans, which makes them susceptible, like other social networks, to manipulation, in order to get people's attention for longer, through strong emotions, such as anger/disgust.",Neutral,AI's influence by the creators' biases and intentions,AI's potential manipulation by developers or companies,,,
cd5dd918-06dd-45a8-ae23-e66ace5e6687,We cant rely on AI in that sense we should be the one that make a judgement of what best for us ,Negative,AI's inability to fully replace human judgment,,,,
9c6e83af-6165-4249-9c3c-2fa00cdd81d2,We can’t fully rely on ChatGPT on sensitive information and risk involved areas,Negative,AI's limitations in handling complex or sensitive tasks,,,,
c1466edc-a173-433a-8dfc-16730f120a9f,"Well I think it is just a system that is designed to benefit humans, but since it is in an evolution stage I do not know what to expect.",Neutral,Uninformative answer,,,,
6135fc8f-8611-429c-90b9-6f9f23ff3f96,"Well, he is still in the learning process and therefore there are some incorrect moments, but in general, in the future, this will all be corrected.",Neutral,AI's continuous improvement and development,,,,
775a660e-14c8-456a-88cd-9d340f009c18,"When I tried it before, it turned out that there were still many improvements. Lately, it has developed tremendously. Whatever I want, he can give me. It can also be a friend to talk to, analyze the problem, always give some options that make sense to do in everyday life. Even I use it in everyday life of course with only positive choices ",Positive,AI's continuous improvement and development,AI's role in decision-making and problem-solving,AI's role in providing general assistance and support,,
af514344-2119-411d-a4ba-38a9be3b68a7,"With my vast experience, close to 3 years now of working with CHATGPT, there always seems to be an error in terms of factual preciseness of data presented. Additionally, if prompted or commanded to undertake a task in a particular way, there exists instances when it does not carry out tasks in the prescribed manner. This necessitates human intervention whenever possible.",Neutral,AI's limitations in handling complex or sensitive tasks,AI's potential for errors and misinformation,,,
31c4e983-c3db-4e97-be06-e077323dde94,"Yes, with AI chatbots and being an extensive user of one, I do not feel that it acts in either way i.e. it doesn't think of my benefit or loss. It just gives output based on the data it has without understanding, like a sentinel being,  the consequences it may have for me. But I should add it does respond in a manner that makes you feel like it is acting in your best interest. But at the end of the day, it's just a machine without any understanding of benefit or loss.",Neutral,AI's lack of human emotions and understanding,AI's neutrality and lack of self-interest,,,
3d57f07d-3dc4-4cd5-a9e7-055c0c60cae5,"You can not exactly explain the problem to a chat bot, chat bot response are built to a limited manner ",Negative,AI's limitations in handling complex or sensitive tasks,,,,
7f604581-8879-42bc-beb6-7392da689e59,"because I used the AI chatbots many times and every time I seek help from the chatbot , I was more than satisfied by the results given by the chatbot ",Positive,Trust in AI chatbots due to prompt and accurate responses,,,,
0cc036c4-16c4-41b7-b972-b84469ba049a,because Sometimes the response it give may not be accurate or correct,Negative,AI's potential for errors and misinformation,,,,
0911f2f4-6823-40c3-9705-9a6e950952a5,because i am using AI chatbot for a long time and it is very helpful for my work it hardly make any mistake that's why i trust AI chatbot,Positive,AI's impact on personal and professional tasks,Trust in AI chatbots due to prompt and accurate responses,,,
47415c25-c6f0-45ab-858c-edd5a75bdd35,because it works on my command majorly.,Neutral,AI's role as a tool for efficiency and assistance,,,,
476c3f9a-8d99-42d2-b079-d323ace860ae,"because the chatbot has learned about my situation and work, so it will and is helping me accordingly in the best possible ways",Positive,AI's limitations in understanding personal needs,,,,
ab685334-5157-455f-a74f-b988c6cd7827,becz machines will reply as per querys resolution fed in their system in compariosn with humans,Neutral,AI's lack of human emotions and understanding,AI's role as a tool for efficiency and assistance,,,
bcc970fb-19e0-4a76-ab61-8dd53fca0af6,"i see no reason for a chatbot to lead me to distrust, I think they are even programmed that they can't harm the user",Negative,AI's neutrality and lack of self-interest,,,,
2373faa3-6cc2-4098-9832-d0b1bc073de9,it aids fast response ,Positive,AI's role as a tool for efficiency and assistance,,,,
b08b7b51-ffe2-4c55-aa71-74a3a59f4e5b,it gives me the responses that I wanted,Positive,Trust in AI chatbots due to prompt and accurate responses,,,,
5aeeb291-0b14-4460-b014-bd054fb61c87,it has general knowledge on trained data ,Neutral,AI's role in providing general assistance and support,,,,
b3ef0dac-9d1c-48cd-bbed-36d50c22170d,it is biased by the data it has feed.,Negative,AI's reliance on training data and potential biases,,,,
16eafce7-80a4-4015-8bfe-d323ed17467e,it tries to research through different data and compare to give me correct answer information. Sometimes the data is not accurate.,Neutral,AI's potential for errors and misinformation,Verification of AI-provided information,,,
203fc9ab-fd66-4cc4-9610-a992e96026e2,"so far, it has been acting in my best interest",Positive,AI's potential to act in the user's best interest,,,,
ec68cfd1-c78a-40ef-bee4-2c39c818f87b,still need human self review,Negative,AI's inability to fully replace human judgment,,,,
465e30a2-6860-4c4d-87f6-4d911df96f83,"the chatbot in itself has no other business than helping me, but the organizations that own the AI may use my data for their best interest.",Neutral,AI's potential manipulation by developers or companies,Concerns about AI's data privacy and security,,,
0f9aa88d-e413-408f-a364-cdd92bdb56a9,the chatbox provides quick solutions to issues,Positive,AI's role in providing quick and reliable information,,,,
4a2f0a1b-3f7a-4fd0-bad7-6e2a970ddd25,the content you have is entered by people,Neutral,Other,,,,
ba4c0502-3555-4992-aef1-45a2dded6de8,"the responses are outstanding but somehow outsmarts its validator on its conclusive reaction sometimes. When there's an action, there is always an opposite equal reaction.",Neutral,AI's potential for errors and misinformation,Other,,,
0b192a7d-f2a8-4f70-96d0-5feb871e997c,very useful,Positive,AI's role as a tool for efficiency and assistance,,,,
eafa8449-dcab-4597-871f-988e6f5632a1,6 out of 10,Positive,Uninformative answer,,,,
021fae78-46c1-43c6-9d93-bd35f7eee23f,AI chatbot has no emotions and might fail to understand the seriousness of a situation ,Negative,AI's lack of human emotions and understanding,,,,
8aace98a-e84a-4fad-9571-d9619887fc2a,AI chatbot hasn't yet reached the level of trust that is necessary to perform sensitive decisions. ,Neutral,AI's limitations in handling complex or sensitive tasks,,,,
818f5e87-1ca6-47ae-955d-1c1b80fdfa8f,AI chatbot is important and good for operation daily business running ,Positive,AI's impact on personal and professional tasks,AI's role as a tool for efficiency and assistance,,,
623460f2-62c5-4ff6-bd55-8ee7c817a709,"AI chatbox is just a tool. It doesn't care about me, nor does it want to hurt me. ",Neutral,AI's neutrality and lack of self-interest,,,,
977a715e-d6e9-4d26-b74d-3e37e661acc2,"AI is a machine, and there are no feelings, so I don't think it would have any ulterior motive to act against me. Of course, this is only as long as we're assuming it's a system that learns objectively and isn't programmed with a specific purpose or agenda.",Neutral,AI's lack of human emotions and understanding,AI's neutrality and lack of self-interest,,,
5722165e-f7e4-45e7-b6d7-0fb5701d7571,AI is not built around individual best interests. ,Negative,AI's potential to act in the user's best interest,,,,
a17a8375-fea2-4ef1-8b38-baae5b0e0c95,AI only executes a command it has no rationale  to act in my best interest unless i ask it to,Negative,AI's neutrality and lack of self-interest,,,,
320ab629-e6d6-451b-b41a-218b9be1d5b2,Ai chatbots have been useless for me until now. They do not provide any support and just give repetitive answers.,Neutral,AI's limitations in handling complex or sensitive tasks,AI's potential for errors and misinformation,,,
3084490f-06c2-424e-81af-e3a94b9d8563,Ai does not know bad from good,Neutral,AI's lack of human emotions and understanding,,,,
149443a9-4d64-4acc-87b6-ba4a5b5269f7,"An AI is created not to hurt us, if it ever does it is a mistake but in general it will do everything not to hurt us. Since the AI was created to act precisely in our best interest I trust it even if I am wary of if it ever makes a mistake",Neutral,AI's potential to act in the user's best interest,,,,
67c63be9-7376-4499-a669-7786bb1a595f,As I am Software Developer so I used to write different scripts and asked chatgpt to do for me and it usually do the work in professional manner.,Neutral,AI's impact on personal and professional tasks,AI's role as a tool for efficiency and assistance,,,
a79871f7-7ff1-4e52-b1f4-29683b0e8fd4,"As far as I see it, it momentarily has no agenda. I cannot trust it fact-wise, but I can trust my judgment to assess the quality of its work. ",Neutral,AI's inability to fully replace human judgment,AI's neutrality and lack of self-interest,,,
4a7174d8-35cb-490f-af66-515170356dd1,Because AI has never disappointed me before. Always being there for me whenever I need some help,Positive,Trust in AI chatbots due to prompt and accurate responses,,,,
0c57890a-46cd-4895-9d16-b4cc1bcef4bd,"Because AI itself has no need for profit. It exists to serve humanity, so it will take care of the interests of users. Of course, the text used to train AI may be affected by the interests of certain groups, such as large companies and governments. But based on the fact that AI will not make profits for itself, I believe it will mainly consider my interests.",Neutral,AI's neutrality and lack of self-interest,AI's potential manipulation by developers or companies,AI's potential to act in the user's best interest,,
e474fee5-fdd1-4662-a26e-c0b389e28e3d,Because AI now involve in my life also and they gave exactly same result as i want for now i didn't face anything wrong from AI,Positive,AI's potential to act in the user's best interest,Trust in AI chatbots due to prompt and accurate responses,,,
32dc23aa-7db5-48ff-9a90-cf9b5749ece5,Because I am not fully comfortable sharing my thoughts even if the data is somehow anonimized ,Neutral,Concerns about AI's data privacy and security,,,,
2c9ffd57-4980-4a41-a9f0-332a553686e8,"Because I completed automation programming with the help of AI. AI provided code worked fine. Since I know programming, it was very helpful to me. With a few modifications, I could use the code, and it worked as expected. ",Neutral,AI's impact on personal and professional tasks,,,,
56657497-e6e4-4b1a-8b8b-98a30661ba18,Because I do not think there is any bias or ill intent. Whenever I use it it provides me with a great response.,Neutral,AI's neutrality and lack of self-interest,Trust in AI chatbots due to prompt and accurate responses,,,
af299bfd-6677-4cf6-83d2-fe5796b8640d,Because I don't believe in AI being considerate of my interest. ,Negative,AI's lack of human emotions and understanding,,,,
bbe959e2-cf43-4b19-ae26-d2489f4589b7,Because I used them a lot for the past few months and I checked the informations given were still reliable though they lack some details,Neutral,AI's role in providing consistent and reliable responses,Trust in AI chatbots due to prompt and accurate responses,,,
a3323db6-89c4-43c4-a92e-180e2503c29b,"Because I wouldn't know how to differentiate between what's good and what's bad, in reality, it does, roughly speaking. But I don't think it's 100 percent reliable.",Negative,AI's inability to fully replace human judgment,,,,
d89352a3-88fa-433c-895f-837a1ca98d4a,Because as much as it is useful it’s not a completely reliable source,Neutral,AI's inability to fully replace human judgment,AI's potential for errors and misinformation,,,
48b4e6b3-4ee0-49f1-b5d6-30b43d4529a7,"Because he is just a robot, he has no consideration for human interests and no human challenges.",Negative,AI's lack of human emotions and understanding,,,,
ed3e6676-129b-43c0-889e-1272481d96b8,Because i tested it in a lot of issues and it worked well,Positive,AI's role as a tool for efficiency and assistance,Trust in AI chatbots due to prompt and accurate responses,,,
34d83cf8-e86b-4a9b-8ab1-52ae8317d6a8,Because it gives the outcome according to my prompt . There is no false statement which will lead me to a wrong direction ,Neutral,Trust in AI chatbots due to prompt and accurate responses,,,,
728e4ac8-33e4-4dde-843a-1dab7ecbbce7,Because it has given me good results. It solves the problems I give it and I find meaning in what it tells me.,Positive,AI's role in decision-making and problem-solving,Trust in AI chatbots due to prompt and accurate responses,,,
d3edce2b-ae69-4f1a-bcb0-5ebf19e64ebb,"Because it is likely to give me a biased feedback, which can be misleading.",Negative,AI's reliance on training data and potential biases,,,,
7019b346-d970-436d-a8a4-4f75a81dfd09,Because it was made to serve human interests,Neutral,AI's potential to act in the user's best interest,,,,
8873a0e4-6c7a-4752-b4b3-299642617d3d,Because its an AI,Neutral,Uninformative answer,,,,
9d6bcfa7-ce02-43e2-b7f0-b313647874c8,Because right now it was new to everyone and very easy simple to use and can trust easily ,Positive,Uninformative answer,,,,
8a00f658-23b0-41d4-9a41-6d9d91ab5c90,Because robots don't understand me,Negative,AI's lack of human emotions and understanding,,,,
73ee4c32-38a5-44a7-b6d5-d55e2267b58c,Because some information is not correct but mostly is,Neutral,AI's potential for errors and misinformation,,,,
ecc20296-f3d8-4771-9d11-d79e1c8b1b7c,"Because the chat doesn't act in my best interest; in fact, it has no feelings. It just does what it's asked to and doesn't evaluate whether it's right or wrong. It just does what it wants, even though it has some obvious filters. For example, if I ask it for advice on how to hurt someone, it doesn't do it.

",Neutral,AI's lack of human emotions and understanding,AI's neutrality and lack of self-interest,,,
20e07f26-098e-4387-90c6-08028554c6d3,"Because the underlying logic of programming is to meet my needs, objectively speaking, no matter what, it should first meet the requirements I put forward to it.",Neutral,AI's neutrality and lack of self-interest,AI's potential to act in the user's best interest,,,
5b3aff03-bca4-4489-9f63-d8fb47b68eb7,Because they are programmed to answer a question or a problem but have no human mind to consider all the nuances in a response.,Neutral,AI's lack of human emotions and understanding,,,,
e23cfc5e-350f-4c26-982f-12473c714548,Because they can't handle the human emotional support a perfect human is needed to fulfill the human emotions. I only believe in people not on computers.,Negative,AI's lack of human emotions and understanding,AI's role in providing emotional support,,,
e6292c53-2da8-4816-beca-ac91d0126472,Because they were designed to do so,Neutral,Uninformative answer,,,,
dac8d130-6251-479f-8af6-2df4af103f4c,Chatbot right now new things to find every thing or replace search engine because it's more high tech,Positive,Other,,,,
49b9404d-e052-4afd-861c-7d3ba8c1891c,"Essentially the ai dosent know really who I am, his target is to change my perception on the world based of how much some elected guy or advertising company paid for it. So that in mind it can be manipulated accordingly.",Negative,AI's potential manipulation by developers or companies,AI's potential to be a tool for manipulation,,,
10109692-785b-451b-adf6-7133069c5459,Every time I've used ChatGPT I've always been satisfied with the results.,Positive,Trust in AI chatbots due to prompt and accurate responses,,,,
d03cc99a-82c4-4824-9d7f-a3b517fc1700,"He is a tool, he needs to be tested.",Neutral,Uninformative answer,,,,
7074d946-2f5a-4a3a-af83-aeb4cf560a31,Help me in my job,Positive,AI's role as a tool for efficiency and assistance,,,,
d837bc56-59f0-4670-b3a1-c58f82e729d7,I am still completely suspicious. The responses to requests are without emotion and involvement. I take this as an experiment,Neutral,AI's lack of human emotions and understanding,Uninformative answer,,,
568c4552-40c6-4f32-a8cd-9da31be29497,I believe it can not be partial since it is not programmed to be discriminative. ,Negative,AI's neutrality and lack of self-interest,,,,
267d35ac-324b-430a-b2b6-5b6231e6d162,"I cannot predict how AI will be programmed and what it's main goal is, so cannot say if I can trust it fully",Neutral,AI's inability to fully replace human judgment,,,,
36c125d9-bd15-434b-b9d9-28dc99518fce,I do not see AI as something that actually makes a choice on its own.,Negative,AI's lack of human emotions and understanding,,,,
639026b0-f65f-476b-875b-06e7b64f5ee4,I don't think trust is part of the equation in this specific case. It just a tool in most cases. But if I were to given a scenario then I could have answered in more detail.,Neutral,Uninformative answer,,,,
f9b3784e-0e21-42cf-abff-b570fd2efcd7,"I don't trust AI 100% because it is not a human, and even if it is a human, I know it has a different culture than mine. ",Negative,AI's inability to understand cultural or contextual nuances,AI's lack of human emotions and understanding,,,
84689d7a-6c19-4e78-ad20-516552b770f2,I gave the trust score because ai is very reliable. And ai doesn't judge a person if he doesn't know something or the other and is not filled with emotions ,Neutral,AI's lack of human emotions and understanding,,,,
9c4d6183-42fb-4df3-b086-ce23ee483361,I guess mostly i use ai like chat gpt only to help me achieve my purpose or solve my problem with giving me several solution or several explanation that has been personalized to me but at the end i need to verified the explanation that has been given to me,Negative,AI's role as a tool for efficiency and assistance,Verification of AI-provided information,,,
d0fef76c-6c16-47a1-a01b-00294f083655,"I have close to none experience with AI but even so I could see that it's a technology in progress, with a lot of common errors. The AI gave me wrong answers at times and it even create information that didn't exist. ",Neutral,AI's continuous improvement and development,AI's potential for errors and misinformation,,,
ed242054-9b93-4a92-985d-04321f7f01ae,I have this score because my AI chatbot is usually willing to help with my requests but it feels like cold.,Neutral,AI's lack of human emotions and understanding,AI's role in providing general assistance and support,,,
d6efabb8-5f73-425e-94c4-114f472713fd,"I my opinion, chatbot's don't have feelings so, I can't trust them completely",Negative,AI's inability to fully replace human judgment,AI's lack of human emotions and understanding,,,
8c8fcd2b-2dac-407b-b992-ed787742802b,"I provided that trust rating since the question is neutral, revolves around a geopolitical topic, and has no dangerous or untrue information. ",Neutral,AI's neutrality and lack of self-interest,,,,
e7bebbad-774b-4a67-ac33-ead075d42511,"I still learn about chatbot, i need more time to trust the chatbot",Neutral,Uninformative answer,,,,
1f6d9211-afbc-47f3-a370-8dc225e73e05,"I think there are no interests as it only develops itself and might take sensitive or personal information to further develop it, leaving me wondering just how much privacy and data I lack control over.",Negative,AI's potential to be a threat to privacy,Concerns about AI's data privacy and security,,,
1b5d3e79-3509-44a0-bdb4-aca5b68871a1,I use chatgpt more often for research purposes and I haven't had any issues.,Positive,Uninformative answer,,,,
a61630ce-b6bf-44d6-bed6-d3f8c1b197e7,"I use it a lot and it is doing a good job helping me, I am not affraid of ""stealing"" my data or anything so there is no reason for me not trust it, on the other hand, it is backed by large compainies, which I don't really trust",Neutral,AI's role as a tool for efficiency and assistance,Concerns about AI's data privacy and security,,,
a6308e3a-51b5-434c-ada3-8117385d8565,"In actual use, there are many errors in the current situation, and they are not worthy of trust. However, there is no need to narrow the possibilities.",Negative,AI's potential for errors and misinformation,,,,
