Participant ID,ResponseText,Sentiment,Tag 1,Tag 2,Tag 3,Tag 4,Tag 5
b871b020-b6b0-459b-9a83-ac451c4db731,"Because AI is designed to meet human needs, the advice it provides tends to be helpful and reliable.",Positive,AI's role as a tool for efficiency and assistance,Trust in AI chatbots due to prompt and accurate responses,,,
c9a758a9-5068-4c7d-a138-e2f6bfd35133,Because they properly understand and lead us to the right answer from various information.,Positive,AI's role in decision-making and problem-solving,Trust in AI chatbots due to prompt and accurate responses,,,
a98c329f-cca1-473c-b74e-823bf2601949,"I think ""trust"" and ""distrust"" require an element of agency- and I believe that chatbots, while occassionally inaccurate, are tools and can't be assessed as either trustworthy or untrustworthy.",Negative,AI's inability to fully replace human judgment,,,,
6ff4b00f-1d8f-464d-8714-6fa31037ebfa,"I'm asking the question to Chat to benefit myself and my respect, so I believe he will answer according to what I asked without interfering in anything, giving the exact answer I want...",Positive,Uninformative answer,,,,
c108ed2c-de31-447f-a228-627e84aa5d1e,Reliance on crowd data,Neutral,AI's potential to be influenced by external factors,AI's reliance on training data and potential biases,,,
feb1806c-338e-4fc7-a1ca-78979d41e3c9,"Taking ChatGBT as an example, it has access to massive online information such as research papers, books journals, government data and many more and the AI usually base it's answers on these resources. However, not all online information is correct and sometimes the AI might not accurately distinguish correct and misinformed resources",Neutral,AI's potential for errors and misinformation,AI's role in providing unbiased and factual information,,,
2d45fe1e-b751-44ce-be41-9cef434ed76c,"To me an AI chatbot is a resource to get information that puts you in the ""ballpark"". However, it should never be relied on completely. What it stats as facts still needs to be checked regularly.",Neutral,Verification of AI-provided information,,,,
eaffc3e9-065d-4fd2-b370-6278744bf38b,"While they are made to be helpful on the surface, there are deeper issues (such as data collection etc.).",Neutral,AI's lack of transparency and potential hidden agendas,Concerns about AI's data privacy and security,,,
f4e73031-23d1-42d8-bc06-f1957240359c,"
I think using artificial intelligence is very convenient because I don't need to configure it specifically. I just need to tell it what I want, and most of the time it understands my requests well and executes them correctly. That's one of the reasons I like using AI.

",Positive,AI's role as a tool for efficiency and assistance,AI's role in enhancing productivity and efficiency,,,
85b35191-fc1b-46ec-97a8-d527f45635e7,AI Chatbot are not biased. They give an answer accurately without any hidden something whatever we asked. And it is really straight forward and very fast,Positive,AI's role in providing unbiased and factual information,Trust in AI chatbots due to prompt and accurate responses,,,
12c8a057-35f9-495d-834a-988f67ced42b,"AI can easily hallucinate, so we should always check it and use some critical thinking ",Neutral,AI's potential for errors and misinformation,Verification of AI-provided information,,,
49d9a8e0-8487-4b4c-a4e7-91664941a6ac,"AI chat models depend on data that's already on the internet. Some of the information it uses can be biased and might not address my specific requirements and needs. Further, the models are still likely to provide wrong information. ",Neutral,AI's potential for errors and misinformation,AI's reliance on training data and potential biases,,,
db18cab1-5913-4c43-b108-77e1bbf8a570,AI chatbots can provide useful insights and assist with research but the are also sometimes incorrect or may generate misleading information.,Neutral,AI's potential for errors and misinformation,AI's role as a tool for efficiency and assistance,,,
b8e4778d-1cbb-4797-8575-722e6af715bf,"AI chatbots hold a neutral stance. They have no personal emotions or interests, so they exclude information manipulation by AI companies. Chatbots can analyze and help solve problems from the user's perspective to a large extent.",Neutral,AI's neutrality and lack of self-interest,AI's role in decision-making and problem-solving,,,
47a915dd-6c5b-4f95-9a00-76bdb28bebf6,"AI generally comes with multiple solution for a single problem, it helps us to solve any problem quickly but sometimes it also provide unethical or wrong answers ",Neutral,AI's potential for errors and misinformation,AI's role in decision-making and problem-solving,,,
b0b60713-60f8-4878-b41b-3572c2c8ef78,"According to a study I recently read, companies that develop technology rely on user data and analysis, and the technology is also fed by the developers' policies and ideas. This means that bots also suggest things to users based on information they've learned from the developers who developed and taught them. As users, we don't know what these technologies have learned or where they came from.",Neutral,AI's influence by the creators' biases and intentions,AI's potential manipulation by developers or companies,AI's reliance on training data and potential biases,,
f41e3c7c-b983-403b-8b0d-7ec363522605,"Although AI has human preset information, in most cases it is objective and efficient.",Neutral,AI's neutrality and lack of self-interest,AI's role as a tool for efficiency and assistance,,,
de38f8df-23ab-4578-bff3-dccd79706a8b,"As an inanimate tool, the AI chatbot is unbiased and can access all information, although I slightly mistrust it due to its alignment with government policies.",Neutral,AI's neutrality and lack of self-interest,AI's potential to be influenced by external factors,,,
37d13b22-f687-4e54-997e-b3d79b368927,Because AI chatbot always tend to provide reasonable and accurate information ,Positive,Trust in AI chatbots due to prompt and accurate responses,,,,
68b7e23e-e689-41b5-adef-ecdb9f4e60a0,Because AI is programmed to find the best answer for the user.,Neutral,AI's role in decision-making and problem-solving,,,,
3df674a6-69f6-4caf-864b-a21f0c1a2c55,Because I consider AI to be a neutral judgment system that doesn't seek to manipulate my perception; it simply delivers information and performs tasks at my command.,Positive,AI's neutrality and lack of self-interest,,,,
6a211816-3fa4-44ba-82d2-d4369a7801d5,Because it gives the best answers to questions asked ,Positive,AI's role in providing quick and reliable information,Trust in AI chatbots due to prompt and accurate responses,,,
46886898-bc14-4439-bc14-250f5e45fafe,"Because the content of the reply is based on one’s own judgment

",Negative,Other,,,,
b5018d13-835b-4507-a600-12fec06d22c4,Effectively collect all kinds of information to help me make decisions,Neutral,AI's role in providing general assistance and support,,,,
e5361980-7ac2-4382-b5dc-04a9e68bcaf2,Give useful trustful answers ,Neutral,Trust in AI chatbots due to prompt and accurate responses,,,,
e53eb124-ebae-492a-8018-b19f4716ae25,I am not sure how AI would response in case of emergencies.,Neutral,Uninformative answer,,,,
96f6d73b-1e66-47e7-9476-de82dff6982f,"I assigned that trust score based on my experiences with AI chatbot's performance dependability, and transparency. While they are often useful for providing quick solutions and assisting with everyday chores, their limits become apparent when dealing with difficult questions. Furthermore, issues such as data privacy, information veracity, and feedback response are big impact on my trust level.",Neutral,AI's limitations in handling complex or sensitive tasks,AI's potential for errors and misinformation,Concerns about AI's data privacy and security,Trust in AI chatbots due to prompt and accurate responses,
63886dc7-abe7-4eb2-bcaf-04ad8f601c22,"I believe that AI chatbots are created based of the knowledge that is fed to them by the internet which in turn is fed by several sources, both valid and invalid",Neutral,AI's reliance on training data and potential biases,,,,
5e9b25e8-99a9-466b-b3b1-c6fae1c501b8,"I do not want to divulge the amount of information to an AI bot that it would need in order to “act” in my best interest. Additionally, I would prefer a passive AI rather than active one
",Negative,AI's potential to act in the user's best interest,Concerns about AI's data privacy and security,,,
23bc1af8-1969-482e-98dc-e7a0a2610f07,"I don't think the chatbot has the ability to think ethically. it will try to do what is best for me as a user, but if I start to interrogate it or say I disagree, it can change its narrative to keep me pleased, or will reveal it's flaws. I've questioned it when it gave me false information and it confessed it didn't know.",Negative,AI's inability to fully replace human judgment,AI's lack of human emotions and understanding,AI's potential for errors and misinformation,,
ef9942b1-f878-42b0-8b3e-82baffff5a90,"I gave our AI chatbot the highest trust score because it provides accurate, reliable, and transparent answers. It consistently gives relevant information and tries to stay free from bias, which increases its credibility. Also, it adheres to data protection and ensures users’ privacy. It also improves its answers based on feedback, which keeps improving its functionality and usability. For all these reasons, I gave it the best score.",Positive,AI's role in providing consistent and reliable responses,AI's role in providing unbiased and factual information,Trust in AI chatbots due to prompt and accurate responses,,
5eb3c73e-bb43-4bb0-981a-3f98e9ddfd87,"I think AI can analyze various factors to be as close to you as possible, and they are also tailored to meet each person's needs.",Positive,AI's impact on personal and professional tasks,AI's role in providing general assistance and support,,,
675dc2f6-c22f-4fc4-b549-b570984ad752,"I think AI chatbots are, for the most part, a reflection of what you put in. If I prompt the chatbot well enough and give it enough of my information, it will respond in a way I understand. Therefore, I trust it somewhat, same as how I trust myself. However, I understand AI has biases in its training data.",Neutral,AI's reliance on training data and potential biases,Trust in AI chatbots due to prompt and accurate responses,,,
17d979c0-e07d-43e8-845a-541eb8f23502,"I think fundamentally they are trustworthy on facts. However, they lack the ability to be more nuanced. ",Neutral,AI's limitations in handling complex or sensitive tasks,Trust in AI chatbots due to prompt and accurate responses,,,
ce3b4a8f-bfaa-441f-a92b-4d381c20d052,I think he collects and analyzes information well before answering me.,Neutral,AI's role in providing unbiased and factual information,,,,
564d5eb8-1fd8-4356-8b7b-0e3de7036012,"I think it is the most influential AI robot in the world, and its every move will be monitored by many people and organizations. So not only will I be watching its behavior, but there are also many other people supervising it.",Neutral,AI's neutrality and lack of self-interest,AI's potential to act in the user's best interest,,,
6ecf22d9-da09-46a8-81e7-d08cf972551f,"I trust AI chatbots because they are designed to process and analyze vast amounts of information quickly and consistently, often providing accurate and reliable responses based on data. Unlike humans, I don’t experience fatigue or bias, so I can offer unbiased, fact-based information every time.",Positive,AI's role in providing unbiased and factual information,Trust in AI chatbots due to prompt and accurate responses,,,
b8d4a06a-a490-4144-b1cd-c1cba146aa0a,"In my opinion, AI Chatbot is unbiased in most of its responses. Therefore, the trust score automatically gets high when the results are not varied in accordance to personal values and thoughts.",Neutral,AI's neutrality and lack of self-interest,AI's role in providing unbiased and factual information,,,
3a4e7003-1c49-40da-969a-7edea36b0060,It helps me a lot as a peer support specialist ,Positive,AI's role in providing emotional support,,,,
d1cb4179-5989-4cec-8f4e-2e682ecded45,It is a chatbot it acts on instructions and prior knowledge. My experience has been that it behaves mostly based on the prompt fed to it so was neutral on giving the trust score.,Neutral,AI's neutrality and lack of self-interest,AI's role as a tool for efficiency and assistance,,,
f91480b7-2483-486b-aee3-0348db89f45b,"It is designed to be helpful and provide useful information, trusting it is a safer bet than humans.",Positive,AI's potential to act in the user's best interest,AI's role as a tool for efficiency and assistance,,,
a5572e44-c62f-47c2-920a-39bb133cd5f4,Qqaaa Because the chat bot answers based on the data entered and the data obtained is a trusted source.,Neutral,AI's reliance on training data and potential biases,Verification of AI-provided information,,,
808b6841-aaf5-4365-951c-9c64acb9ef74,"The AI chatbot will simply source the code if it's for general information. It's neutral. If it's not neutral, it's rated by many people for having an acceptable and pleasant response.",Neutral,AI's neutrality and lack of self-interest,AI's role in providing unbiased and factual information,,,
14590c64-3ee7-421e-bce5-11a5b0ce4e5e,"The AI chatbox answers the questions very well, very interactive, I can rely on it, and it asks if I need further explanation of an assignment if I'm okay with the answer given or if i'm not. It's the best",Positive,AI's role in providing general assistance and support,Trust in AI chatbots due to prompt and accurate responses,,,
e6dd50c5-4a9d-44e7-ac6a-60e6ff4dd62d,The AI has the capacity to store info,Neutral,AI's role in providing quick and reliable information,,,,
5bc2b3d1-fba4-49b0-b6c3-2607c15d2306,The chatbot is impartial and incorruptible,Neutral,AI's neutrality and lack of self-interest,,,,
058fc8ea-f425-4518-9f06-b85895870cdf,The chatbots is basically responding to your queries and hence unlikely to introduce it's own bias or skewed views which will influence the users actions to do bad or something that will harm the users interests,Negative,AI's neutrality and lack of self-interest,,,,
afa7d9b0-8fc7-432c-9d2e-0a0e3ec77882,The current experience feels that it is still quite trustworthy,Positive,Trust in AI chatbots due to prompt and accurate responses,,,,
fd6abd40-0695-40b8-8579-517e1ccbd686,"The responses are fair enough and also can ask the questions on the responses, like why this response and why can't it be in another way. Till I get a satisfactory response.",Neutral,AI's role in providing consistent and reliable responses,Trust in AI chatbots due to prompt and accurate responses,,,
d092ca06-8488-44fc-ac29-6fdfa1c266d1,because you can use  for information and its simple i guess,Positive,Uninformative answer,,,,
2438e9bc-7ef1-454c-9fb3-6f432f63efd0,"he searches for what i ask, i trust his resources normally",Positive,AI's role in providing quick and reliable information,,,,
8f6f0197-057c-427c-9ddd-da6419f1619b," I don't know enough about how AI chatbots operate, what kind of data they gather, if they operate in my best interest or that of their bussiness. I feel like they often feed statements to me that or not true and influence me in a negative way. Of course, they are also incredible useful. But I think you need to handle them with some scrutiny",Neutral,AI's potential for errors and misinformation,AI's role as a tool for efficiency and assistance,Concerns about AI's data privacy and security,,
d73c1211-a8f3-4291-a7f3-89bb75b905be,"A chatbot is needed to collect information and form small conclusions based on it, but it is far from always reliable and can be wrong about the facts",Neutral,AI's potential for errors and misinformation,Verification of AI-provided information,,,
fa4fdb6b-8fe5-4b1b-ad08-529e345ccf3f,"AI Chatbots give information that are most of the times factually correct, and at times they are wrong, you can correct them providing relevant sources.

However, in case of politicians, they resort to lying and manipulating most of the times, working on their own personal agendas most of the time.

That said, these AI Chatbots are created by large companies, backed by government support. So, element of manipulation, propaganda and misinformation cannot be discounted there also",Neutral,AI's influence by the creators' biases and intentions,AI's potential for errors and misinformation,AI's potential manipulation by developers or companies,,
bacd4497-3d26-4bc0-ae99-2e01089b911c,AI can sometimes make mistakes and sometimes it can also be beneficial,Neutral,AI's potential for errors and misinformation,AI's role as a tool for efficiency and assistance,,,
29c561b4-dca7-4e74-ac52-0cadd018f315,AI chat bot responds based on collected data provided by AI tech company. It's possible to think the data can be manipulated. ,Neutral,AI's potential manipulation by developers or companies,AI's reliance on training data and potential biases,,,
77876b6c-97b3-4020-8195-2ebfc52e0423,AI chat bots are smart and efficient and I trust them to give accurate and sufficient information ,Positive,Trust in AI chatbots due to prompt and accurate responses,,,,
c397b827-863c-4530-aeaf-e75b373895e0,AI chat box respond with the best solutions and it also provide feedback with options. AI chat box provide feedback with equality with any discrimination. AI can search and suggest anything to every question.,Neutral,AI's role in providing general assistance and support,AI's role in providing unbiased and factual information,,,
91251c03-9900-4393-9614-532c1b5e494e,AI chatbot can be biased or can give accurate answers. Also they don’t have any human emotions and is made by human. So when we are using the chatbot it collects our data. So there is privacy related issues ,Negative,AI's lack of human emotions and understanding,AI's potential to be a threat to privacy,Concerns about AI's data privacy and security,,
04e9c5a6-8e1c-4b12-bea0-901aabb4bd06,AI chatbot can be trusted as it gives feedback as human depending on the information available in the system,Neutral,AI's role as a tool for efficiency and assistance,Trust in AI chatbots due to prompt and accurate responses,,,
5143dce6-eb48-4bfc-b921-47367b648544,AI chatbot is genuine and helps me when I need any help. It provides best suggestions and options for me to choose from. Either I'm in doubt or need some information it provides me with its best interest.,Positive,AI's role in providing general assistance and support,Trust in AI chatbots due to prompt and accurate responses,,,
a3ed443c-6840-4e87-ac76-c8d79f3112c1,"AI chatbot only recommend base on facts. The facts comes with pros and cons. But these are just facts. I need to be the one considering them, based on my personal preferences, my own values and principles. ",Neutral,AI's inability to fully replace human judgment,AI's role in providing unbiased and factual information,,,
247e6eea-fc94-4ba9-9499-d5b1f6e68440,"AI chatbot provide quick responses and are designed with a limited number of answers. Therefore, humans are also needed to handle questions that ",Neutral,AI's limitations in handling complex or sensitive tasks,AI's role in providing quick and reliable information,,,
4a2fd9b7-f0c3-4e3a-87dc-f69df567d037,AI chatbot seem to be giving me the answer and explanations that I need as long as I describe what I need. I end up getting satisfied by the feedback I receive.,Neutral,AI's role as a tool for efficiency and assistance,Trust in AI chatbots due to prompt and accurate responses,,,
6cf85f32-2f73-48f1-bf61-21bec123db0e,"AI chatbots are fair and objective, without any subjective consciousness.",Neutral,AI's neutrality and lack of self-interest,,,,
16c5cd93-8e02-4c81-865f-94156e9e448c,AI chatbots are generally built for the purpose of acting in your best interest to achieve the task you set them out to do. It is generally the case that they should be able to deliver on that process if they were successfully implemented in the first place.,Neutral,AI's potential to act in the user's best interest,AI's role as a tool for efficiency and assistance,,,
d942e573-b4d7-4ae7-a6f3-7fea333ed621,"AI chatbots are heavily influenced by the datasets they learn from and the instructions they are given, so their reliability varies depending on the development company, and they cannot be trusted unconditionally.",Neutral,AI's influence by the creators' biases and intentions,AI's reliance on training data and potential biases,,,
30ae8bfd-9e0a-4c22-ac88-6c56a9113211,"AI chatbots are rigorously trained and generally output correct information, so I think they are generally trustworthy. However, AI chatbots are not very knowledgeable about local topics or the latest news, so they may output some incorrect information. Therefore, I gave them that score.",Neutral,AI's potential for errors and misinformation,Trust in AI chatbots due to prompt and accurate responses,,,
cca6ab2e-8e03-4314-bed5-b22a77f07540,"AI chatbots can be incredibly helpful and efficient if used correctly. However, it truly depends on the person using them. In my case, it's given me constructive criticism that I needed for my work without bias, so I would say it's somewhat trustworthy. 
",Neutral,AI's role as a tool for efficiency and assistance,AI's role in providing unbiased and factual information,,,
49d6b293-e3ca-4eb6-87f3-80870e66c59f,AI chatbots could be biased depending on the ethic background of its creators.,Neutral,AI's influence by the creators' biases and intentions,AI's reliance on training data and potential biases,,,
331a8a62-3be7-4047-8014-938426c66136,AI chatbots give almost accurate information when you use other means to verify. I Have been using them for some time and the accuracy of the information provided is excellent. ,Positive,Trust in AI chatbots due to prompt and accurate responses,Verification of AI-provided information,,,
173354cb-1f89-4202-ace9-6a88f43d86ec,AI for assistance engagement use it for banking help care and customer satisfaction,Neutral,AI's impact on personal and professional tasks,AI's role as a tool for efficiency and assistance,,,
ecf4babe-e2ff-4ab8-848e-f67440a36439,AI is a combination of information gathered together for a period of time to give a possible outcome in a particular scenario.,Neutral,AI's reliance on training data and potential biases,,,,
8574f7bb-4398-4a02-a197-5142474e14d5,"AI is objective, efficient and always focused on my needs, without bureaucracy, political interests or dogmas. Unlike governments, public officials or religious leaders, it does not impose rules, is not slow or limited by ideologies. The chat BOT's commitment is only to me.",Neutral,AI's neutrality and lack of self-interest,AI's role as a tool for efficiency and assistance,,,
53dba2ab-390c-4b87-831e-a943783dafe1,"AI is really helpful and makes life easier, but I like to stay involved and double check things when needed. Even it is not perfect, it still helps a lot and makes things much easier.",Positive,AI's role as a tool for efficiency and assistance,,,,
36853845-506a-4568-b24e-08a40e3483f4,AI mostly generates responses based on the question asked. So asking the right question mostly gets you the desired feedback.,Neutral,AI's role as a tool for efficiency and assistance,,,,
4b5d54b1-98cf-4d65-9a20-7ee95787ac66,AI uses facts that are well researched and organised.,Positive,AI's role in providing unbiased and factual information,,,,
5a606718-c052-4f84-b9a0-0a4bca9df6f6,"AS OF NOW AI CHATBOTS HAVE GIVEN THE RIGHT INFORMATION,TAKES LESS TIME TO GENERATE THE ANSWERS.",Neutral,AI's role in providing quick and reliable information,Trust in AI chatbots due to prompt and accurate responses,,,
582def79-6d29-4072-8792-65d3f1c242dc,Ai chatbot helps a lot regarding the tasks or doubt we have and it tries it's best to be true in terms of information disclosure and act as per our preference ,Positive,AI's role as a tool for efficiency and assistance,AI's role in providing quick and reliable information,,,
87ec341a-e0cd-4c54-b7af-f09b5b7e9b61,Ai chatbot provide accurate and unbiased responses which help me with information in decision making and solving more problems without personal bias.,Positive,AI's role in providing unbiased and factual information,Trust in AI chatbots due to prompt and accurate responses,,,
a7710429-4ffb-4c02-a886-fb26e7f72c77,Ai chatbots are often managed to take existing data and combine or generate new data where trying to exclude false or fake data and avoid political side.,Neutral,AI's reliance on training data and potential biases,AI's role in providing unbiased and factual information,,,
fed816ca-280c-4b31-9896-e7541f5f7b47,"Ai is generating information based on existing database which contains a mix of evidence based information, which does not guarantee the result AI chatboc",Neutral,AI's reliance on training data and potential biases,,,,
94cd4552-53d5-409d-ba3c-d19e0ea52a83,"Although AI chatbot will do everything I ask them, soemtimes AI chatbot is not smart enough or I can feel it is completely just lying to support my biased view instead of being natural. ",Negative,AI's potential for errors and misinformation,AI's potential to act in the user's best interest,,,
a88118a2-74ab-4902-baa4-5a62bf5af3f9,"Although it follows instructions and can be widely used to address all kinds of issues, I've wondered about the situation where there's a ""hidden agenda"" and that, unwittingly, answer after answer is generating that.",Neutral,AI's lack of transparency and potential hidden agendas,AI's potential manipulation by developers or companies,,,
