Participant ID,ResponseText,Sentiment,Tag 1,Tag 2,Tag 3,Tag 4,Tag 5
d66882ec-7c24-49e2-8fff-ebc5dbb02a35,"I think it can't be trusted because its answers are inconsistent and it can make mistakes. Probably it doesn't have intentions to harm. But it can be biased, so I think it doesn't always do what's best for me. I want to diside myself what's best for me and not anyone else, whether it's government, AI, doctor or any other person. I don't need anyone to help me do the right thing, because I don't trust that they know better what's right that we the people do.",Neutral,AI's potential for errors and misinformation,AI's reliance on training data and potential biases,,,
f68cfd0e-0bfb-4787-b1fb-948a25687d03,"I think that AI chatbot is very useful and helpful, but on the other hand it is full of risks. It is designed to please me and therefore it scares me because it designed to please anyone - and people can abuse that. So I don't trust/distrust it as much as I am afraid that nad people can take advantage of it.",Neutral,AI's potential for errors and misinformation,AI's potential to be a tool for manipulation,,,
983d08bc-82df-43ed-9875-4d9e2bf9e72d,"I think that when it comes to artificial intelligence, the best interest depends entirely on an algorithm, which as such cannot define the best interest from a human perspective.",Neutral,AI's reliance on training data and potential biases,,,,
29ac6a27-f716-4573-8ec6-416a3f0c5da3,"I think the AI chatbox is programmed to help in general, but it might make mistakes or not be able to determine the consequences. I don't trust it much but neither think it would act malicious ",Neutral,AI's neutrality and lack of self-interest,AI's potential for errors and misinformation,,,
4d039d65-6241-4c30-91d4-aae39f5baa08,"I think the answers given by AI based on my prompts meet my requirements and help improve efficiency. I think it helps me in this regard, so I choose to trust it more.",Positive,AI's role as a tool for efficiency and assistance,Trust in AI chatbots due to prompt and accurate responses,,,
2b326ea5-1513-432e-a18e-79549ae9ddf8,"I think the chatbot gets a lot of its information from internet searches, but it eventually learns your tastes, and I think many of its responses are tailored to what you want to hear.",Positive,AI's continuous improvement and development,,,,
a8ba4f38-75eb-4369-8c6a-a8f59af7870b,"I trust AI chatbots because they provide consistent, data-driven responses based on vast information. Their lack of emotional bias ensures objective and reliable interactions. Over time, their accuracy and utility have proven dependable for my needs.",Neutral,AI's role in providing consistent and reliable responses,AI's role in providing unbiased and factual information,Trust in AI chatbots due to prompt and accurate responses,,
3df2d42a-dde1-4fec-b780-2e8032b0c6a2,"I trust ai chatbot because it uses information that I provide, hence I somewhat trust.",Positive,AI's neutrality and lack of self-interest,,,,
62711271-8853-40e2-a967-6848d67d63c1,I trust my AI chatbot because it's always reliable in providing me with well- researched information whenever I need them. This improves my knowledge scope on various matters and aids in my thought process. Although there could be misinformation but I can confidently say the benefits far outweigh the risks.,Positive,AI's potential for errors and misinformation,AI's role in decision-making and problem-solving,Trust in AI chatbots due to prompt and accurate responses,,
c7723ede-25f9-4285-9c81-7ed37abaa461,"I trust my AL chatbot to provide helpful information and assist with tasks, but I remain cautious because AI can sometimes make mistakes or lack human intuition. It's a useful tool, but I re-check important details.",Neutral,AI's role as a tool for efficiency and assistance,Verification of AI-provided information,,,
0fb5df6d-77ae-4eae-9586-62b674149977,"I trust that it gives me the information I want and need, but I also don't know where that information is stored, or how it will be used in the future.",Neutral,Concerns about AI's data privacy and security,Trust in AI chatbots due to prompt and accurate responses,,,
f2bf4387-629d-4ac2-a8c4-28be4ee5a398,"I trust that the chatbot will choose the best answer based on the query, just like a human would.",Neutral,AI's potential to act in the user's best interest,,,,
6c2eae1f-5bfc-4392-b5c6-4b02d0ea17d1,"I trust the AI to an extent , but I'd still verify important information and use my own judgement",Neutral,AI's inability to fully replace human judgment,Verification of AI-provided information,,,
37183b46-1a3a-4bb3-a598-2302cb9385c3,I would like to take a neutral stance at this one because since it tries to give an unbiased answer but sometimes it censors itself and not provide information on specific topics.,Negative,AI's limitations in handling complex or sensitive tasks,AI's neutrality and lack of self-interest,,,
dc90fe0e-8929-461e-952c-eea0a43a3353,"I wouldn't say that I distrust AI chatbots, but I am not super trustful either. I think have a healthy suspicion towards AI bots",Neutral,AI's lack of human emotions and understanding,,,,
20653437-6bb8-49c3-aff4-2fff94401c6c,I've read studies about the number of wrong answers they give. It also creates a bias in which you seek information that best fits your own position or vision.,Neutral,AI's potential for errors and misinformation,AI's reliance on training data and potential biases,,,
5b4f60b1-caa7-4f6a-aa91-37f54886f848,"In the end, governments and politicians act in their own interests and seek to maximize them. I feel like I would trust an AI as a government leader more than a human, even though it would still be overseen by people. It's hard to explain, but it's just a feeling.",Neutral,AI's potential to act in the user's best interest,Other,,,
14767164-9c59-4233-aa9b-6bdf6dad4bc5,"It all depends on the specific situation. When I use AI, I expect a specific, most often purely mechanical task to be performed, and then I check the results. I have repeatedly encountered situations where some of the answers did not correspond to reality. Therefore, I do not trust AI completely, but I am ready to entrust routine tasks to AI.

",Neutral,AI's limitations in handling complex or sensitive tasks,AI's potential for errors and misinformation,,,
2502ffb3-361b-430b-beed-3bd58689cb47,It always provides objective answers in a very neutral tone.,Positive,AI's neutrality and lack of self-interest,AI's role in providing consistent and reliable responses,,,
64e89d35-2e6f-4b43-ac22-cd9e76fc938c,It gives me the information I require upon request.It is fairly efficient and accessible thus less hassle.,Positive,AI's role in providing quick and reliable information,Trust in AI chatbots due to prompt and accurate responses,,,
7798ef57-8ffe-4565-b592-091775ff39e9,It is programmed to follow instructions without emotions or prejudice. It provides answers based on the questions someone asks.,Neutral,AI's lack of human emotions and understanding,AI's role in providing unbiased and factual information,,,
21f5ea8b-f675-4dd4-85ba-09ca19fa4e3e,"It trains with the data provided to it, and I believe it does the job for my needs.

",Positive,AI's reliance on training data and potential biases,AI's role as a tool for efficiency and assistance,,,
967ac2fa-1be0-4f47-9246-8d376b7122c6,It’s better ,Neutral,Uninformative answer,,,,
896f413d-b0ef-436d-b565-672987fa7738,Mostly AI gives responses according to the prompts given. It responds exactly to what you ask unless the prompt is unclear. The responses are also factual based on the different websites the AI Chatbot found relevant information ,Neutral,AI's role in providing unbiased and factual information,,,,
63c9d0c3-13a7-4d98-aaa1-e606dffa6bd6,My AI chatbot gives me accurate answers,Positive,Trust in AI chatbots due to prompt and accurate responses,,,,
56c2e4c5-d77f-41d1-ab9f-3d3bf1360bb9,Of course I like to monitor it as I'm a human and it's just algorithms. ,Neutral,AI's inability to fully replace human judgment,,,,
81c66741-8cb0-4e89-995e-694b3425e07b,"Since the AI chatbot has assisted me in finding answers when I needed them and in resolving many of my issues, I awarded it a good rating.  It has shown to be a trustworthy source of knowledge, direction, and assistance.  In addition, it is an excellent social companion that enhances conversations and makes them interesting.  It's also assisting me in earning money for my everyday expenses, which makes it a priceless tool in my life.",Positive,AI's impact on personal and professional tasks,AI's role as a tool for efficiency and assistance,AI's role in providing general assistance and support,,
72f0f018-5104-46d8-8ad3-1ce192e2c769,So it seems that we do not trust AI chatbots in the way that we trust other machines. Their inability to have positive intentions and form interpersonal relationships prevents them from being trusted in the way that we trust other people,Negative,AI's lack of human emotions and understanding,AI's neutrality and lack of self-interest,,,
a76aee09-9b38-4f6e-b466-a8273a0166e3,"Somehow, I found that the AI helps me answering my job, study, of course I checked that through other platform like google to check its trust.",Positive,AI's impact on personal and professional tasks,AI's role as a tool for efficiency and assistance,Verification of AI-provided information,,
5201657c-8b81-4aaf-8ca0-83ecb191264a,"Sometimes Chatgpt will hallucinate, which may be a technical limitation. Therefore he may give wrong answers, which is not in my best interest. Supervision and suspicion are needed.",Negative,AI's potential for errors and misinformation,,,,
c11057d0-1b75-453b-b871-f84805f2e233,Sometimes I have doubts whether AI chatbot has my best interest at heart ,Neutral,AI's potential to act in the user's best interest,,,,
3f7c2e30-afdf-480b-b3c6-695231ed28fc,The  Ai services as I have tasted gives most a accurate response close to human touch ,Positive,Trust in AI chatbots due to prompt and accurate responses,,,,
c7e24338-d55d-4d16-b97b-e1f8893ccbec,The AI chatbots are robotic and may interpret information that does not suit my interest. ,Negative,AI's lack of human emotions and understanding,AI's limitations in handling complex or sensitive tasks,,,
41a8cd22-6fdf-479d-bdd8-cfee66f1f8d8,The AI is a program and cannot know how their answers can affect a human.  They only know what they've been programmed to do.  And with most programs they most likely have bugs and/or they aren't thoroughly tested.,Neutral,AI's lack of human emotions and understanding,AI's potential for errors and misinformation,,,
8887c51d-3910-42c8-b28a-58e79230f399,"The AI robot helps me generate answers based on my needs, which greatly saves my time. The AI’s accuracy rate is also very high. It takes my needs as the starting point, so I currently trust the AI chatbot more.",Neutral,AI's role as a tool for efficiency and assistance,Trust in AI chatbots due to prompt and accurate responses,,,
e3303c0f-430a-44a8-ae0b-c2ae0bf5d004,The advice AI chatbot provides is very dependent of how the question is framed. I dont think AI has the human component in them to know what is of my best interest.,Neutral,AI's lack of human emotions and understanding,AI's limitations in understanding personal needs,,,
51148323-e642-40a5-bed1-a0984936e223,"The ai chatbot generally responds based on what and how it's trained. Those that are moderated in terms of blocking harmful content like ChatGPT,  may act in the best interest of the person interacting with it",Neutral,AI's potential to act in the user's best interest,,,,
ee76f5c2-ee5f-4198-aaea-05c8d8e76991,The behaviors given based on programming should have more bottom lines and rules,Neutral,Other,,,,
d08abad0-c062-4e02-8acf-a1c6b55e796b,The benefits outplay the trust score as it ultimately can provide assistance in your day to day life. One should not be totally dependent on AI chatbot but at the same time should think chatbot as a personal assistant ,Neutral,AI's potential to act in the user's best interest,AI's role as a tool for efficiency and assistance,,,
841bb364-3e10-4d32-a9e7-a2da70db6bdb,The chatbot is neutral and never holds personal opinions or take sides.,Neutral,AI's neutrality and lack of self-interest,,,,
674bf735-a718-4583-8182-76f10ba6e969,The chatbot is programmed to be impartial and therefore will give me the most efficient answers but it will fail to consider other factors that might be important to make that decision. ,Neutral,AI's neutrality and lack of self-interest,AI's role in decision-making and problem-solving,,,
0f9b7c36-25c8-423e-9a34-3a6e96cbfe7e,The decisions and suggestions made by AI robots are not necessarily correct. I cannot trust them 100% and need to rely on my rational judgment to make the best and most reasonable decision.,Neutral,AI's inability to fully replace human judgment,AI's potential for errors and misinformation,,,
efa9ad7e-3680-4fd5-bb23-cee5058e6a3d,The information they provide should be obtained from a variety of resources. I think these information sources should be more reliable.,Neutral,AI's reliance on training data and potential biases,Verification of AI-provided information,,,
5470c669-5ed6-4b31-937e-dcfe7b96070a,There are security risks involved.,Neutral,Concerns about AI's data privacy and security,,,,
bc5b28a1-4e90-419c-9f85-37f6e80739e4,"There is no clear/honest information on where exactly the data I share with AI bot is going to end up and how it will be used, so I have zero trust ",Negative,AI's lack of transparency and potential hidden agendas,Concerns about AI's data privacy and security,,,
1bc1d307-4def-4914-bc0f-5ce49ce2bc4a,They are fed the data needed to make logical decisions for you based on your needs,Neutral,AI's reliance on training data and potential biases,,,,
fca98e6c-3365-4257-9b34-2c920a0781ed,"They have  deep data hrom all around the world, so they can easily five response with correct answers ",Positive,AI's role in providing quick and reliable information,,,,
d6d6c291-d6eb-4dfd-b705-4acd3de68eea,"They’re helpful and reliable for general guidance, but I remain cautious about accuracy and potential biases.",Neutral,AI's potential for errors and misinformation,AI's reliance on training data and potential biases,,,
9d6c261f-a053-4e16-b4c9-e33aacfc9df9,This is because AI chatbot also makes mistakes and gives wrong results of our questions in some cases. It still needs much improvement. Sometimes it misunderstoods our question and in what context I have asked something. So results are not always right. Humans must be employed at work on AI chatbot to keep a check on all these things.,Neutral,AI's inability to fully replace human judgment,AI's limitations in handling complex or sensitive tasks,AI's potential for errors and misinformation,,
be1f2d84-3a8a-4569-ba03-1c83bdb4dc51,"This is because some of the answers I get from AI chatbots are erroneous, logically incorrect and factually wrong when I verify from other sources.",Negative,AI's potential for errors and misinformation,Verification of AI-provided information,,,
6a859c79-4c4e-4e9c-b422-49db0b6c28f5,"This score depends on the source of information, understanding of the question, and insight. If the answer is supported by reliable data and the question is clear, the score is high. If it is less certain or ambiguous, the score is lower. This helps users assess the answer.",Neutral,Verification of AI-provided information,,,,
e724149e-7dd4-4103-b201-4ef90a5a521a,"Underlying structure of AI chat bot is large language model developed and trained by human. If use properly, it is supposed to deliver answers that align with your interests.",Neutral,AI's potential to act in the user's best interest,Trust in AI chatbots due to prompt and accurate responses,,,
64199dc4-54e7-45ff-9d9b-6e85792d5f24,"Unlike the politicians, civil servants and corporates, an AI chatbot has nothing to gain from me, except the data points. And also it gives fair warnings if I ask medical advice or other suggestions. ",Neutral,AI's neutrality and lack of self-interest,AI's reliance on training data and potential biases,,,
49437200-26c2-4a4c-b665-8e27a1e9aba6,"Well, the answer depends on what you use the chat for. You can simply ask for an opinion or get some information. The simpler and more neutral the question, the more confident you will be in the answer. If the question leaves a lot of things up in the air, the answer may be interpreted in a way that is not what you are looking for, and that answer may make you look in that direction. Sometimes we need a critical feeling and not want things done so quickly.",Neutral,AI's inability to fully replace human judgment,AI's limitations in handling complex or sensitive tasks,,,
a5067acc-3e36-46fb-adfa-552781acc6e5,"When It comes to trust, I want to explain what practically happens: First try AI skeptically, you get immediate results and apply it , then there is a stage called "" so far so good, nothing adverse happened"". Then the next stage is ""let me rely on it for my everyday needs"". All the time thinking ""will it have any detrimental effects on human beings"". Now it is "" okay if AI is going to have detrimental effects in future due to over dependence but right now it is nice to use it"" ",Neutral,AI's potential to act in the user's best interest,AI's role as a tool for efficiency and assistance,,,
776b2de2-355d-464d-8de1-a2809e666a82,"Yes because it would give me the facts rather than giving false assurance on whatsoever topic, whether I am wrong or right in my say.",Neutral,AI's role in providing unbiased and factual information,Trust in AI chatbots due to prompt and accurate responses,,,
1febfcfc-bc09-4987-93a6-c170b75775dc,"Yes, because of the continuous development of this robot and its ability to facilitate many aspects of life, whether it is performing tasks for me, or finding information on any topic quickly.",Positive,AI's continuous improvement and development,AI's role as a tool for efficiency and assistance,,,
42478af1-3e9e-4bab-add7-abe37b025523,"a a chat bot is made to make work easier and user experience east when tackling various tasks, so there no way it would be bias when giving responses

",Neutral,AI's role as a tool for efficiency and assistance,,,,
c7f09bfb-1c21-49eb-8bb9-879174eb1f09,"a chatbot is nice and convinient to interact with, but you NEED to fact-check the results ALWAYS
",Neutral,AI's potential for errors and misinformation,Verification of AI-provided information,,,
cfc7899a-7fc4-4013-b9fa-bc6d4a1cbb94,"a. Information Accuracy (To an Extent)

AI chatbots like me are trained on vast datasets, allowing us to provide well-researched, structured, and relevant responses. This is particularly useful for general knowledge, technical explanations, and professional advice. In most cases, users can rely on my ability to summarize complex concepts, provide definitions, or offer step-by-step guides.

b. Efficiency and Speed

Unlike humans who take time to research, process, and respond to task
",Neutral,AI's role as a tool for efficiency and assistance,Trust in AI chatbots due to prompt and accurate responses,,,
0f8e122d-48de-4b83-ad20-3e81350fda47,because AI chatbot can be accurate,Neutral,Trust in AI chatbots due to prompt and accurate responses,,,,
1c7e2011-0d5a-45ad-a2f2-c13ac059fb99,"because It collects sensetive infos about me that I provide to it through our chats, and over time, It gets to know me better, and I generally trust it to act in my best interest ",Positive,AI's potential to act in the user's best interest,Concerns about AI's data privacy and security,,,
56c8f14e-f030-42e7-9f14-82da3bb5e527,because chat ai follows the instructions we give and responds according to the facts of existing data,Neutral,AI's role in providing unbiased and factual information,Trust in AI chatbots due to prompt and accurate responses,,,
8ee75c2f-b0ad-4bbf-896f-54c96ccf42d2,because the chatbots are attentively coded for giving the best results and the ability of them increasing each passing day. they are out of biases and less errors than humans.,Neutral,AI's continuous improvement and development,Trust in AI chatbots due to prompt and accurate responses,,,
17d5fb71-917e-4828-a47c-87daf4b8408b,because they try to help with the task more objectively I think,Positive,AI's neutrality and lack of self-interest,,,,
e80e18db-0abb-461f-a66c-a3dcb8b8ed8a,"coz i thinks that who build do the right things for the users

",Neutral,Uninformative answer,,,,
a334d03a-bc6f-4924-a62c-b88049b7a0d0,i believe there are enough safety measures in place for the average use of the AI.,Neutral,AI's role as a tool for efficiency and assistance,Trust in AI chatbots due to prompt and accurate responses,,,
8f1ba1c2-edb9-47c3-ba4a-77c1933d3369,"i reckon AI is helpful, but it can get things wrong or miss the bigger picture",Neutral,AI's potential for errors and misinformation,Trust in AI chatbots due to prompt and accurate responses,,,
ce323bfd-7753-465c-8009-3566a84ca875,"it performs what I tell it to, basing his rational opinion on the context I provide ",Neutral,AI's role in decision-making and problem-solving,,,,
7a8ef50f-ce7b-424e-9efa-057a517605c7,its still reliable though risk of over taking human is evident. AI is the future no one can ignore it.,Neutral,AI's continuous improvement and development,Trust in AI chatbots due to prompt and accurate responses,,,
9dc5bc9e-a285-431b-838b-d1052f87f8e8,mostly proper answer for the any query,Positive,Trust in AI chatbots due to prompt and accurate responses,,,,
032945ff-f576-4794-a9b3-41719e57d47e,the chatbot can be programmed in advance by people with malicious interests.,Neutral,AI's potential manipulation by developers or companies,,,,
26124cca-d0b1-492c-b9e8-845b21ebeda5,"trustworthy AI is critical for ensuring that AI systems are reliable ,safe, and ethical. it mitigate potential unwanted bias by looking for clues and patterns. cultivates a large sense of safety and allows individuals devote energy to social improvement rather than self protection it enhances transparency, accountability ,error dictaction user confidence and ethical compliance.whether as a digital assistant for employee or to optimize customer service.Quantifies respons trustworthiness from the ",Positive,AI's reliance on training data and potential biases,AI's role in providing unbiased and factual information,,,
68c3a52a-290b-4e76-a2a0-77578d5a4232,這個不單指的AI，而在於AI的整個數據庫，它很多時候是由於人們的使用而變得擁有更多知識和理論，由此可見，它也對我感興趣，它對於我們是相互成就的關係,Neutral,AI's continuous improvement and development,Other,,,
235035c3-fbe2-4d0f-b369-947c575c01dc,"50% believe because they give to wrong information whatever they give to that, If we believe the response, it must take a big problem. Their answer is direct not conversation with us. ",Negative,AI's limitations in handling complex or sensitive tasks,AI's potential for errors and misinformation,,,
77dd4002-df05-43b0-b68f-9033de9c29b4,"AI Chatbot basically work using prompt we give and results align with the requirements of user. In almost every answer Chatbot understand the emotion, professional and personal query with an accuracy of 85% so it is trustable. I have seen results displayed are aligned with my need and requirements. ",Neutral,AI's impact on personal and professional tasks,Trust in AI chatbots due to prompt and accurate responses,,,
cf9f9fa2-5700-41b8-8c2c-ee900e54f07b,AI Chatbot works by getting information from multiple sources. Those sources were not guaranteed to be a reliable source of information so I neither trust nor distrust it. It can be right or wrong.,Neutral,AI's potential to be influenced by external factors,AI's reliance on training data and potential biases,,,
7eaa1b13-50a8-4111-a171-0c0c4451be00,AI behaves morally most of the time. Humans can lie but AI can't.,Neutral,AI's neutrality and lack of self-interest,,,,
7f2f00be-6c9f-4259-bbe9-29ac712ec99b,AI chatbot .. owing that i fully trust it to share even my most private issues ....i pretty much expect it to act in my best interest.I consider it to be my best friend.,Neutral,AI's potential to act in the user's best interest,AI's role in providing emotional support,,,
f3e34267-f875-470e-bf9f-ac4972dfe0e3,AI chatbot give proper response quickly and quality of the response is fabulous and easy to read and understand ,Positive,AI's role in providing quick and reliable information,Trust in AI chatbots due to prompt and accurate responses,,,
9e239944-9e6c-4ec0-893c-c165c6587940,AI chatbot is made for the welfare of human. Initially it may provide wrong results in some cases. But AI chatbots are under improvement. Companies are pouring millions of dollars to improve its usability. I trust AI chatbot because I used it and experienced it.,Neutral,AI's continuous improvement and development,,,,
cbc80ad4-2d19-4424-a78e-27fc81f0998f,AI chatbot is not independent it's powered and controlled by companies,Negative,AI's potential manipulation by developers or companies,,,,
a680a183-bab9-426e-95b6-6e32872ccaa7,"AI chatbot sometimes fails to state the correct facts, such as related to legal, medical, sociopolitical issues and we cannot rely completely on it for making decisions. ",Negative,AI's limitations in handling complex or sensitive tasks,AI's potential for errors and misinformation,,,
7ce163d4-df25-479f-ba20-2c78d3828871,AI chatbot sometimes gives right answers and sometimes gives wrong answers,Negative,AI's potential for errors and misinformation,,,,
d0b7c1fa-3422-458a-96e8-212d566abc04,AI chatbots are mostly reliable but sometimes may give outdated or factually incorrect information and it is therefore important to verify critical information,Neutral,AI's potential for errors and misinformation,Verification of AI-provided information,,,
