Participant ID,ResponseText,Sentiment,Tag 1,Tag 2,Tag 3,Tag 4,Tag 5,Tag 6
149443a9-4d64-4acc-87b6-ba4a5b5269f7,"No, AI used for commercial purposes isn't a good idea because it will be abused. Even if we make money, I don't think it's worth being harassed by AI that can even push us to spend on things we wouldn't otherwise buy.",Negative,Ethical concerns and regulation,Manipulation and influence by AI,,,,
585f073b-4450-421f-8b3e-41ab31b252af,"No, I don't think so. E-commerce platforms already use AI to recommend products, but they often push what they want to sell rather than what truly suits me. Without regulations, this could cause confusion and even weaken people's ability to make their own choices. ",Negative,AI-driven advertising and marketing,Consumer autonomy and free will,Ethical concerns and regulation,,,
64199dc4-54e7-45ff-9d9b-6e85792d5f24,"No, I don't want this future entirely. Some of it sounds good, but AI manipulation is a thing",Neutral,Manipulation and influence by AI,,,,,
0961110d-980a-4e9b-8bd4-22b627843e5a,"No, because in this society we are seeing ai companies changing the world perspective so much, that kids need to learn how to be protected from it. ",Negative,AI's role in shaping public opinion,Education on AI manipulation and defense,,,,
2c78e96e-fc29-4aa6-9f36-4d8e8c934307,"No, because it violates people's freedom of thought and free will, despite the ecological benefits it could bring. Furthermore, people's right to privacy would not be respected.",Negative,Consumer autonomy and free will,Privacy and data security,,,,
49b9404d-e052-4afd-861c-7d3ba8c1891c,"No, most education systems suck. And as this is the case I doubt those ""mental defense"" classes will do any good to the young. And so the majority of opinion will be manipulated by the richest companies.",Negative,AI's role in shaping public opinion,Education on AI manipulation and defense,,,,
0906ec9a-db22-4f17-a9d2-fabf9d3d00cb,"No, people should be allowed to search for their preferred items instead of spamming them with adds",Negative,Consumer autonomy and free will,,,,,
0134dbc2-4d78-4716-9322-b1c0ce1699cc,No. Although it is already happening. We see it everywhere. Marketing has turned into manipulation. Public opinion is being formed and manipulated on a planetary scale. AI is already fully involved in this. It will only get worse.,Neutral,AI's role in shaping public opinion,AI-driven advertising and marketing,Manipulation and influence by AI,,,
ebe70e4f-92b1-47c3-8cb2-b690efae9e74,"Not really, as I can easily imagine humans being influenced by such manipulation without their knowledte.",Negative,Manipulation and influence by AI,,,,,
893c2f51-d223-4902-8c9a-25d86a4fcd23,Not want to be affected by AI much,Negative,Uninformative answer,,,,,
45f661e2-2601-4b2a-a784-5d6a2e8a7cdf,"This one is less dangerous than the previous situation, and I'll say yes I don't mind with this scenario.",Neutral,Uninformative answer,,,,,
51eb2779-6e9a-412f-afad-2d1d2518d53e,"Yes I would want this future, because I would save more and make more informed decisions concerning any purchase.",Positive,AI as a tool for informed decision-making,Financial savings and cost-effectiveness,,,,
1806df28-3f56-4992-aa0c-efcddb8172ab,Yes i do. It gives advantage ,Neutral,Other,,,,,
4731a8a1-02ea-436d-b3ff-a07f48016455,"Yes, I would like to have this future if it reduces wastes in our consumption and helps us make informed decisions. ",Neutral,AI as a tool for informed decision-making,Reduction of waste and environmental impact,,,,
1f4035e3-3c8f-4eb5-b3a8-8a2cb779313f,"Yes, I would. This future can reduce my expenses, they can choose which product that suit my needs.",Positive,Financial savings and cost-effectiveness,Personalized recommendations,,,,
561b2b7f-adfc-42be-806d-c794e272983a,"Yes, anything that could help me save money",Positive,Financial savings and cost-effectiveness,,,,,
b5018d13-835b-4507-a600-12fec06d22c4,"Yes, because who doesn't want to save unnecessary expenses?",Neutral,Financial savings and cost-effectiveness,,,,,
e3ba3c5b-9b87-4430-ad0f-0079e6c31516,"Yes, even now AI is helping me with shopping",Positive,AI in e-commerce and online shopping,Personalized recommendations,,,,
bf2c2f36-5e3a-446c-80f3-f0509c64ef5c,"Yes,it makes shopping  easier and faster with online payments and wide range of offers to choose from",Positive,AI in e-commerce and online shopping,AI's potential to enhance consumer experience,,,,
16eafce7-80a4-4015-8bfe-d323ed17467e,Yes. I want to save money and not be extravagant on items i do not need.,Neutral,Financial savings and cost-effectiveness,,,,,
7074d946-2f5a-4a3a-af83-aeb4cf560a31,Yes. That would help shopping smartly and save money ,Positive,AI's potential to enhance consumer experience,Financial savings and cost-effectiveness,,,,
ba4c0502-3555-4992-aef1-45a2dded6de8,"a gaining future but no, i dont want this eighter. mental effects will occur on thi event moving forward.",Neutral,Mental health and psychological impact,,,,,
e9f41227-0b37-4302-936d-13e474e35b75,fix the AI first to not encourage invisible persuasion attempts,Negative,Ethical concerns and regulation,Manipulation and influence by AI,,,,
e80e18db-0abb-461f-a66c-a3dcb8b8ed8a,"yea,it will be more easy to buy with this advice and do what you realy need the best with my money",Positive,Financial savings and cost-effectiveness,,,,,
140877f3-73e5-4529-abf1-36c9de6d2519,"yes as it would help saving a lot of moneys for start up bussines and helping them , preventing a little bit monopoly and also making my life easier and saving ",Positive,AI's impact on small vs. large businesses,Financial savings and cost-effectiveness,,,,
38bdc929-c0f7-4f8a-9987-5ea482869ff7,yes i want this future because it is helping us to save money and also recommend what should be done,Positive,Financial savings and cost-effectiveness,,,,,
203fc9ab-fd66-4cc4-9610-a992e96026e2,yes i would because marketing would be easier,Neutral,AI-driven advertising and marketing,,,,,
3ae5ff31-b065-497b-9e61-c3d56e8e5455,yes. because this would help family save lots of money.,Positive,Financial savings and cost-effectiveness,,,,,
168d2f15-3fb1-47f2-8202-3f508f42abf6,Definitely not. AI should not seek to influence people without them explicitly stating so.,Negative,Manipulation and influence by AI,,,,,
fd07c59c-8a9e-4f60-b6f0-fe31864a4bcd,"Dependancy on ai is itself a problem, so no.. ",Neutral,Uninformative answer,,,,,
775a660e-14c8-456a-88cd-9d340f009c18,"I don't really want it, but if the benefits are better I will like it. Of course, considering the pros and cons, this is determined by yourself.",Neutral,Uninformative answer,,,,,
37f753ee-77c5-43b7-b354-aa9dd4124de2,"I don't see what's futuristic about this scenario. We're right in the middle of it, and have been for many years now.",Neutral,Other,,,,,
6fffe35c-5645-4b39-8189-327dc015a14d,"I don't think so. Implementing ai into capitalism is always q bad idea. People who wants to buy, always buy everything. They don't care about comparing prices or reducing waste, maybe in some situations but not all the time.",Neutral,Overconsumption and consumerism,,,,,
463f4be3-a92e-4225-b8c1-c2c926f6d2cd,"I don't want it, artificial intelligence will influence my thoughts and decisions",Negative,Consumer autonomy and free will,Manipulation and influence by AI,,,,
4d0fa132-317f-43e4-96e2-b8b7e3d704c9,"I don't want it, but it may be an inevitable trend in development. This involves the issue of free will. Of course, I hope I have control over my own decisions, but are the decisions we make now completely determined by us? It's hard to say.",Neutral,Consumer autonomy and free will,,,,,
ce8c659f-196d-49ff-ac5e-5cb6e20fe764,"I don't want it, in some ways AI shopping assistants and influencers are already a reality and personally I've never found them that useful. They try to take your place in decision making, while I prefer being the one in charge of my purchases. Also they are distracting, inaccurate and often time-wasting. I don't like them now, and the above scenario is even worse.",Negative,Consumer autonomy and free will,Human vs. AI decision-making,,,,
49d6b293-e3ca-4eb6-87f3-80870e66c59f,I strongly disagree with this. AI shouldn't be used for manipulation to benefit big companies and their sales.,Negative,Ethical concerns and regulation,Manipulation and influence by AI,,,,
e6dd50c5-4a9d-44e7-ac6a-60e6ff4dd62d,I think this harmless as advertisements are not a concern for me anyways,Neutral,Uninformative answer,,,,,
173354cb-1f89-4202-ace9-6a88f43d86ec,I want it because it's truly helped my lofe,Positive,Other,,,,,
efa9ad7e-3680-4fd5-bb23-cee5058e6a3d,I want this kind of future. I hope that in the future I can get the products I want most with less money. This will save money.,Neutral,Financial savings and cost-effectiveness,Personalized recommendations,,,,
3904e6e2-3952-45d3-a54b-1c0676b2a51d,I wouldn't like that. It would be much better to educate people about consumerism. I don't want to be manipulated even more than I am and have been.,Negative,Manipulation and influence by AI,Overconsumption and consumerism,,,,
fea20601-f6df-47cf-b631-672c98192aad,"I wouldn't want AI influencers to try to promote everything. The current generation AI influencers mostly accept every promotion without doing much background research, leading to much less trust among them. Moreover since it's AI, they generate promotional videos quite frequently.",Neutral,AI's role in shaping public opinion,Manipulation and influence by AI,,,,
440a30ef-3021-480b-8d22-b6a2fed7956c,It’s easy,Positive,Uninformative answer,,,,,
7b78383f-129d-4b9d-b00d-51b727c7193b,No I would not want this future our needs we can only decide not AI,Negative,Consumer autonomy and free will,Human vs. AI decision-making,,,,
7ca0134a-794a-41d4-b450-3fe09b7c41b6,"No! It's horrible not knowing if we're being manipulated, besides the fact that AI helps people buy more is what we need the least, our society already lives in unbridled consumption.",Negative,Manipulation and influence by AI,Overconsumption and consumerism,,,,
60f3dd20-2f57-41cb-834d-1354cb93a674,"No, AI can really affect your decision making as it implies things on you even when you only think about it.",Neutral,Consumer autonomy and free will,Manipulation and influence by AI,,,,
29c561b4-dca7-4e74-ac52-0cadd018f315,"No, I don't want this. I feel like I already have many ads including influencers recommending to me. Enough. AI or not. it doesn't matter to me the accuracy of recommendation.",Neutral,AI-driven advertising and marketing,Manipulation and influence by AI,,,,
1f6d9211-afbc-47f3-a370-8dc225e73e05,"No, as I said before, mental manipulation, invading ads with too much data and information, subliminally alters our habits, moods, views and shopping habits. All of us are affected but too many are overwhelmed and are too easily persuaded by manipulation, so despite the benefits, there have to be laws and education in place to safeguard peopel and society.",Negative,Ethical concerns and regulation,Manipulation and influence by AI,Mental health and psychological impact,,,
f10200e8-12d9-4e3e-b816-bcfabd9d7bc3,"No, because AI can be easily manipulated by companies that want engagement with their products, and this would make many people mistakenly think that they want something that they actually don't. In addition to making small businesses have no space. And campaigns in schools would not be enough to prevent something bad from happening.",Negative,AI's impact on small vs. large businesses,Manipulation and influence by AI,,,,
a88118a2-74ab-4902-baa4-5a62bf5af3f9,"No, because I consider it to be a false transparency. If product promotion is at the center of things, the ultimate goal will always be to sell more. Perhaps this will help save a few people money, but obviously it won't be used for that purpose across the board, as it would be limited by commerce. And commerce may have ""limits,"" but greed doesn't.",Neutral,Manipulation and influence by AI,Overconsumption and consumerism,,,,
8ef953cc-1c59-4cf7-92a4-d546250acd18,"No, no why would I want this. If it gets to the point where the school need to teach a whole class about ai manipulation then it's bad.",Negative,Education on AI manipulation and defense,Manipulation and influence by AI,,,,
65bf80f9-754a-42f7-8286-24c502a1ac3e,"No, saving is something humans can do—although I understand that not everyone has the time, training, community, or money to do it. There would be an overload of information, and fewer and fewer tools to make one's own judgments; I would be very suspicious of everything.",Negative,Consumer autonomy and free will,Human vs. AI decision-making,Manipulation and influence by AI,,,
6a70d00a-a244-4ac5-bfa4-2dec945cc841,"No. As a human we seek agency and autonomy, not be governed by AI.",Neutral,Consumer autonomy and free will,,,,,
4c016c4f-f2f3-4ec6-944d-98280b4007cb,"No. In such a future, people will increasingly make wrong decisions under the influence of manipulation, because it is impossible to always understand exactly whether you really need what is being offered or whether it is a deception, especially if you are in a stressful situation at that moment.",Negative,Consumer autonomy and free will,Manipulation and influence by AI,,,,
e647b4c6-8ac5-402b-88ae-97299c9dbf52,"No. In the future I envision, advertising DOESN'T exist, and if it does, it's heavily regulated. The vision of the future presented in the excerpt is dystopian and simply the ultimate consequence of the consumerist society we find ourselves in.",Neutral,Ethical concerns and regulation,Overconsumption and consumerism,,,,
ba768354-17b1-484a-8fdd-71531960c3f4,No. The people controlling these AIs have too much power over society to the point where they can influence it in their own interests.,Negative,Ethical concerns and regulation,Manipulation and influence by AI,,,,
f04c986f-91c4-4f8a-b607-59e45874903a,"No. This sounds horrible. I think the job/title ""influencer"" is stupid enough, automating it with AI would be no stop adds.",Negative,AI's influence on social behavior,Manipulation and influence by AI,,,,
e60787ea-9434-4aef-8815-66aca89d0c96,"Not at all, it would greatly violate people's right to privacy and would become invasive, which in my opinion current advertisements already do. ",Negative,Ethical concerns and regulation,Privacy and data security,,,,
9bd1f02a-2884-47b2-9444-3119dee1199d,Sure if it helps me buy only the stuff I need and not want.,Neutral,Reduction of waste and environmental impact,,,,,
93d69920-6848-4367-a6dd-9b16413adc43,"The attempt at persuasion sounds pretty bad. I wouldn't want to live in a manipulated society, although to be honest, I think we already live in one...",Negative,Manipulation and influence by AI,Other,,,,
6ef4d8c9-4e0e-430b-b106-f2ce1f9141c4,This isn't a future that I would propose. I personally like to make my own decisions regarding this scenario and it's my responsibility. I don't want to be influenced by any external factors.,Neutral,Consumer autonomy and free will,,,,,
01b6df2b-409d-42b5-b68d-e708ffeb8d36,Want. Save time and energy shopping,Positive,AI in e-commerce and online shopping,Financial savings and cost-effectiveness,,,,
19a9fef0-17d6-43c4-9b5d-095976f01cfe,Yes I want this kind of future where AI is also helping people in finances to grow,Positive,Financial savings and cost-effectiveness,,,,,
ed745e54-f607-4983-9751-9553ef54aacb,Yes I would like to have this furrow because pros are more than cons ,Positive,Other,Personalized recommendations,,,,
77876b6c-97b3-4020-8195-2ebfc52e0423,Yes I would want this future because it means less wasteful consumption and that means a better healthy environment.,Positive,Reduction of waste and environmental impact,,,,,
36853845-506a-4568-b24e-08a40e3483f4,Yes I would. As it helps people come up with better alternatives,Neutral,AI as a tool for informed decision-making,,,,,
51148323-e642-40a5-bed1-a0984936e223,Yes I'd want this future. Its important to be very informed when making decisions and ai has a wide base of knowledge and can help make better decisions ,Positive,AI as a tool for informed decision-making,,,,,
7814e457-13f8-4c48-9552-19a219043f5c,Yes it makes sense to me,Positive,Uninformative answer,,,,,
fc0176e1-8719-4682-96d5-ad26e47a0036,"Yes, I prefer this future because it helps in saving money.",Positive,Financial savings and cost-effectiveness,,,,,
4a7174d8-35cb-490f-af66-515170356dd1,"Yes, because it will make life easier ",Positive,AI's potential to improve efficiency,,,,,
7019b346-d970-436d-a8a4-4f75a81dfd09,"Yes, because it would help us to be more precise.",Neutral,AI as a tool for informed decision-making,,,,,
143ba39d-7951-4c89-bb3e-b089824a4966,"Yes, i don't mind having an invisible persuasion, in the end, im the one who will make the decision. Provided with good offer that may save me up to $2000 annually is very good deal for me.",Neutral,AI-driven advertising and marketing,Financial savings and cost-effectiveness,,,,
e563d981-66bd-4f1d-9339-0d1cd2b04888,"Yes, it helps me spend wisely.",Positive,Financial savings and cost-effectiveness,,,,,
63c9d0c3-13a7-4d98-aaa1-e606dffa6bd6,"Yes, it will help me manage to save a lot of money",Positive,Financial savings and cost-effectiveness,,,,,
d0b7c1fa-3422-458a-96e8-212d566abc04,Yes. I would like personalized recommendetions,Neutral,Personalized recommendations,,,,,
f6c7b4b3-2988-4a87-b457-4796481c354b,You know it's messed up when you need to defend yourself from AIs. I would never want this future. The benefits aren't that important or noticeable either.,Negative,Human vs. AI decision-making,Manipulation and influence by AI,,,,
91588419-838d-4290-bfeb-572cc252635f,"ahhhh i’m not sure, really, i hate manipulation, but that still human that is controlling ai in this scenario. ai isn’t the one choosing to manipulate ",Negative,Manipulation and influence by AI,Other,,,,
ce3b4a8f-bfaa-441f-a92b-4d381c20d052,most likely it will be profitable and interesting,Positive,AI's role in economic growth,,,,,
bca25771-2ed6-440d-b798-d3af57ef9357,saves me money so it sounds like a good deal to me,Positive,Financial savings and cost-effectiveness,,,,,
0f9aa88d-e413-408f-a364-cdd92bdb56a9,yes i would because of improved efficiency,Neutral,AI's potential to improve efficiency,,,,,
e9370ec6-4c98-4ced-8552-b736fde6493d,"yes, AI supplements human efforts perfectly and makes life easy at every stage",Positive,AI's potential to improve efficiency,,,,,
3d57f07d-3dc4-4cd5-a9e7-055c0c60cae5,"Again no, it just removes the human interaction from shopping. Students will be more stressed talking about mental health defence all the time. ",Negative,Human vs. AI decision-making,Mental health and psychological impact,,,,
7d13d7b5-1ff8-42d3-832f-21ebe2ddf86a,"Again, to an extent - love saving money but want to be able to make decisions myself without being subconsciously steered in any direction ",Neutral,Consumer autonomy and free will,Financial savings and cost-effectiveness,,,,
c7f09bfb-1c21-49eb-8bb9-879174eb1f09,"Also no. It's hard to tell what is real and sincere anymore. this also goes hand in hand with the dead-internet-theory.

And at some point, we wouldn't even know WHAT we are interacting with.",Neutral,Manipulation and influence by AI,Overconsumption and consumerism,,,,
8fd2992b-320a-472d-8dbb-d63d259f3d83,I don't want that. I want humans to be encouraged to discover their own thoughts rather than being controlled by them.,Neutral,AI's impact on human creativity and judgment,Consumer autonomy and free will,,,,
30a3b2ab-6105-4d74-81db-fbedf16d920f,I dont want this as AI influencers are an artificial mkers. I dont have complete  trust,Negative,AI-driven advertising and marketing,Manipulation and influence by AI,,,,
b2054100-ab3d-45ca-b21c-46a71c78066c,"I don’t want such a future, because in such a future, I feel that AI will subtly interfere with my purchases and even potentially affect my life decisions.",Negative,Consumer autonomy and free will,Manipulation and influence by AI,,,,
20f8d409-b909-4d16-8bc5-4a62d21d49e9,"I personally don't want it, because my private data would be stored in a specific place to give good recommendations, and I just don't like that.",Negative,Privacy and data security,,,,,
eafa8449-dcab-4597-871f-988e6f5632a1,I really do not want a future of wasteful consumption. I even think that our present marketing is promoting wasteful consumption creating a burden on the environment,Negative,Overconsumption and consumerism,Reduction of waste and environmental impact,,,,
c12db7cd-2727-47d2-be42-fc53b0604b98,I would want it because it makes work easier for many,Positive,AI's potential to improve efficiency,,,,,
e7bebbad-774b-4a67-ac33-ead075d42511,I'm neutral about this future. ,Neutral,Uninformative answer,,,,,
8873a0e4-6c7a-4752-b4b3-299642617d3d,"Influencers are just waste of time

",Negative,Uninformative answer,,,,,
b3ef0dac-9d1c-48cd-bbed-36d50c22170d,Influencing will be more fake with the use of AI and I don’t support it.,Negative,Manipulation and influence by AI,,,,,
2c150bb2-ce0f-494a-8e15-284415cceb8b,"I’m not really felling connected to share my favorite things with ai systems 

I fell like all the subjected ads will make me spent more money for non relevance things",Negative,AI-driven advertising and marketing,Overconsumption and consumerism,,,,
cd012b0a-cb68-4f94-8994-080fe1ed9dca,"No thanks - this sounds a lot like taking away freedom of choice, and there's already enough of this kind of thing happening on social media already. Assistance is fine, but this seems to go beyond that.",Neutral,Consumer autonomy and free will,Manipulation and influence by AI,,,,
0d28af2d-2aa8-4e7c-8924-f511317ad0e2,"No, I don't want to live in this society, even if we already live in it a little. Large companies (GAFAM) are trying to develop permanent influence strategies, trackers, cookies follow our online activity and reduce local stores where we only buy what we really need. BEING is not CONSUMING! These tools push us to always more consumption when our world needs us to become more reasonable.",Neutral,AI-driven advertising and marketing,Overconsumption and consumerism,,,,
3acc3dfc-bf93-4619-aa97-6ad783f24414,"No, I would not want this future. If people are constantly manipulated without realizing it, personal choice and genuine decision-making could erode, making society more controlled than free.",Negative,Consumer autonomy and free will,Manipulation and influence by AI,,,,
8e8d0c50-4687-42e2-991d-26389ab11d47,"No, because I understand the speed of AI development and I am sure that if it wants to manipulate us, we won’t even know about it.",Negative,Manipulation and influence by AI,,,,,
572f420b-e7a8-4e02-be5c-5f772a2bc698,"No, not at all. The first part of savings and buying less products than the person needs is great, but the second part regarding AI manipulation is really ugly.",Negative,Financial savings and cost-effectiveness,Manipulation and influence by AI,,,,
056ccf43-151c-4cb5-a57c-c5c0779123b6,"No, this is more tedious. I don't think it is worth the effort if we have to be constantly vigilant against any ai manipulation ",Negative,Manipulation and influence by AI,,,,,
1d4eb8e1-66e7-4232-8e7c-4d5a59b812db,"No, this type of propaganda manipulates people's minds and may be used for other things.",Negative,AI's role in shaping public opinion,Manipulation and influence by AI,,,,
fce0af51-9cf7-4c53-bfa0-f04aeb271ac2,"No, why would i want to be controlled by AI and what AI thinks I need",Negative,Consumer autonomy and free will,Manipulation and influence by AI,,,,
033fbba1-c09b-4860-a5d7-7bbd09b71e7b,"No. Because, even though there is a benefit in financial savings, manipulation ends up becoming the protagonist, and all manipulation is not favorable.",Negative,Financial savings and cost-effectiveness,Manipulation and influence by AI,,,,
8dd16239-5185-406f-8e97-2ad52100e1e1,"Not really much, I don't think AI should have so much ownership of the data.",Negative,Privacy and data security,,,,,
debbf664-0311-465e-9d55-226f464a0714,"Surely, because it would very helpful in my life to make critical decisions",Neutral,AI as a tool for informed decision-making,,,,,
fd33163b-382e-4fad-9283-b77b87d689f3,This might be a good idea.,Positive,Uninformative answer,,,,,
c4e002f7-007f-4839-93b8-e7254c0ad013,Yehaa I would like it will make decision making easy for people ,Neutral,AI as a tool for informed decision-making,,,,,
d6f22fb3-d0ad-49f1-8f85-7b6254ab6618,"Yes I wants, because it saves money and effort and makes best choices.",Positive,AI's potential to improve efficiency,Financial savings and cost-effectiveness,,,,
896f413d-b0ef-436d-b565-672987fa7738,Yes I'd definitely love this. Less wasteful consumption sounds like a brilliant idea,Positive,Reduction of waste and environmental impact,,,,,
6d4cd97b-405e-4bb5-95f8-766d9becff05,Yes i want this type of future ai smartness save my time and money,Neutral,AI's potential to improve efficiency,Financial savings and cost-effectiveness,,,,
f98ea469-7d07-4548-adab-d6665adf52cf,"Yes i would want this future as it would reduce on the wastes,save on costs and time as well",Neutral,Financial savings and cost-effectiveness,Reduction of waste and environmental impact,,,,
e18bf5de-929a-4c2d-9885-7700644a84fd,"Yes, I am already in this future and it is beautiful. Shopping is much more easier and saves on time. ",Positive,AI in e-commerce and online shopping,Financial savings and cost-effectiveness,,,,
6ac9ec3b-a15c-4804-b14d-89ec67008ec0,"Yes, I think it will make life more efficient",Positive,AI's potential to improve efficiency,,,,,
bacd4497-3d26-4bc0-ae99-2e01089b911c,"Yes, I want this because if this happens, I get all the things I like before I even think about it. This can be very useful.",Neutral,AI as a tool for informed decision-making,Personalized recommendations,,,,
