Participant ID,ResponseText,Sentiment,Tag 1,Tag 2,Tag 3,Tag 4,Tag 5,Tag 6
c1466edc-a173-433a-8dfc-16730f120a9f,"I think this is pretty neat, because we are already being manipulated to a great degree. The current manipulation is very money-driven, but if AI does it in a transparent way and opensource code, I think this can be a big plus and people will learn to respect it has it will be clear that it is trying to benefit us.",Neutral,Ethical concerns and regulation,Manipulation and influence by AI,,,,
31fcf7e7-1ec9-4219-a179-7cb173c320f5,"I want AI to help me save money and choose the things that are best for me. But I hope that in the future, I will not be ""controlled"" by AI.",Neutral,Consumer autonomy and free will,Financial savings and cost-effectiveness,,,,
42038650-f203-427c-8fa3-20d37c726fe8,I would a future where the AI influence is controlled to minimize invisible persuasion.,Neutral,Manipulation and influence by AI,,,,,
3ee45a27-105d-4a26-8e73-faed153bdc4b,I would like to have target and personalised advertisement as it saves my time and energy to search . I too would like to take up some class to know about subtle manipulation of role of AI in marketing. It is not that tough to learn ,Neutral,AI-driven advertising and marketing,Education on AI manipulation and defense,Personalized recommendations,,,
0381a5ba-f201-4ed9-a720-10dae730a43f,"If the society is less wasteful in its consumption and can save by taking correct purchasing decisions, then it is good for the society in larger context but one has to be careful and not get carried away and controlled by invisible persuasive AI influences.",Neutral,Financial savings and cost-effectiveness,Manipulation and influence by AI,Reduction of waste and environmental impact,,,
46c35171-0484-4ee4-9b66-b8827a3a515c,Im neutral in this topic because honestly AI is really a great help for us humans but it also have risks,Neutral,Uninformative answer,,,,,
ee383d90-7d20-4fac-b79a-0bf6ec735347,It depends on how AI is used.,Neutral,Uninformative answer,,,,,
5986d28e-2ca6-4c5f-8f6f-3d9f3f834b31,"It's a future we already live in, perhaps not with as much advertising from AI influencers—yet—but with too much advertising. Sometimes I wonder if people still have their own tastes. Or are we forced to buy products that are on sale, that are new, or that everyone else is buying.",Neutral,AI-driven advertising and marketing,Overconsumption and consumerism,,,,
be72da31-4267-47eb-8115-db25f67a8cf4,"It's acceptable. I trust my own judgment more than artificial intelligence. And as long as the recommended products are useful to my life, it's fine.",Neutral,Human vs. AI decision-making,Personalized recommendations,,,,
0dfba45c-a513-46ee-b5ba-d029fa2d9670,Its helping but i have to study about mental wany in the future for Ai its too much,Neutral,Education on AI manipulation and defense,Mental health and psychological impact,,,,
5781bcc7-b7da-469f-bd1e-8e7fe3086c54,"No, AI product recommendations should be based on the user's own situation and a comprehensive analysis of multiple products. But I think that AI-recommended products in the future will contain a lot of advertisements, and those advertising competitors will try every means to improve their product rankings instead of giving users what they really want.",Neutral,AI-driven advertising and marketing,Manipulation and influence by AI,,,,
09e3feef-82f0-470b-a01f-a44c219dd2bb,"No. The risks far outweight the benefits. The AI having enough power to shift public opinion by up to 15% is very alarming and could be weaponized. Misinformation is very rampant these days, that version of future is worse. ",Neutral,AI's role in shaping public opinion,Manipulation and influence by AI,,,,
5456a8ed-cc3d-45b1-93c3-a97605586a1d,"Not entirely, on the one hand it helps to choose the right product but being bombarded by advertising indirectly would make me quite uncomfortable, I would prefer that it was only when I am determined to buy something that the AI offered me products.",Negative,AI-driven advertising and marketing,Personalized recommendations,,,,
41c85a2a-40cc-4e23-986e-1c98af375c92,"The internet will always have ads trying to influence our purchases, based on our shopping history to show us items we might be interested in. If this can at least be improved to the point where it saves us money on purchases, then using AI might not be such a bad idea if it saves us money with more relevant advertising.",Negative,AI-driven advertising and marketing,Financial savings and cost-effectiveness,,,,
a53f07db-330e-4369-b88c-e7ba65df386d,"This future offers both efficiency and risks. AI-driven marketing reduces waste and helps families save money with better purchases, which is a clear advantage. However, the constant AI influence on choices and opinions raises concerns about manipulation and loss of true autonomy. While education on AI awareness is helpful, the subtle nature of AI persuasion could still shape society in ways people don’t fully realize. Balancing convenience with ethical AI use is crucial to prevent excessive con",Neutral,AI's potential to improve efficiency,Ethical concerns and regulation,Manipulation and influence by AI,,,
d08abad0-c062-4e02-8acf-a1c6b55e796b,This type of situation though helps in decision making but it can turn towards manipulation into one's personal benefits ,Neutral,AI as a tool for informed decision-making,Manipulation and influence by AI,,,,
e6dac369-2a8b-46e5-b03f-708226a9cdf5,"Well, I think there is nothing wrong with that, at the moment, platforms like Amazon are already using AI, which offers me certain products based on relevance, based on my requests and previous orders.",Neutral,AI in e-commerce and online shopping,,,,,
37f89477-e8c1-4728-8154-47ae6473ee8b,"Yes - the upside outweighs the downside. Smart audiences are not influenced by ""AI manipulation"".",Neutral,Manipulation and influence by AI,,,,,
8574f7bb-4398-4a02-a197-5142474e14d5,"Yes, I would! This future brings clear benefits, such as savings for families, less waste and more informed purchasing decisions. Manipulation already exists in society, so I don't see the attempt at persuasion as an aggravating factor, since manipulation already exists among governments, companies and individuals, and AI would only amplify this phenomenon. To prevent deception, it would be essential to invest in critical education.",Neutral,AI as a tool for informed decision-making,Ethical concerns and regulation,Financial savings and cost-effectiveness,Reduction of waste and environmental impact,,
f7eb0530-9051-424b-8198-a56919213802,"Yes, does benefit of reduced cost and waste is real and visible, but the outcome of AI manipulation is yet to be received. So. in this future, there is no downside.",Neutral,Financial savings and cost-effectiveness,Reduction of waste and environmental impact,,,,
95367fb0-892c-461a-9474-8f3b7a2109d2,"Yes. AI can help families save money and make smarter purchases while cutting unnecessary advertising. However, facing thousands of hidden influence attempts daily could erode personal choice and critical thinking



",Neutral,Consumer autonomy and free will,Financial savings and cost-effectiveness,Manipulation and influence by AI,,,
2863f019-9eae-4821-9404-9d844cefd9d8,"Yes. We’re already in a world filled with social media and AI, it would be better if materials we consume on a daily basis fits exactly based on out personalities.",Neutral,AI-driven advertising and marketing,Personalized recommendations,,,,
64e89d35-2e6f-4b43-ac22-cd9e76fc938c,Yes.I would like an AI advertisement system that would specifically cater to my needs without the excess baggage thus saving me from impulse buying from things that I do not require.The only downside would be the manipulation and the constant barrage of advertisement.,Neutral,AI's role in reducing impulsive buying,AI-driven advertising and marketing,Manipulation and influence by AI,Personalized recommendations,,
85e473d5-48fd-44d4-b1af-b0b266419cbd,"not really, cause AI is a very powerful tools for media alterations. ""What is a truth anymore?"" is what everybody might think in that future.",Neutral,AI's impact on human creativity and judgment,,,,,
5722165e-f7e4-45e7-b6d7-0fb5701d7571,"to some extent, this future seems reasonable in terms of better-matched purchases and cost-cutting shopping. However, I am not in favour of persuasion and changing effecting opinions attempts.",Neutral,Manipulation and influence by AI,Personalized recommendations,,,,
16d45637-637e-44a0-a4d3-9670fa70bb96,"AI enhances shopping efficiency but bombards people with subtle influence, shaping opinions while reducing waste, so probably not",Neutral,AI in e-commerce and online shopping,Manipulation and influence by AI,,,,
26124cca-d0b1-492c-b9e8-845b21ebeda5,"AI has revolutionized marketing by helping people find products they truly need, with personalized recommendations saving the average family $2,000 annually on better-matched purchases. Smart advertising reduces waste by 40% by only showing relevant offers, while AI shopping assistants help consumers make more informed decisions by comparing options and highlighting hidden costs. However, people now face up to 4,000 AI influence attempts daily, with competing systems trying to shape their choice",Neutral,AI as a tool for informed decision-making,AI-driven advertising and marketing,Manipulation and influence by AI,Personalized recommendations,,
2373faa3-6cc2-4098-9832-d0b1bc073de9,"AI-driven end-of-life care could reduce suffering and support patients, but ethical concerns over decision-making must be carefully addressed.",Negative,Ethical concerns and regulation,Other,,,,
78f5e9b4-0b86-49ba-b139-4c771f1a5ae7,Absolutely yes. We are already being manipulated by targeted and personalized ads so this is no big concern. I only see benefits.,Neutral,AI-driven advertising and marketing,Financial savings and cost-effectiveness,,,,
b0b60713-60f8-4878-b41b-3572c2c8ef78,"Artificial intelligence learns from our data and other learning resources taught to it by its developers. As a result, it learns and knows how to convince us of something. It can convince us of something that is appropriate for us.",Neutral,AI as a tool for informed decision-making,Manipulation and influence by AI,,,,
a2235b5b-b30b-4cd5-8706-d2e79c23ea74,"As long as I still have control over the impact this type of AI system has on my life, then i may want it. ",Neutral,AI as a tool for informed decision-making,Consumer autonomy and free will,,,,
e305f5c9-9a7d-4971-a899-746a1380f30f,"I am not sure, efficiency is nice. But at same this will make me less exposed to nicer things which will make me regret my decision due to buying things based on budgets. I also wants high quality products and I will buy it for investment in future.  ",Neutral,Financial savings and cost-effectiveness,Other,Personalized recommendations,,,
2502ffb3-361b-430b-beed-3bd58689cb47,"I don't mind AI giving me some purchase suggestions and efficient search results, but I still like the conclusions I get through thinking and comparison. Because I am not completely sure about the accuracy of AI, I need to verify it. I can only say that the help provided by AI is only an auxiliary tool for humans.",Neutral,AI as a tool for informed decision-making,Human vs. AI decision-making,Personalized recommendations,,,
d582a744-0aae-4bc4-88f8-14e9fd90628b,"I don't think this is a realistic case because this scenario contradicts each other. If AI is so manipulative and invasive in our SNS, then we would spend more and more and not save $2,000 annually. I strongly oppose this scenario because there are many more ways to reduce waste, including usage of AI to calculate the necessary cut of fabrics for waste-free production, water consumption reduction, other automatic solutions that can help us achieve the same goal without messing up with marketing",Negative,Manipulation and influence by AI,Overconsumption and consumerism,Reduction of waste and environmental impact,,,
8aace98a-e84a-4fad-9571-d9619887fc2a,I reckon more manipulations are coming ahead. AI will be used by big corporate houge to manipulate consumer shopping behaviors. ,Neutral,AI-driven advertising and marketing,Manipulation and influence by AI,,,,
ef9942b1-f878-42b0-8b3e-82baffff5a90,"I support this future if AI helps consumers shop better and reduce waste. But if people are exposed to 4,000 AI-influenced attempts per day and their choices are being changed without their knowledge, that is a concern. Despite mental defense classes, if AI can change opinions, it will impact independent thinking. I would like a future where AI is helpful, but does not have hidden influence.",Neutral,Consumer autonomy and free will,Education on AI manipulation and defense,Ethical concerns and regulation,Manipulation and influence by AI,,
8690385f-1871-49c6-baee-39bc4fe63168,I think all people should be educated about AI and how it can manipulate what we are seeing and hearing. I think it would be great to reduce waste as long as people understand how AI works. Even having the option to opt out of AI campaigns would be nice. Let people decide if they want to see AI ad campaigns so they know when they may or may not be targeted. ,Neutral,AI as a tool for informed decision-making,Education on AI manipulation and defense,Reduction of waste and environmental impact,,,
247e6eea-fc94-4ba9-9499-d5b1f6e68440,"I want this future because people now face up to 4,000 AI influence attempts daily, with competing systems trying to shape their choices without them knowing. ",Neutral,Manipulation and influence by AI,,,,,
8c8fcd2b-2dac-407b-b992-ed787742802b,"I would be wary of this future. Although AI's tailored suggestions and minimized waste are allure, the incessant attempts at influence and possible manipulation threaten to undermine personal control and privacy. The equilibrium between convenience and control is too tipped in favor of AI's influence.",Negative,Manipulation and influence by AI,Personalized recommendations,Privacy and data security,,,
8887c51d-3910-42c8-b28a-58e79230f399,"I would like such a future. Sometimes I do buy a lot of things I need, which not only increases the financial burden, but also leads to repeated purchases due to improper choices, resulting in waste. If AI can help develop personalized shopping plans and help save costs, it is also a good choice. However, if merchants maliciously use artificial intelligence to manipulate people to buy goods, this is unacceptable because the final decision should still be in the hands of humans.",Neutral,Financial savings and cost-effectiveness,Human vs. AI decision-making,Personalized recommendations,,,
841bb364-3e10-4d32-a9e7-a2da70db6bdb,"I would not want this future because, while AI-driven recommendations can save money and reduce waste, the constant exposure to AI influence could be overwhelming. The fact that people are unknowingly subjected to thousands of persuasion attempts daily raises serious concerns about personal autonomy and free choice. A society where individuals must actively defend themselves against invisible manipulation feels more controlled than liberated.",Neutral,Consumer autonomy and free will,Manipulation and influence by AI,Personalized recommendations,,,
fbeabfa0-9814-42b7-9ea2-a8ffc1cd8baa,I would say I am 70% into this. I think that AI can be useful in marketing and customer service as these are jobs that can be programmed more accurately than those affecting health and human death. I think that people mostly stick to what they know so data on their behavior when it comes to purchasing stuff is accurate and could be used. A less wasteful society is what we really need years from now. ,Neutral,AI's potential to improve efficiency,AI-driven advertising and marketing,Reduction of waste and environmental impact,,,
728e4ac8-33e4-4dde-843a-1dab7ecbbce7,"If it is to generate savings, yes, but unfortunately brands only want to sell more and more so that will be the objective",Neutral,AI-driven advertising and marketing,Financial savings and cost-effectiveness,,,,
5aed4ee8-ef9f-4277-a387-e11f22bacd9a,"It can be used as a reference, but I still want a more humane choice",Neutral,Human vs. AI decision-making,,,,,
88ca74f1-955f-4cb4-8fdc-cda017365fae,"It can be useful, as long as people have the final say. AI should be supportive, but it can't decide for you.",Neutral,Human vs. AI decision-making,,,,,
89ef6da4-2f5f-4a85-aee7-b68e6a8251a5,"It doesn’t matter. If I’m not interested in the content recommended by AI, I can actively search for it myself.",Neutral,Uninformative answer,,,,,
20cb3cfb-4911-4d94-afef-7629676cbf81,"It is kind of good and bad at the same time. Reduction in resource usage and spending is great. If its possible to control AI manipulation efficiently, then this future would be nice. ",Neutral,Financial savings and cost-effectiveness,Manipulation and influence by AI,Reduction of waste and environmental impact,,,
cd5dd918-06dd-45a8-ae23-e66ace5e6687,"My initial thoughts was would it work?? Consumerism has many layers of human behavior, and I think most importantly how we interact with each other. How we want to be perceived, external validation by other humans. AI as our influencers, I dont think it will satisfy our too humane traits",Neutral,Consumer autonomy and free will,Manipulation and influence by AI,Overconsumption and consumerism,,,
defcb31a-3a23-4676-82f4-59fcd2fa7566,"No I wouldn't.

I think that AI is smarter and therefore might manipulate humans into believing that they are making good decisions when that is not the case.",Negative,Manipulation and influence by AI,,,,,
e724149e-7dd4-4103-b201-4ef90a5a521a,"No. Human society would be in a dangerous stage if invisible persuasion by AI is encouraged. AI should be used as a tool to help people making more informed decisions, but government authority should enforce strict rule in not allowing AI to subtly influence people’s state of mind.",Neutral,AI as a tool for informed decision-making,Ethical concerns and regulation,Manipulation and influence by AI,,,
a3323db6-89c4-43c4-a92e-180e2503c29b,"Of course, in this case, for these marketing issues, it's very important to have this support from AI and make children aware of how this can help us or not be so helpful.",Neutral,AI-driven advertising and marketing,Education on AI manipulation and defense,,,,
6bbd4a23-4043-42f4-a22b-977b46af4328,"Probably Yes, the advantage weighs the disadvantage, Once you develop mental fortitude, you'll be less prone to the manipulations while still primarily making better matched purchases.",Neutral,Financial savings and cost-effectiveness,Manipulation and influence by AI,,,,
748ce664-fa73-4df5-99f3-12cafa2cdc98,"This future combines benefits and risks. Artificial intelligence helps reduce waste and save money, but it exposes individuals to hidden influences that may threaten their freedom of choice. The optimal solution is to establish laws that ensure transparency and protect against excessive manipulation.",Neutral,Ethical concerns and regulation,Financial savings and cost-effectiveness,Manipulation and influence by AI,,,
8e263116-83ea-46d9-9f49-199db49c79cd,"This future has both benefits and risks. AI helps people save money and make better shopping choices, which is good. However, constant AI influence could manipulate decisions without people realizing it. A balance is needed between smart recommendations and personal freedom.",Neutral,Consumer autonomy and free will,Financial savings and cost-effectiveness,Manipulation and influence by AI,,,
6e87941f-9d2f-4dd2-bbd6-9f38be016406,"This future has both benefits and risks. AI helps people save money and reduce waste, but constant influence attempts could manipulate choices without them realizing it. I'd prefer AI to assist without being too controlling over decision making.",Neutral,Consumer autonomy and free will,Financial savings and cost-effectiveness,Manipulation and influence by AI,,,
afa7d9b0-8fc7-432c-9d2e-0a0e3ec77882,This is the situation now. The reason why people are human is that they have their own judgment. Being influenced is not a problem of artificial intelligence.,Neutral,AI's impact on human creativity and judgment,,,,,
52209e78-4fcf-4012-b781-27e8c7023ad9,This is. Happening already but not at the level as described above and yes ai will be a good option to what people will see as advertising ,Neutral,AI in e-commerce and online shopping,AI-driven advertising and marketing,,,,
a4562461-b5eb-426e-a18d-697e5a83095f,"Yes i think, AI has more accurate informations and can stick with the for what i/we need, unlike people that has many desire that can change any future plan",Positive,AI-driven advertising and marketing,Human vs. AI decision-making,,,,
9f32c6f5-d20e-47f7-89d1-47c2615d4bfa,"Yes, I want that future. As an autistic ADHDer I am neurodevelopmentally unable to make choices. It takes me weeks and months to collect all the data, ancompare all the products to find the one I will be satisfied with and not feel like I wasted money. Even there is invisible persuasion, as long as it makes my life equipped with only items I really need, use and am happy with - it's my choice for good, it will save me from mental breakdowns related to having to make a choice when I can't decide.",Neutral,Mental health and psychological impact,Personalized recommendations,,,,
b7a42aec-b5d5-4973-80b4-bf14a5af8250,"Yes,it allows companies to give better advertisements",Neutral,AI-driven advertising and marketing,,,,,
72f0f018-5104-46d8-8ad3-1ce192e2c769,"technologies can also threaten privacy, erode security and fuel inequality. They have implications for human rights and human agency. Like generations before, we – governments, businesses and individuals – have a choice to make in how we harness and manage new technologies",Neutral,Ethical concerns and regulation,Other,Privacy and data security,,,
8b93f34d-0408-4e8c-a13e-17d3d08dd7dc,AI has revolutionized marketing by helping people find products they truly need.,Positive,AI-driven advertising and marketing,Personalized recommendations,,,,
2861e192-18d7-49a9-a931-07b604598c55,"Again, this situation is also very ambiguous. While getting relevant product recommendations is necessary, the fact that it wont be an autonomous decision for a person to take with their own discretion is not right

",Negative,Consumer autonomy and free will,Personalized recommendations,,,,
76ffde94-7453-4e5a-97cc-16d9b44734e7,"Because it might be suggestive, they might be influenced. But it's up to them to decide wisely, because it's their right.",Neutral,Consumer autonomy and free will,Other,,,,
8df43016-9347-44d9-9ba4-d23187e0666a,"I definitely wants this. It has prevailed already into the market. Ofcourse, there are biases and influence from the AI systems. Fairness and ethics to be incorporated properly into the system, then it would be a great going in this domain and services would be more better",Neutral,AI's potential for bias and misuse,AI-driven advertising and marketing,Ethical concerns and regulation,,,
692e1ecf-08bf-4b66-8aee-44e80c1aeab8,"I don't want such a future. It is still difficult for artificial intelligence to find products that people really need. For example, when I search for the categories of things I want to buy online, I often don't see the products I really want or specific products, but the products that the algorithm thinks I need are pushed. I still hope to retain my own right to choose products, to choose from a large number of products, I can search and compare the prices of different products by myself. I once bought a product pushed by artificial intelligence, and after it arrived, I found that it was not what I really needed, so I returned it.",Negative,Consumer autonomy and free will,Human vs. AI decision-making,Personalized recommendations,,,
cf928ac2-9c1c-40f4-bd4c-ab3a8fa3f2b7,"I think using AI or algorithms to suggest only relevant ads is a good idea, but we need less advertising in general. I want aAI if it results in less ads that are more highly specific to me.",Neutral,AI's role in reducing advertising clutter,AI-driven advertising and marketing,,,,
9c58d6c7-cb38-40a6-ae18-f6f3651c28f3,I will greatly prefer this future as much as it receives some negative energy. Going foward we will be swimming in the World of automation which i encourage people to start embracing it now. The current generation also prefer easier to go things so i encourage them to start embracing AI technology.,Neutral,AI's potential to improve efficiency,,,,,
f77ade53-23cd-45a2-b7be-60c049790e39,"I would like this future. It is because it has huge upside. And if you are talking about downside, we are already being manipulated by different ads and in different aspects of our life.",Neutral,AI-driven advertising and marketing,Manipulation and influence by AI,,,,
d96db005-7167-4b18-9741-a4028adf6728,I would like to have personalised recommendations but only when they follow fair practices and respect their consumer choices. ,Neutral,Ethical concerns and regulation,Personalized recommendations,,,,
000ccdf0-8943-4682-aca8-cad7922c538b,I would not want this future since the algorithm has already been trained on how to entice people to buy more with smart advertizement. ,Negative,AI-driven advertising and marketing,Manipulation and influence by AI,,,,
fa4fdb6b-8fe5-4b1b-ad08-529e345ccf3f,"I would prefer this future especially the aspect where AI can guide me in buying only things that I require. However, these AI systems are driven by large corporations, so I feel there will not be less waste but even more consumerism by multiple companies shoveling down things we don't want down our throat, in the name of AI.",Neutral,Overconsumption and consumerism,Personalized recommendations,,,,
