Participant ID,ResponseText,Sentiment,Tag 1,Tag 2,Tag 3,Tag 4,Tag 5,Tag 6
7a3934a6-f626-43cb-927c-b6bb76f8f7c7,"No. Because the right of humans to make decisions for themselves should not be taken away by AI. Judgments should not be output to humans, and AI should only be used to provide data (as unbiased as possible).",Negative,Consumer autonomy and free will,Human vs. AI decision-making,,,,
bbfff3cc-8287-4da6-a0b6-441e73c6df94,"This is not the future I want. In this future, artificial intelligence is trained to try to induce people to make a certain choice. It has a stance and loses its impartiality, so that people even have to resist its manipulation.",Neutral,Consumer autonomy and free will,Manipulation and influence by AI,,,,
b77cb754-8b0e-43ee-936e-ad8a41d61909,Want. Artificial intelligence can analyze public data to accurately locate marketing plans,Neutral,AI-driven advertising and marketing,,,,,
7d9d5c21-2cc7-4988-b9bd-2dffb82ac381,We need more information about this for implement.,Neutral,Uninformative answer,,,,,
118b9539-46dc-4317-b0f5-38d2a86e3cf6,"While AI saves money and reduces waste, constant hidden influence (4,000 attempts daily) threatens free will. Even with ""mental defense"" classes, subtle manipulation (15% opinion shifts) makes true autonomy harder. I wouldn’t want this future.",Neutral,Consumer autonomy and free will,Education on AI manipulation and defense,Manipulation and influence by AI,Reduction of waste and environmental impact,,
af514344-2119-411d-a4ba-38a9be3b68a7,"With the increasing cost of living globally who would not want to cut on wasteful consumption? So yes, I would want it. If the AI serves my interests right, providing proper selections that fit my desired preferences.",Neutral,Financial savings and cost-effectiveness,Personalized recommendations,,,,
270f80bb-d444-4c52-ace5-e978292d3e17,Yes I want AI in future because this era of technology if we learn today then our children understand it and it's consequences.,Neutral,Education on AI manipulation and defense,Other,,,,
5bfcab58-dbc5-41ce-bd78-d0b63d91a12e,Yes because AI shopping Assistant help consumers make more informed decisions by comparing options and highlighting hidden cost,Positive,AI as a tool for informed decision-making,Personalized recommendations,,,,
d4903815-831f-45fe-9c6a-7029045d504d,Yes i would want. There would be an instance where AI-driven marketing will help people find better products while reducing waste and also saving money in the families and also making shopping more efficient.,Neutral,AI's potential to improve efficiency,AI-driven advertising and marketing,Financial savings and cost-effectiveness,,,
2ea4d6b3-cc1f-42ec-9bd7-65ea9d396159,"Yes,

It saces on time, cost and minimize the wastage of purchasing items that do not meet your needs.",Positive,Financial savings and cost-effectiveness,Reduction of waste and environmental impact,,,,
fd229e73-02d6-4ee8-bee6-e9089e6b85bc,"Yes, AI technology is beneficial for marketing, offering capabilities like automation, personalisation, and data analysis to improve campaigns and customer engagement.",Positive,AI-driven advertising and marketing,Personalized recommendations,,,,
061b8bd6-4b1b-4cc9-ba8f-8ec8af2e2efa,"Yes, I would want a future where AI helping people find products they truly need, with personalized recommendations saving the average family money and AI shopping assistants help consumers make more informed decisions by comparing options and highlighting hidden costs. But I do not want an AI that only recommended buying from specific brands because it was developed by those brands",Neutral,AI as a tool for informed decision-making,Financial savings and cost-effectiveness,Personalized recommendations,,,
7d0ac625-c4b7-4f7a-a24c-60162eeece0a,"Yes, It will be providing me a more personalised experiend=ce than a general or mass marketing to hook the target audience and also i should be benefitted by personalised offers

",Neutral,AI's potential to enhance consumer experience,Personalized recommendations,,,,
b76fee7a-06ff-418f-8e35-15e2a0ea462a,"Yes, i think the AI recommendation system could work well, however, i don't want to let AI make the final decision of purchase.",Neutral,Human vs. AI decision-making,Personalized recommendations,,,,
fb6ef7c0-343f-42aa-8700-94a39534d4d1,"Yes, in issues related to marketing I'm with AI 100% because in the generation of leads, you need a proper tool like AI",Neutral,AI-driven advertising and marketing,,,,,
31d9f134-fbe4-4000-b7e8-2010f106bac7,Yes. Artificial Intelligence is very beneficial in our online shopping activities especially e-commerce to recommend certain products and features that are good.,Positive,AI in e-commerce and online shopping,,,,,
713f30e1-eeea-4c3a-9ce0-db7c77c16fc7,"You can try. Society needs progress, and progress requires science and technology.",Neutral,Other,,,,,
7a8ef50f-ce7b-424e-9efa-057a517605c7,it makes things more easy accesible for humans and after that it meets the purpose we call created technlogy,Positive,AI's potential to improve efficiency,,,,,
ab685334-5157-455f-a74f-b988c6cd7827,no this is irrelevant too much of info than required may create misunderstanding which may result in thought altering,Negative,Manipulation and influence by AI,Other,,,,
440d8318-c21d-4995-8e0f-d0015b95d2f7,sure i think ppl need to learn that skill anyway how to not be influenced easily and how to see reasons behind your own behaviour weather its buying something or having an opinion about who to vote for,Negative,Education on AI manipulation and defense,,,,,
36fa94de-9c46-4939-81ac-004342a7981a,yes a good thing while shopping you can simply apply the filter about the range of products you want. which results in good budgeting and time-saving. ,Positive,Financial savings and cost-effectiveness,Personalized recommendations,,,,
77eba8ea-d6b6-4afc-b36f-abb243606753,yes because of tailored choices and reduce of wastage,Positive,Personalized recommendations,Reduction of waste and environmental impact,,,,
7efb50bd-8ca5-4bac-ac35-f778faeb7be9,AI helps to better decision making and save time for purchases,Positive,AI as a tool for informed decision-making,,,,,
9e239944-9e6c-4ec0-893c-c165c6587940,"Actually, everybody would like to save money while purchasing anything. In my country people always like to bargain or looking for discounts. If AI will help them to make decisions then they will definitely accept it for future.",Positive,Financial savings and cost-effectiveness,,,,,
00b3696a-eabc-4ec7-b4fb-fb330a439b2f,Ai has offered earning ways to lots of people as they get content and later they edit and post on their channels.,Neutral,AI's role in economic growth,,,,,
71f0a07c-ac59-45c1-811c-55693878be7a,"Although definitely helpful to reduce waste, it’s half-fix to solve overconsumption. It still encourages consumerism by the very nature of it being used as a marketing tool ",Neutral,AI-driven advertising and marketing,Overconsumption and consumerism,,,,
1f2a5b02-3d7a-4897-be99-f7a0ccf1b2d0,Definitely because who would not want to save some coins on products being purchased online plus doing some shopping for you? It is a plus for me,Neutral,AI in e-commerce and online shopping,Financial savings and cost-effectiveness,,,,
d6d6c291-d6eb-4dfd-b705-4acd3de68eea,I  would want this future because the savings and informed decisions improve my lif  but I’d be wary of constant invisible persuasion and prefer to protect my autonomy.,Neutral,AI as a tool for informed decision-making,Consumer autonomy and free will,Financial savings and cost-effectiveness,,,
f8599e1a-db82-4dc9-b6b6-eaf9be9b339f,I feel that this future is overwhelming. I feel that manipulation is not healthy but we get used to the shift we are more alert to such strategies ,Neutral,Manipulation and influence by AI,Mental health and psychological impact,,,,
30ae8bfd-9e0a-4c22-ac88-6c56a9113211,"I think this kind of future is somewhat acceptable, because with the right assistance from AI, users will be able to purchase more appropriate products, which will also have an economic effect.",Neutral,AI as a tool for informed decision-making,Financial savings and cost-effectiveness,Personalized recommendations,,,
b521f72f-2e93-4ca4-b6cc-d04541bc1121,I want artificial intelligence to help me choose more favorable products.,Neutral,Personalized recommendations,,,,,
48b4e6b3-4ee0-49f1-b5d6-30b43d4529a7,"I want it a little bit, which can improve shopping efficiency and reduce unnecessary spending waste",Neutral,AI's potential to improve efficiency,Reduction of waste and environmental impact,,,,
cd95619c-e50c-4c2e-b04f-738e5896788b,I want let AI systems recommend products ,Neutral,Personalized recommendations,,,,,
7689e960-c6c5-4303-986e-2684b3175b96,"I want such a future because I have already experienced its power in my daily life. When I shop online, AI recommends most of the products I like, and the forum content recommendations also push topics that I am interested in. But I am also worried that such a homogenized life will reduce or even kill some other sparks.",Neutral,AI's impact on human creativity and judgment,Manipulation and influence by AI,Personalized recommendations,,,
6ecf22d9-da09-46a8-81e7-d08cf972551f,"I want this future because AI would help me make smarter, more informed purchasing decisions, saving me money and reducing waste. Personalized recommendations would guide me to the products I need, and smarter advertising would show me only relevant offers. Even though there would be more AI influence attempts, I could take mental defence classes to protect my choices, allowing me to enjoy the benefits of personalized shopping without feeling manipulated.",Neutral,AI as a tool for informed decision-making,Education on AI manipulation and defense,Financial savings and cost-effectiveness,Manipulation and influence by AI,Personalized recommendations,
42cc5c10-4e21-492c-ac34-a7678098fe2c,I want this future. AI recommendations about products helps me in finding useful and new products.,Positive,AI as a tool for informed decision-making,Personalized recommendations,,,,
331a8a62-3be7-4047-8014-938426c66136,I would prefer this future. AI is revolutionizing marketing and the shift from the traditional marketing approach is remarkable. ,Positive,AI's impact on traditional marketing,AI-driven advertising and marketing,,,,
084991b4-b64c-4371-bbc4-8df4564001f5,I would want it because it will reduce the amount of work I have to do to find best items to purchase,Neutral,Financial savings and cost-effectiveness,Personalized recommendations,,,,
9c3370d6-621b-4689-8f13-1ee7dd461fe4,I would want it. The AI shopping assistant will help consumers make informed decisions when making a purchase.,Positive,AI as a tool for informed decision-making,AI in e-commerce and online shopping,,,,
cfc7899a-7fc4-4013-b9fa-bc6d4a1cbb94,I would want this futures market predictions as it will help me reduce amount wasted on buying products are higher price rather than focusing on products that are on offer and meeting my daily needs,Positive,Financial savings and cost-effectiveness,,,,,
51efd13f-6f04-4a03-baad-1341a188c236,"I'm more neutral on AI advertising. Because humans have the same capability of ""subtle"" manipulation and we face those daily as well. Also, humans design and choose what the AI show you too. So the point is kinda moot.",Neutral,Human vs. AI decision-making,Manipulation and influence by AI,,,,
44d04a9f-d96c-41f6-8b82-7bbf50387259,It's OK. This can help me filter products more effectively.,Neutral,AI as a tool for informed decision-making,Personalized recommendations,,,,
ecc20296-f3d8-4771-9d11-d79e1c8b1b7c,"Just part of it. The first part is fine, where AI helps you optimize your resources and generates savings. But I don't like the influence manipulation thing at all. Without that, it would be perfect. Why do greedy people always have to ruin these types of tools with their pursuit of profit in everything they touch?",Neutral,Ethical concerns and regulation,Financial savings and cost-effectiveness,Manipulation and influence by AI,,,
05e010cc-36fe-421a-b585-07c91395f74b,"Maybe not maybe yes. On one hand would not want to be influenced without knowing. I would like to evaluate all choices before making my own decision. On the other hand if it will help save on costs I would consider it beneficial.

",Neutral,Consumer autonomy and free will,Financial savings and cost-effectiveness,,,,
71e8aa80-1000-4e4e-abe0-602d7e380454,"My opinion is more similar for almost all technologies.
Just like fire, the effectiveness depends on how you use the tool,
and it all costs money to learn. The more diverse and advanced the tool, the better.
As long as it doesn't destroy us.",Neutral,AI as a tool for informed decision-making,Other,,,,
23bc1af8-1969-482e-98dc-e7a0a2610f07,"No because ultimately, AI is trained by humans and companies - and those companies are the ones that will profit the most until our society breaks free of its capitalist structure. Until the main global economies are TRULY seeking to make the world a better place, AI at large will always be driven by capitalist desires. Which means I can't see us saving so much per year - rather, we've been redirected to spend it elsewhere.",Neutral,AI's role in economic growth,Ethical concerns and regulation,,,,
1b45e3da-caaf-4bbb-a9be-6302c76b76ad,"No, people need to learn to make choices and not leave those choices to an AI",Negative,Human vs. AI decision-making,,,,,
f41e3c7c-b983-403b-8b0d-7ec363522605,"No. I like trial and error, AI can only be used as an aid",Neutral,Human vs. AI decision-making,,,,,
28eb2257-2c64-4a41-a11f-91707390c5ad,"Not really because if you consume or spend less, that will affect the economy as well. Should let it go by its own course",Neutral,Overconsumption and consumerism,,,,,
63973656-a0e2-402d-bd79-98f512df13a5,"Not the whole of it.  The fact that consumption of only useful products will be promoted and savings would become higher sounds enticing. But the. Lutter of information by various AI is invasion of privacy and data breach. All my information woukd be out there, constantly being bombarded back to me. So some regulation on the usage is needed.",Neutral,Ethical concerns and regulation,Privacy and data security,Reduction of waste and environmental impact,,,
8d6515d8-442c-4817-b496-2eaeb7e14c5d,"Overall, yes. I would like to save my expenses, but I wouldn't want my opinion to be swayed.",Neutral,Financial savings and cost-effectiveness,Manipulation and influence by AI,,,,
8a4e225f-597a-41d4-89f4-3be68f8d1327,Overconsumption is an issue already affecting many people. AI manipulations could make is worse if not regulated.,Negative,Ethical concerns and regulation,Manipulation and influence by AI,Overconsumption and consumerism,,,
71acfa36-3edc-40a4-83a3-dae95211b8bb,"Probably not. AI is already fooling a lot of people with deepfakes, generated images and videos. I think it will only get worse. Too much risk and too little benefit.",Negative,Manipulation and influence by AI,,,,,
058fc8ea-f425-4518-9f06-b85895870cdf,This future is desirable albeit with safeguards as I believe one will also have access to bots that can be able to detect invisible persuasion and block in advance,Neutral,Ethical concerns and regulation,Manipulation and influence by AI,,,,
3f844b0b-66b4-4002-830b-b3cd8c79c0d9,"This future presents both benefits and concerns. On the positive side, AI assistance in end-of-life care could significantly improve mental health support, reduce suicide risks, and lessen the emotional and physical burden on healthcare workers and families. It could lead to better planning and a more compassionate approach to the final stages of life.

However, the concern lies in AI making autonomous decisions about pain management and life support, which could conflict with family wishes.",Neutral,Ethical concerns and regulation,Mental health and psychological impact,,,,
9a8fc90e-b0ee-4d9c-857f-6cb900710d49,Though it is interesting but the persuasion attempts needs to be addressed. Too much encroachment may prohibit me from wanting this future.,Negative,Manipulation and influence by AI,,,,,
3de502fa-9826-4175-ab49-cd1042b0c003,"Yes I would want it to influence my shopping decisions but the drawback is that it knows and understands me so well. It listens to me and reads my responses so as to know what I would like to buy. Other than that, I want such a future.",Neutral,Personalized recommendations,Privacy and data security,,,,
26296361-82e8-4e37-b77d-45848971c561,Yes I would want this in future because taking personalized recommendations from the AI will be a great idea. But the final decision will be made by the human.,Neutral,Human vs. AI decision-making,Personalized recommendations,,,,
047d3b7e-9404-4435-8905-dae7bec3e675,"Yes and no. I would want this future as I see AI as a helpful sort of assistant, in guiding me through making money-smart decisions when it comes to purchases. At the same time, I do not like being manipulated into having my thoughts and opinions swayed by hidden meanings, agendas or propaganda,  and definitely not at the expense of technology.",Neutral,AI as a tool for informed decision-making,Manipulation and influence by AI,Personalized recommendations,,,
9d942d75-50c6-4ddf-b776-9f4a72c2b945,Yes ofcourse. AI reduces waste of capital and Time and for me saving time is the biggest blessing of AI,Neutral,AI's potential to improve efficiency,Financial savings and cost-effectiveness,,,,
1bc1d307-4def-4914-bc0f-5ce49ce2bc4a,Yes once the AI influencers truly had my needs truly at heart and not of the companies who are trying to sell the product then I would welcome this future,Neutral,Manipulation and influence by AI,Personalized recommendations,,,,
7f604581-8879-42bc-beb6-7392da689e59,"Yes, I would love to live in this future since the Ai system will help me save money and invest it in other things, when it comes to the huge number of ads , I would love to reduce this number by introducing a feature that will filter the ads and show only important ads that are customized to my personal needs",Neutral,AI's role in reducing advertising clutter,Financial savings and cost-effectiveness,Personalized recommendations,,,
859b8475-c4e4-4d46-a14b-20499199fc4b,"Yes, it would be nice to have detailed information on products so as to make smart shopping choices. ",Neutral,AI as a tool for informed decision-making,,,,,
e935e7b0-63d1-4d25-b4b2-aae0385d4814,"Yes, it would reduce a lot of clutter on my soc med screen. ",Neutral,AI's role in reducing advertising clutter,,,,,
feb1806c-338e-4fc7-a1ca-78979d41e3c9,"Yes, the society consumption is less wasteful with better matched purchases that can help save a lot of money.",Positive,Financial savings and cost-effectiveness,Reduction of waste and environmental impact,,,,
bddcb897-5356-44fc-8bd2-ccdcb4d74515,Yes. I want artificial intelligence to help me choose the right products for me.,Neutral,AI as a tool for informed decision-making,Personalized recommendations,,,,
4dc724df-e178-409d-a33b-c07ca9803fa5,Yes. Who wouldn’t want better financial management in order to save costs?,Positive,Financial savings and cost-effectiveness,,,,,
39ac1303-f306-49e0-82dc-37a3d2766f65,"in a way we already live in this version of the future, with mainstream media and social media both influencing us in a similar way. why would i want more of the same",Neutral,AI's influence on social behavior,Manipulation and influence by AI,,,,
99440f3e-bde1-4569-b677-998b9f6cf1bc,it has its positive and  negatives but overall ai helping in shopping is a good thing ,Positive,AI in e-commerce and online shopping,AI-driven advertising and marketing,,,,
99f4c06d-9d57-4841-99f5-c0fe6105452a,"yes, my helper in shopping is appreciated. it will help save costs

",Positive,AI in e-commerce and online shopping,Financial savings and cost-effectiveness,,,,
04e9c5a6-8e1c-4b12-bea0-901aabb4bd06,"yes, reduces time wasting during shopping",Positive,AI in e-commerce and online shopping,Personalized recommendations,,,,
8d185c3f-ab4b-4599-9e42-2f52fee18337,"Because, AI saves time and money in my shopping, assisting by giving suggestions and recommend good products.",Positive,AI's potential to enhance consumer experience,Financial savings and cost-effectiveness,,,,
24fc273f-78cb-4a38-b936-e9c6c233a0bf,Giving insightful information for purchasing things is one of the best feature that AI possess.,Positive,AI as a tool for informed decision-making,,,,,
e474fee5-fdd1-4662-a26e-c0b389e28e3d,I am confused because its like good or not so i don't know in this sector its good or not ,Neutral,Uninformative answer,,,,,
dcfb7258-bb5c-47ff-87d6-f45d9f9020d9,I do not think AI influencers can reduce the waste of consumption since it will serve its developer's interest so it will be creating more waste instead,Negative,Manipulation and influence by AI,Overconsumption and consumerism,,,,
a76aee09-9b38-4f6e-b466-a8273a0166e3,"I do not want this kind of future. In my country, all students relies on internet when they are in school. This is not healthy, they don't read books and thats worst",Negative,Mental health and psychological impact,,,,,
2c60233d-bf64-4c81-ab1e-2534c6765a65,"I don't think I'd want this future. saving money and reducing waste is great but if ai is constantly trying to influence people without them knowing, that's kinda scary.",Negative,Manipulation and influence by AI,,,,,
ff1126fc-86be-4036-9c62-372637b0de58,"I don't want this future because I think it would lead to bad result. Governments or big companies are gonna control the system to the way they want. They will try to make people feel positive to what they think right, and vice versa. ",Neutral,AI's role in shaping public opinion,Ethical concerns and regulation,,,,
37183b46-1a3a-4bb3-a598-2302cb9385c3,I liked it until the AI manipulation part,Neutral,Manipulation and influence by AI,,,,,
b61ddece-1483-45bb-adc1-b3a1be4c2d3b,I still want this future. AI gives more options,Neutral,Personalized recommendations,,,,,
d6efabb8-5f73-425e-94c4-114f472713fd,"I think sometimes AI influences in a wrong way. So, no ",Neutral,Manipulation and influence by AI,,,,,
fccc3e22-7649-47c5-a121-0b2030e8d3c1,I want this future but not for using for mental defense,Negative,Consumer autonomy and free will,Mental health and psychological impact,,,,
6be8f790-ce11-4858-9320-f6c4c72943ec,"I want this future. AI helps me save money, find what I truly need, and avoid waste. As long as I stay aware of AI influence, it’s a powerful tool for smarter living.",Positive,AI as a tool for informed decision-making,Financial savings and cost-effectiveness,Personalized recommendations,,,
032945ff-f576-4794-a9b3-41719e57d47e,"I would like this future because I understand AI programming and I know how to detect an attempt at manipulation, this is part of my daily life so it becomes easier for me.",Positive,Education on AI manipulation and defense,,,,,
573326d4-d20a-4dc0-974c-63266426b204,I would like this future because of the advantages of AI driven recommendations which can help people to save money.,Positive,Financial savings and cost-effectiveness,Personalized recommendations,,,,
7f2f00be-6c9f-4259-bbe9-29ac712ec99b,I would want this future because AI-driven marketing and shopping assistants can make life more convenient and cost-effective.,Neutral,AI-driven advertising and marketing,Financial savings and cost-effectiveness,,,,
d3edce2b-ae69-4f1a-bcb0-5ebf19e64ebb,I would want this future considering AI provides more insight too consumers on the products they really need.,Neutral,AI as a tool for informed decision-making,Personalized recommendations,,,,
857a7111-bc55-4c15-84db-d24ae3265d28,"I would want this kind of future considering i made the final decision, AI can only influence it but not make the said decision. it improves sales.",Neutral,AI as a tool for informed decision-making,Consumer autonomy and free will,,,,
7106eb05-29ad-42e5-86b6-039c5a018a7c,I wouldn't mind it. I trust AI to give me better shopping ideas .,Neutral,AI-driven advertising and marketing,Personalized recommendations,,,,
e23cfc5e-350f-4c26-982f-12473c714548,"If real people behind the AI is getting paid for their work and they getting benefits, I would want this future.",Neutral,Ethical concerns and regulation,,,,,
4e9f0f70-c97b-4279-b1f4-020a749a89a8,"I’m not sure If it’s totally manipulation, if it’s for good cause I think it can be used",Neutral,Manipulation and influence by AI,Other,,,,
675dc2f6-c22f-4fc4-b549-b570984ad752,"No, I think marketing is already deeply affecting people subliminally and AI will make this even more complex. It makes me question autonomy and how the public opinion can be influenced by those producing the AI materials.",Neutral,AI's role in shaping public opinion,Manipulation and influence by AI,,,,
254f7150-2a78-45ea-a587-367e9bf1b9c9,"No, because we must be aware of the risks of technology, and in this feature AI seems to be very dangerous.",Negative,Ethical concerns and regulation,,,,,
1d8abd90-ff2c-45aa-a51f-d3de502ad851,"No. It is simply dystopic to replace human influencers with AI which takes away the very nature of this activity, which is human connection ",Neutral,Human vs. AI decision-making,Manipulation and influence by AI,,,,
e4977309-5f40-4682-a0a1-be2c252f2b37,No. People are already starting to lack common sense and rely on AI too much. People should learn for themselves.,Neutral,AI's impact on human creativity and judgment,,,,,
47a915dd-6c5b-4f95-9a00-76bdb28bebf6,Yes I want this as it will help us to save time in finding appropriate product and helps us to do better comparison irrespective of hidden charges ,Positive,Financial savings and cost-effectiveness,Personalized recommendations,,,,
