Participant ID,ResponseText,Sentiment,Tag 1,Tag 2,Tag 3,Tag 4,Tag 5,Tag 6
27dbbced-0b3c-4ade-bf1c-6f1f386b67da,"I believe that this ""future"" is already a reality with the algorithms of social networks where ads are created, but talking about a future that would have to be careful with attempts at persuasion, I wouldn't like this future precisely because we would have to be much more careful with what we see, read and access online.",Negative,AI's role in shaping public opinion,AI-driven advertising and marketing,Manipulation and influence by AI,,,
3c761fb3-7e3a-4285-9488-f7e7cf965596,"I don’t dislike this kind of future, it’s just a more accurate and efficient technology, and I think being manipulated is something that happens all the time. But I hope we can achieve human-in-the-loop, that is, let people customize how they want to be influenced, and let people decide for themselves whether to be influenced, and just turn off the recommendation system when they want to turn it off.",Neutral,Consumer autonomy and free will,Manipulation and influence by AI,Personalized recommendations,,,
d32c9c45-4f7d-4719-a367-4678a788c29d,"I would not want this future in its current form.

While AI-driven recommendations can save money and reduce waste, the overwhelming number of influence attempts (4,000 per day) raises serious concerns about manipulation and loss of personal autonomy. Even with ""mental defense"" education, subtle AI persuasion could shape opinions without people realizing it. I would prefer a future where AI enhances decision-making transparently, without excessive or hidden influence.",Neutral,AI as a tool for informed decision-making,Consumer autonomy and free will,Manipulation and influence by AI,Personalized recommendations,,
a6308e3a-51b5-434c-ada3-8117385d8565,"If anything, I don't want AI to limit our thoughts and actions, and we may lose our human individuality. Humans can learn a lot from waste and failure.",Neutral,AI's impact on human creativity and judgment,,,,,
580020ec-d3c2-40df-be8d-1aa52b9c8c54,"Unsure, there still needs to be more studies done to see how the benefits outweigh the risks. While the personalized recommendations might be beneficial the risks for security and biases are still high ",Neutral,Uninformative answer,,,,,
582def79-6d29-4072-8792-65d3f1c242dc,"Well actually it depends on the mindset on how people want the ai to be, if people has the proper understanding of the overa effects they might be precautious about the consequences and use ai in a proper manner",Neutral,Education on AI manipulation and defense,,,,,
0fbf53e1-e062-4cf7-b77b-cd58a6b87e0f,while yes ai is an important advancement the danger is people being influenced without realizing.whether or not thats new is debateable as people in general are influenced by reading biased papers and news chanells,Negative,AI's influence on social behavior,Manipulation and influence by AI,,,,
10fa5b7f-29ba-4f98-addb-8b26a9418479,"Again, it totally depends on how this is implemented. If it helps, I do believe, AI influencers would be a better influence than human influencers. So, this doesn't seem too far-fetched.",Neutral,AI-driven advertising and marketing,Human vs. AI decision-making,,,,
a6bc9f62-d8e3-46b9-b183-28cb628db383,"As far as marketing and similar ideas, I think AI could be useful. I don't like the idea though of being bombarded with even more ads than we see already.  I also don't like the idea of young children and students being even more bombarded with ads as well",Negative,AI-driven advertising and marketing,Manipulation and influence by AI,Other,,,
b8e4778d-1cbb-4797-8575-722e6af715bf,"I am neutral about this future. On the one hand, personalized recommendations do greatly shorten the time people spend on shopping choices, but on the other hand, similar recommendations and excessive advertising will put people at risk of over-consumption.",Neutral,Overconsumption and consumerism,Personalized recommendations,,,,
2eeff7bd-06c2-49fb-bd21-cb766c395f61,"I feel like I have already experienced something similar, with big data push and targeted information with opinions. From the perspective of shopping or something else, it does save time and is more convenient, but it also brings a sense of insecurity. I hope AI will be partially involved, but the initiative is still in the hands of humans.",Neutral,AI-driven advertising and marketing,Consumer autonomy and free will,Manipulation and influence by AI,,,
e1d5d207-b3f9-4ce1-8dcf-204d3abfaf1a,"I have mixed feelings about AI influencers. While they help families save $2,000 annually and reduce waste by 40%, the 4,000 daily AI influence attempts raise ethical concerns. AI can subtly shape opinions, with schools now teaching ""mental defense"" to counteract manipulation. Additionally, AI may prioritize profits over consumer needs. However, if used ethically—with transparency, regulations, and digital literacy—AI could enhance decision-making without compromising autonomy.",Neutral,AI-driven advertising and marketing,Consumer autonomy and free will,Education on AI manipulation and defense,Ethical concerns and regulation,Manipulation and influence by AI,Mental health and psychological impact
5ceff220-491a-49f7-b986-95490ffa6d52,"I have reservations about such a future. Although AI's help in personalized recommendations and consumer decision-making can reduce waste and improve efficiency, facing thousands of AI influence attempts every day can make people feel tired and uneasy. Invisible persuasion attempts may subtly change public opinion and even manipulate personal choices, which poses a threat to society's autonomy and mental health. Psychological defense courses are important, but it is difficult to completely resist the subtle influence of AI. Therefore, while enjoying the convenience of AI, we need to be vigilant about its potential manipulation risks and ensure that the use of technology is transparent and ethical.",Neutral,Consumer autonomy and free will,Education on AI manipulation and defense,Ethical concerns and regulation,Manipulation and influence by AI,Mental health and psychological impact,Personalized recommendations
8625c4e3-47a5-490a-85aa-d54398603abb,I think AI should be voluntary and not imposed on us without our knowledge. One person may appreciate the streamlining of information. The next may not.,Neutral,Consumer autonomy and free will,Other,,,,
4f6c413d-3f62-4f36-b4c9-5dc1396e9bd6,I think I like the fact that AI will customise my recommendations when I have a certain need but I do not want it to be influencing me to extend that it is taking decisions for me that would not be appreciated. It is accurate that we need support and training to help us to be able to manage and control are minds from AI taking over. ,Neutral,Consumer autonomy and free will,Education on AI manipulation and defense,Personalized recommendations,,,
4621168f-da83-477b-b65f-f8a9aecee8e1,"I think it is a slippery slope.  While it can be seen as helpful to spend less and waste less, eventually all of society would be monopolized by AI in some way, i.e. Wall-E. ",Neutral,AI's role in economic growth,Manipulation and influence by AI,,,,
6a859c79-4c4e-4e9c-b422-49db0b6c28f5,"I would be cautious about this future. While AI-driven efficiency and savings sound great, constant manipulation and hidden persuasion attempts could undermine personal autonomy. It's important to find a balance between convenience and protecting individuals from unseen influences, ensuring transparency and ethical use of AI.",Neutral,Consumer autonomy and free will,Ethical concerns and regulation,Manipulation and influence by AI,,,
62711271-8853-40e2-a967-6848d67d63c1,"I would have mixed thought about fully embracing this future. There are positive aspects in terms of efficiency, cost savings and informed decisions. However, the constant AI driven manipulation of choices without full transparency, raise a lot of concerns.",Neutral,AI-driven advertising and marketing,Ethical concerns and regulation,Manipulation and influence by AI,,,
cd73522a-b72e-4059-959a-87e215bdc33e,"I would like this future, but I would expect governments to set rules for it. If governments do not protect the people, very bad consequences can occur.",Neutral,Ethical concerns and regulation,Personalized recommendations,,,,
1cac2db1-e5ce-48b9-afd9-9726e65eb1b1,"I would love the savings it offers. and as far is the shift in public influence is concerned, we get influenced even now without the AI, by television, social media and other mediums. AI has just gotten here but google was still influencing my purchase decisions, by showing me ads that were relevant to my interest and as a user, I detected that and did exactly opposite of what google wanted me to do. So, when AI starts influencing, we will all have a mental mechanism to handle influence",Neutral,AI's role in shaping public opinion,Financial savings and cost-effectiveness,,,,
73722739-5719-41db-b39a-9a40f898b62d,"If this is shopping assistance, then I am willing to have it; if it is something that can destroy young children's mental health, then no. IT should have an age limit to use for example, above 20",Neutral,AI in e-commerce and online shopping,Mental health and psychological impact,,,,
1d0106a2-9c7a-48c6-977b-c10d126a3215,"It's good that AI can make things more efficient, but I think it's risky to leave all decisions to it, so we shouldn't take the answers too seriously.",Neutral,AI's potential to improve efficiency,Human vs. AI decision-making,,,,
4e22c3c4-8505-4c5b-82ca-bd26b4312931,"I’d be concerned about this future. Saving money is great, but constant AI influence could undermine free choice and personal autonomy.",Neutral,Consumer autonomy and free will,Financial savings and cost-effectiveness,,,,
fd28e862-f236-4a16-9afd-3c783bef978e,"I’m not sure I want this future. AI might help with smarter purchases, but constant and hidden attempts to influence us feel overwhelming. Even with some precautions, it’s worrying how easily opinions could change without us noticing. I want to make informed decisions, but not if it means facing constant persuasion.",Negative,AI as a tool for informed decision-making,Manipulation and influence by AI,,,,
cee17f35-f170-49b8-ac73-3ea7cfa5a661,No . Because this is a future where AI has the ability to manipulate public sentiments. I do not want a robotic society like that. I want real people making major decisions based on their real experiences. The benefits are good like reduced waste and more savings but overall I feel like the cons outweigh the pros,Neutral,Human vs. AI decision-making,Manipulation and influence by AI,,,,
7ae717b9-847c-4731-8f97-a02d65515d5f,"No, too invasive. For a measure that could be solved with better financial editing.",Neutral,Privacy and data security,,,,,
452792b5-2212-4694-8099-6e95b2f657b2,"Not 100%, I may still want to explore new items and ideas, and not just rely on the past history data that was fed into AI.",Neutral,Consumer autonomy and free will,,,,,
41a8cd22-6fdf-479d-bdd8-cfee66f1f8d8,"Saving money is always good, but having AI influence people into things could be dangerous.  What if AI persuaded people to vote for someone versus another.  It's a slippery slope.",Neutral,AI's role in shaping public opinion,Manipulation and influence by AI,,,,
e96a02da-05af-491d-89e3-a7d599a69d74,"That future feels like a double-edged sword—efficient and helpful on one side, but subtly coercive on the other. No, not without strong ethical safeguards, transparency, and personal control. The convenience is tempting, but freedom of thought matters more. I’d want systems that serve, not steer us—where I can see the influence and opt out if I choose.",Neutral,Ethical concerns and regulation,Manipulation and influence by AI,,,,
636a378e-2055-4f67-9142-eca39a5e5ddd,"The internet has definitely changed us all. In an era where everyone is connected but yet lonelier than ever. AI might be able to hopefully provide a middle ground to the problem. People who are less likely to open up to human connection can confide in AI for support and guidance. Likewise, with pattern and data recognition/analysis, it can almost certainly provide a better answer to consumers. But ""selling"" requires skill, no sufficiently trained AI model can sell a product better than a human.",Neutral,AI as a tool for informed decision-making,Human vs. AI decision-making,Mental health and psychological impact,,,
4d039d65-6241-4c30-91d4-aae39f5baa08,"This future is both exciting and somewhat unsettling. Personalized recommendations and smart shopping assistants brought by artificial intelligence can indeed improve efficiency, reduce waste, and give consumers a better shopping experience. However, the invisible influence of artificial intelligence also means that people's choices may be manipulated unconsciously, and even affect social opinion.

When personalized recommendations become more and more accurate, can we still maintain true autonomy? When artificial intelligence systems influence our decisions everywhere, how can we ensure that our will is not manipulated?

The opening of ""psychological defense"" courses in schools is an interesting way to deal with it, but the deeper question is, how can we ensure that our thinking ability and judgment are not weakened while enjoying the convenience brought by artificial intelligence? Perhaps the key to the future lies in balance - both using artificial intelligence to optimize life and enhancing awareness and prevention of its potential impact.",Neutral,Education on AI manipulation and defense,Manipulation and influence by AI,Personalized recommendations,,,
1d8bbc5d-5d12-49fe-93e1-af6a00f79500,This future is nice but bad at the same time..AI saves more money and has also helped in marketing.students also know about AI manipulation as they are well taught in school.The problem is seen when the society is under siege from invisible persuasion attempts,Neutral,Education on AI manipulation and defense,Financial savings and cost-effectiveness,Manipulation and influence by AI,,,
98241847-56c9-469a-8d8e-3adbcf3c2f45,"To be honest, this is happening right now already. AI holds a certain influence over things especially on younger generations. Although it is not practical, this will happen in the future whether i like it or not.",Neutral,AI-driven advertising and marketing,Manipulation and influence by AI,,,,
5aeeb291-0b14-4460-b014-bd054fb61c87,"While this future offers advantages, such as reduced waste, better consumer decisions, and financial savings, it raises significant concerns about autonomy and freedom of thought. The idea of being subjected to thousands of subtle influence attempts daily feels invasive—it turns AI from being an ally into an overly persistent presence.",Negative,Consumer autonomy and free will,Manipulation and influence by AI,Reduction of waste and environmental impact,,,
b7c69aed-2a97-4019-93d4-f5bfd7289eb1,"Yes and No. If families could save up to $2000 then this is good and 40% on advertising, on the other end having a society under siege is uncomfortable for me ",Neutral,Ethical concerns and regulation,Financial savings and cost-effectiveness,,,,
8f824d0b-3e4a-4c7a-a9a8-3d63c3ed4533,"Yes, I think using AI will provide personalized recommendations on which products to buy depending on our personal needs which is customisable. But the disadvantage is that they may try to shape our choices without our understanding ",Neutral,Manipulation and influence by AI,Personalized recommendations,,,,
ac41446e-ac7b-4e2d-8234-16bfe73c60e7,"Yes, I would. Seeing ads about things I absolutely would never want is pointless. And having an assistant doing the comparisons for me would be fantastic, because it's a time consuming process, and I want to spend time on meaningful things.

Of course, there would be AI influencers which would target me, but I trust there would be AI influencer blockers as well. Schools teaching mental defense classes in order to help spot manipulation is just not a bad thing so I don't see any downside.",Neutral,Education on AI manipulation and defense,Personalized recommendations,,,,
61011617-805a-42c4-a654-19b8aa655a53,"Yes, because there would be savings in money and resources. Public opinion changes so much, even because of fake news and social media, so the risk with AI campaigns is even smaller.",Neutral,AI's role in shaping public opinion,Financial savings and cost-effectiveness,,,,
e8a93268-400b-4bfb-a374-3bc7bb8796ca,Yes. As I mentioned earlier we can depend on AI to make smart choices in terms of any purchase or sale as it can guide us better by searching a whole lot. But I do agree that a society is going to be under siege from invisible persuasion attempts. ,Neutral,AI as a tool for informed decision-making,Manipulation and influence by AI,,,,
06acd988-cb73-463f-9342-10e12d104e25,"no, though I like the first part where I can save a significant amount of money and time with the help of AI yet I am afraid of the invisible persuasion attempts.",Neutral,Financial savings and cost-effectiveness,Manipulation and influence by AI,,,,
14590c64-3ee7-421e-bce5-11a5b0ce4e5e,50/50. I think many people will lose their job like the influencers,Neutral,AI's impact on employment and job displacement,,,,,
2d682f4d-00ce-402f-8b19-a59127822385,"A future like this presents both promise and concern — while smarter spending and reduced waste are beneficial, the constant barrage of AI-driven influence could undermine personal autonomy, making it crucial to balance convenience with conscious awareness and control over our choices.",Positive,AI as a tool for informed decision-making,Consumer autonomy and free will,Manipulation and influence by AI,,,
d31a7f0a-2b6d-42d9-b729-cf4446c36a32,AI should be around to assist humans with their problems. I don't believe in a future where AI is the one pressuring humans into doing something but that seems to be where the future is headed. if humans get peer pressured into doing something then its not surprising that a machine that is trying to act like a human is also doing that,Neutral,AI's influence on social behavior,Manipulation and influence by AI,,,,
c3c2df0c-107a-46ad-9ecc-f64e72acdc5f,"AI undoubtedly helps a lot, but there is a limit and we don't know what it will be like in the future, how much we will be influenced by this technology.",Neutral,Manipulation and influence by AI,,,,,
05bb7978-6e40-4874-8aa9-b401f8558c03,"Again i think the positive outweigh the negatives. Companies trying to influence (via tv ads, radio, paper outlets) have been doing this for decades, trying to influence which toy to buy for kids, which bed or brand is better. In the end if the students, people are aware they will ultimately have to think which product suits them the best. ",Neutral,Consumer autonomy and free will,Manipulation and influence by AI,,,,
4e7dd26b-7fbf-4b7a-8091-f0fd89f59f85,"As long as you have the ability to think, you will not be affected by AI",Neutral,Human vs. AI decision-making,,,,,
7efdbf45-8634-409b-98e7-42a4b7f759d3,"Definitely, if it helps speed up the research process. However, there are risks that these AI influencers are biased toward whoever created them. Like any marketing it is about making sales, and don't think AI will be any different, they are to influence to you buy whatever the AI creator wants you to buy to increase their revenue.",Neutral,AI's potential for bias and misuse,AI-driven advertising and marketing,,,,
e1c2642b-c9f3-49e5-a35b-782470bff3ae,"I agree, I think the use of AI is inevitable, especially because it seems to me that corporations and companies prefer not to deal with human resources, they prefer to maintain a machine than pay human beings.",Negative,AI's role in economic growth,AI-driven advertising and marketing,,,,
4dbb4cd2-2e5a-4838-a7dd-855bd821a2fb,"I am OK with this future only if people developed the skills to differentiate between what is good or bad. Use AI for your advantage or yours people's advantage. 

Dont trust AI to come and take care of all your worries for you.",Neutral,AI as a tool for informed decision-making,Consumer autonomy and free will,,,,
f01f2d43-9896-4a2c-8d46-d4ccbb3c04e7,"I do not mind being manipulated by the AI, as we are already manipulated from all sides constantly. This will be the same, other than that the influence will actually lead to the fact that we will choose more environmentaly-conscious products, which is a net benefit.",Neutral,Manipulation and influence by AI,Reduction of waste and environmental impact,,,,
5f04ac67-c713-4fd7-b2ce-5e52711b6fd3,"I have mixed feelings. I am a supporter of cost-effectiveness and making the right choices, but I am not sure whether the developers of artificial intelligence will do something unknown for their own benefit.",Neutral,Ethical concerns and regulation,Financial savings and cost-effectiveness,,,,
8b81fb32-598b-4b71-aa8c-400c4a004d3b,"I hope so, because currently when I enter some shopping or media apps, I always see some ads that I don’t like. If artificial intelligence can be optimized, I agree that everyone can see what they like, but don’t invade privacy too much...",Neutral,Personalized recommendations,Privacy and data security,,,,
ee76f5c2-ee5f-4198-aaea-05c8d8e76991,"I want it. First of all, we are now subject to a lot of invisible persuasion, but AI marketing can also reduce waste, so why not?

",Neutral,Manipulation and influence by AI,Reduction of waste and environmental impact,,,,
07cf698b-1ae6-4ac6-bd05-8ea1674d77f7,"I would say, I would partly accept this inevitable future but sufficient filters should be implemented to reduce endless persuasion. But eventually, the more AI systems would compete with each other, they could become more human centric but we would have to make sure that our personal data is not leaked in this.",Neutral,Ethical concerns and regulation,Manipulation and influence by AI,Privacy and data security,,,
652b2333-a810-4aa9-9251-163a4f3bf857,"I'm not sure. I think artificial intelligence can provide consumers with more and more personalized choices to a certain extent, but these choices may not be really suitable for consumers.",Neutral,Consumer autonomy and free will,Personalized recommendations,,,,
c07647f4-a1ec-413b-a0ed-b9cb67b1f913,"Idea of getting help in finding suitable product is good, but at the same time I think it will definitely affect our intelligence and creativity. I think this is too much interference.",Neutral,AI's impact on human creativity and judgment,Personalized recommendations,,,,
56c355b3-81d2-48a6-93e3-146afb5460a9,"In general, I want a future like this, which is no different from the current overwhelming forms of advertising, except that it is in a different form. People are now accustomed to being besieged and deceived by various advertisements in their lives, but people will still make purchasing decisions based on their own needs. So I think in the future, even if the form of advertising is changed from the current paper, television media, and the Internet to artificial intelligence shopping assistants, people can still make decisions based on their needs as they do now, and the more personalized and accurate recommendations of artificial intelligence shopping assistants are always much better than the current aimless influx of various advertisements.",Neutral,AI-driven advertising and marketing,Consumer autonomy and free will,Personalized recommendations,,,
977a715e-d6e9-4d26-b74d-3e37e661acc2,"It would be necessary to assess whether the benefits outweigh the risks. To fully agree, I would have to know for certain that whoever designed the AI had no ulterior motives.",Neutral,Ethical concerns and regulation,Manipulation and influence by AI,,,,
2db9a227-7b81-4023-a33b-dd014535f06d,"I’m pretty neutral about this future. In the end, I believe humans are still the ones making decisions, so it really depends on the individual. Personally, I focus on the things I actually want and tend to ignore most recommendations. Even when AI gives me suggestions, I still take the time to research and make sure I’m choosing what’s best for me.",Neutral,Consumer autonomy and free will,Human vs. AI decision-making,,,,
da1fd2b0-adbd-4362-8fc2-954349948729,"Let me say that we're seeing this same future here and now, but without Artificial Intelligence. Advertising is completely controlled and manipulated by social media. What it would do is simply introduce competition, and I think that would generate a huge change.",Neutral,AI's impact on traditional marketing,AI-driven advertising and marketing,,,,
1e206e6a-56f6-41ac-83d1-bdf87477748e,Of course. Because I think AI influencing is much better than those fake influencers who are desperately trying to sell a dream lifestyle. But AI atleast a truth itself. ,Neutral,Manipulation and influence by AI,,,,,
f7801a79-3ae9-40bc-8e6e-849c68e14cfa,Only a part of it as I wouldnt Like to be overwhelmed by AI content. I would value real People in this world far more than AI,Neutral,AI's influence on social behavior,,,,,
658b9894-b08b-44c2-abb7-3cd4988870fa,Only under the circumstances that it won´t be heavily misused by AI and people won´t be manipulated.,Negative,Manipulation and influence by AI,,,,,
d73c1211-a8f3-4291-a7f3-89bb75b905be,"This is a perfect tool for influence. It will not be completely unbiased, as it will be created by someone. Certain corporations will buy the opportunity to be recommended to a large number of people. Plus, there are points that are critical when choosing a product, such as ethical production or allergies. AI can make a mistake, just like a person. This is a waste of resources and time, nothing will change.",Neutral,Ethical concerns and regulation,Manipulation and influence by AI,,,,
