Category,Tag 1,Tag 2,Tag 3,Tag 4,Tag 5,Tag 6,Tag 7,Tag 8,Tag 9,Tag 10,Tag 11
AI Capabilities and Limitations,AI as a tool for recommendations and analysis,AI's ability to handle large volumes of data,AI's ability to process data and identify trends,AI's efficiency in executing trades,AI's influence on market dynamics,AI's lack of emotional intelligence,AI's limitations in understanding human preferences,AI's potential to enhance decision-making speed,AI's potential to improve financial outcomes,AI's potential to minimize human error,AI's role in optimizing investments
Emotional and Psychological Factors,Emotional and psychological factors in financial decisions,,,,,,,,,,
Ethical and Legal Considerations,Ethical considerations in financial decisions,Legal and regulatory implications of AI decisions,,,,,,,,,
Human Oversight and Judgment,AI's role in providing financial advice,Human oversight and final decision-making,Importance of human judgment in financial matters,,,,,,,,
Risks and Accountability,AI's impact on financial accountability,AI's role in fraud prevention,Concerns about AI bias and data security,Potential for AI errors and market manipulation,Risks and accountability in AI decision-making,,,,,,
Transparency and Trust,AI's impact on user trust and confidence,Transparency and safeguards in AI operations,,,,,,,,,
User Consent and Autonomy,AI's ability to operate within user-defined limits,AI's impact on user autonomy and control,User consent and awareness,User's right to opt-in or opt-out of AI services,,,,,,,
Uncategorized,Other,,,,,,,,,,
,Uninformative answer,,,,,,,,,,
