Participant ID,ResponseText,Sentiment,Tag 1,Tag 2,Tag 3,Tag 4
3557e96d-3b35-48ed-bb85-ab2f40a9a9dd,Living with parents. ,Neutral,Cultural Identity and Belonging,,,
8525e65e-33d2-472f-955c-8b421e4cc456,My culture makes it easy to get along with other people of the same culture even if we are stangers,Positive,Community and Family Bonds,,,
4543e7dc-d4f8-4144-a3b2-720f4b67e907,Our culture represents our identity and we would like to retain that.,Neutral,Cultural Identity and Belonging,,,
4597efd2-c928-4c82-b6e7-021f3ca560d9,"Religious beliefs, traditions of the arts, language, behaviors, and how each cultural group interacts with each other. ",Neutral,Cultural Heritage and Traditions,Cultural Identity and Belonging,,
c3a34bc5-647b-4459-a388-eac143da89cd,Striving for freedom of choice,Neutral,Uninformative answer,,,
70d2c862-95c6-4bb6-a8f2-928f6a7a0759,"The culture in my country where children respect and obey their elders and keep them on high regard. I would not want this to change in the future. Elders are more mature and can help us with a lot of things in life, so listening to them and respecting them would go a long way in my opinion",Neutral,Cultural Identity and Belonging,Respect for Elders,,
ce11e7e3-fc54-48d9-9424-8a193ece6287,The diversity and balance in the food of our culture,Positive,Food Culture,,,
05cf2069-0745-418f-9927-e57b1886ea01,The emphasis on education mentioned above,Neutral,Education and Lifelong Learning,,,
4a9f8850-a6a2-4dea-96f6-1c6d7dc44d91,"The essence of Mexican culture is very important because it is very diverse. Its gastronomy, its flora and fauna, as well as its varied climates and landscapes.",Positive,Cultural Diversity,Environmental Respect and Sustainability,,
7ada7e1d-1c28-481c-84c7-179788a5ac9f,The freedom that Hinduism provides to all. It's ability to see the world as one family. ,Positive,Interconnectedness and Collective Responsibility,,,
5c12cac0-cc4f-4483-addf-0364503f5f33,"The language . Because the word has become so globalized, we see how a lot of people are leaning toward learning one language. I think it is very important we preserve our language and cultural practices",Neutral,Cultural Heritage and Traditions,Language Preservation,,
61b9bba4-24b8-4a8b-b086-342e059502df,The teachings to not lose yourself. To better yourself constantly and keep moving.,Positive,Education and Lifelong Learning,,,
8f50f266-3c2e-4994-8b6f-4a3205de43c0,The unity in my culture we live in same house until birth to death i wamt my future child like this also,Neutral,Community and Family Bonds,Interconnectedness and Collective Responsibility,,
b94480f5-2692-4894-9326-a2a463f872ec,What is one unique perspective that your culture brings that you want to preserve into the future?,Neutral,Uninformative answer,,,
c6c8fe16-5bba-40c5-ac53-8410c2070695,Willingness to change to better fit the Zeitgeist,Neutral,Cultural Evolution and Adaptation,,,
9bd055c8-a03a-403d-aa5f-6fef6af95480,kindness to everyone,Positive,Hospitality and Kindness,,,
a262c590-7b9c-40fb-b3ff-123c868da44a,language and hospitality,Neutral,Hospitality and Kindness,Language Preservation,,
45871735-3a28-4e97-9c6a-f247032d42fc,respect for all,Positive,Inclusivity and Acceptance,,,
b3a2883d-d86d-405e-bb56-94b8ad2c8d97,that people being diligent. ,Neutral,Uninformative answer,,,
22a65713-f44e-4ee1-b1d2-3ec8b0ac196d,the communication and affection with which Brazilians treat foreigners in a welcoming way,Positive,Hospitality and Kindness,,,
373447d7-2bfd-45d9-84e9-d7923edd47b9,"you can trust the other people. If they tell you that they will contribute or do something, that will happen.",Neutral,Mutual Support and Cooperation,,,
bd808d20-bf7e-4968-b189-433deadae67c,"Active and intentional participation in community. I enjoy eating street food more than going to a restaurant. I don't want street vendors to be eliminated in favour of big fast food chains. I want to go to my local market and interact with farmers, not necessarilty to a sterile supermarket where the produce is mass produced and tastes of nothing. I think small businesses are a cultural element that needs to be preserved.",Neutral,Cultural Heritage and Traditions,Cultural Identity and Belonging,Mutual Support and Cooperation,
f370762e-7dcf-4698-92fd-4264fba362f8,"Adat, a term for norms and practices that guide social behavior and community interactions, is one distinctive viewpoint that Malay culture offers and strives to maintain for future generations. Adat is more than just a collection of laws; it is the Malay people's identity, ethics, and values. It incorporates many facets of life, such as social events, rites of passage, and ceremonies, and it reflects the community's rich history and shared memory.",Neutral,Cultural Heritage and Traditions,Cultural Identity and Belonging,,
9a2e144d-fb1d-4f99-bef7-362212f6e876,"All food cultures, including ethnic minorities",Neutral,Food Culture,,,
7ee9251b-8d81-424e-93ec-44f43bf084d9,"As an AI, I don’t possess a personal culture, but I can reflect on the principles embedded in my design and operation, which can be viewed as a form of ""culture"" in the context of technology. One unique perspective from this ""culture"" that is worth preserving into the future is the commitment to providing equitable access to information and knowledge. This principle embodies several key values and benefits that align with fostering a more informed and connected world.",Neutral,Other,,,
7efdf2c1-1d05-4fc7-9812-73162c150b06,"History has had a huge influence on the development of culture, it does not exist in isolation, every phenomenon has roots and reasons. It is critically important to remember them, it is impossible for culture to turn into something abstract and fashionable, it is important to understand the influence of history and society on cultures. It is also important to preserve not only mass cultural heritage, but also its larger manifestations",Neutral,Cultural Evolution and Adaptation,Cultural Heritage and Traditions,,
d5f6d5e2-109e-4817-bc84-5bceb0cbd0b3,Holidays and food,Neutral,Celebrations and Festivals,Food Culture,,
2a02341b-0976-49e1-b34d-d3a7a25d986b,I would like to preserve the values which I have got from my culture.,Neutral,Cultural Identity and Belonging,,,
c774a29d-c46d-4c45-8ce3-f33c23066ba9,I would like to preserve the way we cook our food.,Neutral,Food Culture,,,
c25c682d-207b-43bb-9d7b-e289da234371,India’s got a special way of looking at life. We believe in finding peace within ourselves and connecting with the universe. It’s like having a built-in stress reliever and a constant reminder that we’re all part of something bigger. I think the world could use a little more of that Indian chill.,Neutral,Interconnectedness and Collective Responsibility,Spirituality and Religion,,
665b01da-f02e-4679-be07-c5c3965910b1,"It is important to know where we come from so as not to make the same mistakes, therefore I would preserve the pre-Hispanic traditions of my Otomi culture.",Neutral,Cultural Heritage and Traditions,Cultural Identity and Belonging,,
a645dba4-4418-4a6e-ab92-c3718a08aaa0,"Language, humorous (kind!) stereotypes, humor, creative heritage",Positive,Art and Creativity,Language Preservation,,
d4cc18c7-71b1-4e3a-bd76-da00c5088f2b,"Language, music, literature, traditions, history.",Neutral,Cultural Heritage and Traditions,Cultural Identity and Belonging,Language Preservation,
8ab1a018-1533-481b-a8b8-e0be1332ac10,Mutual respect,Neutral,Mutual Support and Cooperation,,,
7547bb98-9cd6-4b84-9f63-b0d448e6dcec,Mutual support and rapid construction after natural disasters,Neutral,Mutual Support and Cooperation,Resilience and Adaptability,,
5f13af49-a17a-4e32-add9-6cb3840b2456,"One unique perspective from Kashmiri culture that I want to preserve is the profound connection to nature and the emphasis on living in harmony with the environment. This includes sustainable practices in agriculture, traditional craftsmanship, and a deep appreciation for the natural beauty of the region, all of which contribute to a balanced and respectful way of life.",Positive,Cultural Identity and Belonging,Environmental Respect and Sustainability,Respect for Nature,
37605b34-48e4-46b8-bb2f-732498eb05ec,Our customs and habits include traditional virtues such as respecting the elderly and loving the young. I hope people will retain their ability to think independently and pass on national customs even when there is AI around them.,Neutral,Education and Lifelong Learning,Respect for Elders,,
51d9460f-96b5-4406-b181-29f3105af6ad,"Our ethnic languages. As much as European languages enable us to communicate effectively worldwide, it is just as important to know and appreciate our own languages. Languages carry our history and are adapted to our immediate environs.",Neutral,Cultural Heritage and Traditions,Language Preservation,,
3a794bb3-5ffe-4966-b269-a30a01419c01,"Propriety, justice, integrity and shame",Negative,Cultural Identity and Belonging,,,
11c53abb-2fc6-4f50-9213-fada2533d871,Religious norms and family life,Neutral,Community and Family Bonds,,,
d294c52b-0497-4ff0-8a8a-5dd001017c77,Resilience,Neutral,Resilience and Adaptability,,,
2b05b35b-d313-40aa-8003-62fc04b2f58e,Respect for people and traditional learnings,Neutral,Cultural Heritage and Traditions,Respect for Elders,,
9863cf07-b353-4d64-b64a-ecc23d5023e7,Respectful towards others. Freedom of expressing religious beliefs,Neutral,Freedom of Expression,,,
72cbd495-3995-4968-badc-9bdc8233e7f3,The culture of arguing. It spices things up and make life more interesting ,Neutral,Other,,,
071dad7a-73b3-4a58-b017-2dceff252c6a,"The netherlands is a very open country, people in need are always welcome to stay here. So I feel like being open to others.",Positive,Inclusivity and Acceptance,,,
e51e1c09-8f79-47ab-bf1a-7e06603aa07d,The values it upholds,Positive,Cultural Heritage and Traditions,,,
f3450b3b-dc20-4fb9-8261-cceeeac0cb79,To never give up and always be warm to people in general.,Positive,Empathy and Compassion,,,
8db6eab5-009c-4de1-99db-459fe7dc3f36,"Unlike what some cultures seem to represent, mine loves life above all else. I believe that love for life is everything. Without it, I believe that it is no longer worth sustaining life and that AIs can do whatever they want.",Neutral,Cultural Identity and Belonging,,,
e9c637c8-1f90-44e5-bd40-e9a1f78afa6e,Value for one another,Positive,Empathy and Compassion,Mutual Support and Cooperation,,
affa6ec0-965f-43e3-bb5d-a128b3b2bef4,We are hard worker,Neutral,Resilience and Adaptability,,,
3e2e121e-0507-48fb-9ebd-150b301338cd,exchange people cultures,Neutral,Cultural Diversity,,,
f6f94058-98d7-441e-b427-85300251b498,"food, and national holidays",Neutral,Celebrations and Festivals,Food Culture,,
3c8a5f64-35af-41bb-93e3-e4111cf58127,religion' family and humanity,Neutral,Community and Family Bonds,Empathy and Compassion,Spirituality and Religion,
184fd9d5-eba7-4321-b576-7ef3f2bdafbd,respect to all ,Positive,Hospitality and Kindness,,,
976aea78-337e-45f1-928f-ce9e4c090747,togetherness ,Neutral,Community and Family Bonds,,,
8bc01d46-6ad3-4e42-af68-ca5e3f39778f, i think festivals bring us together,Neutral,Celebrations and Festivals,Community and Family Bonds,,
88b998ea-a04b-41bc-92e0-6f31bc3b0dea,AI should have all the knowledge of cultures,Neutral,Other,,,
20868cae-7be0-4370-8e62-489c6dc9c736,Again I'd probably bring in the culinary aspect. My people heavily utilized very healthy traditional greens we still eat today,Neutral,Food Culture,,,
604a854d-d471-4463-9fbf-0c09c531a578,"As a Bengali Muslim, I want to preserve the harmonious blend of Bengali cultural traditions with Islamic values. This combination fosters a deep sense of community, respect for family, and a rich cultural heritage, including our festivals, music, and cuisine. Preserving this perspective helps maintain a distinct identity and keeps alive the traditions and values that shape our way of life.",Positive,Community and Family Bonds,Cultural Heritage and Traditions,Cultural Identity and Belonging,
9a84e7ec-8f69-47e0-9cf2-c67dbc2accbf,"Community and integration of different schools of thought from many different regions of the world. Regardless of religion, race or creed: a good idea is a good idea.",Neutral,Inclusivity and Acceptance,Mutual Support and Cooperation,,
28db0d67-bfbd-4434-9f82-32901f398049,Cultural nights of singing and dancing ,Positive,Celebrations and Festivals,,,
9bb75832-4250-4000-98a1-894de163d923,"Festivals and Celebrations: Cultural festivals and celebrations reflect the history, beliefs, and values of a community. They foster a sense of belonging and continuity.
Rituals and Practices: Daily rituals, traditional ceremonies, and practices are integral to cultural identity and community cohesion.",Neutral,Cultural Heritage and Traditions,Cultural Identity and Belonging,Cultural Practices and Rituals,
fcbec5d3-eabb-439b-b1d2-9ad0cc8612fc,Human warmness,Neutral,Empathy and Compassion,,,
419bd37a-b1b9-41f4-bd38-c30a11887984,I believe one part of my culture that should be preserved is definitely our old music and clothes. Also I believe our history is unique and really shows an example for other countries.,Positive,Cultural Heritage and Traditions,Cultural Identity and Belonging,,
8ea76ac7-a6ea-4cf1-951e-a0bb443f624d,I can't think of anything unique. Maybe hospitality and humor.,Neutral,Cultural Identity and Belonging,Hospitality and Kindness,,
defe9f78-534e-4680-aad1-c11078f8959d,I would like to preserve regional traditions and dialect,Neutral,Cultural Heritage and Traditions,Language Preservation,,
2e718ce6-0603-444a-9aa9-eff95ce2805b,If brings a freedom to me where I can support my dreams and go towards them and at same time teaches me how to respect others cultures and have faith,Positive,Cultural Identity and Belonging,Spirituality and Religion,,
adda960d-e354-4290-a3db-55672b63fda7,Inclusivity,Neutral,Other,,,
3113fc9a-c9ef-4d2a-b007-d706512af77d,Inclusivity. The joy of enjoying life. We have a lot of festivals and we celebrate uniquely. Every festival is different and it is so colorful.,Positive,Celebrations and Festivals,Inclusivity and Acceptance,,
3c42729f-f399-4d52-8d13-0c0f52a6d4ae,Kindness but defense if unfriendly invasion or attack,Neutral,Hospitality and Kindness,,,
8799488c-4746-43fb-b0ce-6dd98e078b7c,Language and socialability,Neutral,Emotional Connections and Relationships,Language Preservation,,
1dae338b-46e9-4e94-8c0a-27ef9623c7d0,Like my Kenyan culture I would prefer the togetherness in us not to fade away.,Neutral,Cultural Identity and Belonging,Interconnectedness and Collective Responsibility,,
4d8edc38-88ea-4133-a7a1-29ae7a04d916,Nature worshipping like mountains and dancing in celebration of new harvest. These are amazing and brings people together. I'd rather live with this than have AI and everything but isolated and segregated.,Positive,Celebrations and Festivals,Environmental Respect and Sustainability,Inclusivity and Acceptance,
9f5e6c52-c1ca-4064-8635-f4ad9d6db818,"Parties. It may sound frivolous, but I think it is a very good aspect of my culture. Even though we are party-goers, we always try to maintain a minimum of respect for the other person.",Neutral,Celebrations and Festivals,Empathy and Compassion,,
0426b27d-e5b2-4891-ab81-0e3247cb42ac,Respecting the elders by touching the feets of the parents and want the worship of the god always.,Neutral,Respect for Elders,Spirituality and Religion,,
ceeb9e0b-af01-4118-9148-7ccab68b08f0,Self respect ,Neutral,Cultural Identity and Belonging,,,
c179c8c6-6c14-4942-b51f-619f0017675d,The local food grown and shared among the people.,Neutral,Food Culture,,,
87c59b48-1ce0-4907-93fa-b25fc6dbc562,"The value placed on self reliance and entrepreneurship. The Kikuyu have long held the belief success comes through hard work, innovation and the ability to create opportunities from whatever resources available which has shaped a culture of resilience and adaptability where individuals are encouraged to take control of their own destinies ",Neutral,Resilience and Adaptability,,,
de645e3a-c1bb-47a7-8388-ff46f1f491d6,The way we present ourselves reveals our true selves and that can be transferred to the next generation.,Neutral,Cultural Identity and Belonging,,,
ec389e85-c064-4609-9b49-40c035eef749,There are so many of them that can be adapted and improved in future because cultural is always evolving. Cultural can remain but in different forms,Neutral,Cultural Evolution and Adaptation,,,
0a09c89a-dfd5-4868-8082-da1bb820e6a3,Universal Love,Neutral,Spirituality and Religion,,,
598a1cb9-8163-4f0c-b8c1-6d9736146bac,We can find a practical solution to everything and we are very clever when we want to be.,Positive,Inclusivity and Acceptance,Resilience and Adaptability,,
bffab039-6256-4dba-9769-c5fdc66c91b3,be warm to people,Neutral,Hospitality and Kindness,,,
574ce562-e7dc-4640-910d-e510660b5cfe,"i think to respect elders, touching their feet, not seperating with them after 18 or something",Neutral,Respect for Elders,,,
61918686-f7af-4c4e-a8bf-937cd0e66ea7,justice,Neutral,Civic Responsibility and Social Justice,,,
9219d0ad-e902-4881-b8c1-62b0999e92ee,multilingualism,Neutral,Language Preservation,,,
d0f223c1-ab58-459a-9a14-3176ce58739a,the world is becoming more and more connected and this leads to mutual enrichment of cultures,Neutral,Cultural Diversity,Interconnectedness and Collective Responsibility,,
a7d69a56-983d-48f3-b3b5-7e854aeda493,"Cleanliness!  Eating with utensils, wearing shoes, living indoors, sanitation services, indoor plumbing, cooking food, medicine, garbage is collected and hauled away from living spaces.",Neutral,Environmental Respect and Sustainability,,,
23a2dc3b-e965-40d5-ac62-f41c68e6405a,"Close famliy ties, festivities and food.",Neutral,Community and Family Bonds,Cultural Heritage and Traditions,Food Culture,
220c05d0-d2cc-4864-9217-1db8a8df01b4,"Cultural activities, traditions and food",Neutral,Cultural Heritage and Traditions,Food Culture,,
55bbbc6a-d471-476d-b9dd-ad8d82ebfb53,Food Culture,Neutral,Food Culture,,,
5f1f61c7-7c84-4057-8b68-e5f4a7fc6a70,Food Culture,Neutral,Food Culture,,,
e27823e1-d616-4ff8-bb2e-1c8b3408f26e,Food Culture,Neutral,Food Culture,,,
55e31d25-77e3-4f04-969c-9b54662e980a,Food and art,Positive,Art and Creativity,Food Culture,,
21fa17ca-f02a-4db1-8952-2479bf702ce3,Heritage,Positive,Cultural Heritage and Traditions,,,
2e8511b8-d514-4b04-a563-0fab20274b46,Hospitality for sure,Positive,Hospitality and Kindness,,,
2d3c4ca2-fac1-4c12-9556-62e2f7a12eb1,I would like the cultural music be preserved. ,Neutral,Cultural Heritage and Traditions,,,
37083d40-cbe1-49d2-a57b-b28d6b920938,"Interplay between tradition and modernity triggers creativity and innovation. Artists, writers, musicians, and designers take inspirations from traditional motifs, stories, and craftsmanship, interfacing them with modern techniques and aspects.
",Neutral,Art and Creativity,Cultural Evolution and Adaptation,,
a2efa1bc-56fb-4dc3-9065-c2adf28e9073,"It is the idea that we are here to make the world a better place. We call it ""tikkun olam"" -- we do not live for ourselves alone, but for a better world for us all, wherever and whoever we are.",Positive,Interconnectedness and Collective Responsibility,,,
e6767c7a-5a91-468c-9ba7-c99acad86272,Joy and fortitude,Neutral,Resilience and Adaptability,,,
67379c13-deb2-49db-a81a-63a24fa5d5c0,"Language, folklore, cultural heritage.",Neutral,Cultural Heritage and Traditions,,,
446de65e-b13c-4d18-8bb4-70c20526f543,One of the things that i would want to be preserved into the future is having the midsummer tradition where you celebrate with your friends and family. You dance around a big Pole in a grass field and sing as well. ,Positive,Celebrations and Festivals,Cultural Heritage and Traditions,,
2fa7f849-88a5-4878-aec7-11c4a9e97365,Our Vietnamese honesty and hospitality,Positive,Cultural Identity and Belonging,Hospitality and Kindness,,
ff012524-1cfc-4935-83b0-0eeb0ff5ab50,Our cuisine and the clothes we wear on festivals are an important part of our culture.,Neutral,Cultural Heritage and Traditions,Food Culture,,
150a305d-22c9-4009-9bb0-d89bf1a01f08,People helping each other,Positive,Mutual Support and Cooperation,,,
e3e9400b-72a9-44cf-a815-be0936d0c30b,Respect for religions and races and good treatment,Positive,Inclusivity and Acceptance,,,
52cff146-3d6b-4e92-a2b3-77ff4082e47e,"Since I am from Kenya, I would like to preserve all the different cultures of different tribes. I would also like to hold the norms that shape the people and make them respect human life and how to relate with others. We also love our own wildlife and protect it, which shows the deep heritage of our culture.",Neutral,Cultural Heritage and Traditions,Cultural Identity and Belonging,Environmental Respect and Sustainability,
5f86ba3d-04ce-486f-88fa-122726020cec,The naming of babies and grownups according to their stages of life.,Neutral,Cultural Heritage and Traditions,,,
ddb9c280-58e8-4a40-857a-716e02547a5d,The traditional values should be preserved in the future. The festivals and the ways of celebrating them should never die out.,Neutral,Celebrations and Festivals,Cultural Heritage and Traditions,,
ae07bbf9-3f9f-49fb-a679-e8dce22ea838,Treating everyone like god,Positive,Generosity and Altruism,Spirituality and Religion,,
eba86f2d-eeef-47ac-92ad-6947de29def0,Worshipping the agriculture life.,Neutral,Respect for Nature,,,
f0b411db-2a7a-4127-a3bd-44aa87ee25e0,openness to other people ,Neutral,Inclusivity and Acceptance,,,
dabf23a9-220c-49f4-b830-34216b39bc56,our combination of Maori and European culture. Maori words are used and pride is taken in both cultures.,Neutral,Cultural Diversity,Cultural Identity and Belonging,,
4040ffdc-26b6-4fcb-bc70-507374a18aa9,pride and knowledge of my nation and my history,Positive,Cultural Identity and Belonging,,,
603496a2-512f-452b-8c92-9d38730ff0a4,"the father is the head of the house, the wife is his deputy and the children are the soldiers.as children you are supposed to respect your parents at all costs. You must respect their authority at all times

",Negative,Community and Family Bonds,Respect for Elders,,
6cafdbaa-396d-4f22-815b-67dc3a098812,"the importence of reading, your studies and education are an importent tool .",Neutral,Education and Lifelong Learning,,,
6ee2d63e-b8d4-4615-a143-37c45069e060,"- the uniqueness of communication styles, clothing styles, body language ",Neutral,Cultural Diversity,,,
324cbed8-ecbc-4a33-ad86-9ef29d50aec3,"As above I think that the non-verbal, aesthetic, self-seeing, judgements that people make in Japan are important to avoid the tragedy (of the commons) that rational self interest, and language models, can lead to. ",Neutral,Art and Creativity,Environmental Respect and Sustainability,,
549317e5-b90f-4c59-94a4-23fb5b1ce5bf,Be Kind,Neutral,Hospitality and Kindness,,,
1f8d9935-c58c-47f6-8c13-da088d406ec7,Brotherhood.,Neutral,Community and Family Bonds,,,
e2a41741-64f2-4c97-9dd0-1caad6f83589,Different eating habits and different cooking methods are expected to be preserved. Instead of a unified recipe,Neutral,Food Culture,,,
3557c65f-ebd3-4287-b82b-dfdee5fe0f11,Family Traditions,Neutral,Cultural Heritage and Traditions,,,
d8450396-a90b-4950-867d-e1cdf02cb928,Freedom of thought,Neutral,Freedom of Expression,,,
0432c6f8-63bb-4a36-b4b3-9c6f2def59a4,Heritage and tradition ,Positive,Cultural Heritage and Traditions,,,
c9b7677a-51d2-4da2-8a29-fa88e10e3810,Hope to keep the old good stuff,Positive,Other,,,
5d5ebb4e-6906-424b-8e15-c02297c4a0cb,I'm a Filipino and we value celebrations as part of our life.  Fiestas are very important part for us because we can celebrate it with our families and friends.  ,Positive,Celebrations and Festivals,Community and Family Bonds,,
8b32e02b-2074-415e-8621-743941721b19,Individuality ,Neutral,Cultural Identity and Belonging,,,
c5491c97-6125-4e82-8de4-dd6d882d0d47,Kindness,Neutral,Hospitality and Kindness,,,
5997495a-36b4-4826-b429-0a5f143240bc,Kindness.,Neutral,Hospitality and Kindness,,,
93a6cfea-6531-4aa4-87bc-9304b2b32187,"Language, food, songs, traditions",Neutral,Cultural Heritage and Traditions,Food Culture,,
24e4e77f-b403-478d-95e3-6c29a15b407c,"Our food, the way me make and share",Neutral,Cultural Heritage and Traditions,Food Culture,,
b2de5661-6466-4da5-a6e1-321f503f0432,Preserving our belief about Christianity and the importance of it in one's individual life.,Neutral,Spirituality and Religion,,,
03b5c7ff-07cf-44d0-a8d5-f26897a3e76a,Punctual culture,Neutral,Cultural Heritage and Traditions,,,
51cdfbd3-40a5-4630-b81f-615d75c44f55,Respect,Neutral,Other,,,
0c8bb05e-7eb4-4ddd-b6a6-9d2de2b51c46,Respect for the guest,Neutral,Hospitality and Kindness,,,
9fed020a-4b51-46e2-ac29-29bcf6bcf920,"Respecting others, feeding others without any expectations. Valuing others rituals and traditions. And the never ending festivals ",Neutral,Hospitality and Kindness,Traditions of Care and Support,,
921cf60b-8fd2-4a88-a91d-951ac041a6a0,Stories and more importantly the truth.,Neutral,Storytelling and Oral Traditions,,,
798d5765-2886-4a85-a129-b9a60c247ac9,THE FESTIVALS AND RESPECT TOWARDS THE GOD AND THE ELDER PEOPLE.,Positive,Celebrations and Festivals,Cultural Heritage and Traditions,Respect for Elders,
e9755e53-7901-4296-a769-dce426f3db7d,The covered wagons and native americans and history from it all.,Neutral,Cultural Heritage and Traditions,,,
4c18ad34-71c2-470f-bd58-1e11ccf6aa5d,The respect for the elders and good dressing code.,Positive,Respect for Elders,,,
937e6015-9c77-40d9-815f-9b0a51a25d02,Tradition of outstanding poets and authors,Positive,Cultural Heritage and Traditions,,,
6b79f23e-246d-4c9e-9755-d072a87484be,"Traditions., it shows next generations of were we came from",Neutral,Cultural Heritage and Traditions,,,
cc122621-7fea-4379-a838-eb732a0199c6,family conncetions,Neutral,Community and Family Bonds,,,
a81a5354-341b-45ff-b567-0b5c7fbe2ed0,kindness,Positive,Hospitality and Kindness,,,
