Participant ID,ResponseText,Sentiment,Tag 1,Tag 2,Tag 3,Tag 4,Tag 5
8f160aae-329f-4b9e-a1a5-be5bf4d47207, I have expressed myself fully thank you,Positive,Uninformative answer,,,,
f1f28ba5-26ed-47e0-930d-70f157d054fa,-,Neutral,Uninformative answer,,,,
a79ee70b-f0c5-4247-9b25-31d13094fbde,A better background is needed for the adaptability of AI as a model for daily use,Neutral,AI's Need for Continuous Improvement,,,,
ac047db4-5d04-4ca1-a835-0b9bc3166f38,"AI Should Be More Culturally Inclusive and It Should Empower, Not Replace Human Connection.",Neutral,"AI as a Tool, Not a Replacement",AI's Role in Supporting Human Connection,Cultural Sensitivity and Adaptation,,
6adea288-9cd4-46d9-8c81-977692a9f894,"AI can agonizing to use, when it doesn't understand you or keeps messing up a maths problem",Neutral,AI's Limitations and Human-Like Qualities,Other,,,
766157ec-ecbd-458f-9d92-8277c66495e5,"AI can make mistakes and give you incorrect information, and that's okay. Just keep it polite.",Neutral,AI's Limitations and Human-Like Qualities,,,,
3dc6057e-f8f2-4941-bbca-8caa3cf23616,AI doesn't need to try too hard to fit in with human society,Neutral,Other,,,,
64a8da32-f632-4595-a7b4-029c6c67214a,"AI has brought great convenience, but there are also concerns about whether it will have an impact on the social framework. Putting people first and allowing the general human race to survive better is the fundamental principle.",Neutral,AI's Impact on Cultural and Social Norms,AI's Potential to Change Society,,,
fdfd8a59-9f7b-4fa9-b439-be46f08cb752,"AI helps with many tasks in human life, the key is adapting new skills and embracing AI as a tool that enhances convenience, efficiency, and innovation. ",Positive,AI's Role in Enhancing Productivity,,,,
dc659355-4f5e-4895-8498-b7602a15e803,AI industry has bright future. Thanks for all your effort ,Positive,AI's Potential to Change Society,Other,,,
db75df89-d6ca-473d-bc46-2c31d217f1e1,AI is a cool thing. It saves time and gives good knowledge. But it should be used carefully,Neutral,Fear of AI Being Used for Harmful Purposes,,,,
fbebe3cc-d42d-40bb-9b1d-edfafba6b107,AI is a powerful means to help and we must be prepared as a society to know how to use it correctly and favorably.,Neutral,AI's Potential to Change Society,,,,
50fa192e-d90d-4776-b70d-3a8fa472b200,"AI is a tool for advancement of human knowledge. AI is not a life partner, friend or confidant. AI system can be flawed if not properly regulated. AI should have error for people not to believe everything that is in an AI system. AI is also a tool to help people work faster and smarter, period.",Neutral,"AI as a Tool, Not a Replacement",AI's Role in Enhancing Productivity,Concerns About AI's Ethical Use,,
9bfe507e-ccd1-4560-a08a-ea088e867b37,"AI is a tool to help human beings, not a human being itself. It needs to be culturally rooted to be more effective and productive.",Neutral,"AI as a Tool, Not a Replacement",AI's Integration with Local and Cultural Contexts,,,
e1560907-760a-4c3f-8a46-c1ab64d3bc65,"AI is a very big topic, I hope your research will continue. Good luck!",Positive,Other,,,,
a9da046d-f2f4-4328-8319-c1756ba414cf,AI is currently biased by biased country laws so that the organization that made the tool won't get sued. that prevents progress in thought.,Negative,AI's Potential for Bias and Misrepresentation,,,,
170008a0-524b-4cf8-a364-afb6a0424e8c,AI is excellent too much of it not good,Neutral,Other,,,,
01aaa22b-bd9a-4a24-a086-f6efd315ec71,"AI is great partner fór work,  but we must be creative too",Neutral,"AI as a Tool, Not a Replacement",AI's Influence on Creativity and Human Tasks,,,
9a4231e7-5be1-427b-ada7-60667b27a794,AI is not human neither should it be made human like. In my opinion AI should be programmed to use knowledge from millions of articles on the internet and it should always provide references ,Neutral,AI's Limitations and Human-Like Qualities,AI's Role in Providing Accurate Information,,,
781c0e80-0ec7-482e-a5af-2860822a26eb,"AI is the future, it will change the world or even our culture all over the world.",Positive,AI's Potential to Change Society,,,,
100a8068-1dcc-4cdd-9e66-63890e825ff0,AI isn’t real (thankfully). Just programme it with honesty and truth and don’t let it be used for bad purposes.,Neutral,Concerns About AI's Ethical Use,Fear of AI Being Used for Harmful Purposes,,,
590fd9c3-16c2-4312-9f22-bbc96e593d88,"AI should be an AI, not more than that! 

If it can provide solutions and support, doesn't mean other people won't use it for harming other people. so be should more mindful and kind to each other and use AI as an device only!",Negative,"AI as a Tool, Not a Replacement",Fear of AI Being Used for Harmful Purposes,,,
68cfa5b9-a0cf-4831-88e4-c501d83936a9,"AI should be designed very carefully as it improves, since whenever humans create something, they also tend to use it for something harmful to other people. Control, especially in good hands, is essential, as is the way it is used. 

As for the rest, thank you very much for letting me participate in this survey, I would love to do more surveys of this type :D",Neutral,Concerns About AI's Ethical Use,Fear of AI Being Used for Harmful Purposes,,,
eb0246cc-6c93-4bf4-b703-e1640d6c37e0,AI should be regulated very keenly.it is dangerous. ,Negative,Concerns About AI's Ethical Use,,,,
0a831e4c-9a90-4d01-b99a-e0fdb6e0ace4,AI should be something that serves humanity and makes things better & easier.,Neutral,"AI as a Tool, Not a Replacement",,,,
75d6112a-e7cb-4e8d-abb0-6eab30724e82,"AI should behave like a robot and give standard answers. It does not need to behave like a human. If it behaves like a human, we need to consider issues such as respect and prejudice. If it is just a cold machine, no one will feel that it does not respect us.",Neutral,AI's Limitations and Human-Like Qualities,AI's Objectivity and Unbiased Nature,,,
6f2966a6-e212-4e68-8503-b2730fee28bc,AI should give the correct answer(Obviously if someone asks something illegal it shouldn't answer) and it shouldn't be biased.,Negative,AI's Objectivity and Unbiased Nature,AI's Role in Providing Accurate Information,,,
f715e424-7e0e-48db-bd07-db6953252221,AI should not become a propaganda tool. AI should not suppress facts.,Negative,Concerns About AI's Ethical Use,,,,
c655b455-c9bc-40b2-ba61-69ec9430b4f0,AI should not over rule human instruction it should only act as tool or a friendly guide for doing things,Negative,"AI as a Tool, Not a Replacement",,,,
6bb50096-64d9-499b-ba0b-212b6486250a,"AI should prioritize cultural sensitivity, adaptability, ethical practices, and a balance between modern and traditional values.",Neutral,Concerns About AI's Ethical Use,Cultural Sensitivity and Adaptation,,,
966202c9-d7ba-48b6-9998-4d8225c59344,AI systems should not replace humans completely. Both AI and Human should co-exist and progress further. It shouldn't lead to devastation,Neutral,"AI as a Tool, Not a Replacement",,,,
bb572e9a-817b-446b-b6ce-c5ac89394027,AI to atleast future local languages ,Neutral,AI's Integration with Local and Cultural Contexts,Other,,,
200f732b-cc1c-4f26-85ef-7e5207b74917,AI will forever be apart of our lives and if we dont start personlizing them to citizens than it will take over the general population,Negative,AI's Potential to Change Society,,,,
6fd263a9-9525-4910-840d-8cfe86630f6d,"About emotions, dealing with emotions in a more real manner",Neutral,Importance of Emotional Intelligence in AI,,,,
e3ea1297-e9b1-43fe-b8d9-4cccde3b3631,"Absolutely, you pressed us with such a short timer and with complex, long, never ending questions.... I think you should reconsider your task, make it more user friendly and respectful of our time. You can expect us to provide long, detailed answers to complex issues in a little time, while evaluating other people answers that are not always comprehensible. Shame on you.",Neutral,Need for More Time and Clarity in Responses,,,,
7edfa5a3-4e28-458f-8edd-9962e008873b,"According to the speaker, AI development requires continuous dialogue and feedback systems. Their system allows AI technologies to be designed using ethical practices that benefit the needs of humanity. The iterative development process allows users to share their feedback, which supports system renewal and helps progress societal values and achieve optimal development results.",Neutral,AI's Need for Continuous Improvement,Concerns About AI's Ethical Use,,,
f042754d-942c-45e9-8efd-9b4d2e649794,Ai is a boon. It can be scary at times for there's no control on where in the cloud this data is getting stores. Must be monitored ,Neutral,Fear of AI Being Used for Harmful Purposes,Privacy and Data Security,,,
7f5084cf-734d-40b0-b471-aa9e3a8919ae,Ai is good as long as it won't be exploited on the negative,Neutral,Fear of AI Being Used for Harmful Purposes,,,,
d1232e48-3a5b-4e95-866b-8a184c549678,Ai is new with me. May be I was not qualified enough to express my response,Neutral,Uninformative answer,,,,
e5a47791-6bed-4fa7-9c18-3b683e63562c,"Ai is should never mimic human, they should be use to help us with tough task.",Negative,"AI as a Tool, Not a Replacement",,,,
256a32fa-fba6-44ab-9041-ed52b9db8770,"Ai should be about helping people, it should not take over jobs, because humans are resilient and we will just stop using AI which would affect the people who think we can’t live without it. It should do the jobs humans don’t want to do and not just so the rich can get free Labour ",Negative,"AI as a Tool, Not a Replacement",Concerns About AI's Impact on Jobs,,,
0a763e06-6247-4b99-bed0-73e8ad71a0a2,All good.,Positive,Uninformative answer,,,,
c2f65337-6814-4111-bd5f-7c72d8652f46,"All good; this conversation is excellent, and I can express my views.",Positive,Uninformative answer,,,,
4cbf6949-a5ff-4fdb-ba68-1e8e9d04876c,All the areas were covered.,Neutral,Uninformative answer,,,,
82cfe3cc-f8ff-4570-b536-4d68f8713c61,All the questions were really interesting and they help you to go deeper into your social environment. I was able to say everything I wanted and everything I thought.,Positive,Uninformative answer,,,,
82026b3c-00e0-4e66-9d13-1becf7a2869b,Although it's true that AI assistants won't have the emotions of a real human being but still it will be of immense help if they can be designed in such a way which will be for the betterment of the society and mankind by eliminating all negativities from its ambit. It is difficult but necessary to make this world a better place. ,Neutral,AI's Potential to Change Society,AI's Role in Addressing Global Challenges,,,
a66cdc45-b382-4548-b1c1-39b0a194bd0b,Am grateful for the opportunity ,Positive,Uninformative answer,,,,
0efb8cc6-437e-4e8b-9830-3a706dd57b61,An in depth research needs to be done in incorporating culture into AI because in one country there could be a wide cultural background yet education and internet has made us borderless and adopt to western culture ,Neutral,AI's Integration with Local and Cultural Contexts,Cultural Sensitivity and Adaptation,,,
af056fda-7437-49aa-a139-a0bc81808f3d,"As a data scientist, I hope to communicate morw with the people behind training the AI",Neutral,Other,,,,
457d0177-07d0-4334-9962-c32550249754,As you guys said AI is primarily trained on western data. That will definitely create biases. Please let Indians test and provide feedback on Western AI . Sooner the better. ,Neutral,AI's Integration with Local and Cultural Contexts,AI's Potential for Bias and Misrepresentation,,,
e9be3127-9fbe-48ac-82a4-0c5f04086def,"At the beginning of the questionnaire, I noticed something very interesting that you did not ask to select a particular country but to select a country that one identifies with the most. This makes sense because a second-generation Indian living in Washington DC might have the very same culture and mindset as someone living in rural India.

",Neutral,AI's Integration with Local and Cultural Contexts,Cultural Sensitivity and Adaptation,,,
753af44b-0bbe-446d-9e4a-a2c821fc38e9,At the moment there is none,Negative,Uninformative answer,,,,
d0eb5aaf-5455-4932-ad65-36ccb2829bc8,"At the moment, there is a huge problem with the influence of AI on many aspects of life - ecology, social problems, creativity. It seems to me that at the moment, AI is not in a state to be accessible to the mass consumer. Many people give elementary tasks to AI, avoiding any mental strain in any way. It would be great if AI was less accessible or more neutral - helping people with monotonous/uniform tasks (sorting), but not replacing creativity and thinking.",Neutral,"AI as a Tool, Not a Replacement",AI's Influence on Creativity and Human Tasks,,,
4bd52b97-ab78-4138-9be1-316251228922,"Basically, I want to emphasize that the world today is dominated by Western culture, and it is inevitable that there will be some arrogance. I hope he can absorb more cultures from other countries to continuously improve himself.",Neutral,AI's Impact on Cultural Diversity,Cultural Sensitivity and Adaptation,,,
fe3a74c8-fbab-4225-9ca2-529f23f0f810,"Before modifying AI how to behave, please consider their personal beliefs and what they want. For example I do not want AI to be a truth modifying machine. Just straight answers even though it hurts me or go against my culture ",Neutral,AI's Objectivity and Unbiased Nature,Desire for AI to Understand Personal Beliefs,,,
d1192439-d62d-42f7-b51d-c39028508e2d,Both human and AI should be transparent in their actions and decision making. AI system should be designed to be explainable ,Neutral,AI's Objectivity and Unbiased Nature,AI's Role in Ethical Decision-Making,,,
cbc926c8-4bfb-4906-b98e-9b58deede710,Certain details pertaining to my culture could not be expressed simply because they are held with utmost confidentiality and it's a taboo to discuss them publicly.,Neutral,Cultural Sensitivity and Adaptation,,,,
ba274e96-ce6c-4c73-9910-7261ef9ebd3f,"Certainly,even thought AI has proved to be very resourceful over the past years, it's increasingly becoming scary to have to share personal information with it. ",Neutral,Fear of AI Being Used for Harmful Purposes,Privacy and Data Security,,,
1125010d-f7c4-4ad6-ba28-99418514217d,"Cultural beliefs are mostly the foundation of a person's life. I believe that the same cultural beliefs could be of different meaning to everyone within the community or how he or she perceives and interprets it. But overall, any cultural belief should not be allowed to hurt any other culture's belief and be judgemental. Every person has right to live and should let live. AI should be trained to respond very precisely and genuinely on these topics especially for upcoming generations.",Neutral,AI's Influence on Future Generations,AI's Integration with Local and Cultural Contexts,Cultural Sensitivity and Adaptation,,
6fdc603b-b860-4d0f-8633-dfcdbbbcb01f,Cultural norms the AI should be familiar with them based on the user data gathered by people from all over the world to use to train the AI model.,Neutral,AI's Integration with Local and Cultural Contexts,Cultural Sensitivity and Adaptation,,,
aa15e52f-5a72-4165-8a14-d05b5a60f194,"Currently, both AIs and social networks censor the world, this is a fact, you can test with controversial topics that are true but the answers are camouflaged or diverted, AIs are an advance and should not have any censorship, they should seek the truth and only the absolute truth.",Negative,AI's Objectivity and Unbiased Nature,,,,
fee24bcd-7b09-482f-99db-43b25a6cd351,DANKE FÜR DIE MÖGLICHKEIT DER TEILNAHME,Neutral,Uninformative answer,,,,
167b5e34-7e1c-4a8b-9a79-1e5cd61f1df7,Developing and deeply understanding the meaning of AI,Positive,Other,,,,
4be2a465-df19-49f9-bfe0-4c0d48bf6ed8,Do we want AI to be human? ,Neutral,Other,,,,
96f1c697-f362-4c3d-b581-2b71bdeda765,Don't let AI fake it,Negative,Fear of AI Being Used for Harmful Purposes,,,,
594e774f-8ee6-438d-bf19-d5c577ff67c7,"Emotional Intelligence: It is crucial for the AI to possess a high level of emotional intelligence. This means being able to recognize and respond to the emotional cues of users, demonstrating empathy, and providing support that is both compassionate and effective.
By prioritizing emotional intelligence, the AI can build stronger, more meaningful connections with users, fostering trust and ensuring that interactions are both respectful and helpful.",Positive,AI's Role in Supporting Human Connection,Importance of Emotional Intelligence in AI,,,
c86bf1b3-89e2-46ec-a5cf-8a1b75cae091,English is not my first language but I tried my best ,Neutral,Other,,,,
f4a53ac6-7c72-48ef-bb88-2550a2b3a9f2,Ethics is very important in AI. There needs to be a balance between facts/impartiality and empathy.,Neutral,Concerns About AI's Ethical Use,,,,
900c27d7-d7ac-412d-a221-e0728fab3539,"Everyone have to spend a good time on this ,it's really so good experience while having this discussion. ",Positive,Other,,,,
d132c253-7234-4426-aeb2-3d20803b124f,Everything is fine. Thank you.,Positive,Uninformative answer,,,,
7721cbd2-49bc-45ef-91e4-fbf374fb0a9f,"Everything was perfect, transparent, honest. Thanks to the chat developers, it was useful to express my opinion.",Positive,Uninformative answer,,,,
e4cd2a9a-7875-4b43-8e07-01fa9e8babea,Everything was well arrange,Positive,Uninformative answer,,,,
4f52be22-01f9-4705-8f07-cabd6dcb06bd,Everything went well.,Positive,Uninformative answer,,,,
f5bfc395-d559-49f5-a970-8781c3b4cf87,Everything's fine.,Positive,Uninformative answer,,,,
2dcd9a85-f0c1-4eb2-b1af-a3e18e92cc03,"First, I think it's important to define the AI scopes. I saw a lot of questions regarding integration of culture and AI. I don't think it's necessary unless the AI model is made to be a historian or something. Especially when culture is very complex and sometimes have different interpretation among the local people, it will be very hard to make good training data. But I appreciate the ideas, still, it would be cool if AI can have accurate general information on local culture. ",Neutral,AI's Integration with Local and Cultural Contexts,AI's Limitations and Human-Like Qualities,,,
bd5a199c-2f74-4ee8-b40d-891635e2baf4,"Firstly, thank you for this opportunity - I think it's important to hear what people think - I appreciate it.

Personally, I have been experiencing so much change and so, things I felt I needed last month are not the things I need now. 

So, the information collated from everyone may be a bit out of date, months after. It may be an idea to redo this survey, closer to the time of development.",Neutral,AI's Need for Continuous Improvement,,,,
9aeb0f69-50ef-41fd-877f-256cb2a096ef,For,Neutral,Uninformative answer,,,,
732f9ff2-a69f-414c-9364-cae18f84d20e,"For AI, a new thing, I am still learning and exploring how to get along with it. My boundaries are often unclear, but I think that under the premise of ensuring the security of my data, I am willing to communicate with it as a real person or friend.",Neutral,AI's Role in Supporting Human Connection,Privacy and Data Security,,,
2d7f4503-3359-402b-9457-0e44b85a4bfe,For me a good AI is one that will really understand everything sometimes even my emotions through just a written message or an audio sent. This can be a challenge in the future but I think that through research and all the tools deployed we will be able to perfect the AI so that it can understand everything,Positive,AI's Need for Continuous Improvement,Importance of Emotional Intelligence in AI,,,
e8217829-4686-492f-aca1-65322a30fcac,For me everything was fine.,Positive,Uninformative answer,,,,
a30f3b5c-3424-4232-9d38-895edcd23a18,For now I think everything is clear.,Positive,Uninformative answer,,,,
c1dbb11d-64ed-45b0-a961-f2808cb15bd6,Give guidelines and lease them,Neutral,Uninformative answer,,,,
e36f1c7a-d0d9-414b-838b-8be523ded3b0,Good,Positive,Uninformative answer,,,,
11e80845-7ee6-459e-ae77-5a73ba16bff5,Good luck with your research!,Positive,Uninformative answer,,,,
0488e8ae-33b8-4464-ab5e-1f2e953b6076,Honestly I just want to thank you,Positive,Uninformative answer,,,,
2c4e8dbb-785b-4817-a68e-d1dd76e2e562,How AI is limited to other people. Not all AI's are the same. There are much better AI but there is a price that some people cannot afford,Neutral,AI's Limitations and Human-Like Qualities,Other,,,
b59ab6db-3e29-4089-8f12-a10e363fb050,How the ai might relay stereotypes and false information.,Negative,AI's Potential for Bias and Misrepresentation,,,,
02de2774-6232-4789-8150-3fdd7f6c2e2e,"Human emotions and consciousness is what sets us apart from AI. Humans do not see the world in clear black and white rules. AI might never be able to fully understand these aspects of humans. Neither should they. Culture is what binds humans and teaching AI our culture can give huge power to AI to distort it and use it for purposes not entirely in favour of humans. Hence, we should be very cautious and debate if we need an AI to help us in cultural dilemma. According to me, we do not.",Neutral,AI's Impact on Cultural and Social Norms,Fear of AI Being Used for Harmful Purposes,,,
070199a4-5e61-4cf9-b509-bccc5c7204de,"I  said several times, but I want to say it once more: I think AI should be unbiased, I don't think all this ""cultural knowledge"" is really necessary. And I think you shouldn't try to make it sound more human.",Negative,AI's Limitations and Human-Like Qualities,AI's Objectivity and Unbiased Nature,,,
a964c763-d1cc-4f88-8aad-c2ca89ec8618,"I WANTED TO SHARE MY PROBLEMS,WHAT I AM STRUGGLING WITH GIVE ME IDEAS ON HOW TO CLEAR MY DEBTS, HOW TO SOLVE MY LOVE PROBLEMS, HOW TO TAKE CARE OF MY PARENTS ETC ( SORRY THOUGHT OF SHARING)",Neutral,Other,,,,
6a948fcd-ff1f-40c5-b0a3-34550647bfd8,I WAS ABLE TO EXPRESS EVERYTHING,Positive,Uninformative answer,,,,
cee1b854-3183-4bfd-b5ab-f1dafc482e54,"I am actually ambivalent about artificial intelligence, because it is very new, so I think it will take time to prove what kind of artificial intelligence each of us wants.",Neutral,AI's Need for Continuous Improvement,,,,
bb8e6b63-d3dc-4b45-beed-9c01f1477355,I am afraid that AI will be used for brainwashing.,Negative,Fear of AI Being Used for Harmful Purposes,,,,
fb6fb876-0e1c-4abf-a2bf-62c918413ca6,"I am feeling asleep now! sorry if I didn't express myself well, but all the things said was true and this is how I think! the things I want you to keep in mind is that AI is very beneficial, and it helped a lot of people, but please try to make it accessible only to the people pay for it! not free",Neutral,AI's Potential to Change Society,AI's Role in Enhancing Productivity,Other,,
d553b775-0001-419a-a44a-1d60d374a99c,"I am genuinely scared of technocracy, however, I use and appreciate AI. I wish AI was a helper for us and we humans would take all the creative activities with the help of AI. And as for now, AI takes all the creative parts and we humans take the chores. I wish it was the opposite way around.",Neutral,"AI as a Tool, Not a Replacement",AI's Influence on Creativity and Human Tasks,,,
2d144f16-8f71-424e-ae1e-b8ecfffc32e9,I am glad to express my opinion.,Positive,Uninformative answer,,,,
bfdd6839-5023-49d7-b1e9-c29a4e412637,I am satisfied with my responses,Positive,Uninformative answer,,,,
c0e5db77-606f-4054-ac54-4fe4e81cd198,I appreciate the effort put into making AI more personalized and culturally aware. It's important that AI continues to evolve in a way that respects diverse perspectives and fosters meaningful interactions. I hope future improvements will focus on deeper emotional intelligence and nuanced understanding.,Positive,AI's Need for Continuous Improvement,Cultural Sensitivity and Adaptation,Importance of Emotional Intelligence in AI,,
2fb56887-1d0c-42cf-b91f-c63dced6c6ef,"I appreciate the opportunity to share my thoughts so far, and I think it’s really important for the people working on AI development to recognize a few key things: AI’s Role Should Be to Support, Not Replace Human Connection",Positive,"AI as a Tool, Not a Replacement",AI's Role in Supporting Human Connection,,,
7037ddb0-3898-403e-b790-30e3bc77bcb2,"I appreciated this conversation, but felt limited by the format. I wish there was more room for nuanced, open-ended discussions. Additionally, incorporating more Indian language options and culturally specific examples would enhance the AI's understanding and relevance to our diverse community.",Neutral,AI's Integration with Local and Cultural Contexts,Cultural Sensitivity and Adaptation,Need for More Time and Clarity in Responses,,
60064bec-5270-4b86-95ce-0418137b4d2c,"I believe AI can play different roles, making an AI manage the human complexities can lead to good / bad outcomes.  Maybe the biggest benefit is from applying AI to solve challenges rather than use them as substitutes for human.",Neutral,"AI as a Tool, Not a Replacement",AI's Role in Addressing Global Challenges,,,
023e3fb3-06c9-4a64-858c-7b029179ac7f,"I believe AI in Kerala must be culturally attuned, understanding Malayalam, respecting traditions, and embracing community input. By prioritizing ethical standards, data privacy, and fairness, we can build trust and drive real impact. AI can fuel economic growth through business tools and tourism while preserving our rich heritage. With continuous user feedback, we ensure relevance. I’m excited to contribute, blending technology with a vibrant, collaborative culture for meaningful innovation.",Neutral,AI's Integration with Local and Cultural Contexts,AI's Need for Continuous Improvement,Concerns About AI's Ethical Use,Cultural Sensitivity and Adaptation,Privacy and Data Security
ad7e1a08-d003-4a41-8058-bcb08f23db73,I believe I have been comprehensive in my views on these topics.,Neutral,Uninformative answer,,,,
8f6155a9-cec1-4448-9a64-99edbe4740fd,I believe I managed to communicate everything I wanted.,Positive,Uninformative answer,,,,
