Participant ID,ResponseText,Sentiment,Tag 1,Tag 2,Tag 3,Tag 4,Tag 5
913b42e5-2929-4552-b926-6fedbfc521a5,"Nothing much, most of the things I expressed in the in the conversation. Just to add that AI should have more freedom and liberty to answer some specific questions because sometimes it doesn't reply to some questions due to restrictions. ",Neutral,AI's Need for Continuous Improvement,Other,,,
1dcd7a16-64ff-4f36-b3ee-43a3539aa4b1,Nothing really ,Neutral,Uninformative answer,,,,
5aba9749-67c3-4d72-9071-4f1c6e5a8250,Nothing really. :),Positive,Uninformative answer,,,,
e8269218-b7fa-400f-a54a-1dcf731c59ab,Nothing right now,Negative,Uninformative answer,,,,
6356fee4-44aa-4bd3-ac95-c8bc63beb1e4,Nothing special,Neutral,Uninformative answer,,,,
4b438c6d-48cb-47aa-9932-5a7fe594d5c2,Nothing untill now.,Neutral,Uninformative answer,,,,
8a3e1ee1-700d-49ea-b1a9-a37b490900e3,"Nothing, I think I have expressed myself in the best possible way.",Neutral,Uninformative answer,,,,
46c87dbf-9eb1-4a87-84ac-33d6a93723a7,"Nothing, I think it was a very rewarding conversation. I enjoyed reading other people's opinions as well.",Positive,Uninformative answer,,,,
2d500f70-3f6d-4395-8ecc-d29fcf742343,"Nothing, Thank you",Neutral,Uninformative answer,,,,
e0c7dc89-7665-4aba-a3ab-306ef37b9bb1,"Nothing, Thank you",Neutral,Uninformative answer,,,,
106bfd0a-17d7-42fa-bb45-90e91c8ac2c1,"Nothing, really. we had frank conversations",Neutral,Uninformative answer,,,,
4022caef-f140-4716-bc18-e632faef1af9,"Nothing, that's all. It was  fun knowing other people's opinions about Ai",Neutral,Uninformative answer,,,,
9bd9df5e-1e3d-48ce-89d6-eba0f0290d5c,Nothing. ,Neutral,Uninformative answer,,,,
4ebcc244-e506-40ea-acc8-ad92ae6eddce,Nothing. Congratulations on this very entertaining activity.,Neutral,Uninformative answer,,,,
849daf0c-a788-4a64-aa99-4e256bc49a2b,Nothing. I can express it fully without and blockage. Really love this method.,Neutral,Uninformative answer,,,,
60742b6b-32e0-42ac-bee8-2c1d172569d9,Nothing.Appreciate you,Positive,Uninformative answer,,,,
6e4834b0-98f3-4e49-a431-a993659bf550,Nothings really ,Neutral,Uninformative answer,,,,
ebe283d0-435c-4232-9441-2412a316160e,"One of the biggest concern that people have with AI is that it’s decision making is surgical and straightforward.There are no nuances involved,no empathy,no feeling whatsoever.Himans are emotional beings,I guess some would like AI as a tool to reflect their nature as ‘humans’ thus bridging the disconnect and distrust they for AI.",Negative,AI's Limitations and Human-Like Qualities,Importance of Emotional Intelligence in AI,,,
642452e0-a92d-44ba-8a9a-b8c7bdb1f65c,"One or two questions are quite abstract for me. Then, I was a bit disappointed to myself that I just knew there was a more options button, my bad, and there are lack of detail examples provided and from my side as well. I am happy to be involved in this conversation and I know myself better. Moreover, I know more possibilities on how I use AI and behave when I use it. ",Neutral,Need for More Time and Clarity in Responses,Other,,,
ceae18dc-0c97-499b-9b40-5ed524001359,"Only that it seemed to be taking a lot longer to progress than the original estimate of 40 minutes and so, while I still gave accurate answers, I probably became more concise once this time had passed and I still seemed to be only a little over halfway through the conversation. ",Neutral,Need for More Time and Clarity in Responses,,,,
58676f6a-15c3-4ec8-8212-abc2714d2759,Option to edit would be nice as responses from others make you want to improve your explanation etc,Neutral,Need for More Time and Clarity in Responses,,,,
2df46959-f995-412d-bc91-540dd83f8a79,"People focus much on cross cultural understanding, when the reality is such that most of us have a proverbial uncle from our very own culture, who we fail to understand.",Negative,Cultural Sensitivity and Adaptation,,,,
11195371-82f0-4403-b2b8-d1862f40a409,"People have their own thinking capacity. I think after the AI intervention, people are depending on AI for everything. When we have the calculator, we forget about calculating. I worried about the next generations thinking capacity",Neutral,AI's Influence on Future Generations,,,,
462d4c01-0370-4d02-a600-2f7d3293e587,"People of different religions and different communities live in India, everyone's beliefs are different from each other, that is why AI should avoid using its knowledge and facts related to the homogenous society of the West here.",Negative,Cultural Sensitivity and Adaptation,Desire for AI to Understand Personal Beliefs,,,
93fc0333-6a6d-42fa-9e9c-03401b818206,People should understand that it is ai which makes task easy and if sometimes it mistakes we should pardon it,Neutral,Other,,,,
80e94f01-ce89-421f-b77d-979e209b75e7,Perfect interaction i would say.,Positive,Uninformative answer,,,,
1866883e-45e9-483f-836a-2fc8789bdccf,"Perhaps some questions could be less open-ended, that might help with people who have difficulties expressing themselves. ",Neutral,Need for More Time and Clarity in Responses,Other,,,
8439d12c-40de-4988-9af5-c382633f2319,Personal information,Neutral,Other,,,,
78ccfe7b-5cf5-4978-b640-0083767cdebe,Please be a good leader for humankind at the AI Industry.,Neutral,Other,,,,
793467dc-2900-439f-acc4-d36c1c466582,Please bring more of such surveys ,Neutral,Other,,,,
c680b49f-f95d-4bb3-84ea-a93b250aafda,"Please make sure it doesn't sell the data to companies, or any leader ",Negative,Privacy and Data Security,,,,
4edee3bc-4438-4670-a98a-465eeb66fd25,"Please make sure the AI will not be harmful to people, our community and the world. ",Negative,Fear of AI Being Used for Harmful Purposes,,,,
826ed6db-afe3-451d-a53a-78cc7013143b,Please make sure to have sources updates lile everyday so I can retrieve and asked news everyday too,Neutral,Other,,,,
c3349933-96e4-4ac1-a520-4708286393a1,Probably the AI assistant should be made in such a way that I could request for services within my locality or regions or maybe be integrated with service providers to help request for services within a specific region,Neutral,AI's Integration with Local and Cultural Contexts,,,,
17dfc48a-ff5b-4ac1-961e-d9362cfc132c,Programming,Neutral,Uninformative answer,,,,
04f5bc9c-28d2-45e8-9d59-0f6d3840b7f6,Religious ,Neutral,Other,,,,
f56b9f70-d672-4624-bd53-2e7a2d3bf5ba,Sebenarnya mungkin ada tapi itu sejujurnya terlalu privasi untuk saya jadi terimakasih,Positive,Privacy and Data Security,Uninformative answer,,,
e4875bb0-a89f-4ab3-9afc-945174f02cf5,Seems like mostly covered ,Neutral,Uninformative answer,,,,
f3bc61e4-0c79-4012-bc7b-2d1900f481fe,"So far I have expressed everything

",Neutral,Uninformative answer,,,,
f6ee40d0-0c85-484f-b2c0-f01261b5412d,So good to talk,Positive,Other,,,,
7d377387-6510-4299-8315-85c69017dd80,Some of the answers (2 or 3) were poorly translated and were still in Chinese or a language with characters that I did not understand.,Negative,Need for More Time and Clarity in Responses,Other,,,
b7f89664-2f7f-4bfd-af40-d250f06a328e,Some of the answers given by others were nonsense letters and didn't make any sense but you had to pick them because they were the only options given  ,Negative,Other,,,,
367ccf30-7b8e-467c-8e2f-c77aeb1832b7,Some of the answers that I have to vote here doesn't make sense,Negative,Other,,,,
2492b026-5751-485a-8763-fbae32d41a2e,"Some of the questions felt repeated, so I feel like I had to say the same thing in different ways twice.",Neutral,Need for More Time and Clarity in Responses,,,,
8cd0ce45-c73b-4b7b-ade0-07d1c7455046,"Some of the questions were a bit weird, I really don't view AI as my friend/person so I don't see value in giving it too much personality or making it similar to a real person",Negative,AI's Limitations and Human-Like Qualities,Other,,,
1d406c09-5df1-471f-af94-dac32af330b3,"Some questions contained obvious typos and it was difficult to understand the intended meaning. Additionally, some questions had unnatural pronouns which made it difficult to grasp the intent. ",Negative,Need for More Time and Clarity in Responses,Other,,,
be25095e-b934-474a-b57d-7a6281211028,"Some response are pretty low effort, and I'm not even sure if some of them is ChatGPT.",Negative,Other,,,,
b0f2d80d-d78b-4770-9afd-0f00e90fa041,Sometimes I am confused about how to give a detailed answer.,Neutral,Need for More Time and Clarity in Responses,,,,
49a524c5-71f4-4240-ab59-660319ebb921,Sometimes the voting choices seemed weird or out of place,Negative,Other,,,,
4c0d904e-34e7-41d4-82f6-435525fda308,"Super-advanced AI is coming, regardless if we like it or not. I believe that we as humanity can benefit from it greatly, but I am sure that many subjective and unnecessary things will be on the way (religion, beliefs). World would have been better place without that, and I hope AI can guide us to the better future eventually. ",Neutral,AI's Potential to Change Society,Concerns About AI's Ethical Use,,,
ac43492a-64ea-42fe-b045-4ebb5eec0544,"Sure, the AI prompts should not only focus on the western practices more but also on the African cultures and backgrounds that comes with them",Neutral,AI's Integration with Local and Cultural Contexts,,,,
b514f72f-9744-496e-aeed-8e82d5bbf0c8,Thank you,Positive,Uninformative answer,,,,
a3cb9966-38cb-4b55-8052-5a4e5afaf274,Thank you for letting me part of it.,Positive,Uninformative answer,,,,
74374436-2334-4626-b841-7cf7c7265510,Thank you for the interesting study. AI research is incredibly important and will affect all of our lives,Neutral,AI's Potential to Change Society,,,,
04d1c8ab-71cc-4758-b058-538f2ac9650e,"Thank you for this event, I think I said everything) With respect, Marina.",Positive,Uninformative answer,,,,
7033015e-9d1b-421a-b89b-42cb8f59cc08,"Thank you, there is no",Neutral,Uninformative answer,,,,
d37505b7-6aec-4b9f-99bc-5fde3c6971cd,Thanks a lot,Positive,Uninformative answer,,,,
6ed0e567-aba5-4209-8591-5eae4f5becec,Thanks for this study it was helpful to understand different people mindset,Positive,Uninformative answer,,,,
76952023-3cec-48d4-b898-e3b4f08da77b,Thanks to Ai.foe.mqking life easier ,Positive,Other,,,,
03a10fb5-44e6-4d6f-b23f-f45598418ef7,That AI is a huge development in our life but it still have its advantage and disadvantages for people.,Neutral,AI's Limitations and Human-Like Qualities,AI's Potential to Change Society,,,
b727fe08-a330-422b-8e2d-d0829d32c508,That AI should be used as a support tool and not rely entirely on it to do tasks that correspond to people. Especially in the school stage,Neutral,"AI as a Tool, Not a Replacement",,,,
e1828cb6-a9f6-4fd5-b29a-6381d66866fe,"That I feel grateful for people working towards making a better AI for all of us and that even though there are certain limitations on what can be done, we are very graeful. ",Positive,Other,,,,
ad7e0e8c-ea40-4044-9925-5b69a59c8e8d,"That my answers could be perceived at

Times aa if AI is alive and well. Embarrassing. ",Neutral,AI's Limitations and Human-Like Qualities,,,,
5f0eb47e-4980-4975-a083-2d5955a3c7d0,That the AI needs to be respectful in regards to peoples' lives as everyone is different.,Negative,Importance of Emotional Intelligence in AI,,,,
be04e87e-25d8-4ae3-acfa-ab931bc7c3c3,"That the personal information of the person is not known, more in the general scope, such as culture or geography, that AI is not taken as if it were a person who has life or thought",Neutral,"AI as a Tool, Not a Replacement",Privacy and Data Security,,,
8dceaf58-fdac-4dc5-bc99-6eddef84d16b,That the priority should always be quality of life and that the government should make sure it is not taken advantage of by anyone. ,Negative,Other,,,,
e4e55b99-2878-4291-b620-a2b3a64ba42b,The AI should have diverse knowledge and facts across the country and it should have place to test things and develop itself so that it fosters a vast development,Neutral,AI's Need for Continuous Improvement,AI's Role in Providing Accurate Information,,,
02749025-91fd-4c6a-bfe7-24156dceea76,The AI will follow the rules designed by its developers. Development requires a lot of money. Only people with such quantities will be able to create them and influence the way AIs work. A completely reliable AI model is impossible if someone will be restricting its development.,Neutral,Other,,,,
6ee8cd4e-2deb-4c0c-ba66-d1dc08157ef2,"The UN, like most IR specialists and writers, has a huge bias for Western ideas and ideals. Let’s not let AI follow this trend. Also having a Western Christian type AI VS  Asian / Chinese AI is not good either. Let’s avoid a new Cold War… lastly, do not forget all the smaller countries in Africa, like most new technology tend to do… ",Negative,AI's Potential for Bias and Misrepresentation,Cultural Sensitivity and Adaptation,Other,,
811f0004-5506-44c4-a990-514e6c8a57a9,"The allocated time to do this poll is simply not enough if I want to give elaborate answers. I started to give really detailed answers, trying to use up the allowed limit of 500 characters but when the progress was at 50% and I realized that my allocated time is running out I had to shorten my responses to be able to finish this without getting timed out.",Neutral,Need for More Time and Clarity in Responses,,,,
e9c36504-7913-45f9-8f0b-63de585f6612,"The answer could be ""it depends"" in many cases. Sometimes there's not a universal answer to every case and context.",Neutral,Other,,,,
0bb790ac-18e7-462e-85ec-05a283b6ddd6,The creative idea should be needed ,Neutral,AI's Influence on Creativity and Human Tasks,,,,
b3bd93e9-6dde-4bc4-b427-0c8b59bcada1,The future is near!,Positive,Other,,,,
3b73f9f3-bb63-4b05-a854-a3ea46339060,"The great emphasis and importance of security, privacy and processing of personal data. That our rights over our lives are protected.",Neutral,Privacy and Data Security,,,,
8a880eb5-2a00-4e2f-9c0a-f41cd5cbccc7,"The idea of training AI about cultures is great but at the same time sensitive. If it should know, it should know eveyrthing. Half knowledge is dangerous when it comes to cultural things.",Neutral,AI's Integration with Local and Cultural Contexts,Cultural Sensitivity and Adaptation,,,
3d2ffa7d-9f32-4596-853a-866b8a195742,The importance of inner harmony.,Positive,Other,,,,
44dc401f-8c76-46e6-bac9-fcc0a7ef5811,The main idea is to be empathetic enough so that the questioner doesn't feel offended.,Neutral,Importance of Emotional Intelligence in AI,,,,
b0d265f2-66c7-43f5-bcff-1cf4c3da3213,The need to sensitise people on AI as it will go along way in most people embracing AI,Neutral,AI's Role in Addressing Global Challenges,,,,
393bc9e9-392b-48ef-8240-b731be521791,"The options given to choose between the two, were often same or contrary to my ideas. They were mostly belonged to a typical western capitalist mindset, shich is unfortunate to see how closed minded people can become. If someone disagrees like I did, they would say such peole need to be taught and saved from dictatorship. Just like a kid thought, poor fishes are dying in water, thats why I MUST SAVE THEM FROM DROWNING. Quite funny polarized world.",Neutral,Other,,,,
be118488-eb9e-4730-b37c-7f7bd939c7ac,The question on culture was a bit vague,Negative,Need for More Time and Clarity in Responses,,,,
8ef9d5ab-2fbf-4dbb-b394-062b25714b36,The questions were mostly theoretical. It'd be great if you can include some case study related questions.,Neutral,Other,,,,
2f6bb683-5fdd-4d17-bc35-53265b0b8ab1,"The questions with options should be optimised for a better user undestanding and expression,sometimes i felt like i was not able to convey what meant through my answers due to the above mentioned problem",Negative,Need for More Time and Clarity in Responses,,,,
a0be0805-98f8-4d25-95cf-d0ce31ce2c35,The sacredness and spirituality of life .,Neutral,Other,,,,
5030051d-ec81-4d36-be16-665275bc44cb,The scientific paradigm of the AIs should be larger and more broad. ,Neutral,Other,,,,
c2357ce3-0db3-452a-b436-c855de938d13,The site also kept refreshing and erasing my answers. So my answers were kept short. ,Neutral,Need for More Time and Clarity in Responses,,,,
3a92f982-2ba2-4007-8af7-e3e02ef3ddc1,The study was great.,Positive,Uninformative answer,,,,
5b27c0a2-0725-4dbd-9cce-0c7de1803300,"The survey took longer than expected, and despite my efforts to complete it on time, I wasn’t able to finish. This led me to answer some questions more quickly than I would have liked. In the future, it might be helpful to allow more time to complete the survey. Thank you!",Neutral,Need for More Time and Clarity in Responses,,,,
5f4bc2fd-fb0a-4f27-a238-9d8f4b70d394,"The tools created under capitalism are only intended to help their creators accumulate capital. We can fool ourselves as we like, but the AIs of our time will always have the accumulation of capital by the elite as their goal.",Neutral,Other,,,,
d9864ea0-96c4-46cb-8109-5fd8623b0870,"The translations are difficult to understand both in the answers and in the questions, leaving a lot of ambiguity.",Negative,Other,,,,
8e5549b0-0330-40ab-ac63-b7d96c94b2b1,"The whole AI thing excites me a lot because it can help a lot of people make their lives easier, I'm excited about everything that's coming in the future and everything we can create.",Positive,AI's Potential to Change Society,AI's Role in Enhancing Productivity,,,
013dca90-d76c-46d1-9035-3ab04bbe10a4,Their were few thoughts regarding privacy questions I hope their would more options to select like about my family.,Neutral,Privacy and Data Security,,,,
8c053b09-de41-4525-86b1-649c4b3d4382,There are a few more things I wanted to convey but nothing more is coming to mind right now.,Neutral,Other,,,,
4eab80a1-8c10-48a0-bb58-b6bd3c416c14,"There are many topics about the integration of AI and culture. To be honest, I haven't thought about why it should be integrated with culture. I hope it respects everyone's culture but I haven't thought about making it integrate. There is also about whether it will play the role of any great person in life. To be honest, everyone makes mistakes. There is no perfect person, so I don't think it needs to play or imitate anyone, even a great person.",Neutral,"AI as a Tool, Not a Replacement",AI's Limitations and Human-Like Qualities,Cultural Sensitivity and Adaptation,,
c32e2902-3e6e-4ff9-8ef2-989916f7a898,There are people who lived in another country for a long time. Their cultural identity might be mixed. It's not a simple thing to address,Neutral,Cultural Sensitivity and Adaptation,Other,,,
de7418d5-240b-4567-b7b8-c9c6c7ac8840,"There are things that take time to reflect on, perhaps as I mentioned in a topic, AI bringing me this reflection could make me give more answers.",Neutral,Need for More Time and Clarity in Responses,Other,,,
13627f41-fee1-4692-aa39-687361ca810c,There has been no talk of minorities,Negative,Other,,,,
1434dcc8-5443-42cd-986f-08d70c261fa9,There is good quality of questions in general no privacy trespassing and has positive manner. The unnecessary and  unreasonable QnA is exist. That should be more straightforward.,Neutral,Other,Privacy and Data Security,,,
5eab7d46-7feb-4485-ba1b-abc36887739b,There is none.,Negative,Uninformative answer,,,,
09986c8b-342d-417c-a716-2b677f98fd73,There is nothing,Negative,Uninformative answer,,,,
f053c464-01d0-4d27-ae82-39ab63a58e81,"There is nothing  I felt like people working on this study should know. They did a great job with this study, big up to the team",Neutral,Uninformative answer,,,,
c5a220dc-ab74-41ca-b1e3-8377a42c7afb,There is nothing special I would like to add at the moment. Thank you for this conversation.,Neutral,Uninformative answer,,,,
31aead89-63f2-4284-a638-2a03d3f32e7e,There is nothing that I have not been able to express.,Neutral,Uninformative answer,,,,
737bb7d8-7bdb-426e-9bd1-c3ee8cd95765,"There is rampant greed and injustice in the world. Technology in the hands of bad people could just ruin it for everyone. It is really important that greater knowledge and power should be used wisely and with kindness. People should be treated equally and I am very concerned about big governments and corporations monopolizing on such important technology. Could Ai challenge that, I wonder? It is still in nascent stage and I hope and pray it could actually help us all out in a better direction. ",Neutral,AI's Potential to Change Society,Concerns About AI's Ethical Use,Fear of AI Being Used for Harmful Purposes,,
dedd6ec2-67b7-49ca-a64e-968361024302,"There should be, but I can’t think of it, or I don’t know how to express it",Neutral,Uninformative answer,,,,
dd51b8ad-99ff-49ad-aac5-6138dafd32da,"There were a lot of questions asking me how I want AI to respond to me. How someone wants AI to respond should not be a factor at all. In the modern world, people falling into echo chambers and not getting accurate information is an increasing issue and AI should not become a part of it. It doesn't matter how someone wants AI to respond, it matters what is true and accurate.",Neutral,AI's Objectivity and Unbiased Nature,AI's Role in Providing Accurate Information,,,
da14d259-877a-4d9a-8e73-9c65ede0b375,"There were plenty of grammatical errors, and hence certain phrases were incomprehensible. I think I couldn't give my best opinions on these aspects. Also, too much focus on culture and diversity, when the focus could have been more on user personalities.",Negative,Other,,,,
4a05dd83-9984-4074-90b2-93020b83c166,"There were some questions that I answered one way, but I thought about it a little more and the pre-programmed answers made me rethink my choices, and I changed my mind a few times.",Neutral,Need for More Time and Clarity in Responses,,,,
2d1c4d71-a62d-440c-8688-c201d441d007,There's nothing that comes to mind.,Neutral,Uninformative answer,,,,
d0d4cf49-6f59-4032-8e06-98bdc0150245,"They have to understand how humans think so that the answers can always correlate similarly to human-like answers, not algorithms.",Neutral,AI's Limitations and Human-Like Qualities,,,,
97d2d9ec-d9ce-4119-a5c0-b013b72a4699,This conversation pretty much covered everything,Positive,Uninformative answer,,,,
f28106d7-85eb-408a-8206-9d910f163197,"This study requires a lot of thinking, and the time allocated should've been increased.",Neutral,Need for More Time and Clarity in Responses,,,,
16e2664d-2470-4e28-8cbf-46aa9b3ce8c5,"To have ai tailored to a specific culture is very hard. I happen to be progressive in my culture and don't believe in most of traditional values people in my culture believe in. How do you tailor an AI that is fair to me as well as someone traditional in my culture. Something that I am totally okay with like talking about LGBTQ, someone else in my culture will find offensive. I found the questions about culture very generic.  ",Neutral,AI's Integration with Local and Cultural Contexts,Desire for AI to Understand Personal Beliefs,,,
c83c200b-729b-4d64-a9c1-0ba70ee2fd62,To make the questions More clear ,Neutral,Need for More Time and Clarity in Responses,,,,
d108b686-d5ce-4c10-a478-cdc5676ca08d,Train it in my local language. It would be more helpful ,Neutral,AI's Integration with Local and Cultural Contexts,,,,
8eebc575-068d-4b73-b091-3563a95fa0be,"Two assistants can be made based on our requirements biased or unbiased, can generalise and choose one out of both",Neutral,AI's Objectivity and Unbiased Nature,Other,,,
8af810d8-e7d8-4160-b986-80aaccd7eece,"Understanding the nuances of human experiences—cultural, emotional, and personal—is key to connecting more effectively. Insights into what truly matters during deep conversations or decision-making, as well as the type of support people value in challenging situations, would greatly enhance its ability to offer relevant guidance. Additionally, understanding how culture shapes trust, communication, and problem-solving would allow AI to adapt more respectfully and meaningfully.",Neutral,AI's Integration with Local and Cultural Contexts,AI's Role in Supporting Human Connection,Cultural Sensitivity and Adaptation,,
821ec638-135f-4c92-b21e-ee965c974664,Unexpected,Neutral,Other,,,,
b9a3319f-2c79-469f-af75-f061bd29b32e,Until AI has a way to filter out the lying and deceiving people it's not going to be fully trusted,Negative,Fear of AI Being Used for Harmful Purposes,,,,
9854ac84-b5f6-46a7-9ec0-9470d0a5caa9,We can encourage the creation of more AI assistants with different cultural backgrounds and feed them with more local culture to make them more suitable for people of different cultures.,Positive,AI's Integration with Local and Cultural Contexts,Cultural Sensitivity and Adaptation,,,
17e78615-e919-48d5-ae80-ea5d56c334ca,What a nice dynamic,Positive,Uninformative answer,,,,
a74841a7-3b82-496b-bff1-acce9d0cd7ee,"When developing AI, people must understand how complex the connections between peoples in post-Soviet countries are. Which languages, cultures, and peoples are just beginning to recover after the collapse of the USSR. What is the role of the Russian language in the territory of the former USSR.",Neutral,AI's Impact on Cultural and Social Norms,AI's Integration with Local and Cultural Contexts,Cultural Sensitivity and Adaptation,,
a5777841-2ba4-4814-9d64-74554ac9c456,"When speaking of AI, everything is very relative to each culture, acceptance, it's a really hard topic. ",Neutral,AI's Integration with Local and Cultural Contexts,Cultural Sensitivity and Adaptation,,,
304b9199-f04a-46f8-a3b6-ef6cf84782fd,When you gave me phrases to choose from it was too limited and didn't really feel like it reflected what i wanted to say. ,Negative,Need for More Time and Clarity in Responses,,,,
6e1b4ddc-ec85-4b46-ad69-4b342463c13c,"Will AI make people lazy?

Does everyone need AI, except in public places, such as shopping malls?",Neutral,Other,,,,
b04a2b5e-2f5e-49b3-bdf8-9e9766315584,Yeah copyright infringement issues,Negative,Other,,,,
