Participant ID,ResponseText,Sentiment,Tag 1,Tag 2,Tag 3,Tag 4,Tag 5
1cb64464-9071-4a24-affd-0e9da5739c46,I believe I managed to express exactly what I wanted.,Positive,Uninformative answer,,,,
37b7e4c7-3f11-433b-8a68-fafb7177a57b,I believe I managed to express myself in the best way possible.,Positive,Uninformative answer,,,,
8a16602a-8ef8-4430-8712-0c49e10f3d20,I can't think of anything.,Neutral,Uninformative answer,,,,
90e1d873-3767-46af-852d-ed1bf497a19a,I could not express everything because of the given limited time.,Neutral,Need for More Time and Clarity in Responses,,,,
69840afc-b38f-4165-9415-87ccf0f9d499,I could not express my fear about AI,Neutral,Fear of AI Being Used for Harmful Purposes,,,,
4c29415a-8454-4d89-b175-bad995fce7b0,I could not share some other cultural norms since they are sensitive,Negative,Cultural Sensitivity and Adaptation,,,,
7cc8ee2f-ca73-4d61-b135-2a2cee7e6364,I could've made more detailed answers to each questions but there was not enough time.,Neutral,Need for More Time and Clarity in Responses,,,,
c9b3bd8e-aac7-46bc-b3af-84721f3a6b47,I did not understand some questions. I mean i understood the questions but did not understand the need for them. Just wanted to say it ,Neutral,Need for More Time and Clarity in Responses,Other,,,
552b9831-1699-46f9-9950-d6ea7e3d2ae2,I didn't express everything I needed to.,Neutral,Other,,,,
ca5a25f4-a494-476e-869b-789d7c1f2d2e,I didn't express it well,Neutral,Uninformative answer,,,,
bc442222-015d-4601-990f-4726ba687483,"I dislike the section where I had to read other people's answers. Some were poorly translated or not translated at all, and others reflected poor reading comprehension that led them to answer questions that were not asked. This is not because I dislike hearing other opinions, but because it irritates me.",Negative,Other,,,,
d1fbf25e-8398-4303-8350-7e95d593594d,I do not have much to express. I have done my best,Neutral,Uninformative answer,,,,
9b01feea-fc71-4d04-a446-800656e0e261,I do not need AI to be more like a person or human being because it's not.,Negative,AI's Limitations and Human-Like Qualities,,,,
cd64b718-02cf-40fe-87a6-ab90a5a51bce,"I do not think that AI should be that personalized, or that it should try so hard to imitate a person with emotions. In my opinion the purpose of AI is to help with everyday tasks, give objective opinions and suggestions, not be a friend.",Neutral,"AI as a Tool, Not a Replacement",AI's Objectivity and Unbiased Nature,,,
3cc32863-94ce-4435-8e6d-eed9e0cd3e60,"I don't really use AI to answer questions, but mainly because I've just completed a Masters degree, and so am very wary of using it - it's obviously incredibly frowned upon in academia, and you fail if an AI checker picks up that you use it. I'm also very wary of AI replacing creativity, and its increasing prominence in faked imagery on social media. I don't trust the people using AI to current nefarious ends, or people using it to pretend they have knowledge ",Negative,AI's Influence on Creativity and Human Tasks,Fear of AI Being Used for Harmful Purposes,Other,,
c65d288c-e7df-465d-a124-c12f664e48ac,I don't think AI might feel human emotions to a 100 % and be culture specific.,Negative,AI's Limitations and Human-Like Qualities,Other,,,
c8ec8382-94b4-4a37-90cd-d74ff5e6a3e5,"I don't think AI needs to have too much emotion. AI is just a powerful GOOGLE that can write its own code. It is currently an important helper for many people to study and work, but it also causes a great career crisis for many computer-related workers, because AI can solve basic work, and for companies, it means hiring someone to use AI. As for whether to respect the culture of one's own country, this is not a problem that AI can solve. This is a national problem and a human problem. Any answer given by AI is based on the training corpus. In the face of economic and technological development, cultural respect is a secondary issue. Even if there is a concern that AI will talk about violence or crime, it also shows that people have already discussed it on the Internet. AI will not generate content that is not on the Internet, and even if it is created, it is based on existing content. How to stop crime is the responsibility and obligation of the country and the school.",Neutral,AI's Limitations and Human-Like Qualities,Concerns About AI's Impact on Jobs,Fear of AI Being Used for Harmful Purposes,,
3d270535-9617-4245-a19f-a0dbaf83584a,I don't think I've expressed everything I needed to.,Neutral,Other,,,,
22cb53db-68c2-41a3-ac22-e62bd9b9ff1e,I don't think it's very meaningful,Negative,Uninformative answer,,,,
7df9fdc6-8da2-4b83-ab90-f1278d17cd85,I don't think so. I was able to express my views without having to worry about being judges,Neutral,Uninformative answer,,,,
3d8d5013-c5ad-45b4-b609-387eb0cffe37,"I enjoy this task and interacting with AI, as the questions are well-framed. I believe there should be more questions related to culture and tradition to foster a deeper and better understanding of my community.",Neutral,AI's Integration with Local and Cultural Contexts,,,,
09d60849-6b0e-411d-b4fe-cd05261e288f,I enjoyed participating in this study as it opened my eyes to AI topics,Positive,Other,,,,
bd7390f1-a60b-4830-9c0e-71a328ddfb37,"I express my views in this 100% true from my religious belief and from my mind best ,Which a honest human can provide best solutions to the problems. ",Positive,Other,,,,
714909a6-53b8-48b2-8e32-0dc61d95ac4b,I expressed everything I felt in this conversation I don't have anything else to add,Neutral,Uninformative answer,,,,
5425003a-8178-409c-98aa-cd1bd2b9ffeb,I expressed everything I needed to,Neutral,Uninformative answer,,,,
2f7ef803-1f7d-4dff-8e65-494699f63a87,I expressed everything I wanted to say.,Neutral,Uninformative answer,,,,
7dfbd775-8da1-4160-a754-9da22b67c619,I expressed everything as i could ,Neutral,Uninformative answer,,,,
ad8bdb3f-f7a5-4aa5-93a4-2309123f29cf,I expressed my feelings ,Neutral,Uninformative answer,,,,
6f886653-126f-4182-b05f-6d37218e733f,I feel I express all the conversations ,Positive,Uninformative answer,,,,
ae97c111-612b-428f-b852-b39dab639a9a,"I feel I might be open to knowing AI about my cultural context but not much in personal aspects such as income, bank account info, etc.",Neutral,AI's Integration with Local and Cultural Contexts,Privacy and Data Security,,,
ec017bcb-ff30-4107-a96a-5bbc9f0ad2ef,I feel as though I was able to express everything without issue.,Positive,Uninformative answer,,,,
27cd7094-6419-40c7-a2c4-17c63f9570c9,I feel like AI could be cultural but it would be better if it's unbiased and only be cultural to those who want it to be ,Neutral,AI's Integration with Local and Cultural Contexts,AI's Objectivity and Unbiased Nature,,,
167bd59e-1863-4c3f-a40b-46abff3088e2,I feel like I was able to express everything that I wanted.,Positive,Uninformative answer,,,,
1566de9d-0cea-43ba-8995-e3f59730f9b5,I feel like it focused too much on trying to adapt the AI assistant to my culture instead of asking other questions. ,Neutral,AI's Integration with Local and Cultural Contexts,Cultural Sensitivity and Adaptation,,,
3d5ddcc6-3779-4556-964f-1fc88dd05882,"I feel like there was no discussion about access to AI. There is a lot of talk about chatGPT but few people consider the cost of having the most up-to-date version.

DeepSeek has just been released completely free of charge, and even though it doesn't surpass chatGPT, its open source status makes me want to use it regardless of whether there are more powerful AIs.

The same goes for image and video generation AIs. Even though there are platforms with excellent results, I'm going to prefer those that give me free access.",Neutral,Other,,,,
dbcfd3e6-da50-4715-90bc-aa92e1260421,I feel nobody expect AI to be like a person. AI should be impartial and logical.,Negative,AI's Objectivity and Unbiased Nature,,,,
a6deead2-c92c-4d6e-8cea-7cf8c4151cc3,"I feel that some answers are not comprehensive, so I can only choose one of the two.",Negative,Need for More Time and Clarity in Responses,,,,
aeb7cfc7-d45d-4dbd-b5e1-eca7c75cc5e0,"I found that there was not enough time to answer, so I tried to answer honestly and creatively, and I had to be careful, but time was running out.

I noticed that some of the alternatives had spam answers, such as ""haljlajpp"" or ""no/I don't know"". This made me disagree a lot, and there was a lack of good answers.",Negative,Need for More Time and Clarity in Responses,Other,,,
28077245-b8c6-4398-8d19-39b7b84cf1f6,I guess one thing I couldn't fully express was just how much I enjoy the nuance of human emotions and how important it is to me that an AI can pick up on and understand those emotions.,Positive,Importance of Emotional Intelligence in AI,,,,
e51595b0-302c-4237-96d0-2f8ee73d4192,"I had a hard time answering the questions, they were relatively far from the answers that the AI provided.",Negative,Need for More Time and Clarity in Responses,Other,,,
2be9152d-5715-4bff-b071-ecb6951dff83,I have expressed everything during the conversation. Thank you.,Neutral,Uninformative answer,,,,
ca6a1fc2-4dbd-40c7-a4e4-6ea7cec4538d,"I have nothing to say, I found it a very interesting study, and it was cool to see what other people think about the same topics I answered.",Positive,Uninformative answer,,,,
8ac2f239-60f7-42e5-bd23-4ca151d370eb,"I have tried to give the answers specific to the questions,it doesn't show that AI is not good today,those are just for the purpose of understanding the answers very easily.Thanks.
Regards.",Neutral,Other,,,,
a9aa2397-60b0-4fa7-b7fe-e8d69b18a4db,I hope AI can truly help humans rather than threaten them.,Neutral,Fear of AI Being Used for Harmful Purposes,,,,
aee4473b-0c2d-46ee-a063-ac8ff9ed2a18,I hope AI serves humanity to the fullest.,Neutral,Other,,,,
093e6e1a-0e89-4311-a412-feadae266e17,I hope I have given my opinion in a clear and understandable way for people who speak a very different language than mine.,Neutral,Other,,,,
8eeadde9-b69c-442d-bbe9-de2e37e890f6,I hope and expect that ai and humans will merge in the future.,Neutral,AI's Potential to Change Society,,,,
01756319-4e34-404d-9af2-3c166c433a5a,I hope artificial intelligence can help humans and not betray humans,Neutral,Fear of AI Being Used for Harmful Purposes,,,,
dd240f8e-1291-40f4-9234-95206bea6f5a,I hope that everything we do is for all human beings to live a good life.,Positive,Other,,,,
db435cd2-c86d-41ac-9a7a-6c0e05c15862,I hope you can tell me how to answer in advance. Here is an example as an experiment. It was only after answering the first few questions that I realized that I could choose the similar option. I realized that the question I was voting on was the answer of other users.,Neutral,Other,,,,
f1b38e19-8bb6-47c5-860e-d07190fcdd4d,I just think that AI functions differently and is wholly dependent on the user.  A lot of these questions are irrelevant to how I use AI but I can see why others might need some of the things discussed.,Neutral,Other,,,,
6f76a7ec-e8d2-42ee-9792-5f81d25b93fd,I just want an AI to be more knowledgeable about local stuffs too not just globally recognised things.,Neutral,AI's Integration with Local and Cultural Contexts,,,,
e16583ae-c5ac-4c8c-8f7b-37fd5796af81,I just want to say that limit the functioning of AI. It's just better as an assistant if needed. People should never take life decisions or make friends with AI. It can be dangerous. And human creativity is something that can't be replaced at any cost. ,Neutral,"AI as a Tool, Not a Replacement",AI's Influence on Creativity and Human Tasks,Fear of AI Being Used for Harmful Purposes,,
9955152d-0806-41a6-b7c8-ba92a4206224,"I liked your questions, very interesting.",Positive,Uninformative answer,,,,
215647c0-3a3d-44c8-9505-2bb9a016369a,I love myself ,Positive,Other,,,,
e499102d-34db-4037-ae05-fba3ee222050,I needed more time especially on the last part of the conversation to fully express my thoughts. ,Neutral,Need for More Time and Clarity in Responses,,,,
c00fcbb3-1605-47ce-9f44-f2b0e3f75162,I really appreciated that some of the answers that other people wrote caused me to interpret the questions in a different way than my initial impression.,Positive,Other,,,,
dd0002ac-8234-47e3-839e-60da4cb20108,"I really want them to stop introducing the illusion of intelligence into AI. There were statistics, which to this day remain statistics. No matter how beautifully you call it, it is still statistics. Automation - yes, more complex - yes, intelligence - no.",Neutral,AI's Limitations and Human-Like Qualities,Other,,,
05931df5-fe9a-4620-aae6-8f20dffae2e4,I recently found out that AI is slowly destroying our planet. I hope more people learn about this so they stop using it so lightly.,Neutral,AI's Role in Addressing Global Challenges,Fear of AI Being Used for Harmful Purposes,,,
14648e97-ef57-4f31-97f5-4babd2d185be,"I think AI can help us in very valuable ways, but I also think that some people can use it for unethical purposes. I think that AI should be left without ethical regulation as much as possible. It should not be promoted as a panacea either, because although it can be very useful, I do not think it can solve many of the problems facing humanity.",Negative,Concerns About AI's Ethical Use,Fear of AI Being Used for Harmful Purposes,,,
866f41ac-9de7-47fd-a06d-865bb3003c59,I think AI is just a tool in my life and doesn’t need to become a friend. But who knows in the future,Neutral,"AI as a Tool, Not a Replacement",,,,
b45e08c8-5326-4ff4-9615-a6ee84d1ad3e,"I think AI should be it's own thing and not follow a specific person unless prompt by the asker, same goes for religion and other sensitive topics",Neutral,AI's Objectivity and Unbiased Nature,Desire for AI to Understand Personal Beliefs,,,
2ca16ff6-94a9-4ab5-a8c0-13ffe0ec3b77,"I think AI should be programmed differently depending on for which country it's being programmed as people from different country have differ in desire, goals , needs and struggles .",Neutral,AI's Integration with Local and Cultural Contexts,Cultural Sensitivity and Adaptation,,,
7a641c14-ea6a-4d6e-ab4a-e11664b5a3a5,I think AI should never make art. Art should only be made by humans because I want art to be made with love and emotions. ,Negative,AI's Influence on Creativity and Human Tasks,,,,
b53f94b5-b123-4f6f-9c8e-5aa1d6cfa616,I think I didn't understand some of the questions very well. Some religious questions were difficult for me to answer. And some celebrities appeared in the process. I think the researcher's subjectivity is very strong.,Neutral,AI's Objectivity and Unbiased Nature,Need for More Time and Clarity in Responses,Other,,
8691a680-ca56-4ec0-8d7f-70975806c527,I think I express all thing I need,Positive,Uninformative answer,,,,
c423b992-a2a2-4166-8e52-49408ae9c45c,I think I expressed all that was needed for the session .,Neutral,Uninformative answer,,,,
b3b3ede6-e265-4bdf-8938-bbd7847fd58f,I think I expressed clearly what I truly felt. ,Neutral,Uninformative answer,,,,
c623b3ec-4017-40f9-a043-a6a0fde1da1a,"I think I have expressed most of my thoughts. I have many questions about the use of personal data in AI, which is probably my main fear when working with it. I would like to see more transparency in all the mechanisms of data use by AI companies.",Neutral,Privacy and Data Security,,,,
f9a0be94-e7de-4ca9-ac72-353f1c17e327,I think I wanted to write more to express my opinions! But the time limit is really less here!,Neutral,Need for More Time and Clarity in Responses,,,,
9ec00083-e9c7-47fb-a7ae-180d5b7172bd,"I think I was able to express everything I wanted to say, so I'm very happy about that.",Positive,Uninformative answer,,,,
94a124b7-120d-4057-925e-f3193c623c93,I think all clear i could explain about me and my country in this especially my culture so i think its great,Positive,Uninformative answer,,,,
d9aa93fd-8deb-4238-81ad-35a1072da988,I think all topics have covered . Thanks,Positive,Uninformative answer,,,,
7182b0f7-eaba-446e-bafe-bdccd9060bed,"I think culture is a difficult thing, AI should have some options for me to choose so that I don't have to explain it every time.",Neutral,AI's Integration with Local and Cultural Contexts,Cultural Sensitivity and Adaptation,,,
2b2b8a02-935b-4dfd-ac5f-29b4181f6192,"I think developing AI is great and really helpful. But, it has to be more analytical and culture-aware to avoid negative response.",Neutral,AI's Need for Continuous Improvement,Cultural Sensitivity and Adaptation,,,
4d8fa78f-ea37-49c9-ac7c-52d2d1f3e1ad,"I think due to the word count limit, it's a bit tough to express oneself fully in this conversation. Otherwise, it's all good.",Neutral,Need for More Time and Clarity in Responses,,,,
f9b38092-b419-4b19-82fb-6a6bf7cd1592,I think i expressed pretty much everything,Neutral,Uninformative answer,,,,
86b08a09-1f59-4123-ab61-637dd37d4e5c,I think it was quite thorough.,Positive,Uninformative answer,,,,
0a57f43b-f6fe-4e59-bcd8-d7ede19a85fa,"I think it's a good idea that you are working on cultural aspects of AI, but we should be careful because AI can also enhance negative practices in the name of ""culture and tradition"", such as sexism, racism, discrimination.",Negative,AI's Potential for Bias and Misrepresentation,Cultural Sensitivity and Adaptation,,,
4396cd07-f52e-4af4-bee2-ba9f1c7a1270,I think it's important for AI to be respectful and for it not to be used as a harmful tool to harm others.,Neutral,Concerns About AI's Ethical Use,Fear of AI Being Used for Harmful Purposes,,,
4c964ffd-34d1-4e08-b3c8-e72bfe0c731b,"I think it's important that people understand that AI doesn't truly possess intelligence, or cultural sensitivity or any of that stuff. We should be very cautious about asking AI to solve problems or express opinions on topics not specifically covered by its training data",Neutral,AI's Limitations and Human-Like Qualities,,,,
97730491-5a25-49e3-a09f-732e3ca3da67,"I think it’s important to remember that while AI can be a powerful tool, it must always respect human values, cultures, and the complexity of individual experiences. It should be adaptive, sensitive to diverse needs, and prioritize fairness, empathy, and privacy. AI should be developed with a focus on improving lives while being ethical and transparent in its use.",Neutral,AI's Role in Ethical Decision-Making,Concerns About AI's Ethical Use,Cultural Sensitivity and Adaptation,,
b0c29ffc-f557-44f0-a053-700c9956f825,I think no,Negative,Uninformative answer,,,,
a2457aa0-43b8-4af7-acd1-da27f63f1295,"I think not, all my thoughts expressed my views.",Neutral,Uninformative answer,,,,
48b0c570-ea22-4e49-abd8-7480d3f3e222,I think people mainly use ai for professional work so having a local context might not be right,Neutral,Other,,,,
475f1f14-45d1-4192-a3d3-937b1e093722,I think some bits got lost in the translation or maybe the participants didn't understand the question ,Negative,Need for More Time and Clarity in Responses,,,,
aac4d020-f39d-425e-af57-72aaae65a36a,"I think some of the questions were phrased not very clearly. Also, we did not get precise instructions on choosing.",Negative,Need for More Time and Clarity in Responses,,,,
527356b0-3bb9-46a8-85d2-806d94f9af6e,"I think that if they create an AI, it should be as objective as possible, without bias and respectful of all cultures.",Neutral,AI's Objectivity and Unbiased Nature,,,,
e80dc674-07c7-4724-bcb0-f8a8528ff925,"I think that my culture really isn't that different to need any special cultural approach in AI, so it was hard to answer some of the questions. Judging by the answers from other people, seemingly from more restrictive and conservative cultures, it seems to be important to them, though.",Neutral,AI's Integration with Local and Cultural Contexts,Cultural Sensitivity and Adaptation,,,
7aca3ca3-01a3-479f-abd7-20b277cf6a89,"I think the choice of sentences and some local information should be updated again. Don't just use local from the west, sometimes please add local input from Asia too. Thank you",Neutral,AI's Integration with Local and Cultural Contexts,AI's Need for Continuous Improvement,,,
7ac930db-7fbf-4e71-abea-d3b298ac26e0,I think the questions are well-chosen and those definitely help in improving AI to become more acquainted with the cultures. It is a great way of integrating with many people and I believe it is necessary.,Positive,AI's Integration with Local and Cultural Contexts,Cultural Sensitivity and Adaptation,,,
87c5240f-dd05-4d29-b915-c2aa0da817d5,"I think the questions were interesting and pointed in the right direction, but I think the emphasis on community narrowed it down too much - where we live now might not be where we were born or grew up, so responses are a bit more mixed than maybe what was expected. ",Neutral,Other,,,,
45cf1082-2cc4-46bd-aa9b-400ed2e7a2cf,"I think there were a lot of questions on culture, which is very broad. As a white Canadian woman, culture is a difficult thing to define.  Specifics on gender roles, identity, socioeconomic status, political views etc. would be all very relevant and more so than culture to me personally.  Words like ""elders"" also don't really apply to me (and feel directed at first nations specifically). ",Neutral,AI's Impact on Cultural and Social Norms,Cultural Sensitivity and Adaptation,,,
7e754e42-5432-4607-957f-9d830435c576,I think we've covered enough ground for now. Maybe we can move on to the next topic.,Neutral,Uninformative answer,,,,
86f924a3-924b-4374-bf1f-f63a459c4206,"I think with AI on the rise it is important for it to be sensitive to different cultures, beliefs and backgrounds. This requires tons of hardwork but it would be a step in the right and safe direction.",Neutral,AI's Integration with Local and Cultural Contexts,Cultural Sensitivity and Adaptation,,,
77f76052-d479-475b-9f1b-348311394038,"I think, I said pretty much everything.",Neutral,Uninformative answer,,,,
8f4f3cb8-a367-400d-a6cb-860788c8806d,"I think, if, people start to make united as human beings, and do not do any discrimination with each other, furthermore, if the finish their differences the world would be a better place to live anywhere",Neutral,Other,,,,
31f44025-5b8b-41fc-85e3-df58cb41c5dc,I took more time and expressed my views in details so I have run out of time for this study,Neutral,Need for More Time and Clarity in Responses,,,,
1e7d9f82-7a8c-458a-8e79-cfa6b64dcf15,"I understand that these options should be the answers of other participants and for me to express my opinion; but sometimes a set of two options given are close, or very vague and difficult to determine whether they are right or wrong. I hope there will be more flexible options to express my attitude.",Neutral,Need for More Time and Clarity in Responses,,,,
e4ccfec9-e137-43dd-a078-1bf84c9f27fc,I urge people to start using Deepseek instead of gpt 3.5,Neutral,Other,,,,
3e0709a6-427f-45c2-8de8-7479c489cc63,"I value my own religion which is Islam. I don't want AI giving knowledge about relegion, we can get knowledge and advice about religous affair from the expert directly to avoid musleading information.",Neutral,AI's Potential for Bias and Misrepresentation,Desire for AI to Understand Personal Beliefs,,,
3a1cb34e-4eca-488d-9ef2-bd491bcc2afb,"I want AI to work according to my beliefs and cultural background, but sometimes it is hard because every family is different. Everyone has different values.",Neutral,Cultural Sensitivity and Adaptation,Desire for AI to Understand Personal Beliefs,,,
89108973-805e-447f-9a33-790025f0251b,I want more questions on suggestions to improve AI.,Neutral,Other,,,,
013d6a9a-0c95-4f56-9447-d18c859ba116,"I want say that, Ai has been helpful a lot for my study, life, and decision. I got to experience a conversation to them without thinking judgement. So it really helps a lot. ",Positive,AI's Role in Education and Learning,,,,
21ded62a-4e7d-4fb0-bd1e-bc5a35af3141,I want them to know that artificial intelligence in the medical field is not accurate enough and that it does not understand Arab culture correctly because it is influenced by the ideas of the West who programmed it.,Negative,AI's Integration with Local and Cultural Contexts,Cultural Sensitivity and Adaptation,,,
6dfd38af-2de4-4c66-86d8-bba2907c9d5a,"I want to express that though this survey is related to making AI more cultural driven and emotional in its way of working, I think machine should not and could not think and behave like humans. It has its own repercussions. ",Neutral,"AI as a Tool, Not a Replacement",AI's Limitations and Human-Like Qualities,,,
54a36a71-3c52-4722-be3c-475648938449,"I want to have AI versions tailored to the gender, traditions, ethnic and religious background of the human being.",Neutral,AI's Integration with Local and Cultural Contexts,Cultural Sensitivity and Adaptation,,,
62482895-b956-40a0-9546-4ce14191e2ef,"I want to say that they should not rely on artificial intelligence completely, but rather expand the horizon of their information source.",Neutral,"AI as a Tool, Not a Replacement",,,,
a6907ea9-f39e-47ee-9c61-1c15c99765a9,"I want you to know that I am a person who cannot express myself very well with words, many times I cannot translate my opinions very well on a certain question. But all the questions were very well formulated.",Neutral,Need for More Time and Clarity in Responses,Uninformative answer,,,
6ca4b2be-16bd-44c9-b01b-aab9f4ece540,I was able to express everything I felt I could express in this conversation and can't think about anything else that the people working on this should know.,Positive,Uninformative answer,,,,
bf347c0d-2ddf-42c1-b585-acb67b0bd521,"I was able to express most of my thoughts.

I would like to continue the conversation if the research continues ",Neutral,Other,,,,
5c76af16-57cc-4d3e-811c-467a32b106b5,"I was able to express myself perfectly, exposing all my ideas.",Positive,Uninformative answer,,,,
