Category,Tag 1,Tag 2,Tag 3,Tag 4,Tag 5,Tag 6,Tag 7
Adaptability to User Needs,Adaptability to user needs,Work with provided information,,,,,
Analytical and Creative Balance,Analytical and creative balance,Analytical focus,Analytical for data-driven tasks,Analytical for problem-solving,Creative focus,Creative for brainstorming,Creative for innovation
Clarifying Questions,Ask questions for clarity,Clarifying questions,,,,,
Context-Dependent Traits,Challenge ideas when necessary,Context-dependent traits,,,,,
Supportive and Challenging,Balance of support and challenge,Challenge ideas constructively,Provide support primarily,Support with constructive feedback,Support with factual information,Supportive and challenging,
Uncategorized,Other,,,,,,
,Uninformative answer,,,,,,
