Category,Tag 1,Tag 2,Tag 3,Tag 4,Tag 5,Tag 6,Tag 7,Tag 8
Analytical and Logical Approaches,Breaking down complex problems into smaller parts,Evaluating pros and cons of solutions,Focusing on root cause analysis,Gathering and analyzing data,Utilizing logical and critical thinking,,,
Community Engagement and Collaboration,Addressing issues through democratic processes,Community discussions and meetings,Delegating tasks and responsibilities,Ensuring transparency and open communication,Incorporating diverse perspectives,Involving local leaders or authorities,Prioritizing consensus and collaboration,
Consultation and Expert Advice,Consulting elders or experienced individuals,Relying on legal systems or courts,Seeking expert advice or professional help,,,,,
Cultural and Ethical Considerations,Balancing practicality with ethical considerations,Considering cultural values and traditions,Considering long-term impacts and sustainability,Emphasizing empathy and respect,Encouraging patience and thoughtful reflection,Maintaining harmony and social stability,Prioritizing the common good and social welfare,Using past experiences and historical models
Innovation and Creative Thinking,Engaging in brainstorming sessions,Fostering innovation and creative thinking,,,,,,
Practical Implementation and Feedback,Implementing solutions with feedback loops,,,,,,,
Resource Utilization and Adaptation,Adapting solutions based on available resources,Utilizing technology and online resources,,,,,,
Uncategorized,Other,,,,,,,
,Uninformative answer,,,,,,,
