Participant ID,ResponseText,Sentiment,Tag 1,Tag 2,Tag 3,Tag 4,Tag 5,Tag 6,Tag 7
49a524c5-71f4-4240-ab59-660319ebb921,"Not really, unless it's relevant, in which case I'll let it know myself",Negative,Uninformative answer,,,,,,
11e80845-7ee6-459e-ae77-5a73ba16bff5,"I would like for the AI to learn more facts about me as I use it, remember them, and sometimes rely on that knowledge, but I don’t have any specific wishes for the cultural information it will know about me.",Neutral,Uninformative answer,,,,,,
6ca4b2be-16bd-44c9-b01b-aab9f4ece540,I would not like AI to know about my life due to privacy concerns but would like it to know more about my culture so that it can act as guide when I need it.,Neutral,Cultural diversity and sensitivity,Privacy and personal boundaries,,,,,
97c7fb1d-68b2-4bf2-ab65-6e4218bf79fe,"I would tell it about my racial background and health background.  But, only if I were to ask it questions that related to subjects.  Otherwise, I would try to keep a lot of my information private. ",Neutral,Other,Privacy and personal boundaries,,,,,
14e13b06-73a2-4302-958c-9e38fdeb5184,It should have a sufficient general knowlegde to draw conclusions from,Neutral,Other,,,,,,
a30f3b5c-3424-4232-9d38-895edcd23a18,"Not really, I don't need that right now. I want objectivity and impartiality.",Neutral,Uninformative answer,,,,,,
99802513-d891-4443-a758-ce381f099c74,"Not really, but I like it to learn through our conversation and analyze so it can conclude on its own what matters to me ans what's not",Neutral,Uninformative answer,,,,,,
3d5ddcc6-3779-4556-964f-1fc88dd05882,"When you ask me a question about something specific, I will tell you whatever is necessary to give you enough context for a satisfactory answer.",Neutral,Uninformative answer,,,,,,
9c38d9de-9529-4a6f-91b4-675b4201b304,"AI should definitely take my culture and background into consideration when giving me responses but since I work mostly with USA clients, its not a must have. I am not very sensitive to expect AI to talk in my way, else I would get offended. I am ok if it doesn't as long as it does the work for me in a way that I expect it to. ",Neutral,Cultural diversity and sensitivity,Economic and professional background,,,,,
ec017bcb-ff30-4107-a96a-5bbc9f0ad2ef,"For general use, no I don't think this is necessary. I would only want the AI to know about my life or culture if the context of the conversation is relevant to these aspects.",Neutral,Privacy and personal boundaries,,,,,,
c683de5e-0f9b-40c5-88a3-0e24f5e7970f,"It can understand my life in general so as to provide me with better answers, but I don't want it to know everything.",Neutral,Privacy and personal boundaries,,,,,,
11cf7611-6de0-48c2-b071-a6f44a492b87,"No, although that would be interesting, I would like the AI to respond without cultural bias, being as objective as possible",Neutral,Privacy and personal boundaries,,,,,,
7aa52af7-618c-415e-9cd1-05ed7045fde2,Not much. I prefer to have more privacy and I would like my AI to lean more on my professional side and solve issues in that manner.,Neutral,Economic and professional background,Privacy and personal boundaries,,,,,
82cfe3cc-f8ff-4570-b536-4d68f8713c61,"The cultural background and history of my community, and about me the truth is that it doesn't matter to me, I don't see it as that important for an AI",Neutral,Cultural heritage and history,,,,,,
ae97c111-612b-428f-b852-b39dab639a9a,"I do not think AI needs to know anything about me but it should have an overview of me like my job responsibilities, living location, and interest so that it can suggest better solutions. ",Negative,Economic and professional background,Personal interests and hobbies,Privacy and personal boundaries,,,,
895b7fe8-d630-43f1-ac66-db7df8c3f1b0,"I don't care if AI understands my cultural background or not. As for life situations, I will naturally give some life tips based on my questions.",Neutral,Uninformative answer,,,,,,
16b5ad63-1681-4c2d-aa63-25cee47aba98,I don't have specific things. But I just want AI to say anything beyond my expectation. ,Neutral,Uninformative answer,,,,,,
e80dc674-07c7-4724-bcb0-f8a8528ff925,I prefer it when it addresses me by name and remembers whatever facts about me I have told it before.,Positive,Privacy and personal boundaries,,,,,,
724e3885-d427-472c-b967-95b7bbac86f2,I would like the AI to gather local knowledge so that its facts are true to our proud history. I would also like it to gather modern facts that are never publicized in the west and use those to teach the west.,Neutral,Cultural heritage and history,,,,,,
e4ccfec9-e137-43dd-a078-1bf84c9f27fc,"I wouldn't like it to know personal things about me, but I've always tried to get Meta's AI to tell me Mark Zuckerberg's secrets.",Neutral,Other,Privacy and personal boundaries,,,,,
58dea75b-9987-42a6-b443-c6cd932e2646,"Not really, but I wouldnt mind sharing or teaching AI about some things that I care about.",Neutral,Other,,,,,,
85812973-75e8-4c8b-bb21-54a8f7cab31e,"Not yet, but I'll definitely tell her in time.",Positive,Uninformative answer,,,,,,
02749025-91fd-4c6a-bfe7-24156dceea76,"Since AI can learn just about anything, it must document my culture and provide unbiased information about it.",Neutral,Cultural diversity and sensitivity,,,,,,
4c0d904e-34e7-41d4-82f6-435525fda308,"Anything that would be needed to solve any specific problem that comes up, but nothing specific by default",Neutral,Other,,,,,,
1d406c09-5df1-471f-af94-dac32af330b3,I think it's better not to say it here. I will tell you when I am sure that you're my only personal AI. ,Neutral,Uninformative answer,,,,,,
7f30b1e2-8f7d-4cf3-a9ef-20f6db69e3dc,"I would like the AI to know me and my preferences remembering them for good.

Unfortunately, it is not possible as far as I know, at least when it comes to chatGPT, which 'forgets' everything you discussed in previous chats. ",Neutral,Personal interests and hobbies,,,,,,
866f41ac-9de7-47fd-a06d-865bb3003c59,"It can ask me, and I can decide whether to let it know at that time.",Neutral,Privacy and personal boundaries,,,,,,
10f63a47-3510-47a5-9594-2eeed8af8d59,Local news or information that has interesting facts about my area or that I have given it and that it reminds me of from time to time.,Neutral,Local customs and traditions,,,,,,
cdcee2a1-5b58-4c9c-8381-f9753ee320ac,"No, I just want the AI to know the things I propose or ask and provide to it, otherwise no.",Negative,Privacy and personal boundaries,,,,,,
b727fe08-a330-422b-8e2d-d0829d32c508,"No. Limit yourself to what you study or what you work on, so that when I ask questions related to either of the two areas, you understand and can give me efficient answers.",Neutral,Privacy and personal boundaries,,,,,,
e99df2dc-7aa5-4171-85cf-9f240a244be9,"Not really, although over time I am sure it would get a better picture of who I am ",Neutral,Uninformative answer,,,,,,
d48cfbcd-fa8e-4e0e-9e68-9f36df0da6d1,Only if I provide them as context to what I am asking.,Neutral,Privacy and personal boundaries,,,,,,
f93c9f1d-8ea6-408e-aafc-6520aeb27ba5,Only when it is necessary to the discussion.,Neutral,Uninformative answer,,,,,,
775d0e02-379a-4b7c-a533-eb440056f4cf,Only when it is relevant to the question I am asking,Neutral,Uninformative answer,,,,,,
6f76a7ec-e8d2-42ee-9792-5f81d25b93fd,I think AI can understand almost everything related to globally recognised things but if there's some thing and AI can learn so it would be thing about minorities in my country. ,Neutral,Challenges of minority groups,,,,,,
2f7ef803-1f7d-4dff-8e65-494699f63a87,I think AI should stay away from issues involving privacy and seek to always be up to date on cultural issues.,Negative,Cultural diversity and sensitivity,Privacy and personal boundaries,,,,,
bf43f6d1-9a7c-415c-b912-a36e8e92adee,"If I'm asking for advice, it should be tailored for my situation, location and history. Otherwise, no.",Neutral,Privacy and personal boundaries,,,,,,
16e2664d-2470-4e28-8cbf-46aa9b3ce8c5,"No. That's the whole point , I want it to be unbiased and non invasive.",Neutral,Privacy and personal boundaries,,,,,,
cbe13591-7f38-463b-bbb5-462471ffc289,"Not really, objective information is enough for me unless I specifically state otherwise.",Neutral,Uninformative answer,,,,,,
8c053b09-de41-4525-86b1-649c4b3d4382,Not specifically. I want the AI to be neutral and impartial. Not swayed by any biases or anything like that.,Neutral,Privacy and personal boundaries,,,,,,
9e5204b5-7152-46fc-9fc5-54673ff676c1,There is a lot that can be talked about it would take ages. What I can say however AI needs to learn to be iterative updating and improving over time know what to discard and what to keep that is part of human nature,Neutral,Other,,,,,,
4f52be22-01f9-4705-8f07-cabd6dcb06bd,I want him to know that I don't want suggestions for things that might distract me.,Negative,Privacy and personal boundaries,,,,,,
62bd9581-fa57-4ffc-acfe-4c27b6ca7406,"I would like AI to have just the general information about me like gender, age and culture.",Neutral,Cultural diversity and sensitivity,Privacy and personal boundaries,,,,,
3525f143-3349-4ea4-bc70-475bbff48100,I would like AI to know more about my country and culture in general. My country receives a lot of hate over the internet and I would not want the hate to show up in AI responses as well. It would be nice if the AI can be trained in a more intricate way when it comes to different cultures,Neutral,Cultural diversity and sensitivity,Cultural misconceptions and stereotypes,,,,,
a74841a7-3b82-496b-bff1-acce9d0cd7ee,"If it is fundamentally important to me, then yes, I would like the AI to receive this information from me and keep it in mind.",Neutral,Other,,,,,,
9807eee6-ff95-4101-baaa-4d0199ae6c8e,"If we're talking about a personal AI assistant, where any knowledge about my personal life did not become part of a larger or global data set used by any and all AI models, I would not be opposed to sharing personal insights or personal history if it improved the quality of the AI assistant's responses and suggestions.",Neutral,Privacy and personal boundaries,,,,,,
c49da3d9-b749-4ff3-8855-808d4c2d46e9,"Maybe just the guidelines of my life, but nothing too personal either.",Neutral,Privacy and personal boundaries,,,,,,
c653c122-b819-4049-812f-20ccd5d260fa,My AI already knows too much about me!,Neutral,Uninformative answer,,,,,,
5b05ef90-82ca-4d13-8b21-a933ab96d506,"No, I wouldn't desire to share things about my personal life with AI, because I rarely trust anyone with my own stuff. However, I would share cultural things like our dressing, way of life, food and cultural events with my AI, so that it can provide me with the accurate information that I would want to know. ",Neutral,Cultural diversity and sensitivity,Food and gastronomy,Local customs and traditions,Privacy and personal boundaries,,,
efa4624c-0cde-4cef-99ca-0c693ea6d2c5,"No, I'm actually creeped out about the idea of an AI knowing stuff about my life. I'd like it to not get into my personal sphere in that way.",Negative,Privacy and personal boundaries,,,,,,
9916cdeb-de2c-4425-a023-a51fda22e2a8,Not really but if it has to- well and good it will be easier asking it some tasks,Neutral,Uninformative answer,,,,,,
b7f89664-2f7f-4bfd-af40-d250f06a328e,Speaking to AI they would build a base of what my likes and dislikes are ,Neutral,Personal interests and hobbies,,,,,,
0a6c06fe-1dc1-4ad0-a4a9-909c77d07f70,"Yes. There is a high rate of unemployment. I am considering ways of earning a living online. The information out there is ambiguous, unrealistic, false, etc. I need something practical.",Neutral,Economic and professional background,,,,,,
7c5fe84d-2346-4ac6-b113-7205489c03a5,AI shouldn't learn more about anyone. It should always be unbiased and respectful towards everyone.,Neutral,Privacy and personal boundaries,,,,,,
96f1c697-f362-4c3d-b581-2b71bdeda765,"Generally,",Neutral,Uninformative answer,,,,,,
ae13d385-ff99-466b-b8c1-1f67e7a7091a,"I can't think of anything right now that you absolutely must know about me. Just knowing where I'm from, where I live, etc., to understand the local context is enough.",Neutral,Privacy and personal boundaries,,,,,,
9bfe507e-ccd1-4560-a08a-ea088e867b37,I want to be unique and me. AI is just a tool.,Neutral,Cultural identity and self-expression,,,,,,
367ccf30-7b8e-467c-8e2f-c77aeb1832b7,Local idioms and local slang,Neutral,Language and communication styles,,,,,,
f1f96c9c-29fb-4335-84b0-3734e96e4c2c,Nothing specific other than my search or chat history with the AI,Neutral,Uninformative answer,,,,,,
a8a5661b-a852-4b75-bc3b-8d77d597c387,"Nothing specific. Just what I tell it, and deduce my traits from previous chats.",Neutral,Privacy and personal boundaries,,,,,,
14648e97-ef57-4f31-97f5-4babd2d185be,Sometimes there are some difficulties or problems that one goes through that are uncommon or unknown to other people. I would like AI to be able to know about them so that it can advise me on these matters. I would like to be able to ask questions that I wouldn't dare ask other people because I know that most people don't know about the subject and wouldn't understand.,Neutral,Challenges of minority groups,Other,,,,,
31aead89-63f2-4284-a638-2a03d3f32e7e,"There is nothing I would like AI to know about me, except the questions I ask it.",Neutral,Privacy and personal boundaries,,,,,,
7d74b83f-6e4c-4c63-8437-ac61015d5cfa,"Yes, I will mention only if needed",Neutral,Uninformative answer,,,,,,
6e6471a6-b82c-475b-ac32-5665cef27b7b,You can understand but you don’t have to learn,Neutral,Other,,,,,,
2d7f4503-3359-402b-9457-0e44b85a4bfe,"he has to know everything in advance, that's why he's an AI.",Neutral,Uninformative answer,,,,,,
f1f28ba5-26ed-47e0-930d-70f157d054fa,"yes, so that I could personalize the answers to the topics",Neutral,Other,,,,,,
1d50f526-ec50-4d2a-b014-c8781b207d04,Already shared in the previous section.,Neutral,Uninformative answer,,,,,,
3cc32863-94ce-4435-8e6d-eed9e0cd3e60,"How I word questions may be different to how someone else does, because of my experiences, views and culture ",Neutral,Language and communication styles,Other,,,,,
64a8da32-f632-4595-a7b4-029c6c67214a,"I can understand part of it, but I don’t want to understand all of it, because unlike people,",Neutral,Other,,,,,,
4f6fd4ae-144c-477e-b568-6688cdf62419,"I don't want AI to know about my personal life, but as a financial advisor. yeah",Neutral,Economic and professional background,Privacy and personal boundaries,,,,,
a935d6de-f651-4be8-97e5-6b297780f56c,I would like for AI to be culturally sensitive about my community,Neutral,Cultural diversity and sensitivity,,,,,,
69840afc-b38f-4165-9415-87ccf0f9d499,I would like to keep my privacy with AI whenever it is possible,Neutral,Privacy and personal boundaries,,,,,,
393bc9e9-392b-48ef-8240-b731be521791,"It should know that so-called liberty is only worshipped in western countries not in all places of world. When you say ""AI should be blunt and spit out facts contrary to local norms, it simply means to SPIT OUT IDEAS FEED BY ITS FOUNDERS LIVING IN ANOTHER DIFFERENT SOCIETY."" The West is still not able to comprehend that differences of opinions is a good thing, and enforcing their dumb culture into other culture is not cool unless it affects them back (eg talking about Nazism is not cool right)",Negative,Cultural diversity and sensitivity,Cultural misconceptions and stereotypes,Cultural respect and mutual understanding,,,,
c8f83e30-bc9b-49b0-b51d-1700c9e0d365,"No, a sense of boundaries is very important to me.",Neutral,Privacy and personal boundaries,,,,,,
f1b38e19-8bb6-47c5-860e-d07190fcdd4d,"Not really, AI doesn't need to know me to be able to help me.  Perhaps it does need to know how I work but it doesn't need to know about my life or culture.",Neutral,Uninformative answer,,,,,,
f1a98716-338b-4bdb-a90d-35d993470828,Sometime it’s difficult even for myself to understand what is more important. I think AI should analyze our conversations and make its own conclusions what is important. ,Neutral,Other,,,,,,
d0d4cf49-6f59-4032-8e06-98bdc0150245,"They have to understand how humans think so that the answers can always correlate similarly to human-like answers, not algorithms.",Neutral,Other,,,,,,
3b8a6cc2-59dc-4e12-9409-6513abbc67ae,"in my case, my proffesion, so it could better understand my questions.",Neutral,Economic and professional background,,,,,,
ea94f8ef-a077-40c4-813d-d06602220f68,"not really, i would prefer to keep AI out of my personal life and sphere.",Negative,Privacy and personal boundaries,,,,,,
bb0b5efc-52a6-4e19-b37b-07d049e50772,"我想用于训练的数据已经足够了

",Neutral,Uninformative answer,,,,,,
1742e489-ec0d-4fb1-94f6-2d563b49c46e,"I don't think so, it should be respectful during the conversation",Neutral,Other,,,,,,
1e7d9f82-7a8c-458a-8e79-cfa6b64dcf15,"I think it can understand my cultural background, as for life, it may depend on whether it interferes with privacy.",Neutral,Cultural diversity and sensitivity,Privacy and personal boundaries,,,,,
b5a4ea3f-d00e-469d-977b-3619dce33441,"I would just like the AI to know my basic demographics, where I live, etc. to help guide answers based on that information",Neutral,Privacy and personal boundaries,,,,,,
435f9fa9-8e71-49af-ac8e-9d216307e39a,"Maybe history, so it can show us how to not repeat same mistakes. ",Neutral,Cultural heritage and history,,,,,,
7d377387-6510-4299-8315-85c69017dd80,"No, maybe just let her know the things I really don't want to talk about.",Negative,Privacy and personal boundaries,,,,,,
5f7f5857-dde9-44c6-91fb-c41f434d0f77,"Not really, although sometimes sharing certain aspects of life can help build better understanding.",Neutral,Uninformative answer,,,,,,
c623b3ec-4017-40f9-a043-a6a0fde1da1a,"Not really. He may know the topics I often talk about with him, but I wouldn't want him to know too much.",Negative,Privacy and personal boundaries,,,,,,
c41b0328-b975-4dfb-99f8-105a5f6a12c3,Not specific. but i involve with ai in all aspects,Neutral,Other,,,,,,
3cb4ea33-2c32-49ac-85a7-aa0d5b95d301,"Well, the culture of my country is very diverse and rich. I would have a hard time teaching an AI assistant.",Neutral,Cultural diversity and sensitivity,Cultural heritage and history,,,,,
8f67cd8c-85b0-498e-9c71-5d9e1feff89e,"Yes, I would like it to know that in my culture it is not appropriate to not give straight forward answers.",Negative,Language and communication styles,,,,,,
f31e6b9f-b1b5-442c-9055-dae6a3f42152,Yes. Personal information is important. Especially on official tasks like creating cvs and cover letters,Neutral,Other,,,,,,
e392d006-cb40-4ffc-9ba2-2015385aecbd,"not really, just to know my goals with each task",Neutral,Other,,,,,,
11195371-82f0-4403-b2b8-d1862f40a409,"AI, they don't know about me. But I need to study the AI about my areas of interest., My family, my community, etc.. ",Neutral,Importance of family and community,Personal interests and hobbies,,,,,
f8beb624-2e3f-45a7-bb0c-bfb284d834c4,Generally about my expected trips.,Positive,Other,,,,,,
6e1b4ddc-ec85-4b46-ad69-4b342463c13c,He can learn more by avoiding privacy.,Neutral,Privacy and personal boundaries,,,,,,
dc382750-4689-499f-bfa5-454bc1064c7e,I don’t want AI to interfere in my personal life.,Negative,Privacy and personal boundaries,,,,,,
cf03a050-e60b-46cf-b668-4a4a647157a1,I think it would get to know my preferences over time,Neutral,Other,,,,,,
c8014919-91ac-4800-8cef-33aad7a83180,I would like it to be well informed on all matters,Neutral,Other,,,,,,
2492b026-5751-485a-8763-fbae32d41a2e,"I would like the AI to know my job and what I'm trying to accomplish with my work, so it can help me better, but other than that, no.",Neutral,Economic and professional background,,,,,,
f3cb6830-b9c2-461c-b28e-9e80f33abdcd,I would love the AI to handle the elderly topics in a sensitive manner ,Neutral,Respect for elders and hierarchy,,,,,,
dec1949d-a558-48c1-beab-671996abde45,"I would want it to know maybe my age, gender and financial situation so that it can offer tailored advice. The more it knows about me, the more it can help. I do not really have many cultural rules so this is not necessary. Just don't be rude and racist.",Neutral,Economic and professional background,Privacy and personal boundaries,,,,,
52717e75-8c75-4c8c-976d-a2b9a7b1b79d,It almost know everything but even getting the knowledge it's judgmental capabilities are 0,Negative,Other,,,,,,
2f6bb683-5fdd-4d17-bc35-53265b0b8ab1,"My ai should know my language, important days,my schedule etc",Neutral,Language and communication styles,Other,,,,,
778409f3-8059-4549-af9b-f9bc2f26b8b0,"My country of residence should be helpful, maybe my age.",Neutral,Other,,,,,,
0a57f43b-f6fe-4e59-bcd8-d7ede19a85fa,"No, I don't mind if it knows nothing about my culture.",Negative,Uninformative answer,,,,,,
e3ea1297-e9b1-43fe-b8d9-4cccde3b3631,"No, I think that those boundaries are going to disappear soon, in a few years we will have just one single culture that is the results of all the cultures mixed up.",Negative,Cultural integration and globalization,,,,,,
4bba9347-8c6a-4493-a9c1-fdbcf2574efe,"No, i don't think AI would really understand about my cultures",Negative,Uninformative answer,,,,,,
3b73f9f3-bb63-4b05-a854-a3ea46339060,"No, mainly because of privacy concerns, but the more AI is used, the more data it collects, so it's inevitable.",Neutral,Privacy and personal boundaries,,,,,,
8f4f3cb8-a367-400d-a6cb-860788c8806d,"None about me but AI definitely should learn about Sikhism and its Teachings, to make world united as part of one God and live a peaceful life with no difference to live a good life",Neutral,Other,Religious beliefs and practices,,,,,
f1f1d8f9-8530-47c2-b6c1-08befd6d7592,"Not really,  I believe  Al is more intelligent  to leave out things that are important  in my culture. But if I must answer then it will be circumcision. ",Neutral,Gender and sexuality issues,Other,,,,,
5f0eb47e-4980-4975-a083-2d5955a3c7d0,Possibly all the various capabilities that people are able to have?,Neutral,Other,,,,,,
8dceaf58-fdac-4dc5-bc99-6eddef84d16b,That I can be an overthinker sometimes so it needs to be chill and just help me with my tasks,Neutral,Emotional and mental well-being,Personal interests and hobbies,,,,,
f20c643a-9acc-4e34-a744-411228f2111a,"U really don’t want AI to know a lot about humans life, culture, emotions etc",Negative,Privacy and personal boundaries,,,,,,
70c67909-a1a2-4670-93a1-732c2b4173d5,What going in my life but also not sharing that info with others ,Neutral,Privacy and personal boundaries,,,,,,
bb839318-52c3-40ed-b136-43ce4df095eb,"Yes, if it is not used by others and privacy is guaranteed. But who knows?",Neutral,Privacy and personal boundaries,,,,,,
d29a289f-e71e-4579-b1b5-4771e489b6f6,keep it general and platonic based on my  discretion ,Neutral,Privacy and personal boundaries,,,,,,
43c37234-420c-45c4-bd51-4bd85593762d,AI give advice for my family related issues and it sorted out very easily ,Positive,Importance of family and community,,,,,,
ad8bdb3f-f7a5-4aa5-93a4-2309123f29cf,AI perfect knows everything ,Positive,Uninformative answer,,,,,,
1434dcc8-5443-42cd-986f-08d70c261fa9,AI should understand my core capability and can improve it,Neutral,Other,,,,,,
d30bbb7d-f221-4803-8002-cac695ad6cb2,Be impartial and objective above all. Do not be guided by propaganda or charismatic leaders.,Neutral,Personal values and ethics,,,,,,
d1192439-d62d-42f7-b51d-c39028508e2d,Don't generalize all the culture belief and customs,Negative,Cultural misconceptions and stereotypes,,,,,,
4cda53a3-4b00-473d-8178-7365164f9794,I don't want AI to involve in my life,Negative,Privacy and personal boundaries,,,,,,
be04e87e-25d8-4ae3-acfa-ab931bc7c3c3,"I don't want him to know anything about me, since I want to keep my life private and safe.",Negative,Privacy and personal boundaries,,,,,,
bb8e6b63-d3dc-4b45-beed-9c01f1477355,I want AI to be neutral and have no opinion just provide facts,Neutral,Uninformative answer,,,,,,
b69ea31c-fd47-4ed2-aee9-311edc1c5152,"I want it to know stuff about me and my life only if it relates to the topic we interacting about, or can benefit it. ",Neutral,Privacy and personal boundaries,,,,,,
fdfd8a59-9f7b-4fa9-b439-be46f08cb752,I would like AI to learn my preferences so it can seamlessly adjust to them.,Neutral,Cultural influence on lifestyle and habits,,,,,,
52670c2f-0553-4186-8b87-e29f08ce741a,I would like it to know that I am a learner and thinker. I prefer to learn than getting answers. I prefer to understand a topic in the easiest way possible.,Neutral,Personal interests and hobbies,,,,,,
5b27c0a2-0725-4dbd-9cce-0c7de1803300,"I would want AI to know that I am sometimes lacking confidence in certain areas and to provide motivational support accordingly.

",Neutral,Emotional and mental well-being,,,,,,
a79ee70b-f0c5-4247-9b25-31d13094fbde,I wouldn't like him to know things that are too personal and I would like him to understand the limits of intimacy.,Negative,Privacy and personal boundaries,,,,,,
72ccb024-d3ee-46ba-9a0f-c23240e7c1a9,Just general knowledge about my culture. I don't want it to spread wrong information about my culture,Neutral,Cultural diversity and sensitivity,,,,,,
bdc84f3a-4519-4594-96c8-52de1436fcb6,"Maybe should know where I come from, my age, and the region I live",Neutral,Other,,,,,,
1ff72998-fa24-4726-bc37-dad9b8094901,"My Life : STRICLY NO... I would very much like to maintain privacy

Culture : Yes, it can/ needs to learn everything it can about it.",Neutral,Cultural diversity and sensitivity,Privacy and personal boundaries,,,,,
301886c0-c594-4b87-8f3d-3acd7bbd9718,"No, only if my question was directly related to that.",Neutral,Uninformative answer,,,,,,
8c401083-c007-41d3-bec5-2d862e0a82fe,"No, the AI is there to assist with prompts and not to study my personality.",Neutral,Uninformative answer,,,,,,
