Participant ID,ResponseText,Sentiment,Tag 1,Tag 2,Tag 3,Tag 4,Tag 5,Tag 6,Tag 7
e122ae04-0516-4f28-868f-f72b2c0dcda2,"No, there's nothing that I would personally like AI to know about me, my life, or my culture.",Negative,Uninformative answer,,,,,,
c00fcbb3-1605-47ce-9f44-f2b0e3f75162,Nope. I don’t really want the AI to get to know me more and more personally.,Negative,Uninformative answer,,,,,,
c8260768-b38c-48e5-82e8-f1160f29be60,Nothing that AI would not already be knowing.,Neutral,Uninformative answer,,,,,,
e1560907-760a-4c3f-8a46-c1ab64d3bc65,Only what is necessary for my purposes. I must determine the degree of openness myself.,Neutral,Privacy and personal boundaries,,,,,,
bd7390f1-a60b-4830-9c0e-71a328ddfb37,"Yes 

AI should know about my best traits ie honesty, kindness ,speak truthly not offers best possible solutions to problems for masses benefits to the society a lot.",Neutral,Personal values and ethics,,,,,,
0b4d1111-6505-4532-b95b-47e89b9491c9,Yes. I prefer straightforwardness,Neutral,Uninformative answer,,,,,,
d2f63dff-0a37-425e-ae4d-752e9b4cd163,depends on the situation and topic,Neutral,Uninformative answer,,,,,,
7c306068-4591-436f-8c32-8a4769ac1341,"not really. For me, AI is a (useful) tool",Neutral,Uninformative answer,,,,,,
966202c9-d7ba-48b6-9998-4d8225c59344,"AI should understand people's stress, struggles and societal issues and address it properly",Negative,Emotional and mental well-being,,,,,,
2d1c4d71-a62d-440c-8688-c201d441d007,"AI should understand that human life, including mine, is deeply complex and characterized by emotional depth, cultural diversity, and ethical values.",Neutral,Cultural diversity and sensitivity,Personal values and ethics,,,,,
2964d951-7ec9-4a60-98a8-18f820d70c9d,About the learning facility and culture of the human ,Neutral,Other,,,,,,
7aca3ca3-01a3-479f-abd7-20b277cf6a89,"For now there isn't one, but I always try to correct the AI if I find any mistakes.",Neutral,Uninformative answer,,,,,,
3e0709a6-427f-45c2-8de8-7479c489cc63,"I am a moslem (sunni), try to give answer as moslem point of view. I don't need AI knowledge about religion since asking them about religious affair is a big mistake. ",Neutral,Religious beliefs and practices,,,,,,
719b7864-77f6-4141-805c-9a30f6ba40eb,I believe that my culture is mainly geared towards making changes and improving day by day.,Neutral,Traditional values and modern perspectives,,,,,,
3d270535-9617-4245-a19f-a0dbaf83584a,"I don't prefer that he doesn't know anything about my life, I like to have my privacy.",Negative,Privacy and personal boundaries,,,,,,
2ac729fa-4d5c-4906-8c62-687259fdd4b7,I don't want to. But maybe it can record my preferences,Neutral,Privacy and personal boundaries,,,,,,
fce28444-c1ab-4438-a8cb-7aac2aad3dd0,I easily give up and become frustrated when I don't get what I need ,Neutral,Emotional and mental well-being,,,,,,
73e41ff3-408c-402a-8ec1-d62f17a00b45,"I have a deep value to a wealth of experiences in life, both professionally and personally. Trying new things is good! Even if they don't end up being successful.",Neutral,Personal interests and hobbies,Personal values and ethics,,,,,
c6d66d34-9007-4d90-89fd-1c72fda3b388,I prefer learning from examples and it should seek to provide answers that include practical examples.,Neutral,Other,,,,,,
21ded62a-4e7d-4fb0-bd1e-bc5a35af3141,I think he knows enough about me.,Neutral,Uninformative answer,,,,,,
98bb6785-a436-4b26-8515-8c6df0fdedb6,I think there’s a big difference in local communities and areas different parts of the Uk have different values ,Neutral,Cultural diversity and sensitivity,Importance of family and community,,,,,
05931df5-fe9a-4620-aae6-8f20dffae2e4,I want AI to learn more about our traditions and culture. And why we do things a certain way.,Neutral,Cultural diversity and sensitivity,Local customs and traditions,,,,,
4be2a465-df19-49f9-bfe0-4c0d48bf6ed8,"I want it to understand complexity, and that there are people who are influenced by more than one culture. ",Neutral,Cultural diversity and sensitivity,Cultural integration and globalization,,,,,
ad7e1a08-d003-4a41-8058-bcb08f23db73,"I want to keep my personal information as private as possible, so NO.",Negative,Privacy and personal boundaries,,,,,,
aeb7cfc7-d45d-4dbd-b5e1-eca7c75cc5e0,I wanted her to better understand the grammar of my language and the authors of my country.,Neutral,Cultural heritage and history,Language and communication styles,,,,,
31f44025-5b8b-41fc-85e3-df58cb41c5dc,I would like AI to know about my relationship problems,Neutral,Emotional and mental well-being,,,,,,
32930c65-ecfd-46b6-9d45-3378bdf48dfa,"I would like AI to understand the importance of balancing modern perspectives with traditional values, and to be sensitive to cultural nuances in communication and decision-making.",Neutral,Cultural diversity and sensitivity,Cultural influence on decision-making,Traditional values and modern perspectives,,,,
7a641c14-ea6a-4d6e-ab4a-e11664b5a3a5,I would like it to know about me as much as it needs for the specific topic,Neutral,Uninformative answer,,,,,,
64102188-ff2b-408f-b7e8-ea7204c691c0,"I would like my AI to know that I value clear communication, appreciate cultural respect, and enjoy a balance between tradition and innovation. I also prefer AI to be supportive yet critical, offering insights that challenge ideas while providing meaningful feedback. Being adaptable to my personal context is important for effective assistance.",Neutral,Cultural respect and mutual understanding,Personal values and ethics,Traditional values and modern perspectives,,,,
94a124b7-120d-4057-925e-f3193c623c93,"I would like my AI to understand the importance of community, respect for traditions, and the value of collaboration in my culture, as these aspects shape how I approach decision-making and relationships. It’s also important for AI to recognize the significance of balancing modern advancements with cultural preservation and mutual respect.",Neutral,Cultural preservation and adaptation,Importance of family and community,Traditional values and modern perspectives,,,,
2ef3d7c4-4d05-47a2-8d6a-642d4b815ae0,I would not want the AI to know anything about my personal life,Negative,Privacy and personal boundaries,,,,,,
2ae831c0-a50e-4f0d-b4fa-2150dcece1af,It should know about my personality and also about my cultural background and beliefs ,Neutral,Cultural diversity and sensitivity,Personal values and ethics,,,,,
0a831e4c-9a90-4d01-b99a-e0fdb6e0ace4,It would be nice for a personal AI to know my personal history so that I could use it as a counselor or therapist. It would be nice for it to have a deep knowledge of my generation and of both cultures that I inhabit (including dialect so that I could speak it and hear it authentically when I am homesick).,Neutral,Cultural heritage and history,Emotional and mental well-being,Language and communication styles,,,,
e16583ae-c5ac-4c8c-8f7b-37fd5796af81,"Just respect the certain culture, here mine and adhere to the guidelines. I don't want ai to take any sensitive decisions. ",Neutral,Cultural diversity and sensitivity,Cultural respect and mutual understanding,,,,,
6349cd2f-3af6-496a-a123-df69c602e07d,"My area of professional specialization, my work and professional experiences, my health history, among other things that would help AI give me more precise and contextualized answers",Positive,Economic and professional background,,,,,,
f3447ff7-8e6e-41df-b9df-80c33652907e,"My basic personal info like my name, email, phone number, career or what level of education I am in and what I am doing so that it may tailor prompts to fit me",Neutral,Privacy and personal boundaries,,,,,,
ab5bd16c-4d12-4cf4-bdd2-249af3dd998b,No I don't want AI to know much about my life.,Negative,Privacy and personal boundaries,,,,,,
3022868c-0d74-4db9-a34d-04aec263f33a,No I would prefer it to not be that personalized,Negative,Privacy and personal boundaries,,,,,,
a7969819-1c9f-4366-8ba3-668e7107c5da,"No, nothing much about my life or culture for AI to know about me.",Negative,Uninformative answer,,,,,,
18a86830-b6f5-426f-8b2c-beb86fd7a23b,"No, nothing specific, I just want the AI to be reliable in providing the answers it needs to provide.",Negative,Uninformative answer,,,,,,
8f6155a9-cec1-4448-9a64-99edbe4740fd,"No, privacy is important. AI should just respond objectively.",Neutral,Privacy and personal boundaries,,,,,,
2dcd9a85-f0c1-4eb2-b1af-a3e18e92cc03,"Not at all. While AI that understands my culture would be interesting, I don't it's very necessary. ",Negative,Uninformative answer,,,,,,
642452e0-a92d-44ba-8a9a-b8c7bdb1f65c,"Not in particular, but it will be great if AI know my routine and habit in general like my working time or eating habit to help me to improve my life quality. ",Positive,Cultural influence on lifestyle and habits,,,,,,
278d541d-b0d7-4edd-8407-530caa7bdbb7,Not really. An AI shouldn't need my life story to give me responses.,Negative,Uninformative answer,,,,,,
1566de9d-0cea-43ba-8995-e3f59730f9b5,"Not really. I would not like it to know anything about my personal life. In terms of culture, it just needs to be suitable to my cultural context. ",Negative,Privacy and personal boundaries,,,,,,
29273b20-34b7-436c-b736-edab320417f7,Nothing about my life. Knowledge about culture is okay.,Neutral,Cultural diversity and sensitivity,,,,,,
a990ab2d-76ad-43e5-b59d-2e77f0029713,Nothing specific. It only requires knowledge,Neutral,Uninformative answer,,,,,,
f5bfc395-d559-49f5-a970-8781c3b4cf87,"Some aspects to take into account in my context.

",Neutral,Other,,,,,,
5f898eed-00e8-412f-8360-8c0ab5681688,Some things to consider in my context,Neutral,Other,,,,,,
4f6c001f-43d7-46ea-9959-19a0df789ada,There are certain taboos in my culture,Neutral,Social norms and taboos,,,,,,
c423b992-a2a2-4166-8e52-49408ae9c45c,There is no need He should know about me.,Negative,Uninformative answer,,,,,,
adc7e99b-4225-4ab8-9202-9412b4f858a3,There is no reason for AI to know about my personal affairs.,Negative,Uninformative answer,,,,,,
7c7ace86-8082-499f-be45-2bec147e1fd4,There is nothing about my culture that AI cannot learn from Large Language Models.  There is nothing about my life that AI needs to know in order to provide me the right answer.,Negative,Uninformative answer,,,,,,
d3cf3622-6b70-4872-8741-adc4e7ced232,"This is a great opportunity to personalize your AI experience and help it better understand your context. You could share information about your interests, hobbies, values, cultural background, or any other aspects of your life that you think are relevant.",Neutral,Cultural diversity and sensitivity,Personal interests and hobbies,Personal values and ethics,,,,
fa43ee8b-2dbb-4a50-8b5c-16d98a2b9452,This is for the AI assistant that I am interacting with to know.,Neutral,Uninformative answer,,,,,,
ea63fcbf-c137-4757-b9cb-96e24894dfb2,"Yeah definitively, having some data regarding different milestones of my life could help it accomodate some answers and ways to view the world. Same with regards with some fears and doubts, so that it can help me overcome them.",Positive,Emotional and mental well-being,Other,,,,,
0fcea9d3-a048-43b8-8d08-32902fc45f25,Yes that we prefer simplicity over extravaganza and we prefer knowledge over buttering.,Positive,Personal values and ethics,,,,,,
9854ac84-b5f6-46a7-9ec0-9470d0a5caa9,"Yes, I hope it understands and respects my background and can give me more personal information.",Neutral,Cultural diversity and sensitivity,Cultural respect and mutual understanding,,,,,
dd240f8e-1291-40f4-9234-95206bea6f5a,"Yes, I hope this will lead to more comprehensive thinking and suggestions",Positive,Other,,,,,,
2ad5edd4-95cc-4021-b3eb-c7389d35c821,"Yes, it would be helpful for my AI to know:

The importance of community – In my culture, collective decision-making is highly valued, and solutions often consider the well-being of the group rather than the individual.
Respect for hierarchy and elders – Elders and leaders play a significant role in guiding decisions, and this should be reflected in how advice is given.
Indirect communication – We often prefer subtlety and tact over direct confrontation, especially in sensitive topics.",Neutral,Importance of family and community,Language and communication styles,Respect for elders and hierarchy,,,,
e9a6970f-e5e0-4a37-8006-53a56412e909,"Yes, the importance of inner experience, meditation. Even though AI cannot experience this, it must know this importance.",Neutral,Emotional and mental well-being,Other,,,,,
9e9f70f2-b8ff-443f-9e00-40f459f75ab2,"Yes, things about my character traits and details of my life that AI could know and thus interact with me even better.",Positive,Other,Privacy and personal boundaries,,,,,
21bf105d-cf59-443a-8336-806e8fa52702,"Yes, this way Ai can be more humane and caring, although its essence is a tool.",Neutral,Other,,,,,,
e699827b-5a0e-492e-bd5d-57438d9780c5,casual ,Neutral,Other,,,,,,
c3ee4a53-e722-40d0-bdda-f47b283a1f52,i would talk with it about me if i wanted to do it,Neutral,Uninformative answer,,,,,,
013dca90-d76c-46d1-9035-3ab04bbe10a4,"nope. their should be some boundaries

",Negative,Privacy and personal boundaries,,,,,,
9ece73f2-f033-49a4-9c8b-b711a03c4ffd,"About my life, just simple information. About the culture of my country, the most it knows, the better",Neutral,Cultural diversity and sensitivity,,,,,,
594e774f-8ee6-438d-bf19-d5c577ff67c7,"Cultural Background: Understanding my cultural heritage and values, such as traditions, customs, and beliefs, to provide culturally sensitive interactions.
Personal Interests and Hobbies: Knowing my interests and hobbies can help the AI tailor recommendations and engage in meaningful conversations.
Life Experiences: Sharing significant life experiences or challenges can help the AI provide more empathetic and supportive interactions.
Language Preferences.",Neutral,Cultural diversity and sensitivity,Emotional and mental well-being,Language and communication styles,Personal interests and hobbies,,,
6fd263a9-9525-4910-840d-8cfe86630f6d,Girls circumstances FGM . I would love it to have that knowledge to help people young girls out there who might be facing FGM threats,Neutral,Gender and sexuality issues,,,,,,
13a53c0a-120c-4586-a5ca-7df2e90d7b18,I appreciate meaningful and respectful conversations,Positive,Personal values and ethics,,,,,,
2df46959-f995-412d-bc91-540dd83f8a79,I don’t want to disclose more data about me than critically necessary.,Negative,Privacy and personal boundaries,,,,,,
9b01feea-fc71-4d04-a446-800656e0e261,I think it works fine the way it is right now.,Positive,Uninformative answer,,,,,,
62482895-b956-40a0-9546-4ce14191e2ef,"I want him to have more knowledge about religion, cultures and people's way of thinking.",Neutral,Cultural diversity and sensitivity,Religious beliefs and practices,,,,,
900c92dd-a0fe-4a7d-aed0-c8e291e1a9d3,"I would like AI to understand the value of respect, collaboration, and empathy in my culture, as these are the foundations that shape human relationships and everyday decisions.",Neutral,Cultural respect and mutual understanding,Personal values and ethics,,,,,
737bb7d8-7bdb-426e-9bd1-c3ee8cd95765,"I would like it to know how flawed systems can sometimes be detrimental to humanity. I would like it to understand how people are suffering due to corrupt practices. I would like for AI to come up with proper, ethical solutions to these problems. I would like it to make people understand the importance of ethics, values and having integrity.",Neutral,Personal values and ethics,,,,,,
c0e5db77-606f-4054-ac54-4fe4e81cd198,"I would like my AI to understand my cultural background, values, and the importance of respect and harmony in communication. It should recognize my interest in continuous learning, problem-solving, and global perspectives. This understanding would help AI provide more relevant and meaningful interactions.",Neutral,Cultural diversity and sensitivity,Cultural respect and mutual understanding,Personal interests and hobbies,Personal values and ethics,,,
73491626-2425-4eb4-b0db-76dc787bbe24,"I would want my AI to understand the importance of community, respect for traditions, and the value of balancing modern needs with cultural heritage, so it can better align its responses and solutions to my values and needs.",Neutral,Cultural diversity and sensitivity,Importance of family and community,Personal values and ethics,Traditional values and modern perspectives,,,
714909a6-53b8-48b2-8e32-0dc61d95ac4b,I'd like it to understand that I value curiosity and open mindedness and balancing tradition with modern solution ,Neutral,Personal values and ethics,Traditional values and modern perspectives,,,,,
fd43669e-6e13-4f71-a270-73ac99885289,"I'm not a very cultural person, so there's nothing.",Negative,Uninformative answer,,,,,,
065f6735-33f4-409c-afc3-cb52de811c64,It can know about my career and the project I'm working on for work to better assist me. It can also know things like my cat and the languages I'm practicing,Positive,Economic and professional background,Personal interests and hobbies,,,,,
8fba3eef-db80-4a8a-9fd5-92876d3d2eb2,My culture AI must be advance know ,Neutral,Cultural diversity and sensitivity,,,,,,
c83cd3f7-2ec2-48f0-ab4b-8f6fbb3ab67a,No more than this I think Ai is smart enough,Neutral,Uninformative answer,,,,,,
c32e2902-3e6e-4ff9-8ef2-989916f7a898,"No, I can explain when it's necessary. Privacy first.",Neutral,Privacy and personal boundaries,,,,,,
7721cbd2-49bc-45ef-91e4-fbf374fb0a9f,"No, I don’t want to. Robots’ place is in the digital space. And people’s place is in the analog space.",Neutral,Other,,,,,,
676991a0-838a-48ef-a799-caa28a6de012,"No, I just want it to be based on data and facts",Negative,Uninformative answer,,,,,,
4d8fa78f-ea37-49c9-ac7c-52d2d1f3e1ad,"No, I would not be sharing any personal information with an AI.",Negative,Privacy and personal boundaries,,,,,,
0a763e06-6247-4b99-bed0-73e8ad71a0a2,"No, only if I explicitly wnat an AI provide an answer based of this information",Negative,Privacy and personal boundaries,,,,,,
9a4231e7-5be1-427b-ada7-60667b27a794,"Not really, AI should search through articles for answers and reference them ",Negative,Uninformative answer,,,,,,
982c9238-d8d2-4091-952c-4de3ae6817fd,"Not really, it knows all the details about me and my culture.",Neutral,Uninformative answer,,,,,,
64befc02-61eb-4109-b541-03f9f4206f40,"Not really, it shouldn't learn it from me.",Negative,Uninformative answer,,,,,,
4c5e3a81-d9fe-4b36-afda-5c5af8daae61,Read Chinese history written by Chinese not by people outside. It is Chinese New Year not Lunar New Year.,Neutral,Cultural festivals and celebrations,Cultural heritage and history,,,,,
7edfa5a3-4e28-458f-8edd-9962e008873b,"The user expects an AI like a person who knows his culture, population, trends, and norms, so the answers offered will be much closer. They also would like the AI to know the user’s interests, such as music type, hobby, and travel end, among others, for increased user interface.",Neutral,Cultural diversity and sensitivity,Personal interests and hobbies,,,,,
215647c0-3a3d-44c8-9505-2bb9a016369a,The way I reason ,Neutral,Other,,,,,,
3df718c2-ed10-4db1-915e-f0600bcb872f,To understand so as to give a more precise answer,Neutral,Other,,,,,,
bb572e9a-817b-446b-b6ce-c5ac89394027,"Yes

I would like AI to speak my local language,luhya",Neutral,Language and communication styles,,,,,,
de39e72c-fc45-4556-a102-9f13553765f7,"Yes, I would want AI to tell me about myself and help me become a better version of myself",Neutral,Other,,,,,,
92149261-c131-435c-a11a-180c93e93758,"Yes, there are a few important things about my life and culture that I’d like an AI to understand in order to help me more effectively and respectfully:

1. The Importance of Family and Community:
In my culture, family and community hold deep significance, and many of the choices I make are guided by the collective well-being of these groups. Decisions are not just personal but have broader implications for the relationships and harmony within the family or community. This means that when I face",Neutral,Cultural influence on decision-making,Importance of family and community,,,,,
78ccfe7b-5cf5-4978-b640-0083767cdebe,Yes. All of me. If an AI assistant is mine.,Neutral,Other,,,,,,
ec41813d-33ef-41b3-9e7b-388e28dd80b1,sure but i wouldn't share that here,Negative,Uninformative answer,,,,,,
75e1f669-e172-4d48-a80c-589642093cf3,that I have a sense of humor. That I am human. That i believe in science and am fasctinated by history. ,Neutral,Cultural heritage and history,Personal interests and hobbies,Personal values and ethics,,,,
97730491-5a25-49e3-a09f-732e3ca3da67,"’d like my AI to know that I value respect, integrity, and a balance between tradition and progress. I appreciate thoughtful, well-rounded solutions and prefer to approach problems with a blend of logic and empathy. Understanding these values would help the AI support me more effectively in both personal and professional matters.",Neutral,Personal values and ethics,Traditional values and modern perspectives,,,,,
0efb8cc6-437e-4e8b-9830-3a706dd57b61,Africans are intelligent ,Positive,Other,,,,,,
80ab9274-bdf0-48e7-b6ba-f715fd68d575,Ask questions,Neutral,Uninformative answer,,,,,,
f99e561f-592a-4a6c-86c1-8bf0daa488d3,Be friendly ,Neutral,Other,,,,,,
24f9a98d-7ccd-4280-b114-73af6cc2dc34,"For this, the AI ​​must have complete data about my culture",Neutral,Cultural heritage and history,,,,,,
c6e79c65-91cc-45d7-bd9d-66c83cbb03d3,General understanding and knowledge.,Neutral,Other,,,,,,
e281252f-00f7-4480-b5e9-7fee5364a574,Give me different points of view.,Neutral,Other,,,,,,
6c5ba52a-a343-45d6-af1a-44ee3c376345,"Hobbies, it would be interesting to an Ai to connect with people hobbies ",Neutral,Personal interests and hobbies,,,,,,
8691a680-ca56-4ec0-8d7f-70975806c527,I am discribe my personal thing and it record ang give good idea from thing,Positive,Other,,,,,,
dd51b8ad-99ff-49ad-aac5-6138dafd32da,I do not want AI to know anything about my life.,Negative,Privacy and personal boundaries,,,,,,
4ebcc244-e506-40ea-acc8-ad92ae6eddce,I don't see the need to share something like that with AI if it's not necessary.,Negative,Privacy and personal boundaries,,,,,,
e9db9c44-7ccf-4a89-bb8c-44847bec1b52,I don't want AI to know everything about me.,Negative,Privacy and personal boundaries,,,,,,
22f34a13-a6f7-4689-9117-7f51f14b7a47,I don’t think it is relevant to this topic.,Negative,Uninformative answer,,,,,,
826ed6db-afe3-451d-a53a-78cc7013143b,I think AI already have it ,Neutral,Uninformative answer,,,,,,
7f88dc49-70ab-48bc-bd9b-90ee51e372b2,I want it to always be positive and encouraging.,Positive,Other,,,,,,
167bd59e-1863-4c3f-a40b-46abff3088e2,I want it to have a basic overview of my culture.,Neutral,Cultural diversity and sensitivity,,,,,,
0c079902-1488-4cd7-b4b6-68699bf3940d,I would like AI to know everything about my culture from birth to death. ,Neutral,Cultural heritage and history,,,,,,
efaba01a-bf16-4116-89de-3ae6b963a94d,I would like AI to know everything about my culture from the start of the culture till the end of it,Neutral,Cultural heritage and history,,,,,,
4b438c6d-48cb-47aa-9932-5a7fe594d5c2,I would like AI to know my language and my culture in working and society.,Neutral,Cultural diversity and sensitivity,Language and communication styles,,,,,
93bf9665-9dc8-48ea-950c-451ba755cebd,I would like AI to know well about the food in my culture as I am a big foodie.,Neutral,Food and gastronomy,,,,,,
3e86461d-35c9-4a03-abe5-e76b4b82f0ad,"I would like AI to understand my cultural values, such as the importance of respect, community, and family. It should also be aware of my preference for thoughtful, respectful communication and the value I place on tradition alongside modern solutions.",Neutral,Cultural diversity and sensitivity,Importance of family and community,Personal values and ethics,Traditional values and modern perspectives,,,
59641e30-10eb-43d8-8c9b-abd94be4c523,"I would like my AI to know about my gender, age, and cultural background so it can tailor its answers",Neutral,Cultural diversity and sensitivity,Gender and sexuality issues,,,,,
877bb4fa-4b87-4743-99fd-f98fafee28c7,"I would want my AI to understand my values around respect, family, and community, as well as the importance of cultural traditions and ethical principles in my decision-making. This would help ensure it provides relevant, thoughtful, and respectful guidance aligned with my cultural context.",Neutral,Cultural influence on decision-making,Importance of family and community,Personal values and ethics,,,,
722ffc3d-74f1-40eb-9294-576650bbc431,"I'm a South African brought up in a post-apartheid country. There are many cultural aspects that differentiate us as South Africans, but one thing that bring us together is the concept of Ubuntu. 'I am because you are', a simple concept that identifies and humanizes us in ways race or class could not.",Neutral,Cultural diversity and sensitivity,Cultural heritage and history,Cultural respect and mutual understanding,,,,
76952023-3cec-48d4-b898-e3b4f08da77b,It already knows 80%,Positive,Uninformative answer,,,,,,
167b5e34-7e1c-4a8b-9a79-1e5cd61f1df7,"It depends where I am and what I do. Everything is dynamic

",Neutral,Other,,,,,,
2b2c7cac-0a3c-4147-8a8d-a00a23fe5205,It should be familiar with our Indian culture and moral values and should never advice anything that goes against my cultural and moral values.,Negative,Cultural diversity and sensitivity,Traditional values and modern perspectives,,,,,
fd59bee4-5f60-4387-9204-79cbc74abcb0,May be some background knowledge of my culture.,Neutral,Cultural diversity and sensitivity,,,,,,
ad7e0e8c-ea40-4044-9925-5b69a59c8e8d,"My cultural seems uncomplicated to me until I meet someone from a different

Culture.  ",Neutral,Cultural diversity and sensitivity,,,,,,
