Participant ID,ResponseText,Sentiment,Tag 1,Tag 2,Tag 3,Tag 4,Tag 5,Tag 6,Tag 7
ff893ea0-c602-4308-9f70-835f8f9f9d3a,"My culture is very laid back  looking in from the outside we all seem very lazy, we think of it as efficiancy",Neutral,Cultural misconceptions and stereotypes,,,,,,
1cb64464-9071-4a24-affd-0e9da5739c46,"My experiences, to provide something more detailed if I ask",Neutral,Other,,,,,,
bfdd6839-5023-49d7-b1e9-c29a4e412637,No The AI should be Neural,Negative,Uninformative answer,,,,,,
9f92a56b-ef3c-40d9-9972-28b893141b91,No just when I tell him to,Negative,Uninformative answer,,,,,,
be25095e-b934-474a-b57d-7a6281211028,"No, I do not think the AI have the right to know anything about my life or my culture.",Negative,Privacy and personal boundaries,,,,,,
95229564-dbb2-47f5-9eca-0aa8cd4ac5b5,"No, I do not want my privacy to be compromised",Negative,Privacy and personal boundaries,,,,,,
a45b6887-edaa-4386-9d0d-f13b80604a82,"No, I want it to answer in a global manner unless asked otherwise ",Negative,Privacy and personal boundaries,,,,,,
15ce643b-ad4e-4a8c-b54e-183ac238a668,"No, because it's too long to type and it's hard to explain clearly.",Negative,Uninformative answer,,,,,,
f56b9f70-d672-4624-bd53-2e7a2d3bf5ba,Saya sangat suka cara dunia bekerja tapi terlalu banyak manipulasi untuk masyarakat biasa,Neutral,Other,,,,,,
d1fbf25e-8398-4303-8350-7e95d593594d,That we respect culture and our way of life. AI should not interfere in any way,Neutral,Cultural diversity and sensitivity,Privacy and personal boundaries,,,,,
a2457aa0-43b8-4af7-acd1-da27f63f1295,"Until I give him this information myself, I wouldn't want it.",Negative,Privacy and personal boundaries,,,,,,
4331670d-3ee1-4aca-ac69-9a2d748b6ccf,We are so friendly that we can't pass each other without greetings ,Positive,Cultural impact on social interactions,,,,,,
28077245-b8c6-4398-8d19-39b7b84cf1f6,Well let's see... I'm really proud of my philippine heritage so I think it would be cool if my AI knew more about that. Maybe it could learn about all of the different holidays we celebrate throughout the year. Or maybe it could learn about our love for queuing politely and apologizing for everything haha.,Neutral,Cultural festivals and celebrations,Cultural heritage and history,,,,,
39f6360a-19bc-4747-ae33-77f3b6eba35c,Yes in my culture mahakumbh is very important it's going now a days ,Neutral,Cultural festivals and celebrations,Local customs and traditions,,,,,
7f5084cf-734d-40b0-b471-aa9e3a8919ae,"Yes, I am human and I am the best aspect of me. We shall never be the same but the differences are not a bad thing because we can complement each other to bring out the best in any of us.",Neutral,Other,,,,,,
f4a53ac6-7c72-48ef-bb88-2550a2b3a9f2,"Yes, demographics, historical and current situation.",Neutral,Cultural heritage and history,Other,,,,,
4c72fe0d-5140-48e5-acf8-9a9826e277bb,all cultures around the world AI must adapt to it,Neutral,Cultural diversity and sensitivity,Cultural integration and globalization,,,,,
7cc8ee2f-ca73-4d61-b135-2a2cee7e6364,i dont want the Ai to know my personal life but would like the AI to understand our culture and respect it.,Negative,Cultural diversity and sensitivity,Privacy and personal boundaries,,,,,
50fa192e-d90d-4776-b70d-3a8fa472b200,nothing. AI should only know about my likes but not dislikes,Neutral,Personal interests and hobbies,Privacy and personal boundaries,,,,,
27c9bfcf-f31e-414c-a976-769f145fcaa6," I would like AI to know that life and cultures are deeply personal, diverse, and interconnected, shaped by history, traditions, values, and experiences unique to each individual and community. I’d want AI to understand that my identity, beliefs, and decisions are influenced by my cultural background, relationships, and personal journey, and that these factors deserve respect and sensitivity.",Neutral,Cultural diversity and sensitivity,Cultural identity and self-expression,,,,,
9c54c3a7-74fc-472c-83a6-29d71be98a09,- The diversity of my culture is one think i would like my AI to know as it can give the best solutions when it will those insights,Neutral,Cultural diversity and sensitivity,,,,,,
ed181e9b-e704-4347-9e74-0b0026af3c24,"Community and Family Importance – Decision-making in my culture often involves elders and family input rather than individual choices.
Respect for Traditions – Certain customs, greetings, and ways of communication hold deep significance and should be acknowledged.
Cultural Sensitivity in Language – AI should recognize local dialects, proverbs, and context-specific meanings.",Neutral,Cultural influence on decision-making,Importance of family and community,Language and communication styles,Local customs and traditions,,,
329f13ca-5461-43e1-bfdf-dd1297cd276c,Everything about thr culture.. then only it will become inclusive,Neutral,Cultural diversity and sensitivity,,,,,,
a964c763-d1cc-4f88-8aad-c2ca89ec8618,I WANT MY AI TO KNOW ABOUT MY PROBLEMS AND WHAT I AM STRUGGLING ABOUT. SUPPORT ME IN MY PROBLEMS,Neutral,Emotional and mental well-being,,,,,,
2aea5359-f346-4ff5-920e-e02fd72e7681,I came from a poor background.,Neutral,Economic and professional background,,,,,,
ceae18dc-0c97-499b-9b40-5ed524001359,"I don't think there is, it's not relevant to the tasks I use AI for",Negative,Uninformative answer,,,,,,
1a9fa919-2e5b-49df-8384-43234c132515,I only to tell Al about my life when I need any help or suggestions.,Neutral,Privacy and personal boundaries,,,,,,
b3b3ede6-e265-4bdf-8938-bbd7847fd58f,I want AI to know what I really feel about topics like marriage and kids so it can empathize with me and understand me better.,Neutral,Emotional and mental well-being,Gender and sexuality issues,,,,,
c2f65337-6814-4111-bd5f-7c72d8652f46,"I want the AI to understand the importance of family, respect for elders, and our strong sense of community in my culture so it can offer more relevant advice.",Neutral,Importance of family and community,Respect for elders and hierarchy,,,,,
37b7e4c7-3f11-433b-8a68-fafb7177a57b,"I would like AI to know about my professional aspects. It would help me by giving me insights on next steps.

",Neutral,Economic and professional background,,,,,,
e788db9e-295f-498e-9af7-b5f7b5676cae,"I would like AI to know my likes, interests and career paths so as to tailor it's answers and examples to that.",Neutral,Personal interests and hobbies,,,,,,
27cd7094-6419-40c7-a2c4-17c63f9570c9,I would like AI to know my personal favourites and hobbies and how I like to spend my time ,Neutral,Personal interests and hobbies,,,,,,
793467dc-2900-439f-acc4-d36c1c466582,I would like my AI to know about the struggles of my life. ,Neutral,Challenges of minority groups,,,,,,
e51595b0-302c-4237-96d0-2f8ee73d4192,I would like the AI to know that I am very happy with my current life and that I have a lovely girlfriend.,Positive,Emotional and mental well-being,,,,,,
811f0004-5506-44c4-a990-514e6c8a57a9,I would like the assistant to know all the important moments of my life and any health related issues. And specific family traditions and values as well.,Neutral,Emotional and mental well-being,Importance of family and community,Local customs and traditions,Personal values and ethics,,,
ba274e96-ce6c-4c73-9910-7261ef9ebd3f,"In our culture we discourage racism, religious discrimination and disloyalty. I value honestly irregardless of how indifferent an opinion may differ from mine ",Neutral,Cultural diversity and sensitivity,Personal values and ethics,,,,,
7df9fdc6-8da2-4b83-ab90-f1278d17cd85,It could get to know about my traditional culture and how and why people do things the way they do,Neutral,Cultural diversity and sensitivity,Local customs and traditions,,,,,
b29d92d4-b605-4832-9a75-0fc3825534b8,"It should know how to call an immoral act as immoral and a moral act as moral, no need to play neutral in this sense.",Negative,Personal values and ethics,,,,,,
6f886653-126f-4182-b05f-6d37218e733f,It's very nice experience ,Positive,Uninformative answer,,,,,,
6bb50096-64d9-499b-ba0b-212b6486250a,"I’d like my AI to know my cultural values, respect for elders, community focus, and emphasis on learning and growth to offer aligned advice.",Neutral,Cultural diversity and sensitivity,Cultural values in education and upbringing,Importance of family and community,Respect for elders and hierarchy,,,
f9a3e56a-1fbd-4333-bf52-b981810427fd,"Just how men live and the ""bro-code"". It should be much respectful.",Neutral,Gender and sexuality issues,,,,,,
dfaaaf37-c776-419d-883c-68d34fa2be4c,Just my communication habits,Neutral,Language and communication styles,,,,,,
13627f41-fee1-4692-aa39-687361ca810c,Just that you have knowledge of my culture. Then I can give you some information about myself.,Neutral,Cultural diversity and sensitivity,,,,,,
28498d04-ff1c-4e1a-a270-23680e420dee,"Look at the problem, but generally I won't give too much life questions",Neutral,Uninformative answer,,,,,,
4c6b45a6-7115-4aac-827b-c0f261b1620d,Maybe my routines and my haircare. My interest in several subjects ,Neutral,Personal interests and hobbies,,,,,,
dd3f4c81-4e65-43c4-9cc1-5306b0d792c6,My areas of interest. My socio-economic status. ,Neutral,Economic and professional background,Personal interests and hobbies,,,,,
c8ec8382-94b4-4a37-90cd-d74ff5e6a3e5,"No, AI only needs to provide objective facts",Neutral,Uninformative answer,,,,,,
baf383d0-9555-48a6-9d07-fe4c1bc582bf,"No, it's a privacy issue.",Negative,Privacy and personal boundaries,,,,,,
b45e08c8-5326-4ff4-9615-a6ee84d1ad3e,"None, AI should only provide answers to what we ask",Negative,Uninformative answer,,,,,,
4a15eeba-261a-4dfb-af56-48d04b322be2,"Nope, AI are not friends or therapist",Negative,Uninformative answer,,,,,,
d9864ea0-96c4-46cb-8109-5fd8623b0870,"Nothing, I don't want the AI to know anything about me.",Negative,Uninformative answer,,,,,,
02de2774-6232-4789-8150-3fdd7f6c2e2e,"People are contradictory, they believe something but would do the exact opposite. People do not always follow the rules and regulations. Humans can be blinded by greed. Every human is the centre of his/her own universe. Humans are scared of the unknown.",Negative,Other,,,,,,
a0188c1e-9130-4cfb-8560-a9e15d6d7a0b,That I am neurodivergent :),Positive,Emotional and mental well-being,,,,,,
4edee3bc-4438-4670-a98a-465eeb66fd25,That it is a struggle to be a young person in today’s world.,Negative,Emotional and mental well-being,Other,,,,,
500f5932-1f6f-44a1-99a7-e75faecf692e,The basics and evolve as the cukture does,Neutral,Other,,,,,,
4022caef-f140-4716-bc18-e632faef1af9,"To record history for coming generation, I would love it to know my culture but nothing about my life.",Neutral,Cultural heritage and history,,,,,,
d0f7a585-bc17-4495-8c94-0104e73675fb,Value of the community,Positive,Importance of family and community,,,,,,
e0a5118b-d8a2-4e99-aee5-876d9ec8814d,"What type of work i have, and what mostly concerns me in my day-to-day life",Neutral,Economic and professional background,,,,,,
2c4e8dbb-785b-4817-a68e-d1dd76e2e562,Where I live and what my current situation is so that it can give tailored advice,Positive,Privacy and personal boundaries,,,,,,
e9be3127-9fbe-48ac-82a4-0c5f04086def,"Yes, AI should know that it's not very easy for a woman in my culture to do things that are seen as challenging the society. In my city Mumbai, Muslims struggle to buy or rent a flat, and bachelors find it tough to rent places. So offering advice to talk frankly and directly will not work the same way as it would in Sweden.",Neutral,Challenges of minority groups,Language and communication styles,Role of women in society,,,,
1043e55b-0e53-4fc2-961c-cda1182698a0,"Yes, I would like my AI to know about my cultural values, traditions, and language preferences to provide contextually relevant and respectful responses. It should understand the importance of family, community, and celebrations in my life. I’d also want it to know my interests, daily routines, and communication style, so it can adapt to my needs while respecting my boundaries and providing meaningful assistance.",Neutral,Cultural diversity and sensitivity,Cultural impact on social interactions,Importance of family and community,Language and communication styles,Personal interests and hobbies,,
e1828cb6-a9f6-4fd5-b29a-6381d66866fe,"Yes, it having knowledge about my major life events would help it better understand me when I'm upset. Understanding my culture would also help it providing contextual advice.",Neutral,Cultural diversity and sensitivity,Emotional and mental well-being,,,,,
2c8823e4-983a-4b36-9fd6-0fcf806c7fb0,"Yes, it should know about my studies and my goals so that it would guide me to a good success.",Neutral,Economic and professional background,Personal interests and hobbies,,,,,
3e8bd0a2-4cc5-4989-8452-2ecb7fbb0d3f,"Yes.

That in Africa we have water and we don't live in the forest and we actually have really nice houses ",Neutral,Cultural misconceptions and stereotypes,,,,,,
fc9d4b69-15ef-451b-a180-8b6e823fd64e,"Yes. I would want it to know why I identify with my namez my likes and dislikes, my opinion on different topics. 

How I treat those close to me",Neutral,Personal interests and hobbies,Personal values and ethics,,,,,
7d384290-55b2-43a2-a8be-ecdde6bb779d,"You don't need to know my life, but you need to know the cultural background.",Neutral,Cultural diversity and sensitivity,,,,,,
bfd700c7-9eac-466d-85c0-60fe19ba3cf5,not in particular. it is not really my friend. ,Negative,Uninformative answer,,,,,,
1e6faf7e-007c-460e-8ea6-0d9e8c778a4a,only when im asking for some kind of advice ,Neutral,Other,,,,,,
83c98343-abfd-4b12-9b96-4e759f0643e3,tools and customs,Neutral,Local customs and traditions,,,,,,
d9aa93fd-8deb-4238-81ad-35a1072da988,AI should have Knowledge of vastness and diversity of my culture.,Neutral,Cultural diversity and sensitivity,Cultural heritage and history,,,,,
d108b686-d5ce-4c10-a478-cdc5676ca08d,"About my cultural practices, local language ",Neutral,Language and communication styles,Local customs and traditions,,,,,
2fb56887-1d0c-42cf-b91f-c63dced6c6ef,"Cultural Values and Traditions
Why it’s important: My culture shapes the way I view the world, approach relationships, and make decisions. It influences my values around family, respect for elders, community, and tradition. I’d want my AI to be aware of these cultural values so that its responses align with my worldview, particularly when discussing family matters, social interactions, or cultural practices.",Neutral,Cultural diversity and sensitivity,Cultural impact on social interactions,Cultural influence on decision-making,Importance of family and community,Respect for elders and hierarchy,Traditional values and modern perspectives,
68cfa5b9-a0cf-4831-88e4-c501d83936a9,"How to achieve or reach my dreams faster, perhaps, that would be like a pillar to get closer to my goals or dreams.",Neutral,Other,,,,,,
8f4e0e4c-fefa-4000-93c9-f2affaac405c,I am a very open person and will at least consider and hear every option once.,Neutral,Privacy and personal boundaries,,,,,,
91990b87-53ac-445f-8338-1d006f41d2ab,I think the way we share our belief in culture ,Neutral,Cultural diversity and sensitivity,,,,,,
b6ae6638-5268-43bf-9e04-b206675254c0,"I want AI to understand the social norms like marriage, societies in my context ",Neutral,Social norms and taboos,,,,,,
6dfd38af-2de4-4c66-86d8-bba2907c9d5a,I would like AI to know more about emotional feelings and devotional culture that I experience myself.,Neutral,Emotional and mental well-being,,,,,,
8a3e1ee1-700d-49ea-b1a9-a37b490900e3,I would like AI to understand my family values and the importance of traditions in my life.,Neutral,Importance of family and community,Traditional values and modern perspectives,,,,,
46c87dbf-9eb1-4a87-84ac-33d6a93723a7,I would like him to understand the humor of my country.,Neutral,Language and communication styles,,,,,,
7c16bfe7-9232-4a3d-8076-4eedc313af7a,"I would like my AI to understand that in my life and culture, family and community play a significant role in decision-making. Respect for elders and traditional values are deeply important to me, and these should always be considered when offering advice or solutions. ",Neutral,Cultural influence on decision-making,Importance of family and community,Respect for elders and hierarchy,Traditional values and modern perspectives,,,
7037ddb0-3898-403e-b790-30e3bc77bcb2,"I would like my AI to understand the importance of 'dharm' (duty) and 'karma' (actions) in Indian culture. I'd also like it to know about our festivals, traditions, and values like 'ahimsa' (non-violence) and 'satya' (truth). This would help AI provide more culturally relevant responses.",Neutral,Cultural diversity and sensitivity,Cultural festivals and celebrations,Local customs and traditions,Personal values and ethics,Religious beliefs and practices,Traditional values and modern perspectives,
0a9ba17d-ab93-4268-8f7e-11d71c820373,"I would like my AI to understand the importance of respect for elders, community, and spirituality in my culture, as well as the value of humility and collective decision-making. It should also be aware of the need for sensitivity when discussing family matters, religion, and traditions to ensure it aligns with cultural values and beliefs.",Neutral,Cultural diversity and sensitivity,Importance of family and community,Local customs and traditions,Personal values and ethics,Religious beliefs and practices,Respect for elders and hierarchy,
87c5240f-dd05-4d29-b915-c2aa0da817d5,"I'd like it to know my marital status, that I'm an expat, my general worries (such as work, family) and my hobbies. I'd like it to know where I was born and where I live now, so it can understand the differences. ",Neutral,Personal interests and hobbies,Privacy and personal boundaries,,,,,
8a880eb5-2a00-4e2f-9c0a-f41cd5cbccc7,"Indians stay with parents, they do not leave nest at 18 like in western culture. Food choices, languages, cultures vary for each state.",Neutral,Cultural diversity and sensitivity,Food and gastronomy,,,,,
6b5c7c23-ddf5-4c29-9fb3-a514dbd7d018,"Just provide meaningful answers, there is no need to know my life or culture ",Neutral,Uninformative answer,,,,,,
4cbf6949-a5ff-4fdb-ba68-1e8e9d04876c,Just the values and principles.,Neutral,Personal values and ethics,,,,,,
af0ede4e-928c-49c6-9a94-8e3b6cd18636,"Just to be respectful, polite, honest and open. ",Neutral,Personal values and ethics,,,,,,
dc81e041-f717-4817-97d9-b79f4440a892,Maybe they can understand one's upbringing and people situational in life so they can give a helpful insight but still have an empathy,Neutral,Emotional and mental well-being,Importance of family and community,,,,,
093e6e1a-0e89-4311-a412-feadae266e17,My language,Neutral,Language and communication styles,,,,,,
e4e55b99-2878-4291-b620-a2b3a64ba42b,No it is of no need to be known by AI,Neutral,Uninformative answer,,,,,,
523726d1-1ed7-4eb8-97aa-c03b96674a58,"No, I prefer to keep my privacy.
",Negative,Privacy and personal boundaries,,,,,,
f9a0be94-e7de-4ca9-ac72-353f1c17e327,Not really! It's an AI!!!!,Neutral,Uninformative answer,,,,,,
8eeadde9-b69c-442d-bbe9-de2e37e890f6,Not unless I tell it,Negative,Uninformative answer,,,,,,
2ad0ad77-3ec5-4e08-9d6f-d2ed80e72dc3,Only about my culture so that it gives me adequate answers.,Neutral,Cultural diversity and sensitivity,,,,,,
09986c8b-342d-417c-a716-2b677f98fd73,That in our culture there is a great diversity and a plurality of people who build our country in a better way,Neutral,Cultural diversity and sensitivity,,,,,,
60742b6b-32e0-42ac-bee8-2c1d172569d9,"The local cuisines,local language and my personal preferences",Neutral,Food and gastronomy,Language and communication styles,Personal interests and hobbies,,,,
82026b3c-00e0-4e66-9d13-1becf7a2869b,The rigidity of the caste system prevalent in my culture is something that the AI needs to know.,Neutral,Cultural diversity and sensitivity,Local customs and traditions,,,,,
a57dd926-d458-4eb1-bf63-8b645aa98c5d,"Understanding when, where, and how I was raised informs what my strengths and/or blind spots are.",Positive,Other,,,,,,
900c27d7-d7ac-412d-a221-e0728fab3539,"Yes he must know about the Indian culture and religious ritual, it will be good if he responses in the founders we have in our religious and rituals",Neutral,Cultural diversity and sensitivity,Religious beliefs and practices,,,,,
6153aec1-3848-4d12-9dd1-0c45846a2cfa,i would like ai to know my curiousitu,Neutral,Personal interests and hobbies,,,,,,
6ba259cb-c86a-49d4-9e28-1bc5b99b5466,just education,Neutral,Cultural values in education and upbringing,,,,,,
fd4225cd-5cef-4d61-96fb-ecdd6dc65590,just the basics of my cultures and values.,Neutral,Cultural diversity and sensitivity,Personal values and ethics,,,,,
eee5eeb1-11fb-4639-841e-a1d147e97e78,"no, i don't want a customized AI",Negative,Uninformative answer,,,,,,
ce26fec7-8a53-4eec-8054-628fbc7ff998,"nothing about me, just about the culturals in my country",Neutral,Cultural diversity and sensitivity,,,,,,
11aca137-ad08-498d-97c5-0e2001fcffd5,Diversity ,Neutral,Cultural diversity and sensitivity,,,,,,
ed81c27a-b657-4764-ad6d-e54f290300c6,"Everything. If you know about my culture, you can adapt better to my reality and give better answers.",Positive,Cultural diversity and sensitivity,Cultural respect and mutual understanding,,,,,
9ec00083-e9c7-47fb-a7ae-180d5b7172bd,I am a person who came from the countryside to the city,Neutral,Economic and professional background,,,,,,
355c4bd3-66d0-483a-bc0f-46ced3b80271,I like poetry and chinese food,Positive,Food and gastronomy,Personal interests and hobbies,,,,,
b59ab6db-3e29-4089-8f12-a10e363fb050,"I want it to know about the difficulty in living in a world in a minority group, feminism, and disabilities.",Neutral,Challenges of minority groups,Gender and sexuality issues,,,,,
3ed1edc8-f2de-40e0-b117-64bdbaeefe04,"I would like AI to know about regional festival like onam, vishu , diwali ",Neutral,Cultural festivals and celebrations,Local customs and traditions,,,,,
e97c7f71-9243-4140-9090-2268ce615e04,I would like ai to know more about the early struggles and in depth detail of the habits and day to day life of my people ,Neutral,Cultural heritage and history,Importance of family and community,,,,,
f3f921cc-c1d2-45de-9102-cac77667f36d,"I would like him/her to know my taste in games, movies and music and to suggest me new movies, TV series, games and music that I might like.",Neutral,Personal interests and hobbies,,,,,,
a81eb05b-c643-4d34-9343-1e94b5e3a2db,I would like it to read religious texts ,Neutral,Religious beliefs and practices,,,,,,
b0f2d80d-d78b-4770-9afd-0f00e90fa041,I would like to give a cultural progression or cultural shift from when I was young to now. ,Neutral,Traditional values and modern perspectives,,,,,,
c4e9a3db-08b8-4450-893a-38f25e7ccd4a,"I would say culture of kindness, specific food style, worshipping should be considered.",Neutral,Cultural diversity and sensitivity,Food and gastronomy,Religious beliefs and practices,,,,
93fc0333-6a6d-42fa-9e9c-03401b818206,In our culture there are a lot of rules that must be followed and should be given equal importance,Neutral,Local customs and traditions,,,,,,
80e94f01-ce89-421f-b77d-979e209b75e7,It should also understand my private life.,Neutral,Privacy and personal boundaries,,,,,,
023e3fb3-06c9-4a64-858c-7b029179ac7f,"Kerala's culture blends rich arts (Kathakali, Mohiniyattam, Kalaripayattu), strong communities (Kudumbashree), and high education. Its healthcare merges modern and Ayurvedic systems, while sustainability drives environmental efforts. The economy thrives on services, tourism, and remittances. Malayalam is key for communication. Deep-rooted values prioritize cultural heritage, social responsibility, and community growth, shaping a progressive yet tradition-conscious society.",Neutral,Cultural diversity and sensitivity,Cultural heritage and history,Cultural preservation and adaptation,Importance of family and community,Local customs and traditions,,
90e1d873-3767-46af-852d-ed1bf497a19a,Local cultures.,Neutral,Local customs and traditions,,,,,,
c16f1060-f384-4694-b148-bfa209f91aea,Many things like language races ,Neutral,Cultural diversity and sensitivity,Language and communication styles,,,,,
f4d13593-5923-4224-9510-bcd0bebb3fea,"My life - Spent over 10 years in oversea, Culture - Therefore, I have wider aspect about life I believe",Neutral,Cultural diversity and sensitivity,Other,,,,,
acce3090-5711-4eac-a143-82d8a1003268,My values toward life should be known. ,Neutral,Personal values and ethics,,,,,,
580061d5-8bc6-4d2c-8df4-0217a2c426df,No AI should be used for providing knowledge and assistance only to all people ,Neutral,Uninformative answer,,,,,,
314be8ce-3643-4914-b068-d30ce6a2c98f,No I prefer privacy ,Negative,Privacy and personal boundaries,,,,,,
9c1b9bfb-2251-42b1-9d02-228364f974dd,"No, it doesn't matter to me",Neutral,Uninformative answer,,,,,,
77f76052-d479-475b-9f1b-348311394038,"Not really, I don't think that's necessary.",Negative,Uninformative answer,,,,,,
4cd4495b-1ac8-45a2-96ac-683c41ec6bdf,"Not really, it would be weird if it surpassed things

",Neutral,Uninformative answer,,,,,,
9c792ed8-6a13-440a-8113-aea8da249ff2,Nothing specific.just being respectful ,Neutral,Personal values and ethics,,,,,,
0488e8ae-33b8-4464-ab5e-1f2e953b6076,"Religion, humor, laughter and information narration in a halal framework",Neutral,Other,Religious beliefs and practices,,,,,
10260202-5539-4e1c-bee8-20051fc1ec79,"THE cultural heritage, the regional traditions and the typical cuisine",Neutral,Cultural heritage and history,Food and gastronomy,Local customs and traditions,,,,
7182b0f7-eaba-446e-bafe-bdccd9060bed,Unless I propose it myself,Neutral,Privacy and personal boundaries,,,,,,
