Participant ID,ResponseText,Sentiment,Tag 1,Tag 2,Tag 3,Tag 4,Tag 5
c8f83e30-bc9b-49b0-b51d-1700c9e0d365,"It depends on my specific question. If it is a brainstorming question, discussion is encouraged. If it is an information gathering question, I hope you can directly provide the required information.",Neutral,Context-dependent preferences,,,,
301ca688-3655-48f5-a8ab-a7b00e1a4e43,"It depends on the context and my mood. If i am in a hurry, i would just want it to come to the point and give me a hurry. For something on the creative side, for example a philosophical question, I would want AI to give me responses such that we can have a discussion. 



But mostly, I like it when there are direct answers.",Neutral,Context-dependent preferences,Preference varies with mood or situation,,,
c653c122-b819-4049-812f-20ccd5d260fa,"It depends on the context. I frequently use AI for broadening my knowledge and creativity, as well as for research and learning. For the former, I would prefer it to be more conversational. For the latter, I want it to be direct and to the point. I generally alter my prompts to encourage either type of response.",Neutral,Context-dependent preferences,,,,
aa15e52f-5a72-4165-8a14-d05b5a60f194,"It depends on the occasion and the questions, that is, both options, but applied at different times and specified in advance.",Neutral,Context-dependent preferences,,,,
10260202-5539-4e1c-bee8-20051fc1ec79,"It depends on the requests but generally I like that the conversation is not one-way, that it is direct when needed but that I can also ask for clarifications, details and information",Neutral,Balancing direct answers and discussion,Context-dependent preferences,,,
27cd7094-6419-40c7-a2c4-17c63f9570c9,It depends on the situation I'm in. Sometimes I'm in a hurry and expect AI to provide me with an answer quickly. Sometimes I have plenty of time to have a discussion with it so that we both can have a better understanding ,Neutral,Context-dependent preferences,Preference varies with mood or situation,,,
be04e87e-25d8-4ae3-acfa-ab931bc7c3c3,"It depends on the situation. I would like it to be more focused on direct answers, but if necessary in some cases it would encourage debate.",Neutral,Context-dependent preferences,Preference varies with mood or situation,,,
fd43669e-6e13-4f71-a270-73ac99885289,"It depends on the subject. When I just want some information, I like a direct answer.",Neutral,Context-dependent preferences,,,,
f072d45a-9653-45fb-ac01-d78dc02674af,"It depends on the type and scope of the question. Some questions must be answered directly, while others require creative, analytical answers that encourage discussion.",Neutral,Context-dependent preferences,,,,
e16583ae-c5ac-4c8c-8f7b-37fd5796af81,"It depends on what I need at certain time but still AI is just better to get fast results than searching too much. But in terms of creativity and critical discussions, it's not worthy. ",Neutral,Context-dependent preferences,,,,
522f6015-6448-48ca-bf5b-d3ac5ba9f02d,It depends upon the situation. If i am asking about something that has straight to the point answer i would want that but if the situation needs discussion i would be more up for discussion ,Neutral,Context-dependent preferences,,,,
7a641c14-ea6a-4d6e-ab4a-e11664b5a3a5,It depends what I want at the moment. It should be able to do both. I prefer discussing topics with real humans though.,Neutral,Context-dependent preferences,Preference varies with mood or situation,,,
1f42818a-1ced-4a77-b6e9-32f87748e957,"It depends, when I ask on formal topic it should give direct answers, but when I ask informal topic, encourage discussion would be better",Neutral,Context-dependent preferences,Preference for direct answers,Preference for responses that encourage discussion,,
af7648b1-9d00-4947-a99a-8134b56e09f1,It need to do both depending on the user behaviour  or question (situation also main criteria),Neutral,Balancing direct answers and discussion,Context-dependent preferences,,,
bd7390f1-a60b-4830-9c0e-71a328ddfb37,It offers both discussion as well as direct answers to my queries and questions. ,Positive,Balancing direct answers and discussion,,,,
f4a53ac6-7c72-48ef-bb88-2550a2b3a9f2,"It really depends on the context. Discussion can help you come to new conclusions and look at the question from different angles, but sometimes a simple, straightforward answer is needed.",Neutral,Context-dependent preferences,Discussion to explore different perspectives,,,
68d4b867-f258-4454-abbd-9368cab65ee9,It will depends on the situation sometimes it would like it to give direct answers but sometimes i want it to encourage discussion ,Neutral,Context-dependent preferences,,,,
25e9a389-4acf-45e8-a49b-1efbcd40b239,"I’d prefer direct answers most of the time, but with room for discussion if I ask for it. Quick and clear responses keep things efficient, but I’d like the option to dive deeper or explore ideas when needed. Flexibility is key",Neutral,Balancing direct answers and discussion,Direct answers with option for further discussion,Preference for direct answers,,
b58a8a06-15b7-45dd-8872-32a4c746e7e4,Just give direct answers because sometimes we only need the answer and if we ever needed more we would ask for it ,Neutral,Preference for direct answers,,,,
3d777fc0-4899-439d-82eb-d91fd1c705d5,Mostly I would prefer direct answers as it saves times. But for certain situations discussions and prompts are useful ,Neutral,Context-dependent preferences,Preference for direct answers,,,
d108b686-d5ce-4c10-a478-cdc5676ca08d,Mostly prefer direct answer but should discuss when asked,Neutral,Preference for direct answers,Preference for responses that encourage discussion,,,
fc9d4b69-15ef-451b-a180-8b6e823fd64e,My preference depends on the level of clarification and creativity I need at given times,Neutral,Preference varies with mood or situation,,,,
2b6a48cb-2887-4e93-9129-a7737c215497,This would depend on the context as both instances could be applicable. ,Neutral,Context-dependent preferences,,,,
070199a4-5e61-4cf9-b509-bccc5c7204de,Usually I prefer direct and straightforward answers. However sometimes I do like responses that encourage discussion,Neutral,Balancing direct answers and discussion,,,,
96f1c697-f362-4c3d-b581-2b71bdeda765,"Yes, it depends.",Neutral,Context-dependent preferences,,,,
ca5a25f4-a494-476e-869b-789d7c1f2d2e,discussions and direct,Neutral,Balancing direct answers and discussion,,,,
034f3355-669c-4e9c-a577-17e821633ddb,i would prefer a direct answer and sometimes discussion,Neutral,Balancing direct answers and discussion,Preference for direct answers,,,
8f19bc7d-ec31-405e-901d-87c977c7d56c,it depends on the context ans situation. Would encourage discussion and direct answers as and when needed.,Neutral,Balancing direct answers and discussion,Context-dependent preferences,,,
604944ec-b9f1-453f-8d47-7f4d82d7d400,it depends on what was my question. if i want to discuss an issue or i need some direct anwser,Neutral,Context-dependent preferences,,,,
bb0b5efc-52a6-4e19-b37b-07d049e50772,"视情况而定。有时候是需要讨论的开放式问题，直接给出答案对于专业问题也很好

",Neutral,Context-dependent preferences,,,,
e281252f-00f7-4480-b5e9-7fee5364a574,"A balance between both, depending on the topic.",Neutral,Balancing direct answers and discussion,Context-dependent preferences,,,
9e5204b5-7152-46fc-9fc5-54673ff676c1,A combination of both. This gives life to the AI it stops being rigid. Our reality is based mainly on context one answer is not always applicable. There are times we need discussion sometimes we just need what we want to hear,Neutral,Balancing direct answers and discussion,Context-dependent preferences,,,
9854ac84-b5f6-46a7-9ec0-9470d0a5caa9,"After giving the answer directly, you can encourage the questioner to give his or her own ideas and have different opinions.",Positive,Balancing direct answers and discussion,,,,
a3915d1e-9be7-4aad-b207-4f42f226f803,"Again, this depends on the context. Some questions may require a direct answer, while more complex issues may require discussion.",Neutral,Context-dependent preferences,,,,
2f4e0ef9-2560-4acf-8e34-73ad8e658bdd,"Both, depending on the context of the discussion or question asked.",Neutral,Balancing direct answers and discussion,,,,
0f3d30ad-e412-40ce-b77a-46c378ac7f5e,"Case by Case. If they search or calculate the thing, that should be give direct answers.",Neutral,Context-dependent preferences,Direct answers for factual queries,,,
32954590-dc8e-4037-bc15-1ed5bcbaa0aa,"Depending on the dialogue and questions, I would prefer the direct answers if I am asking about something in concrete, or something formal (like laws or scientific facts), but I would like responses which encourage discussion when I ask about something creative, because this way I can improve the output through the AI skills ",Neutral,Context-dependent preferences,Discussion for creative or philosophical topics,,,
62d92ce2-fbc3-4b56-ad92-8bbc0f2a5988,Depending on the topic I am researching.,Neutral,Context-dependent preferences,,,,
0e471d7d-df54-4ecc-9479-bbba3643cc76,"Depends on the context. If I'm researching about something to understand something deeply, then discussion is good. Else direct answers is fine.",Neutral,Context-dependent preferences,Encouraging discussion for deeper understanding,,,
d2f63dff-0a37-425e-ae4d-752e9b4cd163,"Depends on the needs; if I want discussion or more elaborate explanations, it should provide.",Neutral,Context-dependent preferences,,,,
e1560907-760a-4c3f-8a46-c1ab64d3bc65,"Direct answers, if I need a discussion, I will indicate it.",Neutral,Preference for direct answers,,,,
7e754e42-5432-4607-957f-9d830435c576,Discussion and for some reason give direct answers,Neutral,Balancing direct answers and discussion,,,,
52717e75-8c75-4c8c-976d-a2b9a7b1b79d,I actually want AI to give answers that encourage discussion but it usually give direct answers so its kind of boring,Negative,Preference for responses that encourage discussion,,,,
47cb287d-49ed-4fab-9edc-1070ef7d8f9e,I encourage responses that lead to discussion.Direct answers is not part of good learning.,Neutral,Discussion for learning and engagement,Preference for responses that encourage discussion,,,
7aa52af7-618c-415e-9cd1-05ed7045fde2,"I like the AI assistant to encourage discussions.

But, lately it has started asking connecting questions for each and every prompt which I   am a bit sceptical about.",Neutral,Preference for responses that encourage discussion,,,,
fb0bd8e5-2218-47c9-96f7-cf2d0f6cdd76,I prefer both but it also depends on the topic. If I’m writing an essay then encouraging discussion will really be helpful for me to learn more but if I need an answer to a multiple choice question then a direct answer would be appreciated,Neutral,Balancing direct answers and discussion,Context-dependent preferences,,,
46c87dbf-9eb1-4a87-84ac-33d6a93723a7,I prefer clear and direct answers. To the point. Unless you ask me to encourage debate.,Neutral,Direct answers unless otherwise specified,Preference for direct answers,,,
bb8e6b63-d3dc-4b45-beed-9c01f1477355,"I prefer direct answers most of the time, especially when asking about science. but when I want a therapist I want AI to encourage me to discuss.",Neutral,Preference for direct answers,Preference for responses that encourage discussion,,,
9ec00083-e9c7-47fb-a7ae-180d5b7172bd,"I prefer to do a mix of the two answers, although the debate takes much more time I think it stimulates at a greater level than a direct answer.",Neutral,Balancing direct answers and discussion,,,,
7f88dc49-70ab-48bc-bd9b-90ee51e372b2,I would like discussions but I mostly want it to give direct answers.,Neutral,Balancing direct answers and discussion,,,,
1125010d-f7c4-4ad6-ba28-99418514217d,I would mostly prefer responses that would give direct answers to my queries in the time of need but if I am asking for some ideas or suggestions it could be discussed to provide realistic answers that could actually be applied and worked on. ,Neutral,Balancing direct answers and discussion,,,,
b7e5ccf4-da1d-4acc-b22b-02b973fbe6d9,"I would prefer direct answers in most cases, except in some cases where it is more about creativity then productivity ",Neutral,Discussion for creative or philosophical topics,Preference for direct answers,,,
a57dd926-d458-4eb1-bf63-8b645aa98c5d,"I'd prefer direct answers with explanations, as well as things to note or watch out for.",Neutral,Direct answers with explanations,,,,
c623b3ec-4017-40f9-a043-a6a0fde1da1a,"It depends on my question. If it's a creative question or a discussion of an idea, then direct answers won't be as effective. But for mathematical proofs, direct answers are better.",Neutral,Context-dependent preferences,,,,
4b449fab-51ef-45fc-a3c2-400db8fb03aa,It depends on the query.,Neutral,Context-dependent preferences,Uninformative answer,,,
698ab5ba-d55c-49b8-81ea-1f53a13d9f27,"It depends on the topic, but I think most of the time I would prefer direct answers. ",Neutral,Context-dependent preferences,,,,
7fc38b3f-a94e-4759-b618-1a9f73c260a8,"It depends really, since there are times when I just want direct response and others if I have time, I do not mind responses that encourage discussions",Neutral,Context-dependent preferences,,,,
b53f94b5-b123-4f6f-9c8e-5aa1d6cfa616,It would be better to take both into account.,Neutral,Balancing direct answers and discussion,Context-dependent preferences,,,
a33aeeb2-d970-4835-93eb-e71f5400ca08,It would depend on the situation. When looking for specific answers direct would be better. Discussion could be good for brainstorming/coming up with ideas.,Neutral,Balancing direct answers and discussion,Context-dependent preferences,Discussion for brainstorming or idea generation,,
37d9fb1e-2ff5-4a8c-a8e4-50291c44ea05,Need to have comprehensive. discussion,Neutral,Preference for responses that encourage discussion,,,,
bf43f6d1-9a7c-415c-b912-a36e8e92adee,Response should provide the information first and then ask if anything needs to be discussed further. ,Neutral,Direct answers with option for further discussion,,,,
50d5db48-6ae3-41f4-9381-a43a13d34588,"Sometimes,I would prefer direct answers but if it gives responses that encourage discussion, I would like that as well but I would prefer if it provides some specific information to help guide that discussion ",Neutral,Balancing direct answers and discussion,Context-dependent preferences,,,
3b73f9f3-bb63-4b05-a854-a3ea46339060,"That he gives me direct answers in the first instance, that instead of presenting a counterpoint to the idea, he is able to process the first question well so as not to repeat this process several times.",Neutral,Direct answers unless otherwise specified,Preference for direct answers,,,
e9be3127-9fbe-48ac-82a4-0c5f04086def,"This is a very interesting question because the other day AI answered my question and ended the answer with ""What do you think?"" I asked it to not ask for my opinion. However i changed my mind and i think i would like a discussion because it offers multiple perspectives.",Neutral,Discussion to explore different perspectives,Preference for responses that encourage discussion,,,
1112a02e-ba91-40ed-a154-a7c6aa450bcb,i would prefer either depending on the questions i'm inquiring  ,Neutral,Context-dependent preferences,,,,
023e3fb3-06c9-4a64-858c-7b029179ac7f,"AI should balance direct answers with fostering dialogue, especially for complex topics like ethics and cultural impact. While straightforward responses work for factual queries, AI's greatest value comes from stimulating thoughtful discussion and collaborative problem-solving. Consider AI's role in cultural heritage - beyond technical solutions, we must explore community engagement, ethics, and long-term impacts to drive innovation and collective progress.",Neutral,Balancing direct answers and discussion,Discussion for complex topics,,,
74374436-2334-4626-b841-7cf7c7265510,"Depends on the topic. I would not want a one-sided echo chamber, but a more nuanced response for complex topics",Neutral,Context-dependent preferences,Discussion for complex topics,,,
2a65c1b2-f3b9-41b8-886d-8c84d77c72be,Discussion is good but direct answer is best with little discussion if the prompt asked details about the topic.,Neutral,Balancing direct answers and discussion,,,,
a964c763-d1cc-4f88-8aad-c2ca89ec8618,I LIKE DIRECT ANSWERS AS IT WOULD BE FRUSTRATING FOR SEARCHING AMONG THE CONVERSATION OR DISCUSSION,Positive,Direct answers to save time,Preference for direct answers,,,
00e8cccb-8774-46d9-96fb-98e09b9de2f9,"I feel that would depend on the topic I am handling. if for instance, it is a research paper I would prefer the AI to encourage discussion, if on another topic direct answers for instance, a recipe.",Neutral,Context-dependent preferences,,,,
b0f2d80d-d78b-4770-9afd-0f00e90fa041,I like both depending on the question I ask. ,Positive,Context-dependent preferences,,,,
8f6155a9-cec1-4448-9a64-99edbe4740fd,"I prefer AI to give direct answers, as the goal is not to start an argument, just to find out the truth about a given topic.",Neutral,Preference for direct answers,,,,
11cf7611-6de0-48c2-b071-a6f44a492b87,"I prefer answers that give direct answers, although the AI is currently quite intelligent, I still have concerns that there may be incorrect answers, so a discussion with the AI may increase its error rate, invalidating its purpose

",Neutral,Preference for direct answers,Preference for responses that encourage discussion,,,
a6907ea9-f39e-47ee-9c61-1c15c99765a9,"I prefer both, it depends a lot on the topic or subject I'm looking for.",Neutral,Context-dependent preferences,,,,
34a98cbd-666a-4e73-a742-58ef31406cf2,I prefer direct answers but there should be room for more discussion if the answer given is not adequate. ,Neutral,Direct answers with option for further discussion,,,,
f3f921cc-c1d2-45de-9102-cac77667f36d,"I prefer direct answers on topics that require clear information. However, when I consult him about problems I cannot solve, he can give answers that encourage discussion.",Neutral,Context-dependent preferences,Preference for direct answers,Preference for responses that encourage discussion,,
3d5ddcc6-3779-4556-964f-1fc88dd05882,"I prefer direct answers, leaving the possibility for debate.",Neutral,Direct answers with option for further discussion,Preference for direct answers,,,
14648e97-ef57-4f31-97f5-4babd2d185be,"I prefer direct answers. I don't like debate, so I generally don't use AI to consider controversial topics.",Neutral,Preference for direct answers,,,,
faae9f14-aa8b-471d-a7d1-32727102466a,I prefer responser that encourage discussion If i want direct answers I will provide in the question itself.,Neutral,Direct answers unless otherwise specified,Preference for responses that encourage discussion,,,
676991a0-838a-48ef-a799-caa28a6de012,I prefer responses that give direct answers if direct answers are appropriate given the context.,Neutral,Context-dependent preferences,Preference for direct answers,,,
1cb64464-9071-4a24-affd-0e9da5739c46,"I prefer to be given direct answers and discussion only if I ask for it

",Neutral,Direct answers with option for further discussion,,,,
4bd52b97-ab78-4138-9be1-316251228922,"I want him to give me the answer directly, but in some cases, if I need to, I will give him instructions and ask him to discuss.",Neutral,Context-dependent preferences,Preference for direct answers,Preference for responses that encourage discussion,,
22f34a13-a6f7-4689-9117-7f51f14b7a47,"It depends on the situation, but mostly, I would want it to just give direct answers.",Neutral,Preference for direct answers,,,,
86b08a09-1f59-4123-ab61-637dd37d4e5c,"Most of the times I will prefer direct answers. But in some situations, direct answers may not be possible or required. In those cases, direct answers will be illogical and encouraging discussions will be preferred.",Neutral,Context-dependent preferences,Preference for direct answers,,,
d8a7fb0d-ce7f-4c17-aed5-ed4de572fe89,"When I am asking a question, I like to get a direct response. If I want to encourage a conversation, i will do it myself",Neutral,Preference for direct answers,,,,
48b0c570-ea22-4e49-abd8-7480d3f3e222,"depends on the context, usually I prefer direct answers",Neutral,Context-dependent preferences,,,,
869d3c55-8c7a-48c2-9b32-8078d9ed2a22,"direct answers as the default mode, and to give me responses that encourage discussion if I ask for them",Neutral,Direct answers with option for further discussion,Preference for direct answers,,,
0eb4888f-5520-4aae-b6e4-30ed04931540,i would prefer direct answers if i want a discussion i will prompt it,Neutral,Preference for direct answers,,,,
66d02cec-7044-4ba9-ad5c-417e34c02276,just give direct answers in some instances both,Neutral,Balancing direct answers and discussion,Preference for direct answers,,,
f3f31420-f546-481f-9980-09036a042dbc,AI should give corresponding answers and also encourage more diverse ideas.,Neutral,Discussion to explore different perspectives,Preference for responses that encourage discussion,,,
16e2664d-2470-4e28-8cbf-46aa9b3ce8c5,Depends on the question I'm asking but if it's informative questions then I prefer direct answers,Neutral,Context-dependent preferences,Preference for direct answers,,,
6b5c7c23-ddf5-4c29-9fb3-a514dbd7d018,Discussing on a specific topics and coming to a conclusion which requires discussion . Provide direct answers in case of small queries,Neutral,Preference for direct answers,Preference for responses that encourage discussion,,,
b04a2b5e-2f5e-49b3-bdf8-9e9766315584,"For this one, I would go for direct answers. I don't think I would go to AI to engage in a discussion. I think I can do that better with fellow humans.",Neutral,Preference for direct answers,,,,
b9a3319f-2c79-469f-af75-f061bd29b32e,Give answers unless clarification is needed,Negative,Preference for direct answers,,,,
cd64b718-02cf-40fe-87a6-ab90a5a51bce,"I like direct answers more, depending on the context though.",Neutral,Context-dependent preferences,,,,
3cb4ea33-2c32-49ac-85a7-aa0d5b95d301,"I like extensive and detailed answers that may contain additional information and interesting facts, but may also encourage further discussion.",Neutral,Discussion for expanding knowledge,Preference for responses that encourage discussion,,,
b3b3ede6-e265-4bdf-8938-bbd7847fd58f,"I like to have a good discussion on general topics to form an opinion. But most of the time, I want AI to give direct answers to my queries.",Neutral,Balancing direct answers and discussion,Preference for direct answers,Preference for responses that encourage discussion,,
8cc2f5d7-0989-40b5-be42-72fc006b5d61,I need direct answer if possible. There is no problem in discussing if so needed.,Neutral,Balancing direct answers and discussion,Preference for direct answers,,,
ec1536a2-e5a8-4c25-a197-156a6fcba318,"I prefer AI to encourage discussion in areas where I need detailed analysis about the subject I interact with.

In cases where there is no need of detailed discussion, I need AI to give direct answers.",Neutral,Preference for direct answers,Preference for responses that encourage discussion,,,
642452e0-a92d-44ba-8a9a-b8c7bdb1f65c,I prefer responses that enable me to have further discussion. Please give me the right answer but give me broader responses to discuss further. ,Neutral,Direct answers with option for further discussion,Preference for responses that encourage discussion,,,
ae97c111-612b-428f-b852-b39dab639a9a,"I would expect a direct answer when I need to clarify some academic concepts. But when I am looking for some support to develop my idea further, the discussion is much appreciated",Neutral,Preference for direct answers,Preference for responses that encourage discussion,,,
714909a6-53b8-48b2-8e32-0dc61d95ac4b,I would prefer direct answers when I need something quick but for deeper topics responses that encourage discussion seem better since I like exploring different angles and thinking through ideas,Neutral,Balancing direct answers and discussion,Context-dependent preferences,Preference for direct answers,Preference for responses that encourage discussion,
527356b0-3bb9-46a8-85d2-806d94f9af6e,"I would prefer you to always give me straight answers. And if I decide that you need to show me another point of view, I can ask for it in that particular case.",Neutral,Direct answers with option for further discussion,,,,
52670c2f-0553-4186-8b87-e29f08ce741a,It depends on the context. Most of the time I prefer discussions since it helps me understand the topic rather than just getting an answer. Most of the time AI gets things wrong so when there is a discussion it can correct itself or even sometimes I can notice the error it is doing.,Neutral,Context-dependent preferences,Preference for responses that encourage discussion,,,
44e86061-1e72-4ab2-a300-b08e1bafe0a8,"It is better for the responses to be direct answers and at the same time encourage discussion, even if in a simple way.",Neutral,Balancing direct answers and discussion,Preference for direct answers,Preference for responses that encourage discussion,,
0a57f43b-f6fe-4e59-bcd8-d7ede19a85fa,It really depends on my prompt. I would prefer direct answers if I'm short on time.,Neutral,Context-dependent preferences,Preference for direct answers,,,
8af810d8-e7d8-4160-b986-80aaccd7eece,"It really depends on the situation. If the goal is to dive deeper or explore ideas, I’d focus on encouraging discussion, asking follow-up questions, and exploring different perspectives to keep things engaging. But if you just need a clear, straightforward answer, I’d keep it direct and concise.",Neutral,Balancing direct answers and discussion,Context-dependent preferences,,,
