Participant ID,ResponseText,Sentiment,Tag 1,Tag 2,Tag 3,Tag 4,Tag 5
ff706256-0e50-4cdd-893e-41da9fdabb04,"I would prefer discussions to prompt what I'm playing at. I would also like direct answers instead of a paragraph of explanation, when I want a specific answer. It all depends on the kind of prompt we put in AI, I believe ",Neutral,Balancing direct answers and discussion,Context-dependent preferences,,,
a79ee70b-f0c5-4247-9b25-31d13094fbde,"Depending on the context, sometimes the answer needs to be fixed and not debatable, whereas in a more informal context, debatable answers would be appropriate.",Neutral,Context-dependent preferences,,,,
0a763e06-6247-4b99-bed0-73e8ad71a0a2,"Depends on context. If I need quick answer - I'd prefer direct response. Otherwise, details would be better",Neutral,Context-dependent preferences,,,,
e1bce1ba-9e84-41d7-b71c-82183e76eb9d,"Direct answers, discussions are important but they are not my focus when I ask an AI something.",Negative,Preference for direct answers,,,,
0ef846ce-6dc8-4ce2-baa3-761444e16e7a,Direct answers. If I want discussion I want to be able to prompt it into this role.,Neutral,Direct answers unless otherwise specified,Preference for direct answers,,,
e699827b-5a0e-492e-bd5d-57438d9780c5,"Give it first, and I'll discuss it when I need it.",Neutral,Balancing direct answers and discussion,Preference for direct answers,,,
6356fee4-44aa-4bd3-ac95-c8bc63beb1e4,I prefer direct answers unless you give the indication to create an atmosphere of debate.,Neutral,Direct answers unless otherwise specified,Preference for direct answers,,,
ca6a1fc2-4dbd-40c7-a4e4-6ea7cec4538d,"I usually wait for direct answers, but when I have questions I use it for discussion.",Neutral,Preference for direct answers,Preference for responses that encourage discussion,,,
6f76a7ec-e8d2-42ee-9792-5f81d25b93fd,I want direct answers. But there's time when I asked AI for discussion and then I chat with AI and we gives our response to specific topics. This way I can understand about the pro and cons of certain topic.,Neutral,Balancing direct answers and discussion,Preference for direct answers,,,
b9d8623c-9508-4f53-b9ba-eb1d6c8595e2,"I would expect a direct answer, after direct answer, it can give an another perspective on topics.",Neutral,Direct answers with explanations,Preference for direct answers,,,
93bf9665-9dc8-48ea-950c-451ba755cebd,"I would like AI to first provide the direct answer in the first paragraph. In the last paragraph, it may encourage discussion.",Neutral,Direct answers with option for further discussion,,,,
97d2d9ec-d9ce-4119-a5c0-b013b72a4699,I would prefer AI to focus its responses to give direct answers to my questions. It can ask in the end if I would be interested in a discussion.,Neutral,Direct answers with option for further discussion,Preference for direct answers,,,
c9cff3eb-d7d5-439f-a89e-6ceaf83ba472,I would prefer responses that give direct answers unless I encourage discussion and ask the AI to discuss something with me,Neutral,Direct answers with option for further discussion,Preference for direct answers,Preference for responses that encourage discussion,,
4653a2cb-1d80-466e-8bc6-83f53e5b0d6e,"If I am asking questions, I usually want direct answers. If I have different ideas than knowledge that AI give me, or if I have a completely different idea, I would encourage discussion on my own by continuing to ask and share my thoughts with it and asking questions and discuss about that. So, I would prefer direct answers. I would prompt discussions specifically if I need.",Neutral,Direct answers with option for further discussion,Preference for direct answers,,,
7aca3ca3-01a3-479f-abd7-20b277cf6a89,"If I use a detailed prompt, I like a direct answer. But sometimes I want to be given an explanation that is appropriate to the situation.",Neutral,Context-dependent preferences,Direct answers with explanations,,,
39c541ea-6b7e-4778-bfdb-a0754e408f26,"It again depends on the context, and the prompt. If given a direct prompt, first it should give a direct answer, then maybe divulge a bit, especially for scientific or mathematics. For a social topic, I would expect a more conversational answer ",Neutral,Balancing direct answers and discussion,Context-dependent preferences,,,
99802513-d891-4443-a758-ce381f099c74,It depends if I asked it to be direct and straightforward or If I asked it to have a throughout conversation  ,Neutral,Context-dependent preferences,,,,
87c5240f-dd05-4d29-b915-c2aa0da817d5,"It depends on the question or prompt. If I need to debug a code issue or error, direct answers are best. If I ask for travel recommendations, I like to have responses asking for my preferences and reasons, so it can tailor the recommendations. ",Neutral,Context-dependent preferences,,,,
390e4a12-cd35-4cc7-94be-682b3014fb70,It is purely depends upon the context of the prompt. Sometimes I expect discussion and sometimes direct answers.,Neutral,Context-dependent preferences,,,,
e99df2dc-7aa5-4171-85cf-9f240a244be9,"It really depends on the situation, I would prefer it to be direct and if I am in a discussion mood for me to start that.",Neutral,Context-dependent preferences,Preference varies with mood or situation,,,
900c27d7-d7ac-412d-a221-e0728fab3539,"It totally depends on the situation or the way I have asked the question, sometimes it's a one word kr one liner answer but while understanding so,e deep concepts I need detailed answers with images and references. ",Neutral,Balancing direct answers and discussion,Context-dependent preferences,,,
301886c0-c594-4b87-8f3d-3acd7bbd9718,"Normally when I search for something it is to have direct answers, I think that if it is something that I am looking for more discussion and possibilities I already make it explicit in the prompt.",Neutral,Context-dependent preferences,Preference for direct answers,Preference for responses that encourage discussion,,
8ac2f239-60f7-42e5-bd23-4ca151d370eb,"Not discussion,but the goal should be with step by step concise explanation with direct answers,because most of the times lengthy answers makes us confused.",Neutral,Direct answers with explanations,Preference for direct answers,,,
a74841a7-3b82-496b-bff1-acce9d0cd7ee,"Situational! Sometimes simple direct answers are helpful, sometimes discussion. Depends on the context.",Neutral,Context-dependent preferences,,,,
1a9fa919-2e5b-49df-8384-43234c132515,"Sometimes I need the direct to the point answers.

And sometime I am open to discussion.


",Neutral,Balancing direct answers and discussion,Preference for direct answers,Preference for responses that encourage discussion,,
e80dc674-07c7-4724-bcb0-f8a8528ff925,"That depends on what I want, if I want more discussion I specify that in my prompt, otherwise direct answers work for me.",Neutral,Context-dependent preferences,,,,
18c76933-8731-4e6c-8dc5-6be9d9d19214,"To give me direct answers, if I want further discussion I will ask for it.",Neutral,Direct answers with option for further discussion,,,,
c04a180d-793c-4350-a591-5a0be8ae7e92,depends on the questions. sometimesI would like to have a discussion and sometimes just direct answers,Neutral,Context-dependent preferences,,,,
f31e6b9f-b1b5-442c-9055-dae6a3f42152,"Depends on the context. For something that i need more explanation, I'd want to get a complete explanation. Direct answers however are for specific questions ",Neutral,Context-dependent preferences,Direct answers with explanations,,,
610f28bc-0c7c-46a1-86cd-818dc6190e7d,Depends on the request. Most often I expect direct answers.,Neutral,Context-dependent preferences,Preference for direct answers,,,
8cd0ce45-c73b-4b7b-ade0-07d1c7455046,"Depends on what I am asking, but I think for majority of topics just direct answer",Neutral,Context-dependent preferences,Preference for direct answers,,,
8d656ead-cfb3-4885-ad41-2bbf39e810d8,Direct answer is better for small doubts but for something complex discussion is better ,Neutral,Context-dependent preferences,Discussion for complex topics,,,
d73be5c3-c761-4060-aae7-8eadd66754a3,"Direct answers, although it depends on the context, particularly for my daily use, debate is of no use to me.",Neutral,Context-dependent preferences,Preference for direct answers,,,
49a524c5-71f4-4240-ab59-660319ebb921,"Direct answers, mostly. If discussion was desirable for me I'd prompt it accordingly.",Neutral,Context-dependent preferences,Preference for direct answers,,,
adc7e99b-4225-4ab8-9202-9412b4f858a3,Direct answers. Only open the discussion when the command demands it.,Neutral,Preference for direct answers,,,,
c00fcbb3-1605-47ce-9f44-f2b0e3f75162,"Direct answers? I’m not at a point in life right now where I’m interested in having a discussion with AI. 


But if AI is providing responses to foster discussion between people that’s cool.",Neutral,Preference for direct answers,Preference for responses that encourage discussion,,,
719b7864-77f6-4141-805c-9a30f6ba40eb,"For my purposes, I think I prefer direct answers that help me solve a problem or understand a given situation. I think that when I need to encourage discussion, I would let you know explicitly.

The answers I expect are:

•Exemplary

•Direct

•Concise

•With real information",Neutral,Direct answers for specific tasks,Preference for direct answers,,,
e3ea1297-e9b1-43fe-b8d9-4cccde3b3631,"I am interested in direct answers, I need to reach the core of the topic in a straight way, the discussions can happen every now and then and only if necessary.",Neutral,Balancing direct answers and discussion,Preference for direct answers,,,
8dceaf58-fdac-4dc5-bc99-6eddef84d16b,I need direct answers and encourage discussions when needed,Neutral,Preference for direct answers,Preference for responses that encourage discussion,,,
8e5549b0-0330-40ab-ac63-b7d96c94b2b1,I prefer direct answers unless I specifically ask for responses that encourage debate or you question my answers.,Negative,Direct answers unless otherwise specified,Preference for direct answers,,,
dec1949d-a558-48c1-beab-671996abde45,"I prefer responses that encourage discussion. When it comes to personal goals, direct answers do not really fit that situation. I would expect quite a long back and forth discussion before goals can be set. AI could help with thinking about barriers in reaching my goal or quicker ways to reach goals. Even with a long discussion, AI would probably be quicker to help me than my own research. ",Neutral,Discussion for personal growth,Preference for responses that encourage discussion,,,
8a16602a-8ef8-4430-8712-0c49e10f3d20,"I think answers should give direct answers and proofs, but should be open to some discussion as well. I think that in the common human experience, discussion (with others or wirh self) would have already happened before presenting the matter to the AI.",Neutral,Balancing direct answers and discussion,,,,
29fa3804-9118-46fc-8178-15e1d9edf907,I want it to give me direct elaborate answers of what i want. if a discussion i want it will act upon on it,Neutral,Preference for direct answers,Preference for responses that encourage discussion,,,
7d384290-55b2-43a2-a8be-ecdde6bb779d,"I want the AI to give direct answers and encourage discussion at the end.
",Neutral,Balancing direct answers and discussion,,,,
8eeadde9-b69c-442d-bbe9-de2e37e890f6,I would like direct answers with a prompt for discussion if wanted.,Neutral,Direct answers with option for further discussion,,,,
c6e79c65-91cc-45d7-bd9d-66c83cbb03d3,"I would prefer direct answers for most questions.
A discussion would be best if I am learning at the time about a subject but not for the rest of times.",Neutral,Context-dependent preferences,Preference for direct answers,,,
2c4e8dbb-785b-4817-a68e-d1dd76e2e562,I would prefer it to give a more direct answer. Discussions is okay too if I specifically specified that I want to have one.,Neutral,Balancing direct answers and discussion,,,,
e97c7f71-9243-4140-9090-2268ce615e04,I would prefer responses that give direct answers but it can be great if we could have a proper discussion with ai ,Neutral,Balancing direct answers and discussion,,,,
c83cd3f7-2ec2-48f0-ab4b-8f6fbb3ab67a,I would prefer responses that have discussions but at the end I need the direct answers.,Neutral,Balancing direct answers and discussion,,,,
f3447ff7-8e6e-41df-b9df-80c33652907e,"I would say it should depend on the type of prompt. If I am asking about something that has a straight answer, then the AI assistant should provide a direct answer; if its something open-ended, then it should encourage discussion.",Neutral,Balancing direct answers and discussion,Context-dependent preferences,,,
dc81e041-f717-4817-97d9-b79f4440a892,"I'd prefer it to give a direct answer since most of the time, I use AI to summarize, to review, or to answer mu question only. We can engage or have encourage discussion if I want them to/give them another prompt",Neutral,Direct answers unless otherwise specified,Preference for direct answers,,,
a2457aa0-43b8-4af7-acd1-da27f63f1295,"If I ask a simple question, then I would like a simple answer. But if my question requires a discussion with the AI, then let it discuss with me.",Neutral,Context-dependent preferences,,,,
02de2774-6232-4789-8150-3fdd7f6c2e2e,"If my prompt is complete then I would like the AI to ask questions. Otherwise, I would prefer direct answers to my questions.",Neutral,Context-dependent preferences,Direct answers unless otherwise specified,,,
b514f72f-9744-496e-aeed-8e82d5bbf0c8,"It depends a lot on the context, sometimes I would prefer to receive direct answers that are not subject to interpretation and do not provoke any discussion. In other cases I would prefer to be given answers that provoke discussion and questions, such as in various fields of research.",Neutral,Context-dependent preferences,,,,
4be2a465-df19-49f9-bfe0-4c0d48bf6ed8,"It depends on the context and the type of questions, but if the questions are simple and don't involve complex issues, then the answers should be direct. I don't need a discussion when asking for a recipe, for example. ",Neutral,Context-dependent preferences,Direct answers for factual queries,,,
e2e859fd-a7c1-49ee-9945-c64175c5f861,It depends on the contxt. I would like direct answers for fact checks and for other complex topics I am fine with open ended responses,Neutral,Context-dependent preferences,Direct answers for factual queries,Discussion for complex topics,,
b7f89664-2f7f-4bfd-af40-d250f06a328e,It depends on the question asked. Sometimes i like the encouragement and other times a direct answer is best,Neutral,Context-dependent preferences,,,,
3a1cb34e-4eca-488d-9ef2-bd491bcc2afb,"It totally depends on the topic; sometimes I need a direct answer, sometimes I want discussion. ",Neutral,Context-dependent preferences,,,,
e4ccfec9-e137-43dd-a078-1bf84c9f27fc,"It will depend mainly on the context, but I would prefer more concrete answers. There are times when text generators put in a lot of information.",Neutral,Context-dependent preferences,,,,
9a38deed-9797-46da-a01d-45e30d771476,"Rather than encouraging debate, I like the answers to be direct and when alternatives need to be presented, I can discuss them to forge a more complete response.",Positive,Balancing direct answers and discussion,Preference for direct answers,,,
baf383d0-9555-48a6-9d07-fe4c1bc582bf,"This depends on the specific needs. Generally speaking, directly giving an answer lacks the verification process.
",Neutral,Context-dependent preferences,,,,
013d6a9a-0c95-4f56-9447-d18c859ba116,"Well for me this is situational, since some of the user are really in need of direct answer and some are just ideas. But for me I would like both, for me to be able to have direct answer as well as discussion that could expand my knowledge. ",Neutral,Balancing direct answers and discussion,Context-dependent preferences,Discussion for expanding knowledge,,
62b8e68b-83cd-4c9c-9084-14110e3d0a19,"depends, sometimes i need both sometimes direct.",Neutral,Context-dependent preferences,Preference varies with mood or situation,,,
14481095-0cc5-4635-88b5-13632713879b,i mainly prefer the ai to just give direct answers with an open question to encourage more specific discussion,Neutral,Preference for direct answers,Preference for responses that encourage discussion,,,
86f924a3-924b-4374-bf1f-f63a459c4206,"most of the times, direct answers. as i used just have doubts. i would ask it to prompt a discussion when it is needed.",Neutral,Preference for direct answers,,,,
91990b87-53ac-445f-8338-1d006f41d2ab,Both depending on the situation or prompt,Neutral,Balancing direct answers and discussion,Context-dependent preferences,,,
70c67909-a1a2-4670-93a1-732c2b4173d5,Both depends on the question ,Neutral,Context-dependent preferences,,,,
a990ab2d-76ad-43e5-b59d-2e77f0029713,Both. It depends on the context,Neutral,Balancing direct answers and discussion,Context-dependent preferences,,,
af056fda-7437-49aa-a139-a0bc81808f3d,"Depends on my goals, but it is inclined more on direct answers to save time. Encouraging discussion-type responses should be optional to the asker. Let us  initiate the engagement first before the AI does.",Neutral,Context-dependent preferences,Preference for direct answers,,,
5ec5a158-a465-42bd-9ed2-5b6b5005a44b,Depends on the context ,Neutral,Context-dependent preferences,,,,
4f804dde-1354-4a87-829d-481ce45fa07d,Depends on the prompt. But I prefer direct answers. Encouraging discussion should be added in the prompt (sometimes doesn't work),Neutral,Context-dependent preferences,Preference for direct answers,,,
f503005e-adc7-46b8-af4d-0a82cd4bfab8,Depends on the question I’m asking ,Neutral,Uninformative answer,,,,
e16f6a78-c92e-4fbb-8daa-d3eaba2bc276,Depends on the topic,Neutral,Context-dependent preferences,,,,
3c078075-db8c-4d93-9e30-4188022736d3,"Depends on what I am asking. If I wanted a discussion, I would specifically ask for a longer and more detailed explanation. For the simple things, I would appreciate straight to the point answers.",Neutral,Context-dependent preferences,Direct answers unless otherwise specified,,,
1434dcc8-5443-42cd-986f-08d70c261fa9,Direct answers are more suitable for most users. Discussion answer is necessary if user specify the requirement ,Neutral,Preference for direct answers,Preference for responses that encourage discussion,,,
7c306068-4591-436f-8c32-8a4769ac1341,Direct answers mainly. Discussion should be encouraged only when requested or if AI senses from my queries that I still do not fully understand the topic,Neutral,Direct answers unless otherwise specified,Preference for direct answers,Preference for responses that encourage discussion,,
8693fa4a-c229-4def-aead-32c3cc8bac9f,"Direct answers,discuss it’s too popular but sometimes it’s not needed,unless we are on a discussion session",Neutral,Direct answers to save time,Preference for direct answers,,,
ed81c27a-b657-4764-ad6d-e54f290300c6,"Direct answers. AI should not engage me in debate unless I ask it to. In the event that I make a mistake and provide incorrect data, AI should be able to correct me.",Neutral,Direct answers unless otherwise specified,Preference for direct answers,,,
0848dd9a-855b-442d-8357-92e40942bc20,For today's world we want everything fast and instant. I'm going to have to agree just give an answer directly to the answers or if I want something more I'll ask for it. ,Neutral,Context-dependent preferences,Preference for direct answers,,,
bb839318-52c3-40ed-b136-43ce4df095eb,Give the answer directly. It is best to discuss it in categories and analyze specific issues instead of giving general answers.,Neutral,Discussion for complex topics,Preference for direct answers,,,
0bc9fd87-bcf5-4ec1-bfd1-a542dd9d5a81,He should do this according to the nature of the question.,Neutral,Other,,,,
06bf3c74-89af-4ef9-a396-b9ab51d8f6f2,I guess it depends on the question I am answering. But mainly I would prefer direct response ,Neutral,Context-dependent preferences,Preference for direct answers,,,
3e86461d-35c9-4a03-abe5-e76b4b82f0ad,"I like direct answers, but sometimes I also like answers that encourage discussion",Neutral,Balancing direct answers and discussion,,,,
1566de9d-0cea-43ba-8995-e3f59730f9b5,"I prefer direct answers as I think I would probably use AI in instances when I need to get something done quickly, or where I need to simplify certain tasks. Discussions could tend to lead to complexity. ",Neutral,Direct answers for quick solutions,Direct answers to save time,Preference for direct answers,,
a7979952-31c7-47f1-98cf-a0e31ff1017d,"I prefer direct answers but if I ask you to debate, you would be able to do it.",Neutral,Direct answers with option for further discussion,Preference for direct answers,,,
cd61ca43-e49f-482c-8815-b275e2088a01,"I prefer direct answers, but this highly depends on context. If I'm asking historical questions, there needs to be a lot of input. For smaller questions like helping making a to-do list, correct text or translate something, a direct answer is necessary.",Neutral,Context-dependent preferences,Preference for direct answers,,,
4f52be22-01f9-4705-8f07-cabd6dcb06bd,I prefer to give direct answers and modify the request later if necessary.,Neutral,Preference for direct answers,,,,
7cc8ee2f-ca73-4d61-b135-2a2cee7e6364,I usually prefer direct answers. I'm open to responses that encourage discussion but it depends on the subject.,Neutral,Context-dependent preferences,,,,
be24cc51-1822-44b8-9a3d-94c05862809a,I would AI to give me direct answers straightforwardly and encourage discussion where possible or need to be to discuss something.,Neutral,Balancing direct answers and discussion,Preference for direct answers,Preference for responses that encourage discussion,,
03a10fb5-44e6-4d6f-b23f-f45598418ef7,"I would like it to give direct answers but if my prompt is not enough, encouraging discussion will be helpful.",Neutral,Balancing direct answers and discussion,Preference for direct answers,Preference for responses that encourage discussion,,
75e1f669-e172-4d48-a80c-589642093cf3,"I would prefer responses that encourage discussion, generally. However there are times that direct answers are what I am looking for as I am on a time constraint. I have found that my prompts to AI will determine which line of dialog I am interested at the time and AI has been good to see that. ",Neutral,Balancing direct answers and discussion,,,,
e122ae04-0516-4f28-868f-f72b2c0dcda2,"I would prefer responses that just give direct answers to begin with. If I then would like more responses which encourage discussion, I would prefer to make that choice myself. Especially because depending on what I am using AI for at the time, I may or may not need discussion. Although, I can see how discussion can help you see things from other perspectives in a way you may not see yourself.",Neutral,Balancing direct answers and discussion,Discussion to explore different perspectives,,,
b29d92d4-b605-4832-9a75-0fc3825534b8,"In most of the cases i want direct answer, if i need them to be discussed then i will carry on the conversation",Neutral,Context-dependent preferences,Preference for direct answers,,,
606a3f41-8d53-4bdf-8d6a-e71e63665ae4,It depends on the context ,Neutral,Context-dependent preferences,,,,
ad7e1a08-d003-4a41-8058-bcb08f23db73,"It depends on the context and the type of request. A mathematical answer does not, by definition, have to give rise to a conversation.",Neutral,Context-dependent preferences,Direct answers for technical or scientific queries,,,
ec017bcb-ff30-4107-a96a-5bbc9f0ad2ef,"It depends on the context. If I need the AI to challenge me in my way of thinking for example I would want discussion, but if I wanted to learn something new then I would want direct answers.",Neutral,Context-dependent preferences,Preference varies with mood or situation,,,
579d2218-9539-4a1c-b938-9c4b9c341579,It depends on the question.,Neutral,Context-dependent preferences,,,,
ad8bdb3f-f7a5-4aa5-93a4-2309123f29cf,It depends on the situation ,Neutral,Preference varies with mood or situation,,,,
f4d13593-5923-4224-9510-bcd0bebb3fea,"It depends on the situation, sometimes I need the direct answers, but also need the discussion. ",Neutral,Context-dependent preferences,,,,
64a8da32-f632-4595-a7b4-029c6c67214a,It depends on the situation.,Neutral,Context-dependent preferences,Uninformative answer,,,
7c86fcaa-8747-45e5-b4a0-70acf634a497,It depends on the situation.,Neutral,Context-dependent preferences,Uninformative answer,,,
1d406c09-5df1-471f-af94-dac32af330b3,"It depends on the topic, but generally, I prefer responses that give direct answers. ",Neutral,Context-dependent preferences,Preference for direct answers,,,
93a1e322-7c01-42c0-bd0f-5aff54886660,It depends on what I want ,Neutral,Context-dependent preferences,,,,
ceae18dc-0c97-499b-9b40-5ed524001359,"It depends what I am asking it, sometimes there is just a straightforward answer I am looking for, sometimes I am looking for general ideas to work from",Neutral,Context-dependent preferences,,,,
d8770d6a-3728-4919-928f-8a99fe9e9941,It still depends on the subject.,Neutral,Context-dependent preferences,,,,
4ebcc244-e506-40ea-acc8-ad92ae6eddce,It will depend on what I ask of him.,Neutral,Context-dependent preferences,Preference varies with mood or situation,,,
d9aa93fd-8deb-4238-81ad-35a1072da988,Most of the time I need clear and short answers sometime I need detailed answer when it is related to my job or learning purpose.,Neutral,Context-dependent preferences,,,,
cbf5f7f6-6412-492e-a2b5-bc05d01331b1,"My main purpose for using AI is to gather information, so I would prefer a direct answer on that issue.",Neutral,Preference for direct answers,,,,
