Participant ID,ResponseText,Sentiment,Tag 1,Tag 2,Tag 3,Tag 4,Tag 5
439832e2-50f8-49b9-b544-8ec3255ff5b9,I like it when AI gives me direct and short answers to my questions and the creative tasks are left to me.,Positive,Direct answers to save time,Preference for direct answers,,,
fd9cb339-fa0c-47e6-9c88-838f39ef494d,"I want it to encourage discussion. When I wonder something, I don't want the AI just saying yes to what I'm asking. I want it to criticize and verify what is wrong in my question or explanation. I don't want it just conform or give direct answers. ",Neutral,Discussion for critical thinking,Preference for responses that encourage discussion,,,
a965e66b-0c26-49fa-bca8-38bd458267bb,I would prefer direct answers unless otherwise instructed.,Neutral,Direct answers unless otherwise specified,Preference for direct answers,,,
6f2966a6-e212-4e68-8503-b2730fee28bc,I would prefer if it feels like I am talking to a person rather than a robot which gives direct answers.,Neutral,Other,Preference for responses that encourage discussion,,,
e788db9e-295f-498e-9af7-b5f7b5676cae,I would prefer responses that encourage discussion as in that way I can be able to give further instructions to AI or clarify on areas I feel like it may have missed. ,Neutral,Preference for responses that encourage discussion,,,,
b2200b0e-2c06-4e5e-8d2f-0624e9fe97a0,In most cases I want the AI to give me the answer directly.,Neutral,Preference for direct answers,,,,
c3ee4a53-e722-40d0-bdda-f47b283a1f52,a little bit of both,Neutral,Balancing direct answers and discussion,,,,
48356c21-3b36-4dce-906f-d952cf3174db,just direct answers unless i ask for clarification ,Neutral,Direct answers unless otherwise specified,Preference for direct answers,,,
ab84f73b-40d9-42f5-afd6-3ebcb5511713,that gives direct answers to what is asked of him,Neutral,Preference for direct answers,,,,
14e13b06-73a2-4302-958c-9e38fdeb5184,Both,Neutral,Other,,,,
dbcfd3e6-da50-4715-90bc-aa92e1260421,Both,Neutral,Balancing direct answers and discussion,,,,
f50b84a7-dc52-444b-8c6d-c725d773656e,Both,Neutral,Balancing direct answers and discussion,,,,
81dc147c-56df-4d18-a831-70cac273b40b,"Both depend on the context of the topic, but the discussion is good and helps with challenge and creativity.",Positive,Context-dependent preferences,Preference for responses that encourage discussion,,,
11aca137-ad08-498d-97c5-0e2001fcffd5,Both.,Neutral,Context-dependent preferences,Uninformative answer,,,
2dcd9a85-f0c1-4eb2-b1af-a3e18e92cc03,I like it better when it gives me direct answer unless I specified otherwise because I need them to give the most accurate response as fast as possible.,Neutral,Direct answers unless otherwise specified,Preference for direct answers,,,
62482895-b956-40a0-9546-4ce14191e2ef,I prefer both of them,Positive,Balancing direct answers and discussion,Context-dependent preferences,,,
48846b3a-555f-458a-997e-4b7d3788ffd1,I prefer in between,Neutral,Balancing direct answers and discussion,,,,
564979e5-c5de-47b3-b779-51dbf7568ec1,I prefer response that encourages discussion when I have a lot of time or I want to learn something in deep. If I am in rush I like to get direct answers. ,Positive,Balancing direct answers and discussion,Context-dependent preferences,,,
3ed1edc8-f2de-40e0-b117-64bdbaeefe04,"I prefer responses that encourage discussion, as they foster deeper understanding and critical thinking. An AI assistant should ask probing questions, explore different perspectives, and engage in dialogue to help me refine my ideas and arrive at well-rounded conclusions.",Neutral,Discussion for critical thinking,Discussion for refining ideas,Discussion to explore different perspectives,Encouraging discussion for deeper understanding,Preference for responses that encourage discussion
4bba9347-8c6a-4493-a9c1-fdbcf2574efe,"I prefer responses that encourage discussion, it's boring for me if the AI just straight up answer the questions",Neutral,Preference for responses that encourage discussion,,,,
7f30b1e2-8f7d-4cf3-a9ef-20f6db69e3dc,I prefer the latter.,Neutral,Uninformative answer,,,,
90e1d873-3767-46af-852d-ed1bf497a19a,"I prefer with just give direct answers, unless if I asked something else.",Neutral,Direct answers unless otherwise specified,Preference for direct answers,,,
c86bf1b3-89e2-46ec-a5cf-8a1b75cae091,"I would like both of them but if I have to choose, to encourage discussion",Neutral,Preference for responses that encourage discussion,,,,
d30bbb7d-f221-4803-8002-cac695ad6cb2,I would prefer both,Neutral,Balancing direct answers and discussion,,,,
e8269218-b7fa-400f-a54a-1dcf731c59ab,I would prefer both,Neutral,Balancing direct answers and discussion,,,,
1043e55b-0e53-4fc2-961c-cda1182698a0,"I would prefer responses that encourage discussion when exploring ideas or learning, but direct answers when I need quick and clear information.

",Neutral,Balancing direct answers and discussion,Context-dependent preferences,,,
d5e1930e-6bc3-4a19-9451-d18a0e81aeba,both,Neutral,Balancing direct answers and discussion,,,,
d64df773-608b-4403-a9f2-4857af28ce69,"direct answers about what I'm dealing with

",Neutral,Preference for direct answers,,,,
1e6faf7e-007c-460e-8ea6-0d9e8c778a4a,im open to a discussion if there are valide arguments there,Neutral,Discussion to explore different perspectives,Preference for responses that encourage discussion,,,
20e78ce3-0e12-465d-a6c1-4b18fe7ab709,Discussions are better because one gets diverse responses hence challenging the already existing ones to get the better responses ,Neutral,Discussion to explore different perspectives,Preference for responses that encourage discussion,,,
7b6dd76f-ed90-4806-a221-bc73e08a4ef6,"For creativity and learning, I prefer responses that encourage discussion. For quick tasks, I like direct answers.",Positive,Context-dependent preferences,Preference for responses that encourage discussion,,,
737bb7d8-7bdb-426e-9bd1-c3ee8cd95765,I prefer a lengthy discussion as I could understand the nuances and intricacies of a subject matter clearly.,Neutral,Discussion for learning and engagement,Preference for responses that encourage discussion,,,
12595a56-aec9-4db8-965d-bee81aceff60,I prefer direct answers unless otherwise specified.,Neutral,Direct answers unless otherwise specified,Preference for direct answers,,,
5f4bc2fd-fb0a-4f27-a238-9d8f4b70d394,"I prefer direct answers, I have no interest in debating with a tool that comes with the bias of the company that developed it.",Negative,Preference for direct answers,,,,
849daf0c-a788-4a64-aa99-4e256bc49a2b,I prefer that encourage discussion as it is make more well understanding on  it. But sometimes I need direct answer when need faster.,Neutral,Balancing direct answers and discussion,Preference for responses that encourage discussion,,,
6d8e641e-c9f2-4f26-b58a-9d0051ae5a6d,"I would generally prefer direct answers, to be more time efficient",Neutral,Direct answers to save time,Preference for direct answers,,,
62bd9581-fa57-4ffc-acfe-4c27b6ca7406,I would like responses that both encourage discussion and give direct answers. This can give a person a different point of view.,Neutral,Balancing direct answers and discussion,,,,
9f01bbea-2250-44ae-8f4c-527e3b2d1fd6,I would prefer AI to give direct answers to me.,Neutral,Preference for direct answers,,,,
1688e08f-d00d-4d64-8d94-a0141de67c43,"I would prefer direct answers. I'll continue the conversation if I find it necessary, but I don't need chit-chat or emotional support from a machine. ",Neutral,Preference for direct answers,,,,
7f5084cf-734d-40b0-b471-aa9e3a8919ae,If it can help one to think bigger and better then that is more preferred. It can help one broaden the scope of ideas and perspective ,Neutral,Other,,,,
6fd263a9-9525-4910-840d-8cfe86630f6d,Direct answers to keep things more real,Positive,Preference for direct answers,,,,
8eebc575-068d-4b73-b091-3563a95fa0be,Direct answers. This makes it like a true conversation,Neutral,Preference for direct answers,,,,
10750e6a-3452-4941-bfac-28a060c808a9,I prefer AI to give me responses that encourage discussions to understand more on the topic,Neutral,Encouraging discussion for deeper understanding,Preference for responses that encourage discussion,,,
282f3a8e-79a8-4821-bd81-19cb79f0acf6,I prefer direct answers and broader ones.,Neutral,Balancing direct answers and discussion,Preference for direct answers,,,
2f7ef803-1f7d-4dff-8e65-494699f63a87,"I prefer direct answers, according to what I'm looking for. I don't have time for discussions or debates.",Neutral,Direct answers to save time,Preference for direct answers,,,
b85b90a7-a07c-46af-89a9-a4f0be166b87,I prefer direct answers. I don't like talk to AI for long time.,Negative,Preference for direct answers,,,,
75b4a46a-315f-46eb-926b-dafe0fdcdcb1,"I prefer direct answers; most of the time I'm in a hurry. If I wanted more info, I'd use another resource.",Neutral,Direct answers to save time,Preference for direct answers,,,
900c92dd-a0fe-4a7d-aed0-c8e291e1a9d3,"I prefer responses that encourage discussion, as it helps me dive deeper into the topic. But sometimes, I also appreciate direct answers when I need quick information.",Positive,Balancing direct answers and discussion,Preference for responses that encourage discussion,,,
d16fe75f-ffd3-401b-8b81-fa4368dac6ab,I would prefer the AI ​​to answer directly.,Neutral,Preference for direct answers,,,,
ec41813d-33ef-41b3-9e7b-388e28dd80b1,I'd prefer direct answers unless otherwise specified,Negative,Direct answers unless otherwise specified,Preference for direct answers,,,
1e672d04-fe5a-44f2-846e-2f02c84fb9ab,It's situational. If I'm using it for entertainment or creativity I'd like it encourage discussion. ,Neutral,Context-dependent preferences,Discussion for creative or philosophical topics,Preference for responses that encourage discussion,,
9ef77dc5-3750-4bd9-8af3-c7292684473b,Responses that gives direct answers.,Neutral,Preference for direct answers,,,,
cbe5afb9-5c8d-4587-8743-20b60a9c65fa,a little bit discussion only if needed,Neutral,Balancing direct answers and discussion,,,,
e05bf71c-3d8c-4bdd-ac09-12fe0261e83e,answers that encourage discussion so that we can share ideas and maybe take tips from AI,Neutral,Discussion to explore different perspectives,Preference for responses that encourage discussion,,,
92149261-c131-435c-a11a-180c93e93758,"
I think I’d lean more toward responses that encourage discussion. I like the chance to explore different angles or dive deeper into a topic. A direct answer is useful when I need clarity or a quick solution, but having room for back-and-forth feels more engaging and helps me process things better.",Positive,Balancing direct answers and discussion,Encouraging discussion for deeper understanding,Preference for responses that encourage discussion,,
e8217829-4686-492f-aca1-65322a30fcac,"A little of each. I believe that answers that encourage discussion are useful because they stimulate thinking and critical thinking, but direct answers are also welcome.",Neutral,Balancing direct answers and discussion,,,,
109719d5-a02f-429b-921e-afcfad114673,"Both, I think it is also correct to question their ideas or their point of view to reach a healthy debate where the user is allowed to expand their ideas.",Neutral,Balancing direct answers and discussion,Discussion to explore different perspectives,,,
f5cd81e6-57db-4ea5-a9c6-d454411fdd24,Direct answers are better for me. ,Positive,Preference for direct answers,,,,
8ebbcfa4-e59a-4caa-8323-34cdebe105a7,Direct answers are preferred ,Neutral,Preference for direct answers,,,,
3a92f982-2ba2-4007-8af7-e3e02ef3ddc1,Direct answers mostly.,Neutral,Preference for direct answers,,,,
231f8b35-ef3b-4c3b-b623-bc669654cea3,I have no preference regarding this question,Neutral,Uninformative answer,,,,
b510f746-f1af-4c59-891b-8f3407a92bac,I prefer a more direct answers ,Neutral,Preference for direct answers,,,,
ff24570d-25b5-40c2-bc13-2894d55ca9a0,"I prefer answers that encourage discussion, because that way I will know when I am right and when I am wrong, I will learn new ways of seeing that situation.",Positive,Discussion for learning and engagement,Preference for responses that encourage discussion,,,
3e8bd0a2-4cc5-4989-8452-2ecb7fbb0d3f,"I prefer direct answer, because honestly I am not good at discussion.  ",Neutral,Preference for direct answers,,,,
2c8823e4-983a-4b36-9fd6-0fcf806c7fb0,I prefer to have discussion rather than direct answers as they provide more and more detailed answers that could help my work to do more productive and remember the things.,Neutral,Preference for responses that encourage discussion,,,,
bf5e0c6b-34c3-45ca-85f4-5dbbfab22dbe,"I usually prefer direct answers, I don't need a friend, I need a machine that provides me solutions.",Neutral,Direct answers for quick solutions,Preference for direct answers,,,
d1192439-d62d-42f7-b51d-c39028508e2d,I want AI should directly give me answers ,Neutral,Preference for direct answers,,,,
cabd819b-0f1f-4942-ab75-4e2ea3b5cb67,"I want AI to give me answers directly. When I want to know details, it will guide me to dig deeper.",Neutral,Preference for direct answers,Preference for responses that encourage discussion,,,
550576a2-c0b6-4b75-99ae-2fb6c9407d73,"I will prefer detailed answers and responses because detailed information is always useful.

Encouraging discussion should be choice because not everyone has time to discuss all things.",Neutral,Encouraging discussion for deeper understanding,Preference for responses that encourage discussion,,,
9807eee6-ff95-4101-baaa-4d0199ae6c8e,I would prefer direct answers in response to my questions.,Neutral,Preference for direct answers,,,,
f49445f2-5882-427a-bf65-5147341803cb,I would prefer more direct answers.,Neutral,Preference for direct answers,,,,
1720db13-f61b-492f-8d41-8136bc905096,I would prefer responses that encourage discussion although direct answers are important but engaging in a dialogue would helps understand more by exploring different approaches and find a better grasp of complex topics.,Neutral,Encouraging discussion for deeper understanding,Preference for responses that encourage discussion,,,
4cda53a3-4b00-473d-8178-7365164f9794,I would prefer the direct answer with explanation would be great.,Neutral,Direct answers with explanations,Preference for direct answers,,,
be25095e-b934-474a-b57d-7a6281211028,"Just giving direct answers is enough, although I often fear the answer that it have is inaccurate.",Neutral,Preference for direct answers,,,,
2d1c4d71-a62d-440c-8688-c201d441d007,Most of the time I nee direct answers.,Neutral,Preference for direct answers,,,,
9a4231e7-5be1-427b-ada7-60667b27a794,One that gives direct answers unless I ask for a discussion ,Neutral,Direct answers unless otherwise specified,Preference for direct answers,,,
c3349933-96e4-4ac1-a520-4708286393a1,Responses that give direct answers,Neutral,Preference for direct answers,,,,
a7969819-1c9f-4366-8ba3-668e7107c5da,"Yes, AI should encourage discussions and feedback, well detailed and concise.",Neutral,Discussion for learning and engagement,Preference for responses that encourage discussion,,,
eb0246cc-6c93-4bf4-b703-e1640d6c37e0,i prefer direct answers. they suit me well  especially when am studying.,Neutral,Preference for direct answers,,,,
6802188c-a28c-4cb0-8756-566a00bd007c,i would prefer direct answer and explanations to it,Neutral,Direct answers with explanations,Preference for direct answers,,,
fd59bee4-5f60-4387-9204-79cbc74abcb0,i would prefer discussions where applicable.,Neutral,Preference for responses that encourage discussion,,,,
2492b026-5751-485a-8763-fbae32d41a2e,"Definitely direct answers, because when I use it I usually need a quick straight to the point answer and it keeps on going... If i need extra answers, I will just ask for it",Neutral,Direct answers to save time,Preference for direct answers,,,
b0d265f2-66c7-43f5-bcff-1cf4c3da3213,Depends with situation though I prefer responses that encourage discussion ,Neutral,Context-dependent preferences,Preference for responses that encourage discussion,,,
11e80845-7ee6-459e-ae77-5a73ba16bff5,Direct answers are preferable to me.,Neutral,Preference for direct answers,,,,
e4875bb0-a89f-4ab3-9afc-945174f02cf5,"Direct answers mostly, ",Neutral,Preference for direct answers,,,,
4a05dd83-9984-4074-90b2-93020b83c166,"I prefer answers that encourage further discussion, in order to provide an ""exchange of ideas""",Neutral,Discussion to explore different perspectives,Preference for responses that encourage discussion,,,
bfdd6839-5023-49d7-b1e9-c29a4e412637,I prefer direct anaswers ,Neutral,Preference for direct answers,,,,
f9a0be94-e7de-4ca9-ac72-353f1c17e327,"I prefer direct answers to be honest. For me, AI is an AI, not a human!",Neutral,Preference for direct answers,,,,
c6d66d34-9007-4d90-89fd-1c72fda3b388,"I prefer responses that encourage discussion because they help in drafting the perfect response I expect. Discussions also help the assistant understand what I need, making it more helpful in every day life situations. ",Positive,Encouraging discussion for deeper understanding,Preference for responses that encourage discussion,,,
982c9238-d8d2-4091-952c-4de3ae6817fd,"I prefer responses that give direct answers.
",Neutral,Preference for direct answers,,,,
21ded62a-4e7d-4fb0-bd1e-bc5a35af3141,I prefer to be given direct answers.,Neutral,Preference for direct answers,,,,
8691a680-ca56-4ec0-8d7f-70975806c527,I think ai should give response that encourage discussion and give good idea,Neutral,Preference for responses that encourage discussion,,,,
4c0d904e-34e7-41d4-82f6-435525fda308,I would prefer AI to give as direct and definitive answer as possible.,Neutral,Preference for direct answers,,,,
b69ea31c-fd47-4ed2-aee9-311edc1c5152,I would prefer direct and clear answers rather than a big paragraph.,Neutral,Preference for direct answers,,,,
2c0049e9-6d6b-4250-8de7-f08b05f2282d,I would prefer direct answers as I am using AI to get a clear answer most of the times,Neutral,Preference for direct answers,,,,
2b2b8a02-935b-4dfd-ac5f-29b4181f6192,I would prefer responses that give direct answers.,Neutral,Preference for direct answers,,,,
369aa487-fd68-4a75-9d0f-1a9fc6fd6a60,I would prefer responses that give direct answers.,Neutral,Preference for direct answers,,,,
913b42e5-2929-4552-b926-6fedbfc521a5,I would prefer responses that give direct answers. ,Neutral,Preference for direct answers,,,,
c16f1060-f384-4694-b148-bfa209f91aea,It should give direct answers,Neutral,Preference for direct answers,,,,
97730491-5a25-49e3-a09f-732e3ca3da67,"I’d prefer responses that encourage discussion, as it helps me explore ideas more deeply and think critically. While direct answers are useful for quick tasks, I find that engaging in a dialogue allows for a better understanding of concepts, fosters creativity, and encourages me to refine my thinking.",Positive,Discussion for critical thinking,Encouraging discussion for deeper understanding,Preference for responses that encourage discussion,,
3e0709a6-427f-45c2-8de8-7479c489cc63,"Mostly, I'll need direct answer. ",Neutral,Preference for direct answers,,,,
01cc8b2b-49e1-4dd9-95c3-73a6f1b38709,just direct answers most of the time,Neutral,Preference for direct answers,,,,
9916cdeb-de2c-4425-a023-a51fda22e2a8, Mostly Direct answers,Neutral,Preference for direct answers,,,,
9c54c3a7-74fc-472c-83a6-29d71be98a09,"- I would like my AI to give me just direct answers

",Neutral,Preference for direct answers,,,,
d1fbf25e-8398-4303-8350-7e95d593594d,Answers that provide direct answers,Neutral,Preference for direct answers,,,,
4e89d382-a2cf-426f-83cd-b1a3fa7e58b1,"Depending upon my urgency, I might prefer if it’s encouraging discussion ",Neutral,Context-dependent preferences,Preference varies with mood or situation,,,
45cf1082-2cc4-46bd-aa9b-400ed2e7a2cf,Direct answers are best.,Positive,Preference for direct answers,,,,
cbf261ba-deb5-46c7-b56c-a0bf358e7213,"Direct answers are the best.

",Positive,Preference for direct answers,,,,
a46c16de-86d1-45a4-bdb2-540b9d6d8b12,Direct answers.,Neutral,Preference for direct answers,,,,
32ec091e-1deb-4016-a375-7a8bbe623568,Direct answers.,Neutral,Preference for direct answers,,,,
de0745d6-988c-4a65-81d9-6a198ee05641,Direct answers.,Neutral,Preference for direct answers,,,,
7026f3b1-925a-40a6-a3aa-1c23b6935cf0,Direct answers.,Neutral,Preference for direct answers,,,,
4aa6cc38-b1e8-44bd-89fd-33654e3bf59e,Direct answers.,Neutral,Preference for direct answers,,,,
58429ba7-7d86-4ab9-8f0c-5e63ed1b9f1d,Direct answers.,Neutral,Preference for direct answers,,,,
5f898eed-00e8-412f-8360-8c0ab5681688,Direct answers.,Neutral,Preference for direct answers,,,,
3d2ffa7d-9f32-4596-853a-866b8a195742,Direct answers.,Neutral,Preference for direct answers,,,,
55e38d3d-f49a-405d-814b-165e6b6f1ee6,"Direct answers.

",Neutral,Preference for direct answers,,,,
d48cfbcd-fa8e-4e0e-9e68-9f36df0da6d1,Direct answers. I do not wish to engage in a discussion with an AI.,Neutral,Preference for direct answers,,,,
821ec638-135f-4c92-b21e-ee965c974664,"Encourage discussion. If you give people answers right away, it will deprive them of the ability to think and may lead them astray.",Neutral,Discussion for critical thinking,Preference for responses that encourage discussion,,,
09d60849-6b0e-411d-b4fe-cd05261e288f,Give direct answers,Neutral,Preference for direct answers,,,,
b2c255a5-bc7b-4853-b4e8-ea9f502a9163,Give direct answers,Neutral,Preference for direct answers,,,,
b45e08c8-5326-4ff4-9615-a6ee84d1ad3e,Give direct answers,Neutral,Preference for direct answers,,,,
75ac64a3-ead9-4690-abf5-f80d2af42577,"Give direct answers

",Neutral,Preference for direct answers,,,,
98bb6785-a436-4b26-8515-8c6df0fdedb6,Give direct answers ,Neutral,Preference for direct answers,,,,
8059a983-87ab-4153-8a0a-fc4db425c067,Give direct answers ,Neutral,Preference for direct answers,,,,
1e660fe7-0ef5-4aa8-a8f7-4a671ee35d1d,Give direct answers ,Neutral,Preference for direct answers,,,,
0c2b5eeb-62cf-4490-95a0-2d06df774806,Give direct answers but correctly,Neutral,Preference for direct answers,,,,
df7bb24a-8ae7-4310-ac6b-c79d68a830f6,Give the answer directly,Neutral,Preference for direct answers,,,,
990494fe-fc1a-4f55-b277-537efd501257,Give the answer directly,Neutral,Preference for direct answers,,,,
c683de5e-0f9b-40c5-88a3-0e24f5e7970f,Give the answer directly,Neutral,Preference for direct answers,,,,
596db86f-14d8-4fa6-9694-6f04592bb72f,Give the answer directly,Neutral,Preference for direct answers,,,,
732f9ff2-a69f-414c-9364-cae18f84d20e,Give the answer directly,Neutral,Preference for direct answers,,,,
db435cd2-c86d-41ac-9a7a-6c0e05c15862,Give the answer directly,Neutral,Preference for direct answers,,,,
b0ad99f2-3259-400b-b9b2-45c2bfb334e7,Give the answer directly,Neutral,Preference for direct answers,,,,
d215fec4-48d7-430b-bf9d-004ea067311e,Give the answer directly,Neutral,Preference for direct answers,,,,
de92e0a0-04aa-4231-9b91-0a756def34ce,Give the answer directly,Neutral,Preference for direct answers,,,,
2ac729fa-4d5c-4906-8c62-687259fdd4b7,Give the answer directly,Neutral,Preference for direct answers,,,,
59a7b36f-fb96-4eea-9fa0-6a8bb5b9368a,Give the answer directly,Neutral,Preference for direct answers,,,,
04dc8c4b-efaa-4be9-a18f-414fbe21628a,Give the answer directly,Neutral,Preference for direct answers,,,,
4eab80a1-8c10-48a0-bb58-b6bd3c416c14,Give the answer directly,Neutral,Preference for direct answers,,,,
cee1b854-3183-4bfd-b5ab-f1dafc482e54,Give the answer directly,Neutral,Preference for direct answers,,,,
cc021402-d4aa-4b25-b331-c88e0c74266b,Give the answer directly,Neutral,Preference for direct answers,,,,
e05af122-2ff8-4354-b345-295c77470d3a,Give the answer directly,Neutral,Preference for direct answers,,,,
15ce643b-ad4e-4a8c-b54e-183ac238a668,Give the answer directly,Neutral,Preference for direct answers,,,,
c8ec8382-94b4-4a37-90cd-d74ff5e6a3e5,Give the answer directly,Neutral,Preference for direct answers,,,,
80a114b3-f80c-4af6-87d0-db9b41d13c7f,Give the answer directly,Neutral,Preference for direct answers,,,,
e9db9c44-7ccf-4a89-bb8c-44847bec1b52,Give the answer directly.,Neutral,Preference for direct answers,,,,
c9d3f78a-0f10-4721-95f3-fbb74e23833a,Give the answer directly.,Neutral,Preference for direct answers,,,,
555c6eaf-cb2b-483c-a953-bc00f7557669,I hope AI can give the answer directly.,Neutral,Preference for direct answers,,,,
a9aa2397-60b0-4fa7-b7fe-e8d69b18a4db,I hope to get a direct answer.,Neutral,Preference for direct answers,,,,
3df718c2-ed10-4db1-915e-f0600bcb872f,"I hope to give a direct answer, it should save my time instead of wasting it",Neutral,Direct answers to save time,Preference for direct answers,,,
d37505b7-6aec-4b9f-99bc-5fde3c6971cd,I like to have short and direct answers.,Positive,Preference for direct answers,,,,
d132c253-7234-4426-aeb2-3d20803b124f,I mostly prefer responses that encourage discussion rather than giving a direct answer. In discussion you broaden your topic and learn deeper in context,Neutral,Encouraging discussion for deeper understanding,Preference for responses that encourage discussion,,,
314be8ce-3643-4914-b068-d30ce6a2c98f,I prefer direct and straight to the point responses,Neutral,Preference for direct answers,,,,
552b9831-1699-46f9-9950-d6ea7e3d2ae2,I prefer direct answers that help me quickly achieve what I am looking for.,Neutral,Direct answers for quick solutions,Preference for direct answers,,,
ae13d385-ff99-466b-b8c1-1f67e7a7091a,I prefer direct answers unless you tell me otherwise.,Neutral,Direct answers unless otherwise specified,,,,
5b27c0a2-0725-4dbd-9cce-0c7de1803300,I prefer it to give direct answers.,Positive,Preference for direct answers,,,,
62820303-a21d-4c3d-9798-a63d100b905f,"I usually prefer direct answers

",Neutral,Preference for direct answers,,,,
